{
  "generated_at": "2025-12-15T11:29:43.524Z",
  "timezone": "Europe/Paris",
  "horizon_days": 60,
  "count": 1475,
  "events": [
    {
      "id": "ADE60322e706c616e6e696e67554c5f323032355f323032362d3134323139342d382d33",
      "title": "Travaux service technique",
      "start": "2025-12-15T07:00:00+01:00",
      "end": "2025-12-15T19:00:00+01:00",
      "allDay": false,
      "location": "",
      "description": "\n\n\n\n(Modifié le:11/12/2025 11:38)",
      "status": "",
      "url": "",
      "lastModified": "2025-12-11T11:38:00+01:00"
    },
    {
      "id": "ADE60322e706c616e6e696e67554c5f323032355f323032362d373930322d302d30",
      "title": "TD GR.2 Neurosciences du contrôle moteur",
      "start": "2025-12-15T08:00:00+01:00",
      "end": "2025-12-15T11:00:00+01:00",
      "allDay": false,
      "location": "Bridoux_TD 4",
      "description": "\n\nGR.2\nLANGLET Cécile\n\n(Modifié le:03/12/2025 14:26)",
      "status": "",
      "url": "",
      "lastModified": "2025-12-03T14:26:00+01:00"
    },
    {
      "id": "ADE60322e706c616e6e696e67554c5f323032355f323032362d38343737312d332d30",
      "title": "EI Paysage et politique publique : urbanisme, régl. et marchés",
      "start": "2025-12-15T08:00:00+01:00",
      "end": "2025-12-15T12:00:00+01:00",
      "allDay": false,
      "location": "Bridoux_TD 2",
      "description": "\n\nLPRO Agro AAU\nNAVROT Sebastien\n\n(Modifié le:27/11/2025 17:36)",
      "status": "",
      "url": "",
      "lastModified": "2025-11-27T17:36:00+01:00"
    },
    {
      "id": "ADE60322e706c616e6e696e67554c5f323032355f323032362d3133353539352d322d30",
      "title": "TP Gr.2 Biochimie",
      "start": "2025-12-15T08:00:00+01:00",
      "end": "2025-12-15T12:00:00+01:00",
      "allDay": false,
      "location": "Bridoux_ TP Monod E7",
      "description": "\n\nBATTAGLIA Éric\nTP Gr.2 de Biochimie et Biologie moléculaire\n\n(Modifié le:22/09/2025 12:19)",
      "status": "",
      "url": "",
      "lastModified": "2025-09-22T12:19:00+02:00"
    },
    {
      "id": "ADE60322e706c616e6e696e67554c5f323032355f323032362d3230383833382d302d30",
      "title": "CC UE 103.1 Chimie : Molécules",
      "start": "2025-12-15T08:00:00+01:00",
      "end": "2025-12-15T09:30:00+01:00",
      "allDay": false,
      "location": "Bridoux_Einstein,Bridoux_TD 8",
      "description": "\n\nTP A Portail PC\nTP B Portail PC\nTP C Portail PC\nTP D Portail PC\nTP E Portail PC\nTP F Portail PC\nTP G Portail PC\nTRAULLÉ Nathan\nCOURILLEAU-GOBRY Anne\nCARRE Vincent\n\n(Modifié le:15/12/2025 08:53)",
      "status": "",
      "url": "",
      "lastModified": "2025-12-15T08:53:00+01:00"
    },
    {
      "id": "ADE60322e706c616e6e696e67554c5f323032355f323032362d36353539392d312d30",
      "title": "réservation 1/3 temps ",
      "start": "2025-12-15T08:00:00+01:00",
      "end": "2025-12-15T10:00:00+01:00",
      "allDay": false,
      "location": "",
      "description": "\n\n\n\n(Modifié le:15/12/2025 08:53)",
      "status": "",
      "url": "",
      "lastModified": "2025-12-15T08:53:00+01:00"
    },
    {
      "id": "ADE60322e706c616e6e696e67554c5f323032355f323032362d39353633362d302d30",
      "title": "UE 704 EC4 TD Programmes APA",
      "start": "2025-12-15T09:00:00+01:00",
      "end": "2025-12-15T12:00:00+01:00",
      "allDay": false,
      "location": "Bridoux_TP Damasio D3",
      "description": "\n\nBOLMONT Benoît\nPromo complète M1 FI/FC\n\n(Modifié le:13/11/2025 11:14)",
      "status": "",
      "url": "",
      "lastModified": "2025-11-13T11:14:00+01:00"
    },
    {
      "id": "ADE60322e706c616e6e696e67554c5f323032355f323032362d31303337342d302d30",
      "title": "TP A1 EC 302.1 réactions couplées",
      "start": "2025-12-15T09:00:00+01:00",
      "end": "2025-12-15T12:00:00+01:00",
      "allDay": false,
      "location": "Bridoux_TP Perrin A9",
      "description": "\n\nLECLERC Nathalie\nTP A1 - L2 Chimie\nL2 Chimie LAS\nL2 PC\nL2 PC LAS\nL2 Chimie PE\nL2 PC PE\n\n(Modifié le:16/09/2025 10:21)",
      "status": "",
      "url": "",
      "lastModified": "2025-09-16T10:21:00+02:00"
    },
    {
      "id": "ADE60322e706c616e6e696e67554c5f323032355f323032362d36353539392d302d30",
      "title": "réservation 1/3 temps ",
      "start": "2025-12-15T10:00:00+01:00",
      "end": "2025-12-15T10:30:00+01:00",
      "allDay": false,
      "location": "",
      "description": "\n\n\n\n(Modifié le:15/12/2025 08:51)",
      "status": "",
      "url": "",
      "lastModified": "2025-12-15T08:51:00+01:00"
    },
    {
      "id": "ADE60322e706c616e6e696e67554c5f323032355f323032362d3130333333312d312d30",
      "title": "EA ORAL Méthodes d'intervention et suivi de stage 1",
      "start": "2025-12-15T10:15:00+01:00",
      "end": "2025-12-15T12:15:00+01:00",
      "allDay": false,
      "location": "Bridoux_TP Start up 1 D14BIS",
      "description": "\n\nTD APAS\nTD APAS LAS\nHAINAUT Jean-Philippe\n\n(Modifié le:30/09/2025 14:09)",
      "status": "",
      "url": "",
      "lastModified": "2025-09-30T14:09:00+02:00"
    },
    {
      "id": "ADE60322e706c616e6e696e67554c5f323032355f323032362d3136373839332d362d30",
      "title": "EI ME730 Mobiliser les savoirs propres à la discipline des LC-1",
      "start": "2025-12-15T10:15:00+01:00",
      "end": "2025-12-15T12:15:00+01:00",
      "allDay": false,
      "location": "Bridoux_TD 28",
      "description": "\n\nHESSE Stéphanie\nM1 MEEF PC\n\n(Modifié le:02/09/2025 16:56)",
      "status": "",
      "url": "",
      "lastModified": "2025-09-02T16:56:00+02:00"
    },
    {
      "id": "ADE60322e706c616e6e696e67554c5f323032355f323032362d3133313338302d302d38",
      "title": "EI 1 EC 102.2 Optique géométrique ",
      "start": "2025-12-15T10:15:00+01:00",
      "end": "2025-12-15T12:15:00+01:00",
      "allDay": false,
      "location": "Bridoux_TD 3",
      "description": "\n\nGREFFIER Olivier\nTD 1 Portail PC\n\n(Modifié le:09/12/2025 14:38)",
      "status": "",
      "url": "",
      "lastModified": "2025-12-09T14:38:00+01:00"
    },
    {
      "id": "ADE60322e706c616e6e696e67554c5f323032355f323032362d38383731342d352d30",
      "title": "TD ME730 Savoirs propres à la discipline et épistémologie",
      "start": "2025-12-15T11:00:00+01:00",
      "end": "2025-12-15T12:00:00+01:00",
      "allDay": false,
      "location": "Bridoux_TD 1",
      "description": "\n\nMONIER Brice\nPrépa CAPES STAPS EDT M1\nM1 MEEF EPS - Groupe A\nM1 MEEF EPS - Groupe B\n\n(Modifié le:22/09/2025 11:04)",
      "status": "",
      "url": "",
      "lastModified": "2025-09-22T11:04:00+02:00"
    },
    {
      "id": "ADE60322e706c616e6e696e67554c5f323032355f323032362d39353830342d302d30",
      "title": "UE 905 TP EC3 Programmes APA",
      "start": "2025-12-15T13:00:00+01:00",
      "end": "2025-12-15T17:00:00+01:00",
      "allDay": false,
      "location": "Bridoux_TP Start up 2 D16",
      "description": "\n\nHAINAUT Jean-Philippe\nPromo complète M2 FI/FC\n\n(Modifié le:14/11/2025 11:10)",
      "status": "",
      "url": "",
      "lastModified": "2025-11-14T11:10:00+01:00"
    },
    {
      "id": "ADE60322e706c616e6e696e67554c5f323032355f323032362d3139303231342d322d30",
      "title": "CC 716 Valorisation des déchets",
      "start": "2025-12-15T13:00:00+01:00",
      "end": "2025-12-15T14:00:00+01:00",
      "allDay": false,
      "location": "Bridoux_TD 1",
      "description": "\n\nCM GE\nLECLERC Nathalie\n\n(Modifié le:12/12/2025 13:28)",
      "status": "",
      "url": "",
      "lastModified": "2025-12-12T13:28:00+01:00"
    },
    {
      "id": "ADE60322e706c616e6e696e67554c5f323032355f323032362d393736392d302d34",
      "title": "TD 301.1 Analyse 3",
      "start": "2025-12-15T13:30:00+01:00",
      "end": "2025-12-15T15:30:00+01:00",
      "allDay": false,
      "location": "Bridoux_TD 27",
      "description": "\n\nMOHRBACH Hervé\nTD L2 Physique\nL2 Physique FC\nL2 Physique LAS\nL2 PC\nL2 Physique PE\n\n(Modifié le:15/09/2025 16:06)",
      "status": "",
      "url": "",
      "lastModified": "2025-09-15T16:06:00+02:00"
    },
    {
      "id": "ADE60322e706c616e6e696e67554c5f323032355f323032362d333039332d312d30",
      "title": "TP A NUMOC - SV",
      "start": "2025-12-15T13:30:00+01:00",
      "end": "2025-12-15T15:30:00+01:00",
      "allDay": false,
      "location": "Bridoux_TP Info1 C1",
      "description": "\n\nTP  A\nPARANT Marc\n\n(Modifié le:15/09/2025 10:55)",
      "status": "",
      "url": "",
      "lastModified": "2025-09-15T10:55:00+02:00"
    },
    {
      "id": "ADE60322e706c616e6e696e67554c5f323032355f323032362d3133353138362d332d30",
      "title": "TD IJ Environnement et Santé",
      "start": "2025-12-15T13:30:00+01:00",
      "end": "2025-12-15T15:30:00+01:00",
      "allDay": false,
      "location": "Bridoux_TD 14",
      "description": "\n\nTP  I\nTP  J\nLEGUILLE Carole\n\n(Modifié le:21/10/2025 11:44)",
      "status": "",
      "url": "",
      "lastModified": "2025-10-21T11:44:00+02:00"
    },
    {
      "id": "ADE60322e706c616e6e696e67554c5f323032355f323032362d373836392d302d3134",
      "title": "EI 2 UE 101 Mathématiques 1",
      "start": "2025-12-15T13:30:00+01:00",
      "end": "2025-12-15T15:30:00+01:00",
      "allDay": false,
      "location": "Bridoux_TD 18",
      "description": "\n\nTD 2 Portail PC\nGLEIZE Jérôme\n\n(Modifié le:24/09/2025 13:21)",
      "status": "",
      "url": "",
      "lastModified": "2025-09-24T13:21:00+02:00"
    },
    {
      "id": "ADE60322e706c616e6e696e67554c5f323032355f323032362d3130383736372d302d30",
      "title": "TP GR C : TRAVAUX PRATIQUES DE MECANIQUE",
      "start": "2025-12-15T13:30:00+01:00",
      "end": "2025-12-15T17:15:00+01:00",
      "allDay": false,
      "location": "Bridoux_ TP Ampère H2",
      "description": "\n\nTP GR C\nTP GR C \nGIRARD Gautier\n\n(Modifié le:12/11/2025 10:39)",
      "status": "",
      "url": "",
      "lastModified": "2025-11-12T10:39:00+01:00"
    },
    {
      "id": "ADE60322e706c616e6e696e67554c5f323032355f323032362d393937332d302d32",
      "title": "TD Diversité des publics et gestion de projet",
      "start": "2025-12-15T13:30:00+01:00",
      "end": "2025-12-15T15:30:00+01:00",
      "allDay": false,
      "location": "Bridoux_TD 3",
      "description": "\n\nTD EM\nJESSEL Jean-Jacques\n\n(Modifié le:01/12/2025 13:34)",
      "status": "",
      "url": "",
      "lastModified": "2025-12-01T13:34:00+01:00"
    },
    {
      "id": "ADE60322e706c616e6e696e67554c5f323032355f323032362d3131353635372d302d30",
      "title": "EI 3 EC 103.2 Cinétique chimique",
      "start": "2025-12-15T13:30:00+01:00",
      "end": "2025-12-15T15:30:00+01:00",
      "allDay": false,
      "location": "Bridoux_TD 4",
      "description": "\n\nGHARRED Nawres\nTD 3 Portail PC\n\n(Modifié le:03/10/2025 17:29)",
      "status": "",
      "url": "",
      "lastModified": "2025-10-03T17:29:00+02:00"
    },
    {
      "id": "ADE60322e706c616e6e696e67554c5f323032355f323032362d3131323430312d302d30",
      "title": "EI 1 EC 103.2 Cinétique chimique",
      "start": "2025-12-15T13:30:00+01:00",
      "end": "2025-12-15T15:30:00+01:00",
      "allDay": false,
      "location": "Bridoux_TD 5",
      "description": "\n\nAKIL Suzanna\nTD 1 Portail PC\n\n(Modifié le:03/10/2025 17:28)",
      "status": "",
      "url": "",
      "lastModified": "2025-10-03T17:28:00+02:00"
    },
    {
      "id": "ADE60322e706c616e6e696e67554c5f323032355f323032362d39383234332d302d30",
      "title": "UE 707 EC2 TD + CC Éthique de la santé",
      "start": "2025-12-15T13:30:00+01:00",
      "end": "2025-12-15T17:30:00+01:00",
      "allDay": false,
      "location": "Bridoux_TP Start up 1 D14BIS",
      "description": "\n\nBRIER Laurence\nPromo complète M1 FA\nPromo complète M1 FI/FC\n\n(Modifié le:03/11/2025 15:36)",
      "status": "",
      "url": "",
      "lastModified": "2025-11-03T15:36:00+01:00"
    },
    {
      "id": "ADE60322e706c616e6e696e67554c5f323032355f323032362d3137313531332d382d30",
      "title": "TP ME941 Pratique expérimentale en M-PC et PCdes LP 1",
      "start": "2025-12-15T13:30:00+01:00",
      "end": "2025-12-15T16:30:00+01:00",
      "allDay": false,
      "location": "Bridoux_TP Hertz H13",
      "description": "\n\nM2 M-PC\nM2 MEEF PC\nBECU Lydiane\n\n(Modifié le:26/09/2025 18:40)",
      "status": "",
      "url": "",
      "lastModified": "2025-09-26T18:40:00+02:00"
    },
    {
      "id": "ADE60322e706c616e6e696e67554c5f323032355f323032362d36303339372d312d30",
      "title": "TD UE 706 - Ecologie des communautés",
      "start": "2025-12-15T14:00:00+01:00",
      "end": "2025-12-15T16:00:00+01:00",
      "allDay": false,
      "location": "Bridoux_TD 2",
      "description": "\n\nTD GEMAREC\nDANGER Michael\n\n(Modifié le:14/11/2025 10:04)",
      "status": "",
      "url": "",
      "lastModified": "2025-11-14T10:04:00+01:00"
    },
    {
      "id": "ADE60322e706c616e6e696e67554c5f323032355f323032362d3133313430382d302d3132",
      "title": "EI 1 EC 102.1 Mécanique du point",
      "start": "2025-12-15T15:45:00+01:00",
      "end": "2025-12-15T17:45:00+01:00",
      "allDay": false,
      "location": "Bridoux_TD 18",
      "description": "\n\nTD 1 Portail PC\nGREFFIER Olivier\n\n(Modifié le:01/10/2025 11:41)",
      "status": "",
      "url": "",
      "lastModified": "2025-10-01T11:41:00+02:00"
    },
    {
      "id": "ADE60322e706c616e6e696e67554c5f323032355f323032362d36303033312d312d30",
      "title": "TP B NUMOC - SV",
      "start": "2025-12-15T15:45:00+01:00",
      "end": "2025-12-15T17:45:00+01:00",
      "allDay": false,
      "location": "Bridoux_TP Info4 C11",
      "description": "\n\nTP  B\nPARANT Marc\n\n(Modifié le:10/11/2025 14:29)",
      "status": "",
      "url": "",
      "lastModified": "2025-11-10T14:29:00+01:00"
    },
    {
      "id": "ADE60322e706c616e6e696e67554c5f323032355f323032362d3134323139342d382d32",
      "title": "Travaux service technique",
      "start": "2025-12-16T07:00:00+01:00",
      "end": "2025-12-16T19:00:00+01:00",
      "allDay": false,
      "location": "",
      "description": "\n\n\n\n(Modifié le:11/12/2025 11:38)",
      "status": "",
      "url": "",
      "lastModified": "2025-12-11T11:38:00+01:00"
    },
    {
      "id": "ADE60322e706c616e6e696e67554c5f323032355f323032362d3132393730312d302d30",
      "title": "Seconde chance 504 Outils numériques",
      "start": "2025-12-16T08:00:00+01:00",
      "end": "2025-12-16T10:00:00+01:00",
      "allDay": false,
      "location": "Bridoux_TP Info2 C5",
      "description": "\n\nPOSTNIKOV Andrey\nL3 Physique FC\nL3 Physique LAS\nTD L3 Physique\n\n(Modifié le:05/09/2025 11:11)",
      "status": "",
      "url": "",
      "lastModified": "2025-09-05T11:11:00+02:00"
    },
    {
      "id": "ADE60322e706c616e6e696e67554c5f323032355f323032362d32313431352d302d30",
      "title": "EI 1 Langues et internationalisation",
      "start": "2025-12-16T08:00:00+01:00",
      "end": "2025-12-16T10:00:00+01:00",
      "allDay": false,
      "location": "Bridoux_TD 17",
      "description": "\n\nUBASSY Mickaël\nLPRO Agro AAU\nLPRO Agro ADNT\n\n(Modifié le:05/11/2025 09:36)",
      "status": "",
      "url": "",
      "lastModified": "2025-11-05T09:36:00+01:00"
    },
    {
      "id": "ADE60322e706c616e6e696e67554c5f323032355f323032362d36343236362d322d30",
      "title": "EI UE 902 EC 2 Organisation des réseaux de soins et de coordination",
      "start": "2025-12-16T08:00:00+01:00",
      "end": "2025-12-16T10:00:00+01:00",
      "allDay": false,
      "location": "Bridoux_TP Start up 1 D14BIS",
      "description": "\n\nM2 A3R\nGALLAND Sophie\n\n(Modifié le:10/09/2025 12:56)",
      "status": "",
      "url": "",
      "lastModified": "2025-09-10T12:56:00+02:00"
    },
    {
      "id": "ADE60322e706c616e6e696e67554c5f323032355f323032362d393430312d302d35",
      "title": "CM 303.1 Ondes et vibrations",
      "start": "2025-12-16T08:00:00+01:00",
      "end": "2025-12-16T10:00:00+01:00",
      "allDay": false,
      "location": "Bridoux_TD 18",
      "description": "\n\nTREMBLAY Jean-Christophe\nTD L2 Physique\nL2 Physique FC\nL2 Physique LAS\nL2 PC\nL2 Physique PE\n\n(Modifié le:15/09/2025 16:06)",
      "status": "",
      "url": "",
      "lastModified": "2025-09-15T16:06:00+02:00"
    },
    {
      "id": "ADE60322e706c616e6e696e67554c5f323032355f323032362d3133313431352d332d30",
      "title": "EI 3 UE 101 Mathématiques 1",
      "start": "2025-12-16T08:00:00+01:00",
      "end": "2025-12-16T10:00:00+01:00",
      "allDay": false,
      "location": "Bridoux_TD 5",
      "description": "\n\nTD 3 Portail PC\nJABER Hassan\n\n(Modifié le:03/11/2025 16:54)",
      "status": "",
      "url": "",
      "lastModified": "2025-11-03T16:54:00+01:00"
    },
    {
      "id": "ADE60322e706c616e6e696e67554c5f323032355f323032362d3130383736352d312d30",
      "title": "TP GR A : TRAVAUX PRATIQUES DE MECANIQUE",
      "start": "2025-12-16T08:15:00+01:00",
      "end": "2025-12-16T12:00:00+01:00",
      "allDay": false,
      "location": "Bridoux_ TP Ampère H2",
      "description": "\n\nTP GR A\nTP GR A\nGIRARD Gautier\n\n(Modifié le:08/10/2025 12:43)",
      "status": "",
      "url": "",
      "lastModified": "2025-10-08T12:43:00+02:00"
    },
    {
      "id": "ADE60322e706c616e6e696e67554c5f323032355f323032362d31303534392d332d30",
      "title": "TD Théorie et pratique des APSA /Activités athlétiques",
      "start": "2025-12-16T08:30:00+01:00",
      "end": "2025-12-16T10:00:00+01:00",
      "allDay": false,
      "location": "Bridoux_TD 4",
      "description": "\n\nTD EM LAS\nTD EM\nWALTER Christophe\n\n(Modifié le:14/10/2025 18:22)",
      "status": "",
      "url": "",
      "lastModified": "2025-10-14T18:22:00+02:00"
    },
    {
      "id": "ADE60322e706c616e6e696e67554c5f323032355f323032362d39353633362d332d30",
      "title": "UE 704 EC4 TD Programmes APA",
      "start": "2025-12-16T09:00:00+01:00",
      "end": "2025-12-16T12:00:00+01:00",
      "allDay": false,
      "location": "Bridoux_TP Damasio D3",
      "description": "\n\nBOLMONT Benoît\nPromo complète M1 FI/FC\n\n(Modifié le:14/11/2025 11:12)",
      "status": "",
      "url": "",
      "lastModified": "2025-11-14T11:12:00+01:00"
    },
    {
      "id": "ADE60322e706c616e6e696e67554c5f323032355f323032362d36323631302d302d33",
      "title": "TP B1 EC 302.1 réactions couplées",
      "start": "2025-12-16T09:00:00+01:00",
      "end": "2025-12-16T12:00:00+01:00",
      "allDay": false,
      "location": "Bridoux_TP Perrin A9",
      "description": "\n\nTP B1 - L2 Chimie\nLECLERC Nathalie\n\n(Modifié le:20/11/2025 09:36)",
      "status": "",
      "url": "",
      "lastModified": "2025-11-20T09:36:00+01:00"
    },
    {
      "id": "ADE60322e706c616e6e696e67554c5f323032355f323032362d39353830352d312d30",
      "title": "UE 905 TD EC3 Programmes APA",
      "start": "2025-12-16T09:00:00+01:00",
      "end": "2025-12-16T12:00:00+01:00",
      "allDay": false,
      "location": "Bridoux_TP Start up 2 D16",
      "description": "\n\nHAINAUT Jean-Philippe\nPromo complète M2 FI/FC\n\n(Modifié le:14/11/2025 11:12)",
      "status": "",
      "url": "",
      "lastModified": "2025-11-14T11:12:00+01:00"
    },
    {
      "id": "ADE60322e706c616e6e696e67554c5f323032355f323032362d3138313031312d302d30",
      "title": "TD+EA Filière APAS - Activité Physique Adaptée Santé - MAJEURE",
      "start": "2025-12-16T10:15:00+01:00",
      "end": "2025-12-16T12:15:00+01:00",
      "allDay": false,
      "location": "Bridoux_TD 25",
      "description": "\n\nASSELIN Marine\nAPA MAJEURE\n\n(Modifié le:01/12/2025 16:30)",
      "status": "",
      "url": "",
      "lastModified": "2025-12-01T16:30:00+01:00"
    },
    {
      "id": "ADE60322e706c616e6e696e67554c5f323032355f323032362d32323335382d322d30",
      "title": "EI 2 Gestion et analyse de données",
      "start": "2025-12-16T10:15:00+01:00",
      "end": "2025-12-16T12:15:00+01:00",
      "allDay": false,
      "location": "Bridoux_TD 8",
      "description": "\n\nQUEVREUX Pierre\nLPRO Agro AAU\nLPRO Agro ADNT\n\n(Modifié le:03/12/2025 12:16)",
      "status": "",
      "url": "",
      "lastModified": "2025-12-03T12:16:00+01:00"
    },
    {
      "id": "ADE60322e706c616e6e696e67554c5f323032355f323032362d393531302d302d36",
      "title": "CM 303.2 Electromagnétisme 2",
      "start": "2025-12-16T10:15:00+01:00",
      "end": "2025-12-16T12:15:00+01:00",
      "allDay": false,
      "location": "Bridoux_TD 6",
      "description": "\n\nMESSINA René\nTD L2 Physique\nL2 Physique FC\nL2 Physique LAS\nL2 PC\nL2 PC LAS\nL2 PC PE\nL2 Physique PE\n\n(Modifié le:15/09/2025 16:06)",
      "status": "",
      "url": "",
      "lastModified": "2025-09-15T16:06:00+02:00"
    },
    {
      "id": "ADE60322e706c616e6e696e67554c5f323032355f323032362d3230363034342d302d30",
      "title": "CC2 503.2 Relativité restreinte",
      "start": "2025-12-16T10:15:00+01:00",
      "end": "2025-12-16T12:15:00+01:00",
      "allDay": false,
      "location": "Bridoux_Salle des Actes B14",
      "description": "\n\nL3 Physique FC\nL3 Physique LAS\nTD L3 Physique\nGRANDATI Yves\nMOHRBACH Hervé\n\n(Modifié le:05/09/2025 11:11)",
      "status": "",
      "url": "",
      "lastModified": "2025-09-05T11:11:00+02:00"
    },
    {
      "id": "ADE60322e706c616e6e696e67554c5f323032355f323032362d3130303835352d302d32",
      "title": "EI 4 EC 103.2 Cinétique chimique",
      "start": "2025-12-16T10:15:00+01:00",
      "end": "2025-12-16T12:15:00+01:00",
      "allDay": false,
      "location": "Bridoux_TD 18",
      "description": "\n\nGHARRED Nawres\nTD 4 Porail PC\n\n(Modifié le:03/10/2025 17:29)",
      "status": "",
      "url": "",
      "lastModified": "2025-10-03T17:29:00+02:00"
    },
    {
      "id": "ADE60322e706c616e6e696e67554c5f323032355f323032362d3133313431322d302d31",
      "title": "EI 1 UE 101 Mathématiques 1",
      "start": "2025-12-16T10:15:00+01:00",
      "end": "2025-12-16T12:15:00+01:00",
      "allDay": false,
      "location": "Bridoux_TD 16",
      "description": "\n\nGRANDCOLAS Michel\nTD 1 Portail PC\n\n(Modifié le:18/11/2025 16:17)",
      "status": "",
      "url": "",
      "lastModified": "2025-11-18T16:17:00+01:00"
    },
    {
      "id": "ADE60322e706c616e6e696e67554c5f323032355f323032362d36343330342d302d30",
      "title": "CM UE 904 EC 2 Conception d'un projet entrepreneurial",
      "start": "2025-12-16T10:15:00+01:00",
      "end": "2025-12-16T12:15:00+01:00",
      "allDay": false,
      "location": "Bridoux_TP Start up 1 D14BIS",
      "description": "\n\nBASTIEN Nicolas\nM2 A3R\n\n(Modifié le:10/09/2025 12:56)",
      "status": "",
      "url": "",
      "lastModified": "2025-09-10T12:56:00+02:00"
    },
    {
      "id": "ADE60322e706c616e6e696e67554c5f323032355f323032362d3133313430392d302d3137",
      "title": "EI 2 EC 102.1 Mécanique du point",
      "start": "2025-12-16T10:15:00+01:00",
      "end": "2025-12-16T12:15:00+01:00",
      "allDay": false,
      "location": "Bridoux_TD 24",
      "description": "\n\nWAX Jean-François\nTD 2 Portail PC\n\n(Modifié le:03/11/2025 17:03)",
      "status": "",
      "url": "",
      "lastModified": "2025-11-03T17:03:00+01:00"
    },
    {
      "id": "ADE60322e706c616e6e696e67554c5f323032355f323032362d3138383033382d392d30",
      "title": "Réunion DPT STAPS",
      "start": "2025-12-16T12:15:00+01:00",
      "end": "2025-12-16T13:30:00+01:00",
      "allDay": false,
      "location": "Bridoux_TP Damasio D3",
      "description": "\n\nRéunion\n\n(Modifié le:08/07/2025 13:29)",
      "status": "",
      "url": "",
      "lastModified": "2025-07-08T13:29:00+02:00"
    },
    {
      "id": "ADE60322e706c616e6e696e67554c5f323032355f323032362d39383839322d302d30",
      "title": "Concours blanc M1 PC",
      "start": "2025-12-16T13:00:00+01:00",
      "end": "2025-12-16T18:00:00+01:00",
      "allDay": false,
      "location": "Bridoux_TD 29",
      "description": "\n\nM1 MEEF PC\nM2 M-PC\nM2 MEEF PC\nDALMASSO Stéphane\nGLEIZE Jérôme\n\n(Modifié le:11/12/2025 17:18)",
      "status": "",
      "url": "",
      "lastModified": "2025-12-11T17:18:00+01:00"
    },
    {
      "id": "ADE60322e706c616e6e696e67554c5f323032355f323032362d3131323430312d302d31",
      "title": "EI 1 EC 103.2 Cinétique chimique",
      "start": "2025-12-16T13:30:00+01:00",
      "end": "2025-12-16T15:30:00+01:00",
      "allDay": false,
      "location": "Bridoux_TD 2",
      "description": "\n\nAKIL Suzanna\nTD 1 Portail PC\n\n(Modifié le:03/10/2025 17:28)",
      "status": "",
      "url": "",
      "lastModified": "2025-10-03T17:28:00+02:00"
    },
    {
      "id": "ADE60322e706c616e6e696e67554c5f323032355f323032362d39333339392d302d30",
      "title": "Seconde chance UE 301.1 Chimie organique 1",
      "start": "2025-12-16T13:30:00+01:00",
      "end": "2025-12-16T15:00:00+01:00",
      "allDay": false,
      "location": "Bridoux_Salle des Actes B14",
      "description": "\n\nHESSE Stéphanie\nL2 Chimie LAS\nTD A L2 Chimie\nL2 PC\nL2 PC LAS\nL2 Chimie FC\nL2 Chimie PE\nL2 PC PE\n\n(Modifié le:16/09/2025 10:21)",
      "status": "",
      "url": "",
      "lastModified": "2025-09-16T10:21:00+02:00"
    },
    {
      "id": "ADE60322e706c616e6e696e67554c5f323032355f323032362d39353739372d312d30",
      "title": "UE 904 EC4 TD Programmes APA",
      "start": "2025-12-16T13:30:00+01:00",
      "end": "2025-12-16T16:30:00+01:00",
      "allDay": false,
      "location": "Bridoux_TP Damasio D3",
      "description": "\n\nBOLMONT Benoît\nPromo complète M2 FI/FC\n\n(Modifié le:25/09/2025 12:00)",
      "status": "",
      "url": "",
      "lastModified": "2025-09-25T12:00:00+02:00"
    },
    {
      "id": "ADE60322e706c616e6e696e67554c5f323032355f323032362d36303130382d312d30",
      "title": "TP I NUMOC - SV",
      "start": "2025-12-16T13:30:00+01:00",
      "end": "2025-12-16T15:30:00+01:00",
      "allDay": false,
      "location": "Bridoux_TP Info6 F2",
      "description": "\n\nTP  I\nPARANT Marc\n\n(Modifié le:12/09/2025 16:26)",
      "status": "",
      "url": "",
      "lastModified": "2025-09-12T16:26:00+02:00"
    },
    {
      "id": "ADE60322e706c616e6e696e67554c5f323032355f323032362d3135313731302d31332d30",
      "title": "EI 4 UE 101 Mathématiques 1",
      "start": "2025-12-16T13:30:00+01:00",
      "end": "2025-12-16T15:30:00+01:00",
      "allDay": false,
      "location": "Bridoux_TD 5",
      "description": "\n\nTP G Portail PC\nFARDET Anne-Laure\n\n(Modifié le:22/09/2025 10:02)",
      "status": "",
      "url": "",
      "lastModified": "2025-09-22T10:02:00+02:00"
    },
    {
      "id": "ADE60322e706c616e6e696e67554c5f323032355f323032362d3131363236372d302d34",
      "title": "EI 2 EC 103.2 Equilibres chimiques",
      "start": "2025-12-16T13:30:00+01:00",
      "end": "2025-12-16T15:30:00+01:00",
      "allDay": false,
      "location": "Bridoux_TD 7",
      "description": "\n\nTD 2 Portail PC\nACHARD Christian\n\n(Modifié le:24/09/2025 13:21)",
      "status": "",
      "url": "",
      "lastModified": "2025-09-24T13:21:00+02:00"
    },
    {
      "id": "ADE60322e706c616e6e696e67554c5f323032355f323032362d36323830342d312d30",
      "title": "TP Gr2 UE 304 Systèmes électroniques mesures : étude et pratique",
      "start": "2025-12-16T13:30:00+01:00",
      "end": "2025-12-16T17:30:00+01:00",
      "allDay": false,
      "location": "Bridoux_TP  Edison H7",
      "description": "\n\nTP Gr2 L2 SPI (UE301 et 304)\nTITE Teddy\n\n(Modifié le:02/12/2025 10:27)",
      "status": "",
      "url": "",
      "lastModified": "2025-12-02T10:27:00+01:00"
    },
    {
      "id": "ADE60322e706c616e6e696e67554c5f323032355f323032362d323930312d31342d30",
      "title": "EI CD Mathématiques pour la biologie",
      "start": "2025-12-16T13:30:00+01:00",
      "end": "2025-12-16T15:30:00+01:00",
      "allDay": false,
      "location": "Bridoux_TD 15",
      "description": "\n\nCAMARA Baba Issa\nTP  C\nTP  D\n\n(Modifié le:20/10/2025 17:24)",
      "status": "",
      "url": "",
      "lastModified": "2025-10-20T17:24:00+02:00"
    },
    {
      "id": "ADE60322e706c616e6e696e67554c5f323032355f323032362d3130383736362d332d30",
      "title": "TP GR B : TRAVAUX PRATIQUES DE MECANIQUE",
      "start": "2025-12-16T13:30:00+01:00",
      "end": "2025-12-16T17:15:00+01:00",
      "allDay": false,
      "location": "Bridoux_ TP Ampère H2",
      "description": "\n\nTP GR B\nTP GR B \nGREFFIER Olivier\n\n(Modifié le:12/11/2025 10:39)",
      "status": "",
      "url": "",
      "lastModified": "2025-11-12T10:39:00+01:00"
    },
    {
      "id": "ADE60322e706c616e6e696e67554c5f323032355f323032362d3130333333312d322d30",
      "title": "EA ORAL Méthodes d'intervention et suivi de stage 1",
      "start": "2025-12-16T13:30:00+01:00",
      "end": "2025-12-16T15:30:00+01:00",
      "allDay": false,
      "location": "Bridoux_TP Start up 2 D16",
      "description": "\n\nTD APAS\nTD APAS LAS\nHAINAUT Jean-Philippe\n\n(Modifié le:30/09/2025 14:09)",
      "status": "",
      "url": "",
      "lastModified": "2025-09-30T14:09:00+02:00"
    },
    {
      "id": "ADE60322e706c616e6e696e67554c5f323032355f323032362d35353235332d302d30",
      "title": "Seconde chance UE 505 Chimie orbitalaire",
      "start": "2025-12-16T13:30:00+01:00",
      "end": "2025-12-16T15:00:00+01:00",
      "allDay": false,
      "location": "Bridoux_TD 8",
      "description": "\n\nL3 Chimie FC\nTD - L3 Chimie\nAUBRIET Frédéric\nCARRE Vincent\n\n(Modifié le:17/11/2025 11:07)",
      "status": "",
      "url": "",
      "lastModified": "2025-11-17T11:07:00+01:00"
    },
    {
      "id": "ADE60322e706c616e6e696e67554c5f323032355f323032362d393632302d302d30",
      "title": "TP 1 Biologie moléculaire",
      "start": "2025-12-16T13:30:00+01:00",
      "end": "2025-12-16T17:30:00+01:00",
      "allDay": false,
      "location": "Bridoux_ TP Monod E7",
      "description": "\n\nDUBOIS-POT-SCHNEIDER Hélène\nTP Gr.1 de Biochimie et Biologie moléculaire\n\n(Modifié le:10/09/2025 15:42)",
      "status": "",
      "url": "",
      "lastModified": "2025-09-10T15:42:00+02:00"
    },
    {
      "id": "ADE60322e706c616e6e696e67554c5f323032355f323032362d36343237372d302d30",
      "title": "EI UE 903 EC 2 Les soft skills, nouveaux enjeux professionnels",
      "start": "2025-12-16T14:00:00+01:00",
      "end": "2025-12-16T18:00:00+01:00",
      "allDay": false,
      "location": "Bridoux_TP Start up 1 D14BIS",
      "description": "\n\nHUSSON Nadine\nM2 A3R\n\n(Modifié le:10/09/2025 12:56)",
      "status": "",
      "url": "",
      "lastModified": "2025-09-10T12:56:00+02:00"
    },
    {
      "id": "ADE60322e706c616e6e696e67554c5f323032355f323032362d31313638342d302d32",
      "title": "TP B 306.1 Physique expérimentale 2",
      "start": "2025-12-16T14:00:00+01:00",
      "end": "2025-12-16T17:00:00+01:00",
      "allDay": false,
      "location": "Bridoux_TP Carnot H6",
      "description": "\n\nL2 Physique FC\nL2 Physique LAS\nL2 Physique PE\nTP B L2 Physique\nLECLERC Arnaud\n\n(Modifié le:26/09/2025 12:22)",
      "status": "",
      "url": "",
      "lastModified": "2025-09-26T12:22:00+02:00"
    },
    {
      "id": "ADE60322e706c616e6e696e67554c5f323032355f323032362d3139303537382d302d30",
      "title": "CC 706 Ecologies des communautés",
      "start": "2025-12-16T15:00:00+01:00",
      "end": "2025-12-16T17:00:00+01:00",
      "allDay": false,
      "location": "Bridoux_TD 27",
      "description": "\n\nDEVIN Simon\nTP GRP 2\n\n(Modifié le:19/11/2025 17:07)",
      "status": "",
      "url": "",
      "lastModified": "2025-11-19T17:07:00+01:00"
    },
    {
      "id": "ADE60322e706c616e6e696e67554c5f323032355f323032362d3132383032362d31342d30",
      "title": "EI EF Mathématiques pour la biologie",
      "start": "2025-12-16T15:45:00+01:00",
      "end": "2025-12-16T17:45:00+01:00",
      "allDay": false,
      "location": "Bridoux_TD 15",
      "description": "\n\nCAMARA Baba Issa\nTP  E\nTP  F\n\n(Modifié le:17/10/2025 14:18)",
      "status": "",
      "url": "",
      "lastModified": "2025-10-17T14:18:00+02:00"
    },
    {
      "id": "ADE60322e706c616e6e696e67554c5f323032355f323032362d36303133352d312d30",
      "title": "TP J NUMOC - SV",
      "start": "2025-12-16T15:45:00+01:00",
      "end": "2025-12-16T17:45:00+01:00",
      "allDay": false,
      "location": "Bridoux_TP Info6 F2",
      "description": "\n\nTP  J\nPARANT Marc\n\n(Modifié le:06/10/2025 15:56)",
      "status": "",
      "url": "",
      "lastModified": "2025-10-06T15:56:00+02:00"
    },
    {
      "id": "ADE60322e706c616e6e696e67554c5f323032355f323032362d3133353138352d342d30",
      "title": "TD H Environnement et Santé",
      "start": "2025-12-16T15:45:00+01:00",
      "end": "2025-12-16T17:45:00+01:00",
      "allDay": false,
      "location": "Bridoux_TD 9",
      "description": "\n\nTP  H\nLEGUILLE Carole\n\n(Modifié le:20/11/2025 11:36)",
      "status": "",
      "url": "",
      "lastModified": "2025-11-20T11:36:00+01:00"
    },
    {
      "id": "ADE60322e706c616e6e696e67554c5f323032355f323032362d3131373038332d302d30",
      "title": "EA Handicap Moteur/int.APAS L.Queraud",
      "start": "2025-12-16T17:00:00+01:00",
      "end": "2025-12-16T18:00:00+01:00",
      "allDay": false,
      "location": "Bridoux_Salle des Actes B14",
      "description": "\n\nTD APAS\nQUERAUD Louis\n\n(Modifié le:23/09/2025 13:18)",
      "status": "",
      "url": "",
      "lastModified": "2025-09-23T13:18:00+02:00"
    },
    {
      "id": "ADE60322e706c616e6e696e67554c5f323032355f323032362d3134323139342d362d34",
      "title": "Travaux service technique",
      "start": "2025-12-17T07:00:00+01:00",
      "end": "2025-12-17T19:00:00+01:00",
      "allDay": false,
      "location": "",
      "description": "\n\n\n\n(Modifié le:11/12/2025 11:39)",
      "status": "",
      "url": "",
      "lastModified": "2025-12-11T11:39:00+01:00"
    },
    {
      "id": "ADE60322e706c616e6e696e67554c5f323032355f323032362d36343232352d302d30",
      "title": "CM UE 901 EC 1 Résilience et vieillissement réussi",
      "start": "2025-12-17T08:00:00+01:00",
      "end": "2025-12-17T10:00:00+01:00",
      "allDay": false,
      "location": "Bridoux_TP Start up 1 D14BIS",
      "description": "\n\nLEMETAYER Fabienne\nM2 A3R\n\n(Modifié le:03/11/2025 14:37)",
      "status": "",
      "url": "",
      "lastModified": "2025-11-03T14:37:00+01:00"
    },
    {
      "id": "ADE60322e706c616e6e696e67554c5f323032355f323032362d32343034352d322d30",
      "title": "EI UE 506 Agroéquipements innovants",
      "start": "2025-12-17T08:00:00+01:00",
      "end": "2025-12-17T12:00:00+01:00",
      "allDay": false,
      "location": "Bridoux_TD 1",
      "description": "\n\nLPRO Agro ADNT\nBELNER Alexandre\n\n(Modifié le:19/11/2025 10:01)",
      "status": "",
      "url": "",
      "lastModified": "2025-11-19T10:01:00+01:00"
    },
    {
      "id": "ADE60322e706c616e6e696e67554c5f323032355f323032362d3139323134372d332d30",
      "title": "TP GR2 EC 302.2 Génie informatique",
      "start": "2025-12-17T08:00:00+01:00",
      "end": "2025-12-17T12:15:00+01:00",
      "allDay": false,
      "location": "Bridoux_TP Info4 C11",
      "description": "\n\nTP Gr2 L2 SPI (UE301 et 304)\nBOUKHNIFER MAAOUI Choubeila\n\n(Modifié le:12/12/2025 11:18)",
      "status": "",
      "url": "",
      "lastModified": "2025-12-12T11:18:00+01:00"
    },
    {
      "id": "ADE60322e706c616e6e696e67554c5f323032355f323032362d3134393930312d302d33",
      "title": "Réservation Victor",
      "start": "2025-12-17T08:00:00+01:00",
      "end": "2025-12-17T10:00:00+01:00",
      "allDay": false,
      "location": "",
      "description": "\nCC1 303.2 JFW\n\n\n(Modifié le:03/10/2025 12:56)",
      "status": "",
      "url": "",
      "lastModified": "2025-10-03T12:56:00+02:00"
    },
    {
      "id": "ADE60322e706c616e6e696e67554c5f323032355f323032362d383437322d302d31",
      "title": "EI 2 EC 103.2 Cinétique chimique",
      "start": "2025-12-17T08:00:00+01:00",
      "end": "2025-12-17T10:00:00+01:00",
      "allDay": false,
      "location": "Bridoux_TD 17",
      "description": "\n\nSCHRAMM Sébastien\nTD 2 Portail PC\n\n(Modifié le:03/10/2025 17:28)",
      "status": "",
      "url": "",
      "lastModified": "2025-10-03T17:28:00+02:00"
    },
    {
      "id": "ADE60322e706c616e6e696e67554c5f323032355f323032362d3130353430352d302d30",
      "title": "CC1 UE 303.2 Electromagnétisme 2",
      "start": "2025-12-17T08:00:00+01:00",
      "end": "2025-12-17T09:30:00+01:00",
      "allDay": false,
      "location": "Bridoux_Salle des Actes B14",
      "description": "\n\nTD L2 Physique\nL2 Physique FC\nL2 Physique LAS\nL2 PC\nL2 PC LAS\nL2 Physique PE\nWAX Jean-François\nMESSINA René\n\n(Modifié le:03/10/2025 12:55)",
      "status": "",
      "url": "",
      "lastModified": "2025-10-03T12:55:00+02:00"
    },
    {
      "id": "ADE60322e706c616e6e696e67554c5f323032355f323032362d38343737332d302d30",
      "title": "TP Paysage et politique publique : urbanisme, régl. et marchés",
      "start": "2025-12-17T08:00:00+01:00",
      "end": "2025-12-17T12:00:00+01:00",
      "allDay": false,
      "location": "Bridoux_TD 3",
      "description": "\n\nLPRO Agro AAU\nNAVROT Sebastien\n\n(Modifié le:27/11/2025 17:36)",
      "status": "",
      "url": "",
      "lastModified": "2025-11-27T17:36:00+01:00"
    },
    {
      "id": "ADE60322e706c616e6e696e67554c5f323032355f323032362d3130313933332d302d32",
      "title": "EI 4 EC 103.2 Equilibres chimiques",
      "start": "2025-12-17T08:00:00+01:00",
      "end": "2025-12-17T10:00:00+01:00",
      "allDay": false,
      "location": "Bridoux_TD 2",
      "description": "\n\nZIMMER Alexandre\nTD 4 Porail PC\n\n(Modifié le:22/09/2025 10:02)",
      "status": "",
      "url": "",
      "lastModified": "2025-09-22T10:02:00+02:00"
    },
    {
      "id": "ADE60322e706c616e6e696e67554c5f323032355f323032362d3133353736302d312d30",
      "title": "TP 4 Biologie moléculaire",
      "start": "2025-12-17T08:00:00+01:00",
      "end": "2025-12-17T12:00:00+01:00",
      "allDay": false,
      "location": "Bridoux_ TP Monod E7",
      "description": "\n\nDUBOIS-POT-SCHNEIDER Hélène\nTP Gr.4 de Biochimie et Biologie moléculaire\n\n(Modifié le:10/09/2025 17:20)",
      "status": "",
      "url": "",
      "lastModified": "2025-09-10T17:20:00+02:00"
    },
    {
      "id": "ADE60322e706c616e6e696e67554c5f323032355f323032362d3131353736382d302d31",
      "title": "EI 3 EC 103.2 Equilibres chimiques",
      "start": "2025-12-17T08:00:00+01:00",
      "end": "2025-12-17T10:00:00+01:00",
      "allDay": false,
      "location": "Bridoux_TD 9",
      "description": "\n\nACHARD Christian\nTD 3 Portail PC\n\n(Modifié le:23/09/2025 18:01)",
      "status": "",
      "url": "",
      "lastModified": "2025-09-23T18:01:00+02:00"
    },
    {
      "id": "ADE60322e706c616e6e696e67554c5f323032355f323032362d37393238382d312d30",
      "title": "TP GR D : TRAVAUX PRATIQUES DE MECANIQUE",
      "start": "2025-12-17T08:15:00+01:00",
      "end": "2025-12-17T12:00:00+01:00",
      "allDay": false,
      "location": "Bridoux_ TP Ampère H2",
      "description": "\n\nTP04\nTP GR D\nGREFFIER Olivier\n\n(Modifié le:12/11/2025 10:43)",
      "status": "",
      "url": "",
      "lastModified": "2025-11-12T10:43:00+01:00"
    },
    {
      "id": "ADE60322e706c616e6e696e67554c5f323032355f323032362d3137343233332d332d30",
      "title": "GULER César et/ou KOHLER Manon et/ou CHILDZ Augustiin",
      "start": "2025-12-17T08:30:00+01:00",
      "end": "2025-12-17T10:15:00+01:00",
      "allDay": false,
      "location": "",
      "description": "\n\n\n\n(Modifié le:24/11/2025 13:07)",
      "status": "",
      "url": "",
      "lastModified": "2025-11-24T13:07:00+01:00"
    },
    {
      "id": "ADE60322e706c616e6e696e67554c5f323032355f323032362d393336382d322d30",
      "title": "TP GR.1 Education thérapeutique du patient",
      "start": "2025-12-17T09:00:00+01:00",
      "end": "2025-12-17T12:00:00+01:00",
      "allDay": false,
      "location": "Bridoux_TP Start up 2 D16",
      "description": "\n\nTP APAS GR.1\nTP APAS GR.1 LAS\nZAYAS-SAMPERE Ignacio\n\n(Modifié le:29/09/2025 19:08)",
      "status": "",
      "url": "",
      "lastModified": "2025-09-29T19:08:00+02:00"
    },
    {
      "id": "ADE60322e706c616e6e696e67554c5f323032355f323032362d3133313235342d302d35",
      "title": "TP B EC 104.3 Outils et culture du numérique 1 - PC ",
      "start": "2025-12-17T09:00:00+01:00",
      "end": "2025-12-17T12:00:00+01:00",
      "allDay": false,
      "location": "Bridoux_TP Info2 C5",
      "description": "\n\nTP B Portail PC\nCODA-BOUCHOT Virginie\n\n(Modifié le:06/11/2025 15:38)",
      "status": "",
      "url": "",
      "lastModified": "2025-11-06T15:38:00+01:00"
    },
    {
      "id": "ADE60322e706c616e6e696e67554c5f323032355f323032362d39353633362d342d30",
      "title": "UE 704 EC4 TD Programmes APA",
      "start": "2025-12-17T10:00:00+01:00",
      "end": "2025-12-17T11:00:00+01:00",
      "allDay": false,
      "location": "Bridoux_TP Damasio D3",
      "description": "\n\nBOLMONT Benoît\nPromo complète M1 FI/FC\n\n(Modifié le:04/11/2025 17:38)",
      "status": "",
      "url": "",
      "lastModified": "2025-11-04T17:38:00+01:00"
    },
    {
      "id": "ADE60322e706c616e6e696e67554c5f323032355f323032362d3130353431322d302d30",
      "title": "CC2 UE 301.2 Algébre",
      "start": "2025-12-17T10:15:00+01:00",
      "end": "2025-12-17T11:45:00+01:00",
      "allDay": false,
      "location": "Bridoux_Salle des Actes B14",
      "description": "\n\nTD L2 Physique\nL2 Physique LAS\nL2 Physique PE\nGRANDATI Yves\nMOHRBACH Hervé\n\n(Modifié le:03/10/2025 12:56)",
      "status": "",
      "url": "",
      "lastModified": "2025-10-03T12:56:00+02:00"
    },
    {
      "id": "ADE60322e706c616e6e696e67554c5f323032355f323032362d3134393930312d302d3136",
      "title": "Réservation Victor",
      "start": "2025-12-17T10:15:00+01:00",
      "end": "2025-12-17T12:15:00+01:00",
      "allDay": false,
      "location": "",
      "description": "\nCC2 301.2 YG\n\n\n(Modifié le:03/10/2025 12:57)",
      "status": "",
      "url": "",
      "lastModified": "2025-10-03T12:57:00+02:00"
    },
    {
      "id": "ADE60322e706c616e6e696e67554c5f323032355f323032362d36343234312d302d30",
      "title": "CM UE 902 EC 1 Politiques publiques de la santé et du social",
      "start": "2025-12-17T10:15:00+01:00",
      "end": "2025-12-17T12:15:00+01:00",
      "allDay": false,
      "location": "Bridoux_TD 27",
      "description": "\n\nPALLEZ Christiane\nM2 A3R\n\n(Modifié le:03/11/2025 14:37)",
      "status": "",
      "url": "",
      "lastModified": "2025-11-03T14:37:00+01:00"
    },
    {
      "id": "ADE60322e706c616e6e696e67554c5f323032355f323032362d3133313431352d32302d30",
      "title": "EI 3 UE 101 Mathématiques 1",
      "start": "2025-12-17T10:15:00+01:00",
      "end": "2025-12-17T12:15:00+01:00",
      "allDay": false,
      "location": "Bridoux_TD 8",
      "description": "\n\nTD 3 Portail PC\nJABER Hassan\n\n(Modifié le:25/11/2025 11:10)",
      "status": "",
      "url": "",
      "lastModified": "2025-11-25T11:10:00+01:00"
    },
    {
      "id": "ADE60322e706c616e6e696e67554c5f323032355f323032362d373539332d302d3132",
      "title": "EI UE 105/OS Remédiation en mathématiques 1",
      "start": "2025-12-17T10:15:00+01:00",
      "end": "2025-12-17T12:15:00+01:00",
      "allDay": false,
      "location": "Bridoux_TP Start up 1 D14BIS",
      "description": "\n\nDALMASSO Stéphane\nTD 4 Porail PC\n\n(Modifié le:14/10/2025 13:01)",
      "status": "",
      "url": "",
      "lastModified": "2025-10-14T13:01:00+02:00"
    },
    {
      "id": "ADE60322e706c616e6e696e67554c5f323032355f323032362d36393636362d302d30",
      "title": "CC 718 Caractérisation des Sites et Sols Pollués ",
      "start": "2025-12-17T10:15:00+01:00",
      "end": "2025-12-17T12:15:00+01:00",
      "allDay": false,
      "location": "Bridoux_TD 6",
      "description": "\n\nMASFARAUD Jean-François\nTP GRP 3\n\n(Modifié le:03/12/2025 09:41)",
      "status": "",
      "url": "",
      "lastModified": "2025-12-03T09:41:00+01:00"
    },
    {
      "id": "ADE60322e706c616e6e696e67554c5f323032355f323032362d39353633362d352d30",
      "title": "UE 704 EC4 TD Programmes APA",
      "start": "2025-12-17T11:00:00+01:00",
      "end": "2025-12-17T12:00:00+01:00",
      "allDay": false,
      "location": "Bridoux_TP Damasio D3",
      "description": "\n\nBOLMONT Benoît\nPromo complète M1 FI/FC\n\n(Modifié le:13/11/2025 11:15)",
      "status": "",
      "url": "",
      "lastModified": "2025-11-13T11:15:00+01:00"
    },
    {
      "id": "ADE60322e706c616e6e696e67554c5f323032355f323032362d393336382d332d30",
      "title": "TP GR.1 Education thérapeutique du patient",
      "start": "2025-12-17T13:00:00+01:00",
      "end": "2025-12-17T15:00:00+01:00",
      "allDay": false,
      "location": "Bridoux_TP Damasio D3",
      "description": "\n\nTP APAS GR.1\nTP APAS GR.1 LAS\nZAYAS-SAMPERE Ignacio\n\n(Modifié le:10/10/2025 16:12)",
      "status": "",
      "url": "",
      "lastModified": "2025-10-10T16:12:00+02:00"
    },
    {
      "id": "ADE60322e706c616e6e696e67554c5f323032355f323032362d3138353134352d302d30",
      "title": "Réunion Obligatoire M2 A3R",
      "start": "2025-12-17T13:30:00+01:00",
      "end": "2025-12-17T16:30:00+01:00",
      "allDay": false,
      "location": "Bridoux_TP Start up 1 D14BIS",
      "description": "\n\nOSTER Thierry\nM2 A3R\n\n(Modifié le:03/11/2025 14:37)",
      "status": "",
      "url": "",
      "lastModified": "2025-11-03T14:37:00+01:00"
    },
    {
      "id": "ADE60322e706c616e6e696e67554c5f323032355f323032362d36323735362d302d32",
      "title": "TD A EC 306.1 Chimie de notre environnement",
      "start": "2025-12-17T13:30:00+01:00",
      "end": "2025-12-17T15:30:00+01:00",
      "allDay": false,
      "location": "Bridoux_TD 3",
      "description": "\n\nL2 Chimie LAS\nL2 Chimie FC\nL2 Chimie PE\nTD A L2 Chimie\nSCHRAMM Sébastien\n\n(Modifié le:20/11/2025 09:36)",
      "status": "",
      "url": "",
      "lastModified": "2025-11-20T09:36:00+01:00"
    },
    {
      "id": "ADE60322e706c616e6e696e67554c5f323032355f323032362d393530342d302d37",
      "title": "TD 303.1 Ondes et vibrations",
      "start": "2025-12-17T13:30:00+01:00",
      "end": "2025-12-17T15:30:00+01:00",
      "allDay": false,
      "location": "Bridoux_TD 24",
      "description": "\n\nTREMBLAY Jean-Christophe\nTD L2 Physique\nL2 Physique FC\nL2 Physique LAS\nL2 PC\nTD 303.1 Ondes et vibrations\nTD 303.1 Ondes et vibrations\nTD 303.1 Ondes et vibrations\nTD 303.1 Ondes et vibrations\nTD 303.1 Ondes et vibrations\nTD 303.1 Ondes et vibrations\nTD 303.1 Ondes et vibrations\nTD 303.1 Ondes et vibrations\nTD 303.1 Ondes et vibrations\nTD 303.1 Ondes et vibrations\nL2 Physique PE\n\n(Modifié le:03/11/2025 11:21)",
      "status": "",
      "url": "",
      "lastModified": "2025-11-03T11:21:00+01:00"
    },
    {
      "id": "ADE60322e706c616e6e696e67554c5f323032355f323032362d3136373930382d322d30",
      "title": "TD ME763 Gérer une classe, avoir une approche réflexive - 1",
      "start": "2025-12-17T13:30:00+01:00",
      "end": "2025-12-17T16:30:00+01:00",
      "allDay": false,
      "location": "Bridoux_TD 28",
      "description": "\n\nCORDIER Frederic\nM1 MEEF PC\n\n(Modifié le:12/09/2025 10:58)",
      "status": "",
      "url": "",
      "lastModified": "2025-09-12T10:58:00+02:00"
    },
    {
      "id": "ADE60322e706c616e6e696e67554c5f323032355f323032362d3133353735322d312d30",
      "title": "TP 2 Biologie moléculaire",
      "start": "2025-12-17T13:30:00+01:00",
      "end": "2025-12-17T17:30:00+01:00",
      "allDay": false,
      "location": "Bridoux_ TP Monod E7",
      "description": "\n\nDUBOIS-POT-SCHNEIDER Hélène\nTP Gr.2 de Biochimie et Biologie moléculaire\n\n(Modifié le:22/09/2025 12:19)",
      "status": "",
      "url": "",
      "lastModified": "2025-09-22T12:19:00+02:00"
    },
    {
      "id": "ADE60322e706c616e6e696e67554c5f323032355f323032362d38383536312d302d30",
      "title": "TP Gr1 UE 304 Systèmes électroniques mesures : étude et pratique",
      "start": "2025-12-17T13:30:00+01:00",
      "end": "2025-12-17T17:30:00+01:00",
      "allDay": false,
      "location": "Bridoux_TP  Edison H7",
      "description": "\n\nCHOUCHENE Bilel\nTP Gr1 L2 SPI (UE301 et 304)\n\n(Modifié le:02/12/2025 10:26)",
      "status": "",
      "url": "",
      "lastModified": "2025-12-02T10:26:00+01:00"
    },
    {
      "id": "ADE60322e706c616e6e696e67554c5f323032355f323032362d3137313531332d31322d30",
      "title": "TP ME941 Pratique expérimentale en M-PC et PCdes LP 1",
      "start": "2025-12-17T13:30:00+01:00",
      "end": "2025-12-17T16:30:00+01:00",
      "allDay": false,
      "location": "Bridoux_TP Hertz H13",
      "description": "\n\nM2 M-PC\nM2 MEEF PC\nBECU Lydiane\n\n(Modifié le:26/09/2025 18:40)",
      "status": "",
      "url": "",
      "lastModified": "2025-09-26T18:40:00+02:00"
    },
    {
      "id": "ADE60322e706c616e6e696e67554c5f323032355f323032362d39353634362d362d30",
      "title": "UE 706 EC2 TD Conduite de projet en APA-S",
      "start": "2025-12-17T13:30:00+01:00",
      "end": "2025-12-17T16:30:00+01:00",
      "allDay": false,
      "location": "Bridoux_TP Start up 2 D16",
      "description": "\n\nPromo complète M1 FI/FC\nLANGLET Cécile\n\n(Modifié le:11/12/2025 15:50)",
      "status": "",
      "url": "",
      "lastModified": "2025-12-11T15:50:00+01:00"
    },
    {
      "id": "ADE60322e706c616e6e696e67554c5f323032355f323032362d3133343437312d302d30",
      "title": "CC1 UE 502 Ressource sols, paysage et biodiversité",
      "start": "2025-12-17T13:30:00+01:00",
      "end": "2025-12-17T14:00:00+01:00",
      "allDay": false,
      "location": "Bridoux_Salle des Actes B14",
      "description": "\n\nLPRO Agro ADNT\nLPRO Agro AAU\nARAN Delphine\n\n(Modifié le:05/11/2025 09:36)",
      "status": "",
      "url": "",
      "lastModified": "2025-11-05T09:36:00+01:00"
    },
    {
      "id": "ADE60322e706c616e6e696e67554c5f323032355f323032362d32373233312d302d30",
      "title": "Substitution // 105 Maths pour la biologie",
      "start": "2025-12-17T14:00:00+01:00",
      "end": "2025-12-17T15:00:00+01:00",
      "allDay": false,
      "location": "Bridoux_TD 18",
      "description": "\n\nCAMARA Baba Issa\nTALAH SADIA\nBOUBENIDER NADIR\nDI ROSA BILAL\n\n(Modifié le:05/12/2025 10:13)",
      "status": "",
      "url": "",
      "lastModified": "2025-12-05T10:13:00+01:00"
    },
    {
      "id": "ADE60322e706c616e6e696e67554c5f323032355f323032362d38383732382d322d30",
      "title": "EI ME750 Concevoir, mettre en ?uvre, réguler et évaluer",
      "start": "2025-12-17T14:00:00+01:00",
      "end": "2025-12-17T15:00:00+01:00",
      "allDay": false,
      "location": "Bridoux_TD 2",
      "description": "\n\nFRANCK Marie-Odile\nM1 MEEF EPS - Groupe A\nM1 MEEF EPS - Groupe B\nPrépa CAPES STAPS EDT M1\n\n(Modifié le:22/09/2025 11:04)",
      "status": "",
      "url": "",
      "lastModified": "2025-09-22T11:04:00+02:00"
    },
    {
      "id": "ADE60322e706c616e6e696e67554c5f323032355f323032362d35333233362d302d30",
      "title": "CC1 UE 503 Ressources en eau et hydrobiologie",
      "start": "2025-12-17T14:00:00+01:00",
      "end": "2025-12-17T14:30:00+01:00",
      "allDay": false,
      "location": "Bridoux_Salle des Actes B14",
      "description": "\n\nFELTEN Vincent\nLPRO Agro ADNT\nLPRO Agro AAU\n\n(Modifié le:05/11/2025 09:36)",
      "status": "",
      "url": "",
      "lastModified": "2025-11-05T09:36:00+01:00"
    },
    {
      "id": "ADE60322e706c616e6e696e67554c5f323032355f323032362d32343034352d332d30",
      "title": "EI UE 506 Agroéquipements innovants",
      "start": "2025-12-17T14:45:00+01:00",
      "end": "2025-12-17T17:45:00+01:00",
      "allDay": false,
      "location": "Bridoux_TD 1",
      "description": "\n\nLPRO Agro ADNT\nBELNER Alexandre\n\n(Modifié le:19/11/2025 10:01)",
      "status": "",
      "url": "",
      "lastModified": "2025-11-19T10:01:00+01:00"
    },
    {
      "id": "ADE60322e706c616e6e696e67554c5f323032355f323032362d383030322d302d3132",
      "title": "EI 3 EC 102.1 Mécanique du point",
      "start": "2025-12-17T15:15:00+01:00",
      "end": "2025-12-17T17:15:00+01:00",
      "allDay": false,
      "location": "Bridoux_TD 13",
      "description": "\n\nTD 3 Portail PC\nCREOLA-CHIVERS Theo\n\n(Modifié le:12/12/2025 09:57)",
      "status": "",
      "url": "",
      "lastModified": "2025-12-12T09:57:00+01:00"
    },
    {
      "id": "ADE60322e706c616e6e696e67554c5f323032355f323032362d393734342d302d31",
      "title": "TD 303.2 Electromagnétisme 2",
      "start": "2025-12-17T15:45:00+01:00",
      "end": "2025-12-17T17:45:00+01:00",
      "allDay": false,
      "location": "Bridoux_TD 6",
      "description": "\n\nWAX Jean-François\nTD L2 Physique\nL2 Physique FC\nL2 Physique LAS\nL2 PC\nL2 PC LAS\nL2 PC PE\nL2 Physique PE\n\n(Modifié le:03/11/2025 16:56)",
      "status": "",
      "url": "",
      "lastModified": "2025-11-03T16:56:00+01:00"
    },
    {
      "id": "ADE60322e706c616e6e696e67554c5f323032355f323032362d3231323431392d302d30",
      "title": "Réunion obligatoire",
      "start": "2025-12-17T16:30:00+01:00",
      "end": "2025-12-17T17:30:00+01:00",
      "allDay": false,
      "location": "Bridoux_TP Start up 2 D16",
      "description": "\n\nLANGLET Cécile\nPromo complète M1 FA\nPromo complète M1 FI/FC\n\n(Modifié le:11/12/2025 15:52)",
      "status": "",
      "url": "",
      "lastModified": "2025-12-11T15:52:00+01:00"
    },
    {
      "id": "ADE60322e706c616e6e696e67554c5f323032355f323032362d3134323139342d302d34",
      "title": "Travaux service technique",
      "start": "2025-12-18T07:00:00+01:00",
      "end": "2025-12-18T19:00:00+01:00",
      "allDay": false,
      "location": "",
      "description": "\n\n\n\n(Modifié le:11/12/2025 11:39)",
      "status": "",
      "url": "",
      "lastModified": "2025-12-11T11:39:00+01:00"
    },
    {
      "id": "ADE60322e706c616e6e696e67554c5f323032355f323032362d383437322d302d32",
      "title": "EI 2 EC 103.2 Cinétique chimique",
      "start": "2025-12-18T08:00:00+01:00",
      "end": "2025-12-18T10:00:00+01:00",
      "allDay": false,
      "location": "Bridoux_TD 7",
      "description": "\n\nSCHRAMM Sébastien\nTD 2 Portail PC\n\n(Modifié le:04/11/2025 11:28)",
      "status": "",
      "url": "",
      "lastModified": "2025-11-04T11:28:00+01:00"
    },
    {
      "id": "ADE60322e706c616e6e696e67554c5f323032355f323032362d37333937362d302d3235",
      "title": "Prêt salle IFSI TD 16 SN",
      "start": "2025-12-18T08:00:00+01:00",
      "end": "2025-12-18T10:00:00+01:00",
      "allDay": false,
      "location": "Bridoux_TD 16",
      "description": "\n1688627997903\nNAVARRO Sylvain\nTD IFSI PRET SALLE\n\n(Modifié le:13/05/2025 12:38)",
      "status": "",
      "url": "",
      "lastModified": "2025-05-13T12:38:00+02:00"
    },
    {
      "id": "ADE60322e706c616e6e696e67554c5f323032355f323032362d3135313731302d32342d30",
      "title": "EI 4 UE 101 Mathématiques 1",
      "start": "2025-12-18T08:00:00+01:00",
      "end": "2025-12-18T10:00:00+01:00",
      "allDay": false,
      "location": "Bridoux_TD 24",
      "description": "\n\nTP G Portail PC\nFARDET Anne-Laure\n\n(Modifié le:22/09/2025 10:02)",
      "status": "",
      "url": "",
      "lastModified": "2025-09-22T10:02:00+02:00"
    },
    {
      "id": "ADE60322e706c616e6e696e67554c5f323032355f323032362d3133313431322d302d36",
      "title": "EI 1 UE 101 Mathématiques 1",
      "start": "2025-12-18T08:00:00+01:00",
      "end": "2025-12-18T10:00:00+01:00",
      "allDay": false,
      "location": "Bridoux_TD 2",
      "description": "\n\nGRANDCOLAS Michel\nTD 1 Portail PC\n\n(Modifié le:01/10/2025 11:41)",
      "status": "",
      "url": "",
      "lastModified": "2025-10-01T11:41:00+02:00"
    },
    {
      "id": "ADE60322e706c616e6e696e67554c5f323032355f323032362d32323736332d31342d30",
      "title": "EI UE 505 Enjeux sanitaires et environne. de l'agroécologie",
      "start": "2025-12-18T08:00:00+01:00",
      "end": "2025-12-18T10:00:00+01:00",
      "allDay": false,
      "location": "Bridoux_TD 1",
      "description": "\n\nLPRO Agro ADNT\nMASFARAUD Jean-François\n\n(Modifié le:05/11/2025 09:36)",
      "status": "",
      "url": "",
      "lastModified": "2025-11-05T09:36:00+01:00"
    },
    {
      "id": "ADE60322e706c616e6e696e67554c5f323032355f323032362d3131353331332d302d30",
      "title": "TP Gr2 UE 304 Systèmes électroniques mesures : étude et pratique",
      "start": "2025-12-18T08:00:00+01:00",
      "end": "2025-12-18T12:00:00+01:00",
      "allDay": false,
      "location": "Bridoux_TP  Edison H7",
      "description": "\n\nTITE Teddy\nTP Gr2 L2 SPI (UE301 et 304)\n\n(Modifié le:02/12/2025 10:27)",
      "status": "",
      "url": "",
      "lastModified": "2025-12-02T10:27:00+01:00"
    },
    {
      "id": "ADE60322e706c616e6e696e67554c5f323032355f323032362d3138353239322d302d3333",
      "title": "Prêt salle IFSI TD 17 MU",
      "start": "2025-12-18T08:00:00+01:00",
      "end": "2025-12-18T10:00:00+01:00",
      "allDay": false,
      "location": "Bridoux_TD 17",
      "description": "\n\nTD IFSI PRET SALLE\nUBASSY Mickaël\n\n(Modifié le:13/05/2025 13:00)",
      "status": "",
      "url": "",
      "lastModified": "2025-05-13T13:00:00+02:00"
    },
    {
      "id": "ADE60322e706c616e6e696e67554c5f323032355f323032362d3231353830332d302d30",
      "title": "Examens UE 905 EC1 - EC2 ",
      "start": "2025-12-18T08:00:00+01:00",
      "end": "2025-12-18T12:00:00+01:00",
      "allDay": false,
      "location": "Bridoux_Salle des Actes B14",
      "description": "\n\nPromo complète M2 FA\nPromo complète M2 FI/FC\nWALTER Christophe\n\n(Modifié le:17/11/2025 14:38)",
      "status": "",
      "url": "",
      "lastModified": "2025-11-17T14:38:00+01:00"
    },
    {
      "id": "ADE60322e706c616e6e696e67554c5f323032355f323032362d36303033352d312d30",
      "title": "TP C NUMOC - SV",
      "start": "2025-12-18T08:00:00+01:00",
      "end": "2025-12-18T10:00:00+01:00",
      "allDay": false,
      "location": "Bridoux_TP Info6 F2",
      "description": "\n\nTP  C\nPARANT Marc\n\n(Modifié le:12/09/2025 16:24)",
      "status": "",
      "url": "",
      "lastModified": "2025-09-12T16:24:00+02:00"
    },
    {
      "id": "ADE60322e706c616e6e696e67554c5f323032355f323032362d39383839322d302d31",
      "title": "Concours blanc M1 PC",
      "start": "2025-12-18T08:00:00+01:00",
      "end": "2025-12-18T13:00:00+01:00",
      "allDay": false,
      "location": "Bridoux_TD 29",
      "description": "\n\nCOURILLEAU-GOBRY Anne\nM1 MEEF PC\nM2 M-PC\nM2 MEEF PC\nHESSE Stéphanie\n\n(Modifié le:11/12/2025 17:19)",
      "status": "",
      "url": "",
      "lastModified": "2025-12-11T17:19:00+01:00"
    },
    {
      "id": "ADE60322e706c616e6e696e67554c5f323032355f323032362d36313639382d302d37",
      "title": "TP A 306.1 Physique expérimentale 2",
      "start": "2025-12-18T09:00:00+01:00",
      "end": "2025-12-18T12:00:00+01:00",
      "allDay": false,
      "location": "Bridoux_TP Carnot H6",
      "description": "\n\nTP A L2 Physique\nLECLERC Arnaud\n\n(Modifié le:03/09/2025 12:54)",
      "status": "",
      "url": "",
      "lastModified": "2025-09-03T12:54:00+02:00"
    },
    {
      "id": "ADE60322e706c616e6e696e67554c5f323032355f323032362d31363935302d302d30",
      "title": "TD GR.3 Neurosciences du contrôle moteur",
      "start": "2025-12-18T09:00:00+01:00",
      "end": "2025-12-18T12:00:00+01:00",
      "allDay": false,
      "location": "Bridoux_TP Damasio D3",
      "description": "\n\nGR.3\nLANGLET Cécile\n\n(Modifié le:11/12/2025 15:52)",
      "status": "",
      "url": "",
      "lastModified": "2025-12-11T15:52:00+01:00"
    },
    {
      "id": "ADE60322e706c616e6e696e67554c5f323032355f323032362d38343737352d31332d30",
      "title": "EI Analyse environnementale et stratégie de valorisation",
      "start": "2025-12-18T09:00:00+01:00",
      "end": "2025-12-18T10:00:00+01:00",
      "allDay": false,
      "location": "Bridoux_TD 4",
      "description": "\n\nEBOLI Jeremie\nLPRO Agro AAU\n\n(Modifié le:03/12/2025 16:25)",
      "status": "",
      "url": "",
      "lastModified": "2025-12-03T16:25:00+01:00"
    },
    {
      "id": "ADE60322e706c616e6e696e67554c5f323032355f323032362d3138353239322d302d3334",
      "title": "Prêt salle IFSI TD 17 MU",
      "start": "2025-12-18T10:00:00+01:00",
      "end": "2025-12-18T12:00:00+01:00",
      "allDay": false,
      "location": "Bridoux_TD 17",
      "description": "\n\nTD IFSI PRET SALLE\nUBASSY Mickaël\n\n(Modifié le:13/05/2025 13:00)",
      "status": "",
      "url": "",
      "lastModified": "2025-05-13T13:00:00+02:00"
    },
    {
      "id": "ADE60322e706c616e6e696e67554c5f323032355f323032362d37333937362d302d3236",
      "title": "Prêt salle IFSI TD 16 SN",
      "start": "2025-12-18T10:00:00+01:00",
      "end": "2025-12-18T12:00:00+01:00",
      "allDay": false,
      "location": "Bridoux_TD 16",
      "description": "\n1688628004507\nNAVARRO Sylvain\nTD IFSI PRET SALLE\n\n(Modifié le:13/05/2025 12:38)",
      "status": "",
      "url": "",
      "lastModified": "2025-05-13T12:38:00+02:00"
    },
    {
      "id": "ADE60322e706c616e6e696e67554c5f323032355f323032362d383030322d302d3138",
      "title": "EI 3 EC 102.1 Mécanique du point",
      "start": "2025-12-18T10:15:00+01:00",
      "end": "2025-12-18T12:15:00+01:00",
      "allDay": false,
      "location": "Bridoux_TD 5",
      "description": "\n\nCREOLA-CHIVERS Theo\nTD 3 Portail PC\n\n(Modifié le:10/12/2025 16:46)",
      "status": "",
      "url": "",
      "lastModified": "2025-12-10T16:46:00+01:00"
    },
    {
      "id": "ADE60322e706c616e6e696e67554c5f323032355f323032362d32323335382d332d30",
      "title": "EI 2 Gestion et analyse de données",
      "start": "2025-12-18T10:15:00+01:00",
      "end": "2025-12-18T12:15:00+01:00",
      "allDay": false,
      "location": "Bridoux_TP Info1 C1",
      "description": "\n\nQUEVREUX Pierre\nLPRO Agro AAU\nLPRO Agro ADNT\n\n(Modifié le:03/12/2025 12:19)",
      "status": "",
      "url": "",
      "lastModified": "2025-12-03T12:19:00+01:00"
    },
    {
      "id": "ADE60322e706c616e6e696e67554c5f323032355f323032362d3134363831302d392d30",
      "title": "EI 4 EC 102.1 Mécanique du point",
      "start": "2025-12-18T10:15:00+01:00",
      "end": "2025-12-18T12:15:00+01:00",
      "allDay": false,
      "location": "Bridoux_TD 4",
      "description": "\n\nTD 4 Porail PC\nMESSINA René\n\n(Modifié le:22/09/2025 10:02)",
      "status": "",
      "url": "",
      "lastModified": "2025-09-22T10:02:00+02:00"
    },
    {
      "id": "ADE60322e706c616e6e696e67554c5f323032355f323032362d3131313931382d342d30",
      "title": "EI 1 EC 103.2 Equilibres chimiques",
      "start": "2025-12-18T10:15:00+01:00",
      "end": "2025-12-18T12:15:00+01:00",
      "allDay": false,
      "location": "Bridoux_TD 24",
      "description": "\n\nAKIL Suzanna\nTD 1 Portail PC\n\n(Modifié le:01/10/2025 11:41)",
      "status": "",
      "url": "",
      "lastModified": "2025-10-01T11:41:00+02:00"
    },
    {
      "id": "ADE60322e706c616e6e696e67554c5f323032355f323032362d373836392d302d3234",
      "title": "EI 2 UE 101 Mathématiques 1",
      "start": "2025-12-18T10:15:00+01:00",
      "end": "2025-12-18T12:15:00+01:00",
      "allDay": false,
      "location": "Bridoux_TD 13",
      "description": "\n\nTD 2 Portail PC\nGLEIZE Jérôme\n\n(Modifié le:24/09/2025 13:21)",
      "status": "",
      "url": "",
      "lastModified": "2025-09-24T13:21:00+02:00"
    },
    {
      "id": "ADE60322e706c616e6e696e67554c5f323032355f323032362d36303034332d302d30",
      "title": "TP D NUMOC - SV",
      "start": "2025-12-18T10:15:00+01:00",
      "end": "2025-12-18T12:15:00+01:00",
      "allDay": false,
      "location": "Bridoux_TP Info6 F2",
      "description": "\n\nTP  D\nPARANT Marc\n\n(Modifié le:20/10/2025 17:24)",
      "status": "",
      "url": "",
      "lastModified": "2025-10-20T17:24:00+02:00"
    },
    {
      "id": "ADE60322e706c616e6e696e67554c5f323032355f323032362d3138383332372d302d30",
      "title": "301 EC1 Biochimie",
      "start": "2025-12-18T11:00:00+01:00",
      "end": "2025-12-18T11:30:00+01:00",
      "allDay": false,
      "location": "Bridoux_TD 9",
      "description": "\n\nALLEMAN QUENTIN\n\n(Modifié le:11/12/2025 11:56)",
      "status": "",
      "url": "",
      "lastModified": "2025-12-11T11:56:00+01:00"
    },
    {
      "id": "ADE60322e706c616e6e696e67554c5f323032355f323032362d3132383032372d31342d30",
      "title": "EI GH Mathématiques pour la biologie",
      "start": "2025-12-18T13:30:00+01:00",
      "end": "2025-12-18T15:30:00+01:00",
      "allDay": false,
      "location": "Bridoux_TD 13",
      "description": "\n\nCAMARA Baba Issa\nTP  G\nTP  H\n\n(Modifié le:06/10/2025 15:56)",
      "status": "",
      "url": "",
      "lastModified": "2025-10-06T15:56:00+02:00"
    },
    {
      "id": "ADE60322e706c616e6e696e67554c5f323032355f323032362d32383137362d302d3133",
      "title": "TP ANGLAIS - GR. B",
      "start": "2025-12-18T13:30:00+01:00",
      "end": "2025-12-18T15:30:00+01:00",
      "allDay": false,
      "location": "Bridoux_TD 17",
      "description": "\n\nUBASSY Mickaël\nTP ANGLAIS - GRP B\n\n(Modifié le:28/08/2025 11:40)",
      "status": "",
      "url": "",
      "lastModified": "2025-08-28T11:40:00+02:00"
    },
    {
      "id": "ADE60322e706c616e6e696e67554c5f323032355f323032362d3131353736382d302d32",
      "title": "EI 3 EC 103.2 Equilibres chimiques",
      "start": "2025-12-18T13:30:00+01:00",
      "end": "2025-12-18T15:30:00+01:00",
      "allDay": false,
      "location": "Bridoux_TD 7",
      "description": "\n\nACHARD Christian\nTD 3 Portail PC\n\n(Modifié le:23/09/2025 18:01)",
      "status": "",
      "url": "",
      "lastModified": "2025-09-23T18:01:00+02:00"
    },
    {
      "id": "ADE60322e706c616e6e696e67554c5f323032355f323032362d3130303835352d302d34",
      "title": "EI 4 EC 103.2 Cinétique chimique",
      "start": "2025-12-18T13:30:00+01:00",
      "end": "2025-12-18T15:30:00+01:00",
      "allDay": false,
      "location": "Bridoux_TD 18",
      "description": "\n\nGHARRED Nawres\nTD 4 Porail PC\n\n(Modifié le:03/10/2025 17:29)",
      "status": "",
      "url": "",
      "lastModified": "2025-10-03T17:29:00+02:00"
    },
    {
      "id": "ADE60322e706c616e6e696e67554c5f323032355f323032362d3133313430392d302d32",
      "title": "EI 2 EC 102.1 Mécanique du point",
      "start": "2025-12-18T13:30:00+01:00",
      "end": "2025-12-18T15:30:00+01:00",
      "allDay": false,
      "location": "Bridoux_TD 4",
      "description": "\n\nWAX Jean-François\nTD 2 Portail PC\n\n(Modifié le:24/09/2025 13:21)",
      "status": "",
      "url": "",
      "lastModified": "2025-09-24T13:21:00+02:00"
    },
    {
      "id": "ADE60322e706c616e6e696e67554c5f323032355f323032362d3131323430312d302d34",
      "title": "EI 1 EC 103.2 Cinétique chimique",
      "start": "2025-12-18T13:30:00+01:00",
      "end": "2025-12-18T15:30:00+01:00",
      "allDay": false,
      "location": "Bridoux_TD 3",
      "description": "\n\nAKIL Suzanna\nTD 1 Portail PC\n\n(Modifié le:03/10/2025 17:28)",
      "status": "",
      "url": "",
      "lastModified": "2025-10-03T17:28:00+02:00"
    },
    {
      "id": "ADE60322e706c616e6e696e67554c5f323032355f323032362d323332342d302d3133",
      "title": "TP ANGLAIS - GR. A",
      "start": "2025-12-18T13:30:00+01:00",
      "end": "2025-12-18T15:30:00+01:00",
      "allDay": false,
      "location": "Bridoux_TD 16",
      "description": "\n\nNAVARRO Sylvain\nTP ANGLAIS - GRP A\n\n(Modifié le:28/08/2025 11:40)",
      "status": "",
      "url": "",
      "lastModified": "2025-08-28T11:40:00+02:00"
    },
    {
      "id": "ADE60322e706c616e6e696e67554c5f323032355f323032362d3133353735342d312d30",
      "title": "TP 3 Biologie moléculaire",
      "start": "2025-12-18T13:30:00+01:00",
      "end": "2025-12-18T17:30:00+01:00",
      "allDay": false,
      "location": "Bridoux_ TP Monod E7",
      "description": "\n\nDUBOIS-POT-SCHNEIDER Hélène\nTP Gr.3 de Biochimie et Biologie moléculaire\n\n(Modifié le:09/09/2025 12:49)",
      "status": "",
      "url": "",
      "lastModified": "2025-09-09T12:49:00+02:00"
    },
    {
      "id": "ADE60322e706c616e6e696e67554c5f323032355f323032362d32323736332d31312d30",
      "title": "EI UE 505 Enjeux sanitaires et environne. de l'agroécologie",
      "start": "2025-12-18T13:30:00+01:00",
      "end": "2025-12-18T16:30:00+01:00",
      "allDay": false,
      "location": "Bridoux_TD 1",
      "description": "\n\nLPRO Agro ADNT\nMASFARAUD Jean-François\n\n(Modifié le:05/11/2025 09:36)",
      "status": "",
      "url": "",
      "lastModified": "2025-11-05T09:36:00+01:00"
    },
    {
      "id": "ADE60322e706c616e6e696e67554c5f323032355f323032362d39353734342d312d30",
      "title": "UE 906 TP EC1 Pratique bien-être",
      "start": "2025-12-18T13:30:00+01:00",
      "end": "2025-12-18T16:30:00+01:00",
      "allDay": false,
      "location": "Bridoux_TP Damasio D3",
      "description": "\n\nLANGLET Cécile\nPromo complète M2 FA\nPromo complète M2 FI/FC\n\n(Modifié le:30/10/2025 12:26)",
      "status": "",
      "url": "",
      "lastModified": "2025-10-30T12:26:00+01:00"
    },
    {
      "id": "ADE60322e706c616e6e696e67554c5f323032355f323032362d3137313531332d312d30",
      "title": "TP ME941 Pratique expérimentale en M-PC et PCdes LP 1",
      "start": "2025-12-18T14:00:00+01:00",
      "end": "2025-12-18T17:00:00+01:00",
      "allDay": false,
      "location": "Bridoux_TP Hertz H13",
      "description": "\n\nM2 M-PC\nM2 MEEF PC\nBECU Lydiane\n\n(Modifié le:26/09/2025 18:40)",
      "status": "",
      "url": "",
      "lastModified": "2025-09-26T18:40:00+02:00"
    },
    {
      "id": "ADE60322e706c616e6e696e67554c5f323032355f323032362d32383137362d302d3134",
      "title": "TP ANGLAIS - GR. B",
      "start": "2025-12-18T15:30:00+01:00",
      "end": "2025-12-18T17:30:00+01:00",
      "allDay": false,
      "location": "Bridoux_TD 17",
      "description": "\n\nUBASSY Mickaël\nTP ANGLAIS - GRP B\n\n(Modifié le:28/08/2025 11:40)",
      "status": "",
      "url": "",
      "lastModified": "2025-08-28T11:40:00+02:00"
    },
    {
      "id": "ADE60322e706c616e6e696e67554c5f323032355f323032362d323332342d302d3134",
      "title": "TP ANGLAIS - GR. A",
      "start": "2025-12-18T15:30:00+01:00",
      "end": "2025-12-18T17:30:00+01:00",
      "allDay": false,
      "location": "Bridoux_TD 16",
      "description": "\n\nNAVARRO Sylvain\nTP ANGLAIS - GRP A\n\n(Modifié le:28/08/2025 11:40)",
      "status": "",
      "url": "",
      "lastModified": "2025-08-28T11:40:00+02:00"
    },
    {
      "id": "ADE60322e706c616e6e696e67554c5f323032355f323032362d3132383032392d31342d30",
      "title": "EI IJ Mathématiques pour la biologie",
      "start": "2025-12-18T15:45:00+01:00",
      "end": "2025-12-18T17:45:00+01:00",
      "allDay": false,
      "location": "Bridoux_TD 13",
      "description": "\n\nCAMARA Baba Issa\nTP  I\nTP  J\n\n(Modifié le:06/10/2025 15:56)",
      "status": "",
      "url": "",
      "lastModified": "2025-10-06T15:56:00+02:00"
    },
    {
      "id": "ADE60322e706c616e6e696e67554c5f323032355f323032362d373539332d302d3134",
      "title": "EI UE 105/OS Remédiation en mathématiques 1",
      "start": "2025-12-18T15:45:00+01:00",
      "end": "2025-12-18T17:45:00+01:00",
      "allDay": false,
      "location": "Bridoux_TP Start up 2 D16",
      "description": "\n\nGREFFIER Olivier\nTD 4 Porail PC\n\n(Modifié le:14/10/2025 13:02)",
      "status": "",
      "url": "",
      "lastModified": "2025-10-14T13:02:00+02:00"
    },
    {
      "id": "ADE60322e706c616e6e696e67554c5f323032355f323032362d3134323139342d31302d31",
      "title": "Travaux service technique",
      "start": "2025-12-19T07:00:00+01:00",
      "end": "2025-12-19T19:00:00+01:00",
      "allDay": false,
      "location": "",
      "description": "\n\n\n\n(Modifié le:11/12/2025 11:39)",
      "status": "",
      "url": "",
      "lastModified": "2025-12-11T11:39:00+01:00"
    },
    {
      "id": "ADE60322e706c616e6e696e67554c5f323032355f323032362d36303034372d312d30",
      "title": "TP E NUMOC - SV",
      "start": "2025-12-19T08:00:00+01:00",
      "end": "2025-12-19T10:00:00+01:00",
      "allDay": false,
      "location": "Bridoux_TP Info2 C5",
      "description": "\n\nTP  E\nPARANT Marc\n\n(Modifié le:05/09/2025 18:11)",
      "status": "",
      "url": "",
      "lastModified": "2025-09-05T18:11:00+02:00"
    },
    {
      "id": "ADE60322e706c616e6e696e67554c5f323032355f323032362d3131383230362d302d30",
      "title": "TP GR.2 Pratiques spécifiques en APAS 1",
      "start": "2025-12-19T08:00:00+01:00",
      "end": "2025-12-19T12:00:00+01:00",
      "allDay": false,
      "location": "",
      "description": "\n\n\n\n(Modifié le:29/09/2025 19:09)",
      "status": "",
      "url": "",
      "lastModified": "2025-09-29T19:09:00+02:00"
    },
    {
      "id": "ADE60322e706c616e6e696e67554c5f323032355f323032362d37373136372d302d30",
      "title": "EXAMEN CC1 Langues et internationalisation",
      "start": "2025-12-19T08:00:00+01:00",
      "end": "2025-12-19T12:00:00+01:00",
      "allDay": false,
      "location": "Bridoux_TD 17",
      "description": "\n\nUBASSY Mickaël\nLPRO Agro AAU\nLPRO Agro ADNT\n\n(Modifié le:05/11/2025 09:36)",
      "status": "",
      "url": "",
      "lastModified": "2025-11-05T09:36:00+01:00"
    },
    {
      "id": "ADE60322e706c616e6e696e67554c5f323032355f323032362d3131313931382d312d30",
      "title": "EI 1 EC 103.2 Equilibres chimiques",
      "start": "2025-12-19T08:00:00+01:00",
      "end": "2025-12-19T10:00:00+01:00",
      "allDay": false,
      "location": "Bridoux_TD 7",
      "description": "\n\nAKIL Suzanna\nTD 1 Portail PC\n\n(Modifié le:01/10/2025 11:41)",
      "status": "",
      "url": "",
      "lastModified": "2025-10-01T11:41:00+02:00"
    },
    {
      "id": "ADE60322e706c616e6e696e67554c5f323032355f323032362d3133313431352d312d30",
      "title": "EI 3 UE 101 Mathématiques 1",
      "start": "2025-12-19T08:00:00+01:00",
      "end": "2025-12-19T10:00:00+01:00",
      "allDay": false,
      "location": "Bridoux_TD 9",
      "description": "\n\nTD 3 Portail PC\nJABER Hassan\n\n(Modifié le:03/11/2025 16:54)",
      "status": "",
      "url": "",
      "lastModified": "2025-11-03T16:54:00+01:00"
    },
    {
      "id": "ADE60322e706c616e6e696e67554c5f323032355f323032362d3135373733322d302d31",
      "title": "EI 4  EC 103.1  Structure de la matière",
      "start": "2025-12-19T08:00:00+01:00",
      "end": "2025-12-19T10:00:00+01:00",
      "allDay": false,
      "location": "Bridoux_TD 6",
      "description": "\n\nTD 4 Porail PC\nHATIM Oumaima\n\n(Modifié le:23/09/2025 16:26)",
      "status": "",
      "url": "",
      "lastModified": "2025-09-23T16:26:00+02:00"
    },
    {
      "id": "ADE60322e706c616e6e696e67554c5f323032355f323032362d39303636342d302d30",
      "title": "Examen TP 301.1",
      "start": "2025-12-19T08:00:00+01:00",
      "end": "2025-12-19T18:30:00+01:00",
      "allDay": false,
      "location": "Bridoux_TP  Edison H7",
      "description": "\n\nTITE Teddy\nL2 SPI\nCHOUCHENE Bilel\n\n(Modifié le:20/11/2025 14:47)",
      "status": "",
      "url": "",
      "lastModified": "2025-11-20T14:47:00+01:00"
    },
    {
      "id": "ADE60322e706c616e6e696e67554c5f323032355f323032362d3131383230362d302d30",
      "title": "TP GR.2 Pratiques spécifiques en APAS 1",
      "start": "2025-12-19T08:00:00+01:00",
      "end": "2025-12-19T12:00:00+01:00",
      "allDay": false,
      "location": "",
      "description": "\n\n\n\n(Modifié le:29/09/2025 19:09)",
      "status": "",
      "url": "",
      "lastModified": "2025-09-29T19:09:00+02:00"
    },
    {
      "id": "ADE60322e706c616e6e696e67554c5f323032355f323032362d3131383230362d302d30",
      "title": "TP GR.2 Pratiques spécifiques en APAS 1",
      "start": "2025-12-19T08:00:00+01:00",
      "end": "2025-12-19T12:00:00+01:00",
      "allDay": false,
      "location": "Bridoux_TP Snoezelen D10,Bridoux_TD 27,Bridoux_TP Start up 1 D14BIS",
      "description": "\n\nBRIER Laurence\nTP APAS GR.2\n\n(Modifié le:29/09/2025 19:09)",
      "status": "",
      "url": "",
      "lastModified": "2025-09-29T19:09:00+02:00"
    },
    {
      "id": "ADE60322e706c616e6e696e67554c5f323032355f323032362d3134363231372d302d30",
      "title": "Projet tutoré en FI/FC",
      "start": "2025-12-19T08:30:00+01:00",
      "end": "2025-12-19T10:00:00+01:00",
      "allDay": false,
      "location": "Bridoux_TP Start up 2 D16",
      "description": "\n\nLANGLET Cécile\nPromo complète M1 FI/FC\nPromo complète M2 FI/FC\nROTH David\n\n(Modifié le:09/12/2025 10:05)",
      "status": "",
      "url": "",
      "lastModified": "2025-12-09T10:05:00+01:00"
    },
    {
      "id": "ADE60322e706c616e6e696e67554c5f323032355f323032362d31313638342d302d35",
      "title": "TP B 306.1 Physique expérimentale 2",
      "start": "2025-12-19T09:00:00+01:00",
      "end": "2025-12-19T12:00:00+01:00",
      "allDay": false,
      "location": "Bridoux_TP Carnot H6",
      "description": "\n\nL2 Physique FC\nL2 Physique LAS\nL2 Physique PE\nTP B L2 Physique\nLECLERC Arnaud\n\n(Modifié le:26/09/2025 12:22)",
      "status": "",
      "url": "",
      "lastModified": "2025-09-26T12:22:00+02:00"
    },
    {
      "id": "ADE60322e706c616e6e696e67554c5f323032355f323032362d39353734302d302d30",
      "title": "UE 906 TD EC1 Pratique bien-être",
      "start": "2025-12-19T10:15:00+01:00",
      "end": "2025-12-19T12:15:00+01:00",
      "allDay": false,
      "location": "Bridoux_TP Damasio D3",
      "description": "\n\nLANGLET Cécile\nPromo complète M2 FI/FC\nPromo complète M2 FA\n\n(Modifié le:17/11/2025 16:41)",
      "status": "",
      "url": "",
      "lastModified": "2025-11-17T16:41:00+01:00"
    },
    {
      "id": "ADE60322e706c616e6e696e67554c5f323032355f323032362d36303035312d312d30",
      "title": "TP F NUMOC - SV",
      "start": "2025-12-19T10:15:00+01:00",
      "end": "2025-12-19T12:15:00+01:00",
      "allDay": false,
      "location": "Bridoux_TP Info2 C5",
      "description": "\n\nTP  F\nPARANT Marc\n\n(Modifié le:17/10/2025 14:17)",
      "status": "",
      "url": "",
      "lastModified": "2025-10-17T14:17:00+02:00"
    },
    {
      "id": "ADE60322e706c616e6e696e67554c5f323032355f323032362d3134353436312d352d30",
      "title": "EI UE 106/OS Remédiation en chimie 1",
      "start": "2025-12-19T10:15:00+01:00",
      "end": "2025-12-19T12:15:00+01:00",
      "allDay": false,
      "location": "Bridoux_TD 1",
      "description": "\n\nTD 4 Porail PC\nCOURILLEAU-GOBRY Anne\n\n(Modifié le:23/09/2025 12:38)",
      "status": "",
      "url": "",
      "lastModified": "2025-09-23T12:38:00+02:00"
    },
    {
      "id": "ADE60322e706c616e6e696e67554c5f323032355f323032362d3133313430382d302d37",
      "title": "EI 1 EC 102.1 Mécanique du point",
      "start": "2025-12-19T10:15:00+01:00",
      "end": "2025-12-19T12:15:00+01:00",
      "allDay": false,
      "location": "Bridoux_TD 5",
      "description": "\n\nGREFFIER Olivier\nTD 1 Portail PC\n\n(Modifié le:09/12/2025 14:38)",
      "status": "",
      "url": "",
      "lastModified": "2025-12-09T14:38:00+01:00"
    },
    {
      "id": "ADE60322e706c616e6e696e67554c5f323032355f323032362d36303037302d312d30",
      "title": "TP G NUMOC - SV",
      "start": "2025-12-19T13:30:00+01:00",
      "end": "2025-12-19T15:30:00+01:00",
      "allDay": false,
      "location": "Bridoux_TP Info2 C5",
      "description": "\n\nTP  G\nPARANT Marc\n\n(Modifié le:22/09/2025 12:14)",
      "status": "",
      "url": "",
      "lastModified": "2025-09-22T12:14:00+02:00"
    },
    {
      "id": "ADE60322e706c616e6e696e67554c5f323032355f323032362d39353734342d302d30",
      "title": "UE 906 TP EC1 Pratique bien-être",
      "start": "2025-12-19T13:30:00+01:00",
      "end": "2025-12-19T15:30:00+01:00",
      "allDay": false,
      "location": "Bridoux_TP Start up 2 D16",
      "description": "\n\nLANGLET Cécile\nPromo complète M2 FA\nPromo complète M2 FI/FC\n\n(Modifié le:17/11/2025 16:40)",
      "status": "",
      "url": "",
      "lastModified": "2025-11-17T16:40:00+01:00"
    },
    {
      "id": "ADE60322e706c616e6e696e67554c5f323032355f323032362d32323736332d31302d30",
      "title": "EI UE 505 Enjeux sanitaires et environne. de l'agroécologie",
      "start": "2025-12-19T13:30:00+01:00",
      "end": "2025-12-19T15:30:00+01:00",
      "allDay": false,
      "location": "Bridoux_TD 1",
      "description": "\n\nLPRO Agro ADNT\nMASFARAUD Jean-François\n\n(Modifié le:05/11/2025 09:36)",
      "status": "",
      "url": "",
      "lastModified": "2025-11-05T09:36:00+01:00"
    },
    {
      "id": "ADE60322e706c616e6e696e67554c5f323032355f323032362d3138353231302d342d30",
      "title": "AGREGATION INTERNE",
      "start": "2025-12-19T14:00:00+01:00",
      "end": "2025-12-19T18:00:00+01:00",
      "allDay": false,
      "location": "Bridoux_TD 24",
      "description": "\n\nPrêt salles et amphi\n\n(Modifié le:14/10/2025 14:31)",
      "status": "",
      "url": "",
      "lastModified": "2025-10-14T14:31:00+02:00"
    },
    {
      "id": "ADE60322e706c616e6e696e67554c5f323032355f323032362d3135343930342d302d30",
      "title": "Examen CC UE 907 TD EC1 Projet de développement ",
      "start": "2025-12-19T15:30:00+01:00",
      "end": "2025-12-19T17:30:00+01:00",
      "allDay": false,
      "location": "Bridoux_TP Start up 2 D16",
      "description": "\n\nLANGLET Cécile\nPromo complète M2 FA\nPromo complète M2 FI/FC\n\n(Modifié le:11/12/2025 16:16)",
      "status": "",
      "url": "",
      "lastModified": "2025-12-11T16:16:00+01:00"
    },
    {
      "id": "ADE60322e706c616e6e696e67554c5f323032355f323032362d36303038352d302d30",
      "title": "TP H NUMOC - SV",
      "start": "2025-12-19T15:45:00+01:00",
      "end": "2025-12-19T17:45:00+01:00",
      "allDay": false,
      "location": "Bridoux_TP Info2 C5",
      "description": "\n\nTP  H\nPARANT Marc\n\n(Modifié le:06/10/2025 15:56)",
      "status": "",
      "url": "",
      "lastModified": "2025-10-06T15:56:00+02:00"
    },
    {
      "id": "ADE60322e706c616e6e696e67554c5f323032355f323032362d3134323139342d382d34",
      "title": "Travaux service technique",
      "start": "2026-01-05T07:00:00+01:00",
      "end": "2026-01-05T19:00:00+01:00",
      "allDay": false,
      "location": "",
      "description": "\n\n\n\n(Modifié le:11/12/2025 11:39)",
      "status": "",
      "url": "",
      "lastModified": "2025-12-11T11:39:00+01:00"
    },
    {
      "id": "ADE60322e706c616e6e696e67554c5f323032355f323032362d3132393735332d302d30",
      "title": "Seconde chance 501.1 Optique ondulatoire",
      "start": "2026-01-05T08:00:00+01:00",
      "end": "2026-01-05T10:00:00+01:00",
      "allDay": false,
      "location": "Bridoux_TD 13",
      "description": "\n\nBITTNER Stefan\nL3 Physique FC\nL3 Physique LAS\nTD L3 Physique\n\n(Modifié le:05/09/2025 11:11)",
      "status": "",
      "url": "",
      "lastModified": "2025-09-05T11:11:00+02:00"
    },
    {
      "id": "ADE60322e706c616e6e696e67554c5f323032355f323032362d39363236372d302d30",
      "title": "Réservation - Examens L3 MCO",
      "start": "2026-01-05T08:00:00+01:00",
      "end": "2026-01-05T18:00:00+01:00",
      "allDay": false,
      "location": "",
      "description": "\n\n\n\n(Modifié le:15/07/2025 11:28)",
      "status": "",
      "url": "",
      "lastModified": "2025-07-15T11:28:00+02:00"
    },
    {
      "id": "ADE60322e706c616e6e696e67554c5f323032355f323032362d39353637312d302d30",
      "title": "UE 803 CM EC1 Psychophysiologie de la fatigue",
      "start": "2026-01-05T08:00:00+01:00",
      "end": "2026-01-05T10:00:00+01:00",
      "allDay": false,
      "location": "Bridoux_TP Damasio D3",
      "description": "\n\nBARBRY Alexis\nPromo complète M1 FA\nPromo complète M1 FI/FC\n\n(Modifié le:27/11/2025 16:14)",
      "status": "",
      "url": "",
      "lastModified": "2025-11-27T16:14:00+01:00"
    },
    {
      "id": "ADE60322e706c616e6e696e67554c5f323032355f323032362d38393533392d332d30",
      "title": "EI ME830 Savoirs propres à la discipline et épistémologie",
      "start": "2026-01-05T09:00:00+01:00",
      "end": "2026-01-05T12:00:00+01:00",
      "allDay": false,
      "location": "Bridoux_TD 1",
      "description": "\n\nMONIER Brice\nPrépa CAPES STAPS EDT M1\nM1 MEEF EPS - Groupe A\nM1 MEEF EPS - Groupe B\n\n(Modifié le:02/12/2025 16:38)",
      "status": "",
      "url": "",
      "lastModified": "2025-12-02T16:38:00+01:00"
    },
    {
      "id": "ADE60322e706c616e6e696e67554c5f323032355f323032362d3137343233332d32312d30",
      "title": "GULER César et/ou KOHLER Manon et/ou CHILDZ Augustiin",
      "start": "2026-01-05T09:00:00+01:00",
      "end": "2026-01-05T18:30:00+01:00",
      "allDay": false,
      "location": "",
      "description": "\n\n\n\n(Modifié le:24/11/2025 13:05)",
      "status": "",
      "url": "",
      "lastModified": "2025-11-24T13:05:00+01:00"
    },
    {
      "id": "ADE60322e706c616e6e696e67554c5f323032355f323032362d36313639382d302d33",
      "title": "TP A 306.1 Physique expérimentale 2",
      "start": "2026-01-05T09:00:00+01:00",
      "end": "2026-01-05T12:00:00+01:00",
      "allDay": false,
      "location": "Bridoux_TP Carnot H6",
      "description": "\n\nTP A L2 Physique\nLECLERC Arnaud\n\n(Modifié le:03/09/2025 12:54)",
      "status": "",
      "url": "",
      "lastModified": "2025-09-03T12:54:00+02:00"
    },
    {
      "id": "ADE60322e706c616e6e696e67554c5f323032355f323032362d39303034352d302d30",
      "title": "Seconde chance UE 302.1 Réactions couplées",
      "start": "2026-01-05T10:00:00+01:00",
      "end": "2026-01-05T11:30:00+01:00",
      "allDay": false,
      "location": "Bridoux_TD 5",
      "description": "\n\nL2 Chimie LAS\nTD A L2 Chimie\nL2 PC\nL2 PC LAS\nL2 Chimie FC\nL2 Chimie PE\nL2 PC PE\nLECLERC Nathalie\n\n(Modifié le:16/09/2025 10:21)",
      "status": "",
      "url": "",
      "lastModified": "2025-09-16T10:21:00+02:00"
    },
    {
      "id": "ADE60322e706c616e6e696e67554c5f323032355f323032362d39353635332d302d31",
      "title": "UE 801 EC2 CM Anthropologie de la maladie et handicap",
      "start": "2026-01-05T10:00:00+01:00",
      "end": "2026-01-05T12:00:00+01:00",
      "allDay": false,
      "location": "Bridoux_TP Start up 1 D14BIS",
      "description": "\n\nPromo complète M1 FA\nPromo complète M1 FI/FC\nARBORIO Sophie\n\n(Modifié le:03/11/2025 15:36)",
      "status": "",
      "url": "",
      "lastModified": "2025-11-03T15:36:00+01:00"
    },
    {
      "id": "ADE60322e706c616e6e696e67554c5f323032355f323032362d35353233392d302d30",
      "title": "Seconde chance UE 503.1 Thermodynamique chimique",
      "start": "2026-01-05T10:15:00+01:00",
      "end": "2026-01-05T11:45:00+01:00",
      "allDay": false,
      "location": "Bridoux_TD 15",
      "description": "\n\nL3 Chimie FC\nL3 Chimie LAS\nTD - L3 Chimie\nACHARD Christian\nAKIL Suzanna\n\n(Modifié le:05/09/2025 11:11)",
      "status": "",
      "url": "",
      "lastModified": "2025-09-05T11:11:00+02:00"
    },
    {
      "id": "ADE60322e706c616e6e696e67554c5f323032355f323032362d31313132352d302d30",
      "title": "CM Ecologie du paysage et phytosociologie",
      "start": "2026-01-05T10:15:00+01:00",
      "end": "2026-01-05T12:15:00+01:00",
      "allDay": false,
      "location": "Bridoux_TD 16",
      "description": "\n\nROBIN Vincent\nTP  C*Option Ecologie du paysage & phytosocio\nTP  D*Option Ecologie du paysage & phytosocio\n\n(Modifié le:10/12/2025 15:01)",
      "status": "",
      "url": "",
      "lastModified": "2025-12-10T15:01:00+01:00"
    },
    {
      "id": "ADE60322e706c616e6e696e67554c5f323032355f323032362d39343239392d342d30",
      "title": "TD ME940 Didactique disciplinaire, mise en oeuvre des program.",
      "start": "2026-01-05T11:00:00+01:00",
      "end": "2026-01-05T12:00:00+01:00",
      "allDay": false,
      "location": "Bridoux_TD 24",
      "description": "\n\nM2 MEEF EPS\nGANDAR Benjamin\n\n(Modifié le:22/09/2025 11:05)",
      "status": "",
      "url": "",
      "lastModified": "2025-09-22T11:05:00+02:00"
    },
    {
      "id": "ADE60322e706c616e6e696e67554c5f323032355f323032362d39353536372d302d30",
      "title": "UE 6.01 EI Techniques de communication liées à l'évènement sportif",
      "start": "2026-01-05T13:00:00+01:00",
      "end": "2026-01-05T17:00:00+01:00",
      "allDay": false,
      "location": "Bridoux_TD 27",
      "description": "\n\nPETIT Édith\nLP GDOSSL FI/FC\n\n(Modifié le:13/10/2025 11:02)",
      "status": "",
      "url": "",
      "lastModified": "2025-10-13T11:02:00+02:00"
    },
    {
      "id": "ADE60322e706c616e6e696e67554c5f323032355f323032362d3130383738312d342d30",
      "title": "TP GR C : TRAVAUX PRATIQUES D'ELECTRICITE",
      "start": "2026-01-05T13:30:00+01:00",
      "end": "2026-01-05T16:30:00+01:00",
      "allDay": false,
      "location": "Bridoux_TP  Edison H7",
      "description": "\n\nTP GR C \nTP03\nTITE Teddy\n\n(Modifié le:03/12/2025 12:00)",
      "status": "",
      "url": "",
      "lastModified": "2025-12-03T12:00:00+01:00"
    },
    {
      "id": "ADE60322e706c616e6e696e67554c5f323032355f323032362d373338372d332d30",
      "title": "EI 1 UE 105 Bonnes pratiques de laboratoire",
      "start": "2026-01-05T13:30:00+01:00",
      "end": "2026-01-05T14:30:00+01:00",
      "allDay": false,
      "location": "Bridoux_TD 14",
      "description": "\n\nTD 1 Portail PC\nBUHAIBEH Ruqaya\n\n(Modifié le:12/11/2025 11:20)",
      "status": "",
      "url": "",
      "lastModified": "2025-11-12T11:20:00+01:00"
    },
    {
      "id": "ADE60322e706c616e6e696e67554c5f323032355f323032362d39333132362d322d30",
      "title": "EI ME1030 Savoirs propres à la discipline et épistémologie",
      "start": "2026-01-05T13:30:00+01:00",
      "end": "2026-01-05T16:30:00+01:00",
      "allDay": false,
      "location": "Bridoux_TD 1",
      "description": "\n\nM2 MEEF EPS\nMONIER Brice\n\n(Modifié le:22/09/2025 11:05)",
      "status": "",
      "url": "",
      "lastModified": "2025-09-22T11:05:00+02:00"
    },
    {
      "id": "ADE60322e706c616e6e696e67554c5f323032355f323032362d343832332d302d30",
      "title": "UE 801 EC3 CM Socio de la prise en charge : vieill et resp soc",
      "start": "2026-01-05T13:30:00+01:00",
      "end": "2026-01-05T16:30:00+01:00",
      "allDay": false,
      "location": "Bridoux_TP Start up 1 D14BIS",
      "description": "\n\nMORALES LA MURA Raul\nPromo complète M1 FA\nPromo complète M1 FI/FC\n\n(Modifié le:03/11/2025 15:36)",
      "status": "",
      "url": "",
      "lastModified": "2025-11-03T15:36:00+01:00"
    },
    {
      "id": "ADE60322e706c616e6e696e67554c5f323032355f323032362d3131353635372d302d31",
      "title": "EI 3 EC 103.2 Cinétique chimique",
      "start": "2026-01-05T13:30:00+01:00",
      "end": "2026-01-05T15:30:00+01:00",
      "allDay": false,
      "location": "Bridoux_TD 4",
      "description": "\n\nGHARRED Nawres\nTD 3 Portail PC\n\n(Modifié le:03/10/2025 17:29)",
      "status": "",
      "url": "",
      "lastModified": "2025-10-03T17:29:00+02:00"
    },
    {
      "id": "ADE60322e706c616e6e696e67554c5f323032355f323032362d36313736322d312d30",
      "title": "CM UE 814 - Traitement physico-chimique des déchets",
      "start": "2026-01-05T13:30:00+01:00",
      "end": "2026-01-05T15:30:00+01:00",
      "allDay": false,
      "location": "Bridoux_TD 12",
      "description": "\n\nMEUX Éric\nCM GE\n\n(Modifié le:18/11/2025 17:55)",
      "status": "",
      "url": "",
      "lastModified": "2025-11-18T17:55:00+01:00"
    },
    {
      "id": "ADE60322e706c616e6e696e67554c5f323032355f323032362d393736392d302d39",
      "title": "TD 301.1 Analyse 3",
      "start": "2026-01-05T13:30:00+01:00",
      "end": "2026-01-05T15:30:00+01:00",
      "allDay": false,
      "location": "Bridoux_TD 7",
      "description": "\n\nMOHRBACH Hervé\nTD L2 Physique\nL2 Physique FC\nL2 Physique LAS\nL2 PC\nL2 Physique PE\n\n(Modifié le:15/09/2025 16:06)",
      "status": "",
      "url": "",
      "lastModified": "2025-09-15T16:06:00+02:00"
    },
    {
      "id": "ADE60322e706c616e6e696e67554c5f323032355f323032362d373632392d342d30",
      "title": "EI UE 106/OS Remédiation en physique 1",
      "start": "2026-01-05T13:30:00+01:00",
      "end": "2026-01-05T15:30:00+01:00",
      "allDay": false,
      "location": "Bridoux_TP Start up 2 D16",
      "description": "\n\nGREFFIER Olivier\nTD 4 Porail PC\n\n(Modifié le:09/10/2025 17:46)",
      "status": "",
      "url": "",
      "lastModified": "2025-10-09T17:46:00+02:00"
    },
    {
      "id": "ADE60322e706c616e6e696e67554c5f323032355f323032362d373836392d302d30",
      "title": "EI 2 UE 101 Mathématiques 1",
      "start": "2026-01-05T13:30:00+01:00",
      "end": "2026-01-05T15:30:00+01:00",
      "allDay": false,
      "location": "Bridoux_TD 16",
      "description": "\n\nTD 2 Portail PC\nGLEIZE Jérôme\n\n(Modifié le:24/09/2025 13:21)",
      "status": "",
      "url": "",
      "lastModified": "2025-09-24T13:21:00+02:00"
    },
    {
      "id": "ADE60322e706c616e6e696e67554c5f323032355f323032362d3139393833382d302d30",
      "title": "TP2 UE 803 - SIG I",
      "start": "2026-01-05T14:00:00+01:00",
      "end": "2026-01-05T17:00:00+01:00",
      "allDay": false,
      "location": "Bridoux_TP Info2 C5",
      "description": "\n\nZELL BOUTTER Sandrine\nTP GRP 2\n\n(Modifié le:24/11/2025 10:59)",
      "status": "",
      "url": "",
      "lastModified": "2025-11-24T10:59:00+01:00"
    },
    {
      "id": "ADE60322e706c616e6e696e67554c5f323032355f323032362d373338372d312d30",
      "title": "EI 1 UE 105 Bonnes pratiques de laboratoire",
      "start": "2026-01-05T14:30:00+01:00",
      "end": "2026-01-05T15:30:00+01:00",
      "allDay": false,
      "location": "Bridoux_TD 15",
      "description": "\n\nSCHRAMM Sébastien\nTD 1 Portail PC\n\n(Modifié le:12/11/2025 11:20)",
      "status": "",
      "url": "",
      "lastModified": "2025-11-12T11:20:00+01:00"
    },
    {
      "id": "ADE60322e706c616e6e696e67554c5f323032355f323032362d38393936332d302d30",
      "title": "Seconde chance UE 302.2 Spectroscopie 1",
      "start": "2026-01-05T15:45:00+01:00",
      "end": "2026-01-05T17:15:00+01:00",
      "allDay": false,
      "location": "Bridoux_TD 13",
      "description": "\n\nL2 Chimie LAS\nTD A L2 Chimie\nL2 PC\nL2 PC LAS\nL2 Chimie FC\nL2 Chimie PE\nCARRE Vincent\n\n(Modifié le:16/09/2025 10:21)",
      "status": "",
      "url": "",
      "lastModified": "2025-09-16T10:21:00+02:00"
    },
    {
      "id": "ADE60322e706c616e6e696e67554c5f323032355f323032362d31313136362d302d30",
      "title": "CM  Physicochimie et biomarqueurs",
      "start": "2026-01-05T15:45:00+01:00",
      "end": "2026-01-05T17:45:00+01:00",
      "allDay": false,
      "location": "Bridoux_TD 18",
      "description": "\n\nMASFARAUD Jean-François\nTP  D*\nTP  C*\n\n(Modifié le:11/12/2025 10:38)",
      "status": "",
      "url": "",
      "lastModified": "2025-12-11T10:38:00+01:00"
    },
    {
      "id": "ADE60322e706c616e6e696e67554c5f323032355f323032362d36313739312d312d30",
      "title": "CM UE 817 - Caractérisation et traitement de l'air",
      "start": "2026-01-05T15:45:00+01:00",
      "end": "2026-01-05T17:45:00+01:00",
      "allDay": false,
      "location": "Bridoux_TD 3",
      "description": "\n\nCOTELLE Sylvie\nCM GE\n\n(Modifié le:09/12/2025 17:50)",
      "status": "",
      "url": "",
      "lastModified": "2025-12-09T17:50:00+01:00"
    },
    {
      "id": "ADE60322e706c616e6e696e67554c5f323032355f323032362d3130303835352d302d33",
      "title": "EI 4 EC 103.2 Cinétique chimique",
      "start": "2026-01-05T15:45:00+01:00",
      "end": "2026-01-05T17:45:00+01:00",
      "allDay": false,
      "location": "Bridoux_TD 2",
      "description": "\n\nGHARRED Nawres\nTD 4 Porail PC\n\n(Modifié le:03/10/2025 17:29)",
      "status": "",
      "url": "",
      "lastModified": "2025-10-03T17:29:00+02:00"
    },
    {
      "id": "ADE60322e706c616e6e696e67554c5f323032355f323032362d3134323139342d31302d30",
      "title": "Travaux service technique",
      "start": "2026-01-06T07:00:00+01:00",
      "end": "2026-01-06T19:00:00+01:00",
      "allDay": false,
      "location": "",
      "description": "\n\n\n\n(Modifié le:11/12/2025 11:39)",
      "status": "",
      "url": "",
      "lastModified": "2025-12-11T11:39:00+01:00"
    },
    {
      "id": "ADE60322e706c616e6e696e67554c5f323032355f323032362d3133313431322d302d3133",
      "title": "EI 1 UE 101 Mathématiques 1",
      "start": "2026-01-06T08:00:00+01:00",
      "end": "2026-01-06T10:00:00+01:00",
      "allDay": false,
      "location": "Bridoux_TD 18",
      "description": "\n\nGRANDCOLAS Michel\nTD 1 Portail PC\n\n(Modifié le:01/10/2025 11:41)",
      "status": "",
      "url": "",
      "lastModified": "2025-10-01T11:41:00+02:00"
    },
    {
      "id": "ADE60322e706c616e6e696e67554c5f323032355f323032362d3133313739382d322d30",
      "title": "EI 2 UE 105 Bonnes pratiques de laboratoire",
      "start": "2026-01-06T08:00:00+01:00",
      "end": "2026-01-06T09:00:00+01:00",
      "allDay": false,
      "location": "Bridoux_TD 1",
      "description": "\n\nTP C Portail PC\nTP D Portail PC\nBUHAIBEH Ruqaya\n\n(Modifié le:12/11/2025 11:21)",
      "status": "",
      "url": "",
      "lastModified": "2025-11-12T11:21:00+01:00"
    },
    {
      "id": "ADE60322e706c616e6e696e67554c5f323032355f323032362d393734342d302d35",
      "title": "TD 303.2 Electromagnétisme 2",
      "start": "2026-01-06T08:00:00+01:00",
      "end": "2026-01-06T10:00:00+01:00",
      "allDay": false,
      "location": "Bridoux_TD 14",
      "description": "\n\nWAX Jean-François\nTD L2 Physique\nL2 Physique FC\nL2 Physique LAS\nL2 PC\nL2 PC LAS\nL2 PC PE\nL2 Physique PE\n\n(Modifié le:15/09/2025 16:06)",
      "status": "",
      "url": "",
      "lastModified": "2025-09-15T16:06:00+02:00"
    },
    {
      "id": "ADE60322e706c616e6e696e67554c5f323032355f323032362d3133313431352d32332d30",
      "title": "EI 3 UE 101 Mathématiques 1",
      "start": "2026-01-06T08:00:00+01:00",
      "end": "2026-01-06T10:00:00+01:00",
      "allDay": false,
      "location": "Bridoux_TD 6",
      "description": "\n\nTD 3 Portail PC\nJABER Hassan\n\n(Modifié le:03/11/2025 16:54)",
      "status": "",
      "url": "",
      "lastModified": "2025-11-03T16:54:00+01:00"
    },
    {
      "id": "ADE60322e706c616e6e696e67554c5f323032355f323032362d38393432332d312d30",
      "title": "EI EC Projet International",
      "start": "2026-01-06T08:00:00+01:00",
      "end": "2026-01-06T10:00:00+01:00",
      "allDay": false,
      "location": "Bridoux_TD 15",
      "description": "\n\nAROUXET Andrea\nCM GE\n\n(Modifié le:20/10/2025 12:55)",
      "status": "",
      "url": "",
      "lastModified": "2025-10-20T12:55:00+02:00"
    },
    {
      "id": "ADE60322e706c616e6e696e67554c5f323032355f323032362d31313238302d302d30",
      "title": "CM Ecophysiologie microbienne",
      "start": "2026-01-06T08:00:00+01:00",
      "end": "2026-01-06T10:00:00+01:00",
      "allDay": false,
      "location": "Bridoux_TD 2",
      "description": "\n\nPAGNOUT Christophe\nTP  A*\nTP  B*\n\n(Modifié le:10/12/2025 10:56)",
      "status": "",
      "url": "",
      "lastModified": "2025-12-10T10:56:00+01:00"
    },
    {
      "id": "ADE60322e706c616e6e696e67554c5f323032355f323032362d35353235312d302d30",
      "title": "Seconde chance EC 504.1 Spectroscopie RMN",
      "start": "2026-01-06T08:00:00+01:00",
      "end": "2026-01-06T09:30:00+01:00",
      "allDay": false,
      "location": "Bridoux_TD 12",
      "description": "\n\nOGET Nicolas\nL3 Chimie FC\nL3 Chimie LAS\nTD - L3 Chimie\n\n(Modifié le:10/11/2025 11:22)",
      "status": "",
      "url": "",
      "lastModified": "2025-11-10T11:22:00+01:00"
    },
    {
      "id": "ADE60322e706c616e6e696e67554c5f323032355f323032362d39353538372d332d30",
      "title": "6.03 EI Marketing des services sportifs",
      "start": "2026-01-06T09:00:00+01:00",
      "end": "2026-01-06T12:00:00+01:00",
      "allDay": false,
      "location": "Bridoux_TP Start up 2 D16",
      "description": "\n\nLP GDOSSL FI/FC\nLic Pro GDOSSL FA\nPIERRE Julien\n\n(Modifié le:13/10/2025 11:02)",
      "status": "",
      "url": "",
      "lastModified": "2025-10-13T11:02:00+02:00"
    },
    {
      "id": "ADE60322e706c616e6e696e67554c5f323032355f323032362d3136303239382d302d30",
      "title": "EXAMENS L1 STAPS salle particulière ",
      "start": "2026-01-06T09:00:00+01:00",
      "end": "2026-01-06T12:00:00+01:00",
      "allDay": false,
      "location": "Bridoux_TD 9",
      "description": "\n\nPrêt salles et amphi\n\n(Modifié le:11/12/2025 14:26)",
      "status": "",
      "url": "",
      "lastModified": "2025-12-11T14:26:00+01:00"
    },
    {
      "id": "ADE60322e706c616e6e696e67554c5f323032355f323032362d37393239322d342d30",
      "title": "TP GR A : TRAVAUX PRATIQUES D'ELECTRICITE",
      "start": "2026-01-06T09:00:00+01:00",
      "end": "2026-01-06T12:00:00+01:00",
      "allDay": false,
      "location": "Bridoux_TP  Edison H7",
      "description": "\n\nTP GR A\nTP01\nTITE Teddy\n\n(Modifié le:03/12/2025 12:00)",
      "status": "",
      "url": "",
      "lastModified": "2025-12-03T12:00:00+01:00"
    },
    {
      "id": "ADE60322e706c616e6e696e67554c5f323032355f323032362d3133313739382d312d30",
      "title": "EI 2 UE 105 Bonnes pratiques de laboratoire",
      "start": "2026-01-06T09:00:00+01:00",
      "end": "2026-01-06T10:00:00+01:00",
      "allDay": false,
      "location": "Bridoux_TD 16",
      "description": "\n\nSCHRAMM Sébastien\nTP C Portail PC\nTP D Portail PC\n\n(Modifié le:12/11/2025 11:21)",
      "status": "",
      "url": "",
      "lastModified": "2025-11-12T11:21:00+01:00"
    },
    {
      "id": "ADE60322e706c616e6e696e67554c5f323032355f323032362d39353730342d312d30",
      "title": "UE 1002 TD EC1 EC1 Motivation et Estime de soi en APA-S",
      "start": "2026-01-06T09:00:00+01:00",
      "end": "2026-01-06T12:00:00+01:00",
      "allDay": false,
      "location": "Bridoux_TD 24",
      "description": "\n\nMASTAGLI Maxime\nPromo complète M2 FA\nPromo complète M2 FI/FC\n\n(Modifié le:02/12/2025 13:39)",
      "status": "",
      "url": "",
      "lastModified": "2025-12-02T13:39:00+01:00"
    },
    {
      "id": "ADE60322e706c616e6e696e67554c5f323032355f323032362d39303030382d302d30",
      "title": "CC2 304.1 Chimiométrie",
      "start": "2026-01-06T10:00:00+01:00",
      "end": "2026-01-06T11:30:00+01:00",
      "allDay": false,
      "location": "Bridoux_TP Info2 C5",
      "description": "\n\nCHAIMBAULT Patrick\nL2 Chimie FC\nTD A L2 Chimie\n\n(Modifié le:06/11/2025 15:06)",
      "status": "",
      "url": "",
      "lastModified": "2025-11-06T15:06:00+01:00"
    },
    {
      "id": "ADE60322e706c616e6e696e67554c5f323032355f323032362d36313731352d302d30",
      "title": "CM UE 805 - Ressources Naturelles",
      "start": "2026-01-06T10:15:00+01:00",
      "end": "2026-01-06T11:45:00+01:00",
      "allDay": false,
      "location": "Bridoux_TD 2",
      "description": "\n\nCM ETOX\nCM GEMAREC\nGROSS Élisabeth Maria\n\n(Modifié le:20/11/2025 16:40)",
      "status": "",
      "url": "",
      "lastModified": "2025-11-20T16:40:00+01:00"
    },
    {
      "id": "ADE60322e706c616e6e696e67554c5f323032355f323032362d36323133322d362d30",
      "title": "CM UE 908 - Biodiversité et perturbations",
      "start": "2026-01-06T10:15:00+01:00",
      "end": "2026-01-06T12:15:00+01:00",
      "allDay": false,
      "location": "Bridoux_TD 12",
      "description": "\n\nCM GEMAREC\nJANS Margot\n\n(Modifié le:20/10/2025 13:03)",
      "status": "",
      "url": "",
      "lastModified": "2025-10-20T13:03:00+02:00"
    },
    {
      "id": "ADE60322e706c616e6e696e67554c5f323032355f323032362d3131313931382d332d30",
      "title": "EI 1 EC 103.2 Equilibres chimiques",
      "start": "2026-01-06T10:15:00+01:00",
      "end": "2026-01-06T12:15:00+01:00",
      "allDay": false,
      "location": "Bridoux_TD 13",
      "description": "\n\nAKIL Suzanna\nTD 1 Portail PC\n\n(Modifié le:01/10/2025 11:41)",
      "status": "",
      "url": "",
      "lastModified": "2025-10-01T11:41:00+02:00"
    },
    {
      "id": "ADE60322e706c616e6e696e67554c5f323032355f323032362d31313237372d352d30",
      "title": "CM Physiologie: régulation des fonctions",
      "start": "2026-01-06T10:15:00+01:00",
      "end": "2026-01-06T12:15:00+01:00",
      "allDay": false,
      "location": "Bridoux_TD 18",
      "description": "\n\nNEGUESQUE Adrien\nTP  A*\nTP  B*\n\n(Modifié le:01/12/2025 16:50)",
      "status": "",
      "url": "",
      "lastModified": "2025-12-01T16:50:00+01:00"
    },
    {
      "id": "ADE60322e706c616e6e696e67554c5f323032355f323032362d3134353436312d362d30",
      "title": "EI UE 106/OS Remédiation en chimie 1",
      "start": "2026-01-06T10:15:00+01:00",
      "end": "2026-01-06T11:45:00+01:00",
      "allDay": false,
      "location": "Bridoux_TD 14",
      "description": "\n\nTD 4 Porail PC\nCOURILLEAU-GOBRY Anne\n\n(Modifié le:23/09/2025 12:38)",
      "status": "",
      "url": "",
      "lastModified": "2025-09-23T12:38:00+02:00"
    },
    {
      "id": "ADE60322e706c616e6e696e67554c5f323032355f323032362d393530342d302d34",
      "title": "TD 303.1 Ondes et vibrations",
      "start": "2026-01-06T10:15:00+01:00",
      "end": "2026-01-06T12:15:00+01:00",
      "allDay": false,
      "location": "Bridoux_TD 27",
      "description": "\n\nTREMBLAY Jean-Christophe\nTD L2 Physique\nL2 Physique FC\nL2 Physique LAS\nL2 PC\nTD 303.1 Ondes et vibrations\nTD 303.1 Ondes et vibrations\nTD 303.1 Ondes et vibrations\nTD 303.1 Ondes et vibrations\nTD 303.1 Ondes et vibrations\nTD 303.1 Ondes et vibrations\nTD 303.1 Ondes et vibrations\nTD 303.1 Ondes et vibrations\nTD 303.1 Ondes et vibrations\nTD 303.1 Ondes et vibrations\nL2 Physique PE\n\n(Modifié le:15/09/2025 16:06)",
      "status": "",
      "url": "",
      "lastModified": "2025-09-15T16:06:00+02:00"
    },
    {
      "id": "ADE60322e706c616e6e696e67554c5f323032355f323032362d35353234332d302d30",
      "title": "Seconde chance UE 501.1 Chimie organique 5",
      "start": "2026-01-06T10:15:00+01:00",
      "end": "2026-01-06T11:45:00+01:00",
      "allDay": false,
      "location": "Bridoux_TD 15",
      "description": "\n\nL3 Chimie FC\nL3 Chimie LAS\nTD - L3 Chimie\nSINDT Michèle\nCOMOY Corinne\nHESSE Stéphanie\n\n(Modifié le:05/09/2025 11:11)",
      "status": "",
      "url": "",
      "lastModified": "2025-09-05T11:11:00+02:00"
    },
    {
      "id": "ADE60322e706c616e6e696e67554c5f323032355f323032362d3131353635372d302d33",
      "title": "EI 3 EC 103.2 Cinétique chimique",
      "start": "2026-01-06T10:15:00+01:00",
      "end": "2026-01-06T12:15:00+01:00",
      "allDay": false,
      "location": "Bridoux_TD 7",
      "description": "\n\nGHARRED Nawres\nTD 3 Portail PC\n\n(Modifié le:03/10/2025 17:29)",
      "status": "",
      "url": "",
      "lastModified": "2025-10-03T17:29:00+02:00"
    },
    {
      "id": "ADE60322e706c616e6e696e67554c5f323032355f323032362d36343236322d332d30",
      "title": "EI UE 902 EC 1 Politiques publiques de la santé et du social",
      "start": "2026-01-06T10:15:00+01:00",
      "end": "2026-01-06T12:15:00+01:00",
      "allDay": false,
      "location": "Bridoux_TP Start up 1 D14BIS",
      "description": "\n\nM2 A3R\nPALLEZ Christiane\n\n(Modifié le:10/09/2025 12:56)",
      "status": "",
      "url": "",
      "lastModified": "2025-09-10T12:56:00+02:00"
    },
    {
      "id": "ADE60322e706c616e6e696e67554c5f323032355f323032362d39343238372d362d30",
      "title": "TD ME930 Savoirs propres à la discipline et épistémologie",
      "start": "2026-01-06T11:00:00+01:00",
      "end": "2026-01-06T12:00:00+01:00",
      "allDay": false,
      "location": "Bridoux_TD 1",
      "description": "\n\nM2 MEEF EPS\nVINCENT Cyrille\n\n(Modifié le:22/09/2025 11:05)",
      "status": "",
      "url": "",
      "lastModified": "2025-09-22T11:05:00+02:00"
    },
    {
      "id": "ADE60322e706c616e6e696e67554c5f323032355f323032362d3135313731302d31322d30",
      "title": "EI 4 UE 101 Mathématiques 1",
      "start": "2026-01-06T13:30:00+01:00",
      "end": "2026-01-06T15:30:00+01:00",
      "allDay": false,
      "location": "Bridoux_TD 4",
      "description": "\n\nTP G Portail PC\nFARDET Anne-Laure\n\n(Modifié le:22/09/2025 10:02)",
      "status": "",
      "url": "",
      "lastModified": "2025-09-22T10:02:00+02:00"
    },
    {
      "id": "ADE60322e706c616e6e696e67554c5f323032355f323032362d39333339332d302d30",
      "title": "CC3 (TP) 302.1 Réactions couplées",
      "start": "2026-01-06T13:30:00+01:00",
      "end": "2026-01-06T15:00:00+01:00",
      "allDay": false,
      "location": "Bridoux_Salle des Actes B14",
      "description": "\n\nLECLERC Nathalie\nL2 Chimie LAS\nTD A L2 Chimie\nL2 Chimie FC\nL2 Chimie PE\nL2 PC PE\n\n(Modifié le:16/09/2025 10:21)",
      "status": "",
      "url": "",
      "lastModified": "2025-09-16T10:21:00+02:00"
    },
    {
      "id": "ADE60322e706c616e6e696e67554c5f323032355f323032362d383437322d302d34",
      "title": "EI 2 EC 103.2 Cinétique chimique",
      "start": "2026-01-06T13:30:00+01:00",
      "end": "2026-01-06T15:30:00+01:00",
      "allDay": false,
      "location": "Bridoux_TD 1",
      "description": "\n\nSCHRAMM Sébastien\nTD 2 Portail PC\n\n(Modifié le:03/10/2025 17:28)",
      "status": "",
      "url": "",
      "lastModified": "2025-10-03T17:28:00+02:00"
    },
    {
      "id": "ADE60322e706c616e6e696e67554c5f323032355f323032362d39353538372d322d30",
      "title": "6.03 EI Marketing des services sportifs",
      "start": "2026-01-06T13:30:00+01:00",
      "end": "2026-01-06T16:30:00+01:00",
      "allDay": false,
      "location": "Bridoux_TP Start up 2 D16",
      "description": "\n\nLP GDOSSL FI/FC\nLic Pro GDOSSL FA\nPIERRE Julien\n\n(Modifié le:13/10/2025 11:02)",
      "status": "",
      "url": "",
      "lastModified": "2025-10-13T11:02:00+02:00"
    },
    {
      "id": "ADE60322e706c616e6e696e67554c5f323032355f323032362d3136343634312d312d30",
      "title": "M1 MEEF PC : Oraux chimie",
      "start": "2026-01-06T13:30:00+01:00",
      "end": "2026-01-06T17:30:00+01:00",
      "allDay": false,
      "location": "Bridoux_TP Delesse A3",
      "description": "\n\nM1 MEEF PC\nCOURILLEAU-GOBRY Anne\n\n(Modifié le:12/11/2025 16:21)",
      "status": "",
      "url": "",
      "lastModified": "2025-11-12T16:21:00+01:00"
    },
    {
      "id": "ADE60322e706c616e6e696e67554c5f323032355f323032362d36323032312d312d30",
      "title": "TD UE 916 - Risques écotoxicologiques et toxicologiques",
      "start": "2026-01-06T13:30:00+01:00",
      "end": "2026-01-06T17:30:00+01:00",
      "allDay": false,
      "location": "Bridoux_TD 9",
      "description": "\n\nTD ETOX\nMASFARAUD Jean-François\n\n(Modifié le:05/09/2025 17:14)",
      "status": "",
      "url": "",
      "lastModified": "2025-09-05T17:14:00+02:00"
    },
    {
      "id": "ADE60322e706c616e6e696e67554c5f323032355f323032362d31313236302d302d30",
      "title": "CM Immunologie approfondie",
      "start": "2026-01-06T13:30:00+01:00",
      "end": "2026-01-06T15:30:00+01:00",
      "allDay": false,
      "location": "Bridoux_TD 15",
      "description": "\n\nNEGUESQUE Adrien\nGroupe A Immunologie\nGroupe B immunologie\n\n(Modifié le:01/12/2025 16:08)",
      "status": "",
      "url": "",
      "lastModified": "2025-12-01T16:08:00+01:00"
    },
    {
      "id": "ADE60322e706c616e6e696e67554c5f323032355f323032362d37393239312d342d30",
      "title": "TP GR B : TRAVAUX PRATIQUES D'ELECTRICITE",
      "start": "2026-01-06T13:30:00+01:00",
      "end": "2026-01-06T16:30:00+01:00",
      "allDay": false,
      "location": "Bridoux_TP  Edison H7",
      "description": "\n\nTPGR B \nTP02\nTITE Teddy\n\n(Modifié le:03/12/2025 12:00)",
      "status": "",
      "url": "",
      "lastModified": "2025-12-03T12:00:00+01:00"
    },
    {
      "id": "ADE60322e706c616e6e696e67554c5f323032355f323032362d3133313630302d312d30",
      "title": "TP A EC 106.1 Travaux pratiques de mécanique du point",
      "start": "2026-01-06T13:30:00+01:00",
      "end": "2026-01-06T16:30:00+01:00",
      "allDay": false,
      "location": "Bridoux_ TP Ampère H2",
      "description": "\n\nCAPPELAERE Emmanuel\nTP A Portail PC\n\n(Modifié le:01/10/2025 11:41)",
      "status": "",
      "url": "",
      "lastModified": "2025-10-01T11:41:00+02:00"
    },
    {
      "id": "ADE60322e706c616e6e696e67554c5f323032355f323032362d31313131302d352d30",
      "title": "CM Géologie et pédologie approfondies",
      "start": "2026-01-06T13:30:00+01:00",
      "end": "2026-01-06T15:30:00+01:00",
      "allDay": false,
      "location": "Bridoux_TD 13",
      "description": "\n\nARAN Delphine\nTP  D*Option Géologie & pédologie \nTP  C*Option Géologie & pédologie \n\n(Modifié le:04/12/2025 15:10)",
      "status": "",
      "url": "",
      "lastModified": "2025-12-04T15:10:00+01:00"
    },
    {
      "id": "ADE60322e706c616e6e696e67554c5f323032355f323032362d36343237362d302d30",
      "title": "CM UE 903 EC 2 Les soft skills, nouveaux enjeux professionnels",
      "start": "2026-01-06T14:00:00+01:00",
      "end": "2026-01-06T16:00:00+01:00",
      "allDay": false,
      "location": "Bridoux_TP Start up 1 D14BIS",
      "description": "\n\nHUSSON Nadine\nM2 A3R\n\n(Modifié le:07/10/2025 14:24)",
      "status": "",
      "url": "",
      "lastModified": "2025-10-07T14:24:00+02:00"
    },
    {
      "id": "ADE60322e706c616e6e696e67554c5f323032355f323032362d39333132362d302d30",
      "title": "EI ME1030 Savoirs propres à la discipline et épistémologie",
      "start": "2026-01-06T14:00:00+01:00",
      "end": "2026-01-06T17:00:00+01:00",
      "allDay": false,
      "location": "Bridoux_TD 3",
      "description": "\n\nM2 MEEF EPS\nVINCENT Cyrille\n\n(Modifié le:22/09/2025 11:05)",
      "status": "",
      "url": "",
      "lastModified": "2025-09-22T11:05:00+02:00"
    },
    {
      "id": "ADE60322e706c616e6e696e67554c5f323032355f323032362d31313638342d302d37",
      "title": "TP B 306.1 Physique expérimentale 2",
      "start": "2026-01-06T14:00:00+01:00",
      "end": "2026-01-06T17:00:00+01:00",
      "allDay": false,
      "location": "Bridoux_TP Carnot H6",
      "description": "\n\nL2 Physique FC\nL2 Physique LAS\nL2 Physique PE\nTP B L2 Physique\nLECLERC Arnaud\n\n(Modifié le:26/09/2025 12:22)",
      "status": "",
      "url": "",
      "lastModified": "2025-09-26T12:22:00+02:00"
    },
    {
      "id": "ADE60322e706c616e6e696e67554c5f323032355f323032362d3137343233332d302d30",
      "title": "GULER César et/ou KOHLER Manon et/ou CHILDZ Augustiin",
      "start": "2026-01-06T14:00:00+01:00",
      "end": "2026-01-06T17:00:00+01:00",
      "allDay": false,
      "location": "",
      "description": "\n\n\n\n(Modifié le:24/11/2025 13:07)",
      "status": "",
      "url": "",
      "lastModified": "2025-11-24T13:07:00+01:00"
    },
    {
      "id": "ADE60322e706c616e6e696e67554c5f323032355f323032362d373539332d302d38",
      "title": "EI UE 105/OS Remédiation en mathématiques 1",
      "start": "2026-01-06T15:45:00+01:00",
      "end": "2026-01-06T17:45:00+01:00",
      "allDay": false,
      "location": "Bridoux_TD 28",
      "description": "\n\nGREFFIER Olivier\nTD 4 Porail PC\n\n(Modifié le:15/12/2025 10:45)",
      "status": "",
      "url": "",
      "lastModified": "2025-12-15T10:45:00+01:00"
    },
    {
      "id": "ADE60322e706c616e6e696e67554c5f323032355f323032362d31313237372d362d30",
      "title": "CM Physiologie: régulation des fonctions",
      "start": "2026-01-06T15:45:00+01:00",
      "end": "2026-01-06T17:45:00+01:00",
      "allDay": false,
      "location": "Bridoux_TD 18",
      "description": "\n\nTP  A*\nTP  B*\nFELTEN Vincent\n\n(Modifié le:10/12/2025 10:56)",
      "status": "",
      "url": "",
      "lastModified": "2025-12-10T10:56:00+01:00"
    },
    {
      "id": "ADE60322e706c616e6e696e67554c5f323032355f323032362d3133313430392d302d3139",
      "title": "EI 2 EC 102.1 Mécanique du point",
      "start": "2026-01-06T15:45:00+01:00",
      "end": "2026-01-06T17:45:00+01:00",
      "allDay": false,
      "location": "Bridoux_TD 17",
      "description": "\n\nWAX Jean-François\nTD 2 Portail PC\n\n(Modifié le:24/09/2025 13:21)",
      "status": "",
      "url": "",
      "lastModified": "2025-09-24T13:21:00+02:00"
    },
    {
      "id": "ADE60322e706c616e6e696e67554c5f323032355f323032362d36343237372d322d30",
      "title": "EI UE 903 EC 2 Les soft skills, nouveaux enjeux professionnels",
      "start": "2026-01-06T16:00:00+01:00",
      "end": "2026-01-06T18:00:00+01:00",
      "allDay": false,
      "location": "Bridoux_TP Start up 1 D14BIS",
      "description": "\n\nHUSSON Nadine\nM2 A3R\n\n(Modifié le:07/10/2025 14:23)",
      "status": "",
      "url": "",
      "lastModified": "2025-10-07T14:23:00+02:00"
    },
    {
      "id": "ADE60322e706c616e6e696e67554c5f323032355f323032362d39353538342d352d30",
      "title": "6.02 EI Administration des services sportifs et politique",
      "start": "2026-01-06T16:30:00+01:00",
      "end": "2026-01-06T18:30:00+01:00",
      "allDay": false,
      "location": "Bridoux_TP Start up 2 D16",
      "description": "\n\nAGAZZI Frédéric\nLP GDOSSL FI/FC\n\n(Modifié le:13/10/2025 11:02)",
      "status": "",
      "url": "",
      "lastModified": "2025-10-13T11:02:00+02:00"
    },
    {
      "id": "ADE60322e706c616e6e696e67554c5f323032355f323032362d39333531352d322d30",
      "title": "EI ME1040 Didactique disciplinaire, mise en oeuvre des program.",
      "start": "2026-01-06T17:00:00+01:00",
      "end": "2026-01-06T19:00:00+01:00",
      "allDay": false,
      "location": "Bridoux_TD 3",
      "description": "\n\nM2 MEEF EPS\nFRIEDRICH Jonathan\n\n(Modifié le:22/09/2025 11:05)",
      "status": "",
      "url": "",
      "lastModified": "2025-09-22T11:05:00+02:00"
    },
    {
      "id": "ADE60322e706c616e6e696e67554c5f323032355f323032362d3134323139342d31322d30",
      "title": "Travaux service technique",
      "start": "2026-01-07T07:00:00+01:00",
      "end": "2026-01-07T19:00:00+01:00",
      "allDay": false,
      "location": "",
      "description": "\n\n\n\n(Modifié le:11/12/2025 11:40)",
      "status": "",
      "url": "",
      "lastModified": "2025-12-11T11:40:00+01:00"
    },
    {
      "id": "ADE60322e706c616e6e696e67554c5f323032355f323032362d3130303835352d302d30",
      "title": "EI 4 EC 103.2 Cinétique chimique",
      "start": "2026-01-07T08:00:00+01:00",
      "end": "2026-01-07T10:00:00+01:00",
      "allDay": false,
      "location": "Bridoux_TD 16",
      "description": "\n\nGHARRED Nawres\nTD 4 Porail PC\n\n(Modifié le:03/10/2025 17:29)",
      "status": "",
      "url": "",
      "lastModified": "2025-10-03T17:29:00+02:00"
    },
    {
      "id": "ADE60322e706c616e6e696e67554c5f323032355f323032362d3130353431332d302d30",
      "title": "Seconde chance UE 302 Mécanique du point et du solide",
      "start": "2026-01-07T08:00:00+01:00",
      "end": "2026-01-07T09:30:00+01:00",
      "allDay": false,
      "location": "Bridoux_TD 7",
      "description": "\n\nTD L2 Physique\nL2 Physique FC\nL2 Physique LAS\nL2 PC\nL2 PC LAS\nL2 Physique PE\nL2 PC PE\nANCARANI Lorenzo\nTALOTTA Francesco\n\n(Modifié le:24/09/2025 17:37)",
      "status": "",
      "url": "",
      "lastModified": "2025-09-24T17:37:00+02:00"
    },
    {
      "id": "ADE60322e706c616e6e696e67554c5f323032355f323032362d3131353736382d302d33",
      "title": "EI 3 EC 103.2 Equilibres chimiques",
      "start": "2026-01-07T08:00:00+01:00",
      "end": "2026-01-07T10:00:00+01:00",
      "allDay": false,
      "location": "Bridoux_TD 17",
      "description": "\n\nACHARD Christian\nTD 3 Portail PC\n\n(Modifié le:24/11/2025 10:02)",
      "status": "",
      "url": "",
      "lastModified": "2025-11-24T10:02:00+01:00"
    },
    {
      "id": "ADE60322e706c616e6e696e67554c5f323032355f323032362d3134393930312d302d3135",
      "title": "Réservation Victor",
      "start": "2026-01-07T08:00:00+01:00",
      "end": "2026-01-07T10:00:00+01:00",
      "allDay": false,
      "location": "",
      "description": "\nSeconde chance 302 FT\n\n\n(Modifié le:10/09/2025 17:17)",
      "status": "",
      "url": "",
      "lastModified": "2025-09-10T17:17:00+02:00"
    },
    {
      "id": "ADE60322e706c616e6e696e67554c5f323032355f323032362d36343237372d312d30",
      "title": "EI UE 903 EC 2 Les soft skills, nouveaux enjeux professionnels",
      "start": "2026-01-07T08:00:00+01:00",
      "end": "2026-01-07T10:00:00+01:00",
      "allDay": false,
      "location": "Bridoux_TP Info6 F2",
      "description": "\n\nDUBOIS-POT-SCHNEIDER Hélène\nM2 A3R\n\n(Modifié le:09/12/2025 17:56)",
      "status": "",
      "url": "",
      "lastModified": "2025-12-09T17:56:00+01:00"
    },
    {
      "id": "ADE60322e706c616e6e696e67554c5f323032355f323032362d36363039312d302d30",
      "title": "CC2 306.1 Chimie de notre environnement",
      "start": "2026-01-07T08:30:00+01:00",
      "end": "2026-01-07T09:30:00+01:00",
      "allDay": false,
      "location": "Bridoux_TD 13",
      "description": "\n\nL2 Chimie LAS\nL2 Chimie FC\nTD A L2 Chimie\nSCHRAMM Sébastien\n\n(Modifié le:04/11/2025 11:29)",
      "status": "",
      "url": "",
      "lastModified": "2025-11-04T11:29:00+01:00"
    },
    {
      "id": "ADE60322e706c616e6e696e67554c5f323032355f323032362d3137343233332d31392d30",
      "title": "GULER César et/ou KOHLER Manon et/ou CHILDZ Augustiin",
      "start": "2026-01-07T08:45:00+01:00",
      "end": "2026-01-07T12:00:00+01:00",
      "allDay": false,
      "location": "",
      "description": "\n\n\n\n(Modifié le:24/11/2025 13:08)",
      "status": "",
      "url": "",
      "lastModified": "2025-11-24T13:08:00+01:00"
    },
    {
      "id": "ADE60322e706c616e6e696e67554c5f323032355f323032362d39353538372d342d30",
      "title": "6.03 EI Marketing des services sportifs",
      "start": "2026-01-07T09:00:00+01:00",
      "end": "2026-01-07T12:00:00+01:00",
      "allDay": false,
      "location": "Bridoux_TP Start up 2 D16",
      "description": "\n\nLP GDOSSL FI/FC\nLic Pro GDOSSL FA\nPIERRE Julien\n\n(Modifié le:13/10/2025 11:02)",
      "status": "",
      "url": "",
      "lastModified": "2025-10-13T11:02:00+02:00"
    },
    {
      "id": "ADE60322e706c616e6e696e67554c5f323032355f323032362d36313830312d312d30",
      "title": "TP UE 818 - Ecole de Terrain",
      "start": "2026-01-07T09:00:00+01:00",
      "end": "2026-01-07T10:00:00+01:00",
      "allDay": false,
      "location": "Bridoux_TD 27",
      "description": "\n\nARAN Delphine\nTP GE\n\n(Modifié le:08/12/2025 14:59)",
      "status": "",
      "url": "",
      "lastModified": "2025-12-08T14:59:00+01:00"
    },
    {
      "id": "ADE60322e706c616e6e696e67554c5f323032355f323032362d3136303239382d312d30",
      "title": "EXAMENS L1 STAPS salle particulière ",
      "start": "2026-01-07T09:00:00+01:00",
      "end": "2026-01-07T12:00:00+01:00",
      "allDay": false,
      "location": "Bridoux_TD 9",
      "description": "\n\nPrêt salles et amphi\n\n(Modifié le:16/10/2025 11:43)",
      "status": "",
      "url": "",
      "lastModified": "2025-10-16T11:43:00+02:00"
    },
    {
      "id": "ADE60322e706c616e6e696e67554c5f323032355f323032362d3130383738332d302d30",
      "title": "TP GR D : TRAVAUX PRATIQUES D'ELECTRICITE",
      "start": "2026-01-07T09:00:00+01:00",
      "end": "2026-01-07T12:00:00+01:00",
      "allDay": false,
      "location": "Bridoux_TP  Edison H7",
      "description": "\n\nTP GR D\nTP04\nTITE Teddy\n\n(Modifié le:03/12/2025 12:01)",
      "status": "",
      "url": "",
      "lastModified": "2025-12-03T12:01:00+01:00"
    },
    {
      "id": "ADE60322e706c616e6e696e67554c5f323032355f323032362d39353638382d302d30",
      "title": "UE 805 EC1 CM Santé Publique",
      "start": "2026-01-07T09:00:00+01:00",
      "end": "2026-01-07T12:00:00+01:00",
      "allDay": false,
      "location": "Bridoux_TP Damasio D3",
      "description": "\n\nPromo complète M1 FA\nPromo complète M1 FI/FC\nOBERLAENDER Aurélia\n\n(Modifié le:11/12/2025 15:31)",
      "status": "",
      "url": "",
      "lastModified": "2025-12-11T15:31:00+01:00"
    },
    {
      "id": "ADE60322e706c616e6e696e67554c5f323032355f323032362d35353235302d302d30",
      "title": "Seconde chance UE 502.1 Chimie de coordination",
      "start": "2026-01-07T10:15:00+01:00",
      "end": "2026-01-07T11:45:00+01:00",
      "allDay": false,
      "location": "Bridoux_TD 3",
      "description": "\n\nL3 Chimie FC\nL3 Chimie LAS\nTD - L3 Chimie\nABDELLAH Ibrahim\n\n(Modifié le:05/09/2025 11:11)",
      "status": "",
      "url": "",
      "lastModified": "2025-09-05T11:11:00+02:00"
    },
    {
      "id": "ADE60322e706c616e6e696e67554c5f323032355f323032362d3130353431342d302d30",
      "title": "CC2 UE 301.1 Analyse",
      "start": "2026-01-07T10:15:00+01:00",
      "end": "2026-01-07T11:45:00+01:00",
      "allDay": false,
      "location": "Bridoux_Salle des Actes B14",
      "description": "\n\nGRANDATI Yves\nTD L2 Physique\nL2 Physique FC\nL2 Physique LAS\nL2 PC\nL2 Physique PE\nMOHRBACH Hervé\n\n(Modifié le:03/10/2025 12:58)",
      "status": "",
      "url": "",
      "lastModified": "2025-10-03T12:58:00+02:00"
    },
    {
      "id": "ADE60322e706c616e6e696e67554c5f323032355f323032362d3134393930312d302d34",
      "title": "Réservation Victor",
      "start": "2026-01-07T10:15:00+01:00",
      "end": "2026-01-07T12:15:00+01:00",
      "allDay": false,
      "location": "",
      "description": "\nCC2 301.1 YG\n\n\n(Modifié le:03/10/2025 12:58)",
      "status": "",
      "url": "",
      "lastModified": "2025-10-03T12:58:00+02:00"
    },
    {
      "id": "ADE60322e706c616e6e696e67554c5f323032355f323032362d3134363831302d372d30",
      "title": "EI 4 EC 102.1 Mécanique du point",
      "start": "2026-01-07T10:15:00+01:00",
      "end": "2026-01-07T12:15:00+01:00",
      "allDay": false,
      "location": "Bridoux_TD 15",
      "description": "\n\nTD 4 Porail PC\nMESSINA René\n\n(Modifié le:23/09/2025 12:37)",
      "status": "",
      "url": "",
      "lastModified": "2025-09-23T12:37:00+02:00"
    },
    {
      "id": "ADE60322e706c616e6e696e67554c5f323032355f323032362d36343238302d302d30",
      "title": "CM UE 904 EC 1 Opportunités et réseaux d'affaires",
      "start": "2026-01-07T10:15:00+01:00",
      "end": "2026-01-07T12:15:00+01:00",
      "allDay": false,
      "location": "Bridoux_TP Start up 1 D14BIS",
      "description": "\n\nM2 A3R\nBASTIEN Nicolas\n\n(Modifié le:10/09/2025 12:56)",
      "status": "",
      "url": "",
      "lastModified": "2025-09-10T12:56:00+02:00"
    },
    {
      "id": "ADE60322e706c616e6e696e67554c5f323032355f323032362d36313736392d362d30",
      "title": "CM UE 816 - Techniques de dépollution des sol",
      "start": "2026-01-07T10:15:00+01:00",
      "end": "2026-01-07T12:15:00+01:00",
      "allDay": false,
      "location": "Bridoux_TD 7",
      "description": "\n\nMASFARAUD Jean-François\nCM GE\n\n(Modifié le:08/12/2025 16:41)",
      "status": "",
      "url": "",
      "lastModified": "2025-12-08T16:41:00+01:00"
    },
    {
      "id": "ADE60322e706c616e6e696e67554c5f323032355f323032362d383437322d302d30",
      "title": "EI 2 EC 103.2 Cinétique chimique",
      "start": "2026-01-07T10:15:00+01:00",
      "end": "2026-01-07T12:15:00+01:00",
      "allDay": false,
      "location": "Bridoux_TD 1",
      "description": "\n\nSCHRAMM Sébastien\nTD 2 Portail PC\n\n(Modifié le:04/11/2025 11:30)",
      "status": "",
      "url": "",
      "lastModified": "2025-11-04T11:30:00+01:00"
    },
    {
      "id": "ADE60322e706c616e6e696e67554c5f323032355f323032362d3133313430382d302d3136",
      "title": "EI 1 EC 102.1 Mécanique du point",
      "start": "2026-01-07T10:15:00+01:00",
      "end": "2026-01-07T12:15:00+01:00",
      "allDay": false,
      "location": "Bridoux_TD 12",
      "description": "\n\nTD 1 Portail PC\nGREFFIER Olivier\n\n(Modifié le:01/10/2025 11:41)",
      "status": "",
      "url": "",
      "lastModified": "2025-10-01T11:41:00+02:00"
    },
    {
      "id": "ADE60322e706c616e6e696e67554c5f323032355f323032362d383030322d302d3131",
      "title": "EI 3 EC 102.1 Mécanique du point",
      "start": "2026-01-07T10:15:00+01:00",
      "end": "2026-01-07T12:15:00+01:00",
      "allDay": false,
      "location": "Bridoux_TD 24",
      "description": "\ncours annulé du 10/12\nTD 3 Portail PC\nCREOLA-CHIVERS Theo\n\n(Modifié le:10/12/2025 16:46)",
      "status": "",
      "url": "",
      "lastModified": "2025-12-10T16:46:00+01:00"
    },
    {
      "id": "ADE60322e706c616e6e696e67554c5f323032355f323032362d3132393737302d302d30",
      "title": "CC2 506 Physique des milieux continus",
      "start": "2026-01-07T13:00:00+01:00",
      "end": "2026-01-07T15:00:00+01:00",
      "allDay": false,
      "location": "Bridoux_TD 17",
      "description": "\n\nL3 Physique FC\nL3 Physique LAS\nTD L3 Physique\nXU Hong\n\n(Modifié le:17/10/2025 12:15)",
      "status": "",
      "url": "",
      "lastModified": "2025-10-17T12:15:00+02:00"
    },
    {
      "id": "ADE60322e706c616e6e696e67554c5f323032355f323032362d39353638392d302d30",
      "title": "UE 805 EC1 TD Santé Publique",
      "start": "2026-01-07T13:00:00+01:00",
      "end": "2026-01-07T16:00:00+01:00",
      "allDay": false,
      "location": "Bridoux_TP Damasio D3",
      "description": "\n\nPromo complète M1 FA\nPromo complète M1 FI/FC\nOBERLAENDER Aurélia\n\n(Modifié le:11/12/2025 15:31)",
      "status": "",
      "url": "",
      "lastModified": "2025-12-11T15:31:00+01:00"
    },
    {
      "id": "ADE60322e706c616e6e696e67554c5f323032355f323032362d36323136342d302d30",
      "title": "TP UE 910 - SIG II",
      "start": "2026-01-07T13:15:00+01:00",
      "end": "2026-01-07T16:15:00+01:00",
      "allDay": false,
      "location": "Bridoux_TP Info6 F2",
      "description": "\n\nSIGNORET-TALANDIER Sandrine\nTP GEMAREC\n\n(Modifié le:08/09/2025 11:35)",
      "status": "",
      "url": "",
      "lastModified": "2025-09-08T11:35:00+02:00"
    },
    {
      "id": "ADE60322e706c616e6e696e67554c5f323032355f323032362d36363435302d302d30",
      "title": "TP1 UE 901 - Humanités",
      "start": "2026-01-07T13:30:00+01:00",
      "end": "2026-01-07T17:30:00+01:00",
      "allDay": false,
      "location": "Bridoux_Salle des Actes B14",
      "description": "\n\nTP ETOX\nEnseignant 1\n\n(Modifié le:05/09/2025 17:14)",
      "status": "",
      "url": "",
      "lastModified": "2025-09-05T17:14:00+02:00"
    },
    {
      "id": "ADE60322e706c616e6e696e67554c5f323032355f323032362d36343236382d302d30",
      "title": "CM UE 903 EC 1 Sociologie de l’innovation",
      "start": "2026-01-07T13:30:00+01:00",
      "end": "2026-01-07T15:30:00+01:00",
      "allDay": false,
      "location": "Bridoux_TP Start up 1 D14BIS",
      "description": "\n\nGRUEV Radoslav\nM2 A3R\n\n(Modifié le:03/11/2025 14:37)",
      "status": "",
      "url": "",
      "lastModified": "2025-11-03T14:37:00+01:00"
    },
    {
      "id": "ADE60322e706c616e6e696e67554c5f323032355f323032362d3136383935392d302d30",
      "title": "M2 MEEF PC Oraux chimie",
      "start": "2026-01-07T13:30:00+01:00",
      "end": "2026-01-07T17:30:00+01:00",
      "allDay": false,
      "location": "Bridoux_TP Delesse A3",
      "description": "\n\nM2 MEEF PC\nCOURILLEAU-GOBRY Anne\n\n(Modifié le:12/11/2025 15:48)",
      "status": "",
      "url": "",
      "lastModified": "2025-11-12T15:48:00+01:00"
    },
    {
      "id": "ADE60322e706c616e6e696e67554c5f323032355f323032362d36313736392d302d30",
      "title": "CM UE 816 - Techniques de dépollution des sol",
      "start": "2026-01-07T13:30:00+01:00",
      "end": "2026-01-07T16:30:00+01:00",
      "allDay": false,
      "location": "Bridoux_TD 8",
      "description": "\n\nMASFARAUD Jean-François\nCM GE\n\n(Modifié le:08/12/2025 16:40)",
      "status": "",
      "url": "",
      "lastModified": "2025-12-08T16:40:00+01:00"
    },
    {
      "id": "ADE60322e706c616e6e696e67554c5f323032355f323032362d35353337352d302d30",
      "title": "Seconde chance UE 506 Chimie quantique",
      "start": "2026-01-07T13:30:00+01:00",
      "end": "2026-01-07T15:00:00+01:00",
      "allDay": false,
      "location": "Bridoux_TD 16",
      "description": "\n\nL3 Chimie FC\nTD - L3 Chimie\nTALOTTA Francesco\nTREMBLAY Jean-Christophe\n\n(Modifié le:17/10/2025 16:27)",
      "status": "",
      "url": "",
      "lastModified": "2025-10-17T16:27:00+02:00"
    },
    {
      "id": "ADE60322e706c616e6e696e67554c5f323032355f323032362d39353538372d302d30",
      "title": "6.03 EI Marketing des services sportifs",
      "start": "2026-01-07T13:30:00+01:00",
      "end": "2026-01-07T17:30:00+01:00",
      "allDay": false,
      "location": "Bridoux_TP Start up 2 D16",
      "description": "\n\nLP GDOSSL FI/FC\nLic Pro GDOSSL FA\nPIERRE Julien\n\n(Modifié le:13/10/2025 11:02)",
      "status": "",
      "url": "",
      "lastModified": "2025-10-13T11:02:00+02:00"
    },
    {
      "id": "ADE60322e706c616e6e696e67554c5f323032355f323032362d3133313237332d332d30",
      "title": "CM EC Management et Gestion de Projet",
      "start": "2026-01-07T13:30:00+01:00",
      "end": "2026-01-07T15:30:00+01:00",
      "allDay": false,
      "location": "Bridoux_TD 1",
      "description": "\n\nUE ALT 01\nCM EC Management et Gestion de Projet\nCM EC Management et Gestion de Projet\nCM EC Management et Gestion de Projet\nUE ALT 01\nCM EC Management et Gestion de Projet\nCM EC Management et Gestion de Projet\nCM EC Management et Gestion de Projet\nMOUGEOT Anais\n\n(Modifié le:10/11/2025 16:55)",
      "status": "",
      "url": "",
      "lastModified": "2025-11-10T16:55:00+01:00"
    },
    {
      "id": "ADE60322e706c616e6e696e67554c5f323032355f323032362d38383230392d302d30",
      "title": "Seconde chance UE 104 NUMOC",
      "start": "2026-01-07T14:00:00+01:00",
      "end": "2026-01-07T15:30:00+01:00",
      "allDay": false,
      "location": "",
      "description": "\n\n\n\n(Modifié le:14/10/2025 17:27)",
      "status": "",
      "url": "",
      "lastModified": "2025-10-14T17:27:00+02:00"
    },
    {
      "id": "ADE60322e706c616e6e696e67554c5f323032355f323032362d38383230392d302d30",
      "title": "Seconde chance UE 104 NUMOC",
      "start": "2026-01-07T14:00:00+01:00",
      "end": "2026-01-07T15:30:00+01:00",
      "allDay": false,
      "location": "",
      "description": "\n\n\n\n(Modifié le:14/10/2025 17:27)",
      "status": "",
      "url": "",
      "lastModified": "2025-10-14T17:27:00+02:00"
    },
    {
      "id": "ADE60322e706c616e6e696e67554c5f323032355f323032362d3139393833372d302d30",
      "title": "TP1 UE 803 - SIG I",
      "start": "2026-01-07T14:00:00+01:00",
      "end": "2026-01-07T17:00:00+01:00",
      "allDay": false,
      "location": "Bridoux_TP Info3 C7",
      "description": "\n\nZELL BOUTTER Sandrine\nTP GRP 1\n\n(Modifié le:24/11/2025 10:54)",
      "status": "",
      "url": "",
      "lastModified": "2025-11-24T10:54:00+01:00"
    },
    {
      "id": "ADE60322e706c616e6e696e67554c5f323032355f323032362d38383230392d302d30",
      "title": "Seconde chance UE 104 NUMOC",
      "start": "2026-01-07T14:00:00+01:00",
      "end": "2026-01-07T15:30:00+01:00",
      "allDay": false,
      "location": "Bridoux_TP Info4 C11,Bridoux_TP Info1 C1,Bridoux_TP Info2 C5",
      "description": "\n\nBITTNER Stefan\nTP A Portail PC\nTP B Portail PC\nTP C Portail PC\nTP E Portail PC\nTP F Portail PC\nCAPPELAERE Emmanuel\nORSAL Gaëlle\n\n(Modifié le:14/10/2025 17:27)",
      "status": "",
      "url": "",
      "lastModified": "2025-10-14T17:27:00+02:00"
    },
    {
      "id": "ADE60322e706c616e6e696e67554c5f323032355f323032362d3230393236382d302d30",
      "title": "Examen TP UE 502.3 Chimie des métaux de transition",
      "start": "2026-01-07T15:45:00+01:00",
      "end": "2026-01-07T16:45:00+01:00",
      "allDay": false,
      "location": "Bridoux_TD 17",
      "description": "\n\nZIMMER Alexandre\nL3 Chimie FC\nL3 Chimie LAS\nTD - L3 Chimie\n\n(Modifié le:13/11/2025 15:15)",
      "status": "",
      "url": "",
      "lastModified": "2025-11-13T15:15:00+01:00"
    },
    {
      "id": "ADE60322e706c616e6e696e67554c5f323032355f323032362d3134323139342d31302d33",
      "title": "Travaux service technique",
      "start": "2026-01-08T07:00:00+01:00",
      "end": "2026-01-08T19:00:00+01:00",
      "allDay": false,
      "location": "",
      "description": "\n\n\n\n(Modifié le:11/12/2025 11:40)",
      "status": "",
      "url": "",
      "lastModified": "2025-12-11T11:40:00+01:00"
    },
    {
      "id": "ADE60322e706c616e6e696e67554c5f323032355f323032362d39333339352d302d30",
      "title": "Seconde chance UE 301.2 Chimie minérale 1",
      "start": "2026-01-08T08:00:00+01:00",
      "end": "2026-01-08T09:30:00+01:00",
      "allDay": false,
      "location": "Bridoux_TD 14",
      "description": "\n\nL2 Chimie LAS\nTD A L2 Chimie\nL2 PC\nL2 PC LAS\nL2 Chimie FC\nL2 Chimie PE\nL2 PC PE\nBOULANGER Clotilde\nNouveau MCF P-C\nZIMMER Alexandre\n\n(Modifié le:24/09/2025 11:59)",
      "status": "",
      "url": "",
      "lastModified": "2025-09-24T11:59:00+02:00"
    },
    {
      "id": "ADE60322e706c616e6e696e67554c5f323032355f323032362d3136373931322d332d30",
      "title": "TD ME771 Contruire une posture réflexive: mémoire - 1",
      "start": "2026-01-08T08:00:00+01:00",
      "end": "2026-01-08T12:00:00+01:00",
      "allDay": false,
      "location": "Bridoux_TD 28",
      "description": "\n\nHESSE Stéphanie\nM1 MEEF PC\n\n(Modifié le:12/11/2025 15:54)",
      "status": "",
      "url": "",
      "lastModified": "2025-11-12T15:54:00+01:00"
    },
    {
      "id": "ADE60322e706c616e6e696e67554c5f323032355f323032362d31313238382d302d30",
      "title": "CM Toxicologie fondamentale",
      "start": "2026-01-08T08:00:00+01:00",
      "end": "2026-01-08T10:00:00+01:00",
      "allDay": false,
      "location": "Bridoux_TD 1",
      "description": "\n\nFAUPIN Solène\nTP  A*\nTP  B*\n\n(Modifié le:11/12/2025 11:19)",
      "status": "",
      "url": "",
      "lastModified": "2025-12-11T11:19:00+01:00"
    },
    {
      "id": "ADE60322e706c616e6e696e67554c5f323032355f323032362d36313633322d302d37",
      "title": "TP B 304.1 Instrumentation en électronique",
      "start": "2026-01-08T08:00:00+01:00",
      "end": "2026-01-08T11:00:00+01:00",
      "allDay": false,
      "location": "Bridoux_TP  Edison H7",
      "description": "\n\nCODA-BOUCHOT Virginie\nL2 Physique FC\nL2 Physique LAS\nL2 Physique PE\nTP B L2 Physique\n\n(Modifié le:26/09/2025 12:22)",
      "status": "",
      "url": "",
      "lastModified": "2025-09-26T12:22:00+02:00"
    },
    {
      "id": "ADE60322e706c616e6e696e67554c5f323032355f323032362d383437322d302d33",
      "title": "EI 2 EC 103.2 Cinétique chimique",
      "start": "2026-01-08T08:00:00+01:00",
      "end": "2026-01-08T10:00:00+01:00",
      "allDay": false,
      "location": "Bridoux_TD 4",
      "description": "\n\nSCHRAMM Sébastien\nTD 2 Portail PC\n\n(Modifié le:03/10/2025 17:28)",
      "status": "",
      "url": "",
      "lastModified": "2025-10-03T17:28:00+02:00"
    },
    {
      "id": "ADE60322e706c616e6e696e67554c5f323032355f323032362d3133313431322d302d3130",
      "title": "EI 1 UE 101 Mathématiques 1",
      "start": "2026-01-08T08:00:00+01:00",
      "end": "2026-01-08T10:00:00+01:00",
      "allDay": false,
      "location": "Bridoux_TD 16",
      "description": "\n\nGRANDCOLAS Michel\nTD 1 Portail PC\n\n(Modifié le:01/10/2025 11:41)",
      "status": "",
      "url": "",
      "lastModified": "2025-10-01T11:41:00+02:00"
    },
    {
      "id": "ADE60322e706c616e6e696e67554c5f323032355f323032362d3132393736392d302d30",
      "title": "Seconde chance 502.2 Mathématiques 5",
      "start": "2026-01-08T08:00:00+01:00",
      "end": "2026-01-08T10:00:00+01:00",
      "allDay": false,
      "location": "Bridoux_TD 17",
      "description": "\n\nGRANDATI Yves\nL3 Physique FC\nL3 Physique LAS\nTD L3 Physique\nMESSINA René\n\n(Modifié le:09/09/2025 16:34)",
      "status": "",
      "url": "",
      "lastModified": "2025-09-09T16:34:00+02:00"
    },
    {
      "id": "ADE60322e706c616e6e696e67554c5f323032355f323032362d3134353436312d372d30",
      "title": "EI UE 106/OS Remédiation en chimie 1",
      "start": "2026-01-08T08:30:00+01:00",
      "end": "2026-01-08T10:00:00+01:00",
      "allDay": false,
      "location": "Bridoux_TD 7",
      "description": "\n\nTD 4 Porail PC\nCOURILLEAU-GOBRY Anne\n\n(Modifié le:23/09/2025 12:38)",
      "status": "",
      "url": "",
      "lastModified": "2025-09-23T12:38:00+02:00"
    },
    {
      "id": "ADE60322e706c616e6e696e67554c5f323032355f323032362d3137343233332d32302d30",
      "title": "GULER César et/ou KOHLER Manon et/ou CHILDZ Augustiin",
      "start": "2026-01-08T08:30:00+01:00",
      "end": "2026-01-08T17:30:00+01:00",
      "allDay": false,
      "location": "",
      "description": "\n\n\n\n(Modifié le:24/11/2025 13:08)",
      "status": "",
      "url": "",
      "lastModified": "2025-11-24T13:08:00+01:00"
    },
    {
      "id": "ADE60322e706c616e6e696e67554c5f323032355f323032362d31313730302d312d30",
      "title": "CM EC Création d’entreprise",
      "start": "2026-01-08T09:00:00+01:00",
      "end": "2026-01-08T12:00:00+01:00",
      "allDay": false,
      "location": "Bridoux_TP Start up 2 D16",
      "description": "\n\nUE ALT 03\nCM EC Création d’entreprise\nCM EC Création d’entreprise\nCM EC Création d’entreprise\nUE ALT 03\nCM EC Création d’entreprise\nCM EC Création d’entreprise\nCM EC Création d’entreprise\nGORKA Loic\n\n(Modifié le:16/09/2025 14:07)",
      "status": "",
      "url": "",
      "lastModified": "2025-09-16T14:07:00+02:00"
    },
    {
      "id": "ADE60322e706c616e6e696e67554c5f323032355f323032362d36313639382d302d38",
      "title": "TP A 306.1 Physique expérimentale 2",
      "start": "2026-01-08T09:00:00+01:00",
      "end": "2026-01-08T12:00:00+01:00",
      "allDay": false,
      "location": "Bridoux_TP Carnot H6",
      "description": "\n\nTP A L2 Physique\nLECLERC Arnaud\n\n(Modifié le:03/09/2025 12:54)",
      "status": "",
      "url": "",
      "lastModified": "2025-09-03T12:54:00+02:00"
    },
    {
      "id": "ADE60322e706c616e6e696e67554c5f323032355f323032362d39353630322d34362d30",
      "title": "PRJ Préparation du projet tutoré",
      "start": "2026-01-08T09:00:00+01:00",
      "end": "2026-01-08T11:00:00+01:00",
      "allDay": false,
      "location": "Bridoux_TP Start up 1 D14BIS",
      "description": "\n\nLP GDOSSL FI/FC\n\n(Modifié le:08/12/2025 14:52)",
      "status": "",
      "url": "",
      "lastModified": "2025-12-08T14:52:00+01:00"
    },
    {
      "id": "ADE60322e706c616e6e696e67554c5f323032355f323032362d39353639302d302d30",
      "title": "UE 805 CM EC2 Mise en œuvre en APA des réseaux professionnels",
      "start": "2026-01-08T10:00:00+01:00",
      "end": "2026-01-08T12:00:00+01:00",
      "allDay": false,
      "location": "Bridoux_TD 2",
      "description": "\n\nPromo complète M1 FA\nPromo complète M1 FI/FC\nBOUTTET Flavien\n\n(Modifié le:04/12/2025 15:21)",
      "status": "",
      "url": "",
      "lastModified": "2025-12-04T15:21:00+01:00"
    },
    {
      "id": "ADE60322e706c616e6e696e67554c5f323032355f323032362d37353431362d302d30",
      "title": "Seconde chance UE 303.3 Phénomènes ondulatoires",
      "start": "2026-01-08T10:00:00+01:00",
      "end": "2026-01-08T11:30:00+01:00",
      "allDay": false,
      "location": "Bridoux_TD 14",
      "description": "\n\nL2 Chimie LAS\nL2 Chimie FC\nL2 Chimie PE\nTD A L2 Chimie\nTREMBLAY Jean-Christophe\n\n(Modifié le:16/09/2025 10:21)",
      "status": "",
      "url": "",
      "lastModified": "2025-09-16T10:21:00+02:00"
    },
    {
      "id": "ADE60322e706c616e6e696e67554c5f323032355f323032362d31313231392d302d30",
      "title": "CM Physiotoxicology",
      "start": "2026-01-08T10:15:00+01:00",
      "end": "2026-01-08T12:15:00+01:00",
      "allDay": false,
      "location": "Bridoux_Salle des Actes B14",
      "description": "\n\nTP  D*\nTP  C*\nFAUPIN Solène\n\n(Modifié le:10/12/2025 16:04)",
      "status": "",
      "url": "",
      "lastModified": "2025-12-10T16:04:00+01:00"
    },
    {
      "id": "ADE60322e706c616e6e696e67554c5f323032355f323032362d3132393736312d302d30",
      "title": "CC2 505 Transferts thermiques",
      "start": "2026-01-08T10:15:00+01:00",
      "end": "2026-01-08T12:15:00+01:00",
      "allDay": false,
      "location": "Bridoux_TD 17",
      "description": "\n\nTALOTTA Francesco\nTD L3 Physique\nL3 Physique FC\nL3 Physique LAS\n\n(Modifié le:05/11/2025 11:17)",
      "status": "",
      "url": "",
      "lastModified": "2025-11-05T11:17:00+01:00"
    },
    {
      "id": "ADE60322e706c616e6e696e67554c5f323032355f323032362d383030322d302d3139",
      "title": "EI 3 EC 102.1 Mécanique du point",
      "start": "2026-01-08T10:15:00+01:00",
      "end": "2026-01-08T12:15:00+01:00",
      "allDay": false,
      "location": "Bridoux_TD 3",
      "description": "\n\nCREOLA-CHIVERS Theo\nTD 3 Portail PC\n\n(Modifié le:10/12/2025 16:46)",
      "status": "",
      "url": "",
      "lastModified": "2025-12-10T16:46:00+01:00"
    },
    {
      "id": "ADE60322e706c616e6e696e67554c5f323032355f323032362d373836392d302d3233",
      "title": "EI 2 UE 101 Mathématiques 1",
      "start": "2026-01-08T10:15:00+01:00",
      "end": "2026-01-08T12:15:00+01:00",
      "allDay": false,
      "location": "Bridoux_TD 1",
      "description": "\n\nTD 2 Portail PC\nGLEIZE Jérôme\n\n(Modifié le:24/09/2025 13:21)",
      "status": "",
      "url": "",
      "lastModified": "2025-09-24T13:21:00+02:00"
    },
    {
      "id": "ADE60322e706c616e6e696e67554c5f323032355f323032362d31313236302d342d30",
      "title": "CM Immunologie approfondie",
      "start": "2026-01-08T10:15:00+01:00",
      "end": "2026-01-08T12:15:00+01:00",
      "allDay": false,
      "location": "Bridoux_TD 16",
      "description": "\n\nRODIUS François\nGroupe A Immunologie\nGroupe B immunologie\n\n(Modifié le:08/12/2025 15:05)",
      "status": "",
      "url": "",
      "lastModified": "2025-12-08T15:05:00+01:00"
    },
    {
      "id": "ADE60322e706c616e6e696e67554c5f323032355f323032362d3131313931382d322d30",
      "title": "EI 1 EC 103.2 Equilibres chimiques",
      "start": "2026-01-08T10:15:00+01:00",
      "end": "2026-01-08T12:15:00+01:00",
      "allDay": false,
      "location": "Bridoux_TD 12",
      "description": "\n\nAKIL Suzanna\nTD 1 Portail PC\n\n(Modifié le:01/10/2025 11:41)",
      "status": "",
      "url": "",
      "lastModified": "2025-10-01T11:41:00+02:00"
    },
    {
      "id": "ADE60322e706c616e6e696e67554c5f323032355f323032362d35353135332d302d30",
      "title": "Seconde chance UE 502.1 Chimie des métaux de transition",
      "start": "2026-01-08T13:30:00+01:00",
      "end": "2026-01-08T15:00:00+01:00",
      "allDay": false,
      "location": "Bridoux_TD 16",
      "description": "\n\nL3 Chimie FC\nL3 Chimie LAS\nTD - L3 Chimie\nMEUX Éric\nLECLERC Nathalie\n\n(Modifié le:18/11/2025 15:40)",
      "status": "",
      "url": "",
      "lastModified": "2025-11-18T15:40:00+01:00"
    },
    {
      "id": "ADE60322e706c616e6e696e67554c5f323032355f323032362d3132353934372d302d30",
      "title": "UE 801 EC1 CM Socio-histoire du handicap",
      "start": "2026-01-08T13:30:00+01:00",
      "end": "2026-01-08T15:30:00+01:00",
      "allDay": false,
      "location": "Bridoux_TP Damasio D3,En direct à distance",
      "description": "\n\nLE BRAS Anatole\nPromo complète M1 FA\nPromo complète M1 FI/FC\n\n(Modifié le:03/11/2025 15:36)",
      "status": "",
      "url": "",
      "lastModified": "2025-11-03T15:36:00+01:00"
    },
    {
      "id": "ADE60322e706c616e6e696e67554c5f323032355f323032362d31333038322d302d33",
      "title": "TP A 304.1 Instrumentation en électronique",
      "start": "2026-01-08T13:30:00+01:00",
      "end": "2026-01-08T16:30:00+01:00",
      "allDay": false,
      "location": "Bridoux_TP  Edison H7",
      "description": "\n\nCODA-BOUCHOT Virginie\nTP A L2 Physique\n\n(Modifié le:28/11/2025 12:21)",
      "status": "",
      "url": "",
      "lastModified": "2025-11-28T12:21:00+01:00"
    },
    {
      "id": "ADE60322e706c616e6e696e67554c5f323032355f323032362d3131353736382d302d34",
      "title": "EI 3 EC 103.2 Equilibres chimiques",
      "start": "2026-01-08T13:30:00+01:00",
      "end": "2026-01-08T15:30:00+01:00",
      "allDay": false,
      "location": "Bridoux_TD 24",
      "description": "\n\nACHARD Christian\nTD 3 Portail PC\n\n(Modifié le:23/09/2025 18:01)",
      "status": "",
      "url": "",
      "lastModified": "2025-09-23T18:01:00+02:00"
    },
    {
      "id": "ADE60322e706c616e6e696e67554c5f323032355f323032362d38393533392d302d30",
      "title": "EI ME830 Savoirs propres à la discipline et épistémologie",
      "start": "2026-01-08T13:30:00+01:00",
      "end": "2026-01-08T17:30:00+01:00",
      "allDay": false,
      "location": "Bridoux_TD 2",
      "description": "\n\nPrépa CAPES STAPS EDT M1\nM1 MEEF EPS - Groupe A\nM1 MEEF EPS - Groupe B\nVINCENT Cyrille\n\n(Modifié le:02/12/2025 16:38)",
      "status": "",
      "url": "",
      "lastModified": "2025-12-02T16:38:00+01:00"
    },
    {
      "id": "ADE60322e706c616e6e696e67554c5f323032355f323032362d39353630322d34342d30",
      "title": "PRJ Préparation du projet tutoré",
      "start": "2026-01-08T13:30:00+01:00",
      "end": "2026-01-08T15:30:00+01:00",
      "allDay": false,
      "location": "Bridoux_TP Start up 2 D16",
      "description": "\n\nLP GDOSSL FI/FC\n\n(Modifié le:08/12/2025 14:52)",
      "status": "",
      "url": "",
      "lastModified": "2025-12-08T14:52:00+01:00"
    },
    {
      "id": "ADE60322e706c616e6e696e67554c5f323032355f323032362d373338382d302d34",
      "title": "TP C EC 106.1 Travaux pratiques de mécanique du point",
      "start": "2026-01-08T13:30:00+01:00",
      "end": "2026-01-08T16:30:00+01:00",
      "allDay": false,
      "location": "Bridoux_ TP Ampère H2",
      "description": "\n\nTP C Portail PC\nCAPPELAERE Emmanuel\n\n(Modifié le:12/12/2025 09:36)",
      "status": "",
      "url": "",
      "lastModified": "2025-12-12T09:36:00+01:00"
    },
    {
      "id": "ADE60322e706c616e6e696e67554c5f323032355f323032362d373632392d352d30",
      "title": "EI UE 106/OS Remédiation en physique 1",
      "start": "2026-01-08T13:30:00+01:00",
      "end": "2026-01-08T15:30:00+01:00",
      "allDay": false,
      "location": "Bridoux_TD 6",
      "description": "\n\nTD 4 Porail PC\nGREFFIER Olivier\n\n(Modifié le:09/10/2025 17:47)",
      "status": "",
      "url": "",
      "lastModified": "2025-10-09T17:47:00+02:00"
    },
    {
      "id": "ADE60322e706c616e6e696e67554c5f323032355f323032362d31313237372d302d30",
      "title": "CM Physiologie: régulation des fonctions",
      "start": "2026-01-08T13:30:00+01:00",
      "end": "2026-01-08T15:30:00+01:00",
      "allDay": false,
      "location": "Bridoux_TD 15",
      "description": "\n\nNEGUESQUE Adrien\nTP  A*\nTP  B*\n\n(Modifié le:01/12/2025 16:50)",
      "status": "",
      "url": "",
      "lastModified": "2025-12-01T16:50:00+01:00"
    },
    {
      "id": "ADE60322e706c616e6e696e67554c5f323032355f323032362d36363436352d302d30",
      "title": "TP2 UE 901 - Humanités",
      "start": "2026-01-08T13:30:00+01:00",
      "end": "2026-01-08T17:30:00+01:00",
      "allDay": false,
      "location": "Bridoux_Salle des Actes B14",
      "description": "\n\nTP GEMAREC\nEnseignant 1\n\n(Modifié le:08/09/2025 11:35)",
      "status": "",
      "url": "",
      "lastModified": "2025-09-08T11:35:00+02:00"
    },
    {
      "id": "ADE60322e706c616e6e696e67554c5f323032355f323032362d31313730312d382d30",
      "title": "CM EC Marketing",
      "start": "2026-01-08T14:00:00+01:00",
      "end": "2026-01-08T17:00:00+01:00",
      "allDay": false,
      "location": "Bridoux_TP Start up 1 D14BIS",
      "description": "\n\nWOLLJUNG Serge\nUE ALT 04\nCM EC Marketing\nCM EC Marketing\nCM EC Marketing\nUE ALT 04\nCM EC Marketing\nCM EC Marketing\nCM EC Marketing\n\n(Modifié le:19/09/2025 11:00)",
      "status": "",
      "url": "",
      "lastModified": "2025-09-19T11:00:00+02:00"
    },
    {
      "id": "ADE60322e706c616e6e696e67554c5f323032355f323032362d31363533332d302d30",
      "title": "CM EC 602.1 Spectrométrie de masse ",
      "start": "2026-01-08T15:15:00+01:00",
      "end": "2026-01-08T17:15:00+01:00",
      "allDay": false,
      "location": "Bridoux_TD 16",
      "description": "\n\nAUBRIET Frédéric\nL3 Chimie FC\nL3 Chimie LAS\nTD - L3 Chimie\n\n(Modifié le:25/11/2025 10:46)",
      "status": "",
      "url": "",
      "lastModified": "2025-11-25T10:46:00+01:00"
    },
    {
      "id": "ADE60322e706c616e6e696e67554c5f323032355f323032362d39353637312d302d31",
      "title": "UE 803 CM EC1 Psychophysiologie de la fatigue",
      "start": "2026-01-08T15:30:00+01:00",
      "end": "2026-01-08T17:30:00+01:00",
      "allDay": false,
      "location": "Bridoux_TP Damasio D3",
      "description": "\n\nBARBRY Alexis\nPromo complète M1 FA\nPromo complète M1 FI/FC\n\n(Modifié le:27/11/2025 16:17)",
      "status": "",
      "url": "",
      "lastModified": "2025-11-27T16:17:00+01:00"
    },
    {
      "id": "ADE60322e706c616e6e696e67554c5f323032355f323032362d3131353635372d302d34",
      "title": "EI 3 EC 103.2 Cinétique chimique",
      "start": "2026-01-08T15:45:00+01:00",
      "end": "2026-01-08T17:45:00+01:00",
      "allDay": false,
      "location": "Bridoux_TD 6",
      "description": "\n\nGHARRED Nawres\nTD 3 Portail PC\n\n(Modifié le:03/10/2025 17:29)",
      "status": "",
      "url": "",
      "lastModified": "2025-10-03T17:29:00+02:00"
    },
    {
      "id": "ADE60322e706c616e6e696e67554c5f323032355f323032362d31313132352d312d30",
      "title": "CM Ecologie du paysage et phytosociologie",
      "start": "2026-01-08T15:45:00+01:00",
      "end": "2026-01-08T17:45:00+01:00",
      "allDay": false,
      "location": "Bridoux_TD 17",
      "description": "\n\nROBIN Vincent\nTP  C*Option Ecologie du paysage & phytosocio\nTP  D*Option Ecologie du paysage & phytosocio\n\n(Modifié le:10/12/2025 15:01)",
      "status": "",
      "url": "",
      "lastModified": "2025-12-10T15:01:00+01:00"
    },
    {
      "id": "ADE60322e706c616e6e696e67554c5f323032355f323032362d31313236302d312d30",
      "title": "CM Immunologie approfondie",
      "start": "2026-01-08T15:45:00+01:00",
      "end": "2026-01-08T17:45:00+01:00",
      "allDay": false,
      "location": "Bridoux_TD 15",
      "description": "\n\nNEGUESQUE Adrien\nGroupe A Immunologie\nGroupe B immunologie\n\n(Modifié le:01/12/2025 16:09)",
      "status": "",
      "url": "",
      "lastModified": "2025-12-01T16:09:00+01:00"
    },
    {
      "id": "ADE60322e706c616e6e696e67554c5f323032355f323032362d3134323139342d31322d32",
      "title": "Travaux service technique",
      "start": "2026-01-09T07:00:00+01:00",
      "end": "2026-01-09T19:00:00+01:00",
      "allDay": false,
      "location": "",
      "description": "\n\n\n\n(Modifié le:11/12/2025 11:40)",
      "status": "",
      "url": "",
      "lastModified": "2025-12-11T11:40:00+01:00"
    },
    {
      "id": "ADE60322e706c616e6e696e67554c5f323032355f323032362d39323933322d322d30",
      "title": "TD ME871 Construire une posture réflexive à travers la recher.",
      "start": "2026-01-09T08:00:00+01:00",
      "end": "2026-01-09T12:00:00+01:00",
      "allDay": false,
      "location": "Bridoux_TP Info1 C1",
      "description": "\n\nMASTAGLI Maxime\nPrépa CAPES STAPS EDT M1\nM1 MEEF EPS - Groupe A\nM1 MEEF EPS - Groupe B\n\n(Modifié le:04/12/2025 11:00)",
      "status": "",
      "url": "",
      "lastModified": "2025-12-04T11:00:00+01:00"
    },
    {
      "id": "ADE60322e706c616e6e696e67554c5f323032355f323032362d3133313431352d32342d30",
      "title": "EI 3 UE 101 Mathématiques 1",
      "start": "2026-01-09T08:00:00+01:00",
      "end": "2026-01-09T10:00:00+01:00",
      "allDay": false,
      "location": "Bridoux_TD 18",
      "description": "\n\nTD 3 Portail PC\nJABER Hassan\n\n(Modifié le:03/11/2025 16:54)",
      "status": "",
      "url": "",
      "lastModified": "2025-11-03T16:54:00+01:00"
    },
    {
      "id": "ADE60322e706c616e6e696e67554c5f323032355f323032362d3132393737312d302d30",
      "title": "Seconde chance 503.2 Relativité restreinte",
      "start": "2026-01-09T08:00:00+01:00",
      "end": "2026-01-09T10:00:00+01:00",
      "allDay": false,
      "location": "Bridoux_TD 24",
      "description": "\n\nGRANDATI Yves\nL3 Physique FC\nL3 Physique LAS\nTD L3 Physique\nMOHRBACH Hervé\n\n(Modifié le:09/09/2025 16:34)",
      "status": "",
      "url": "",
      "lastModified": "2025-09-09T16:34:00+02:00"
    },
    {
      "id": "ADE60322e706c616e6e696e67554c5f323032355f323032362d3131323430312d302d32",
      "title": "EI 1 EC 103.2 Cinétique chimique",
      "start": "2026-01-09T08:00:00+01:00",
      "end": "2026-01-09T10:00:00+01:00",
      "allDay": false,
      "location": "Bridoux_TD 17",
      "description": "\n\nAKIL Suzanna\nTD 1 Portail PC\n\n(Modifié le:03/10/2025 17:28)",
      "status": "",
      "url": "",
      "lastModified": "2025-10-03T17:28:00+02:00"
    },
    {
      "id": "ADE60322e706c616e6e696e67554c5f323032355f323032362d33373532392d302d30",
      "title": "Manon BADURAUX",
      "start": "2026-01-09T08:45:00+01:00",
      "end": "2026-01-09T13:00:00+01:00",
      "allDay": false,
      "location": "",
      "description": "\n\n\n\n(Modifié le:04/12/2025 11:20)",
      "status": "",
      "url": "",
      "lastModified": "2025-12-04T11:20:00+01:00"
    },
    {
      "id": "ADE60322e706c616e6e696e67554c5f323032355f323032362d34313231302d32322d30",
      "title": "Réservation de salle tiers-temps ALIMOHAMMADZADEH TAHER",
      "start": "2026-01-09T08:45:00+01:00",
      "end": "2026-01-09T12:15:00+01:00",
      "allDay": false,
      "location": "",
      "description": "\n\n\n\n(Modifié le:04/12/2025 11:23)",
      "status": "",
      "url": "",
      "lastModified": "2025-12-04T11:23:00+01:00"
    },
    {
      "id": "ADE60322e706c616e6e696e67554c5f323032355f323032362d39353630322d34372d30",
      "title": "PRJ Préparation du projet tutoré",
      "start": "2026-01-09T09:00:00+01:00",
      "end": "2026-01-09T11:00:00+01:00",
      "allDay": false,
      "location": "Bridoux_TP Start up 1 D14BIS",
      "description": "\n\nLP GDOSSL FI/FC\n\n(Modifié le:08/12/2025 14:52)",
      "status": "",
      "url": "",
      "lastModified": "2025-12-08T14:52:00+01:00"
    },
    {
      "id": "ADE60322e706c616e6e696e67554c5f323032355f323032362d31313638342d302d34",
      "title": "TP B 306.1 Physique expérimentale 2",
      "start": "2026-01-09T09:00:00+01:00",
      "end": "2026-01-09T12:00:00+01:00",
      "allDay": false,
      "location": "Bridoux_TP Carnot H6",
      "description": "\n\nL2 Physique FC\nL2 Physique LAS\nL2 Physique PE\nTP B L2 Physique\nLECLERC Arnaud\n\n(Modifié le:26/09/2025 12:22)",
      "status": "",
      "url": "",
      "lastModified": "2025-09-26T12:22:00+02:00"
    },
    {
      "id": "ADE60322e706c616e6e696e67554c5f323032355f323032362d3133313539322d302d34",
      "title": "TP D EC 106.1 Travaux pratiques de mécanique du point",
      "start": "2026-01-09T09:00:00+01:00",
      "end": "2026-01-09T12:00:00+01:00",
      "allDay": false,
      "location": "Bridoux_ TP Ampère H2",
      "description": "\n\nWAX Jean-François\nTP D Portail PC\n\n(Modifié le:24/09/2025 13:21)",
      "status": "",
      "url": "",
      "lastModified": "2025-09-24T13:21:00+02:00"
    },
    {
      "id": "ADE60322e706c616e6e696e67554c5f323032355f323032362d36313736392d312d30",
      "title": "CM UE 816 - Techniques de dépollution des sol",
      "start": "2026-01-09T09:00:00+01:00",
      "end": "2026-01-09T12:00:00+01:00",
      "allDay": false,
      "location": "Bridoux_TD 2",
      "description": "\n\nMASFARAUD Jean-François\nCM GE\n\n(Modifié le:08/12/2025 16:41)",
      "status": "",
      "url": "",
      "lastModified": "2025-12-08T16:41:00+01:00"
    },
    {
      "id": "ADE60322e706c616e6e696e67554c5f323032355f323032362d36313731352d322d30",
      "title": "CM UE 805 - Ressources Naturelles",
      "start": "2026-01-09T10:15:00+01:00",
      "end": "2026-01-09T12:15:00+01:00",
      "allDay": false,
      "location": "Bridoux_TD 5",
      "description": "\n\nCM ETOX\nCM GEMAREC\nARAN Delphine\n\n(Modifié le:08/12/2025 11:55)",
      "status": "",
      "url": "",
      "lastModified": "2025-12-08T11:55:00+01:00"
    },
    {
      "id": "ADE60322e706c616e6e696e67554c5f323032355f323032362d3132393736302d302d30",
      "title": "Seconde chance 503.1 Mécanique analytique",
      "start": "2026-01-09T13:00:00+01:00",
      "end": "2026-01-09T15:00:00+01:00",
      "allDay": false,
      "location": "Bridoux_TD 12",
      "description": "\n\nMÜLLER Martin\nL3 Physique FC\nL3 Physique LAS\nTD L3 Physique\n\n(Modifié le:19/11/2025 10:35)",
      "status": "",
      "url": "",
      "lastModified": "2025-11-19T10:35:00+01:00"
    },
    {
      "id": "ADE60322e706c616e6e696e67554c5f323032355f323032362d39353630322d34382d30",
      "title": "PRJ Préparation du projet tutoré",
      "start": "2026-01-09T13:30:00+01:00",
      "end": "2026-01-09T15:30:00+01:00",
      "allDay": false,
      "location": "Bridoux_TP Start up 2 D16",
      "description": "\n\nLP GDOSSL FI/FC\n\n(Modifié le:08/12/2025 14:52)",
      "status": "",
      "url": "",
      "lastModified": "2025-12-08T14:52:00+01:00"
    },
    {
      "id": "ADE60322e706c616e6e696e67554c5f323032355f323032362d3137313434342d342d30",
      "title": "TD ME971 Construire une posture réflexive 3",
      "start": "2026-01-09T13:30:00+01:00",
      "end": "2026-01-09T15:30:00+01:00",
      "allDay": false,
      "location": "Bridoux_TD 28",
      "description": "\n\nHESSE Stéphanie\nM2 M-PC\nM2 MEEF PC\n\n(Modifié le:12/11/2025 15:55)",
      "status": "",
      "url": "",
      "lastModified": "2025-11-12T15:55:00+01:00"
    },
    {
      "id": "ADE60322e706c616e6e696e67554c5f323032355f323032362d3133313630392d302d33",
      "title": "TP B EC 106.1 Travaux pratiques de mécanique du point",
      "start": "2026-01-09T13:30:00+01:00",
      "end": "2026-01-09T16:30:00+01:00",
      "allDay": false,
      "location": "Bridoux_ TP Ampère H2",
      "description": "\n\nTP B Portail PC\nWAX Jean-François\n\n(Modifié le:01/10/2025 11:40)",
      "status": "",
      "url": "",
      "lastModified": "2025-10-01T11:40:00+02:00"
    },
    {
      "id": "ADE60322e706c616e6e696e67554c5f323032355f323032362d343832332d312d30",
      "title": "UE 801 EC3 CM Socio de la prise en charge : vieill et resp soc",
      "start": "2026-01-09T13:30:00+01:00",
      "end": "2026-01-09T16:30:00+01:00",
      "allDay": false,
      "location": "Bridoux_TP Start up 1 D14BIS",
      "description": "\n\nMORALES LA MURA Raul\nPromo complète M1 FA\nPromo complète M1 FI/FC\n\n(Modifié le:03/11/2025 15:36)",
      "status": "",
      "url": "",
      "lastModified": "2025-11-03T15:36:00+01:00"
    },
    {
      "id": "ADE60322e706c616e6e696e67554c5f323032355f323032362d36313838342d302d30",
      "title": "TP3 UE 901 - Humanités",
      "start": "2026-01-09T13:30:00+01:00",
      "end": "2026-01-09T17:30:00+01:00",
      "allDay": false,
      "location": "Bridoux_Salle des Actes B14",
      "description": "\n\nTP GE\nEnseignant 1\n\n(Modifié le:20/10/2025 12:56)",
      "status": "",
      "url": "",
      "lastModified": "2025-10-20T12:56:00+02:00"
    },
    {
      "id": "ADE60322e706c616e6e696e67554c5f323032355f323032362d3138353231302d352d30",
      "title": "AGREGATION INTERNE",
      "start": "2026-01-09T14:00:00+01:00",
      "end": "2026-01-09T18:00:00+01:00",
      "allDay": false,
      "location": "Bridoux_TD 24",
      "description": "\n\nPrêt salles et amphi\n\n(Modifié le:14/10/2025 14:32)",
      "status": "",
      "url": "",
      "lastModified": "2025-10-14T14:32:00+02:00"
    },
    {
      "id": "ADE60322e706c616e6e696e67554c5f323032355f323032362d3139393833392d302d30",
      "title": "TP3 UE 803 - SIG I",
      "start": "2026-01-09T14:00:00+01:00",
      "end": "2026-01-09T17:00:00+01:00",
      "allDay": false,
      "location": "Bridoux_TP Info2 C5",
      "description": "\n\nZELL BOUTTER Sandrine\nTP GRP 3\n\n(Modifié le:24/11/2025 10:59)",
      "status": "",
      "url": "",
      "lastModified": "2025-11-24T10:59:00+01:00"
    },
    {
      "id": "ADE60322e706c616e6e696e67554c5f323032355f323032362d3134323139342d31332d34",
      "title": "Travaux service technique",
      "start": "2026-01-12T07:00:00+01:00",
      "end": "2026-01-12T19:00:00+01:00",
      "allDay": false,
      "location": "",
      "description": "\n\n\n\n(Modifié le:11/12/2025 11:40)",
      "status": "",
      "url": "",
      "lastModified": "2025-12-11T11:40:00+01:00"
    },
    {
      "id": "ADE60322e706c616e6e696e67554c5f323032355f323032362d39353637332d302d30",
      "title": "UE 803 TD EC1 Psychophysiologie de la fatigue",
      "start": "2026-01-12T08:00:00+01:00",
      "end": "2026-01-12T10:00:00+01:00",
      "allDay": false,
      "location": "Bridoux_TP Start up 1 D14BIS",
      "description": "\n\nBARBRY Alexis\nPromo complète M1 FA\nPromo complète M1 FI/FC\n\n(Modifié le:27/11/2025 16:17)",
      "status": "",
      "url": "",
      "lastModified": "2025-11-27T16:17:00+01:00"
    },
    {
      "id": "ADE60322e706c616e6e696e67554c5f323032355f323032362d3233303139332d322d30",
      "title": "EI ME830 Mobiliser les savoirs propres à la discipline des LC-2",
      "start": "2026-01-12T08:00:00+01:00",
      "end": "2026-01-12T10:00:00+01:00",
      "allDay": false,
      "location": "Bridoux_TD 24",
      "description": "\n\nM1 MEEF PC\nM1 MEEF M-PC\nCODA-BOUCHOT Virginie\n\n(Modifié le:06/11/2025 18:00)",
      "status": "",
      "url": "",
      "lastModified": "2025-11-06T18:00:00+01:00"
    },
    {
      "id": "ADE60322e706c616e6e696e67554c5f323032355f323032362d3132393737322d302d30",
      "title": "Seconde chance 502.1 Mécanique quantique",
      "start": "2026-01-12T08:00:00+01:00",
      "end": "2026-01-12T10:00:00+01:00",
      "allDay": false,
      "location": "Bridoux_TD 12",
      "description": "\n\nANCARANI Lorenzo\nL3 Physique FC\nL3 Physique LAS\nTD L3 Physique\n\n(Modifié le:05/09/2025 11:11)",
      "status": "",
      "url": "",
      "lastModified": "2025-09-05T11:11:00+02:00"
    },
    {
      "id": "ADE60322e706c616e6e696e67554c5f323032355f323032362d39353539362d302d30",
      "title": "6.05 EI Gestion des conflits et des risques",
      "start": "2026-01-12T08:00:00+01:00",
      "end": "2026-01-12T12:00:00+01:00",
      "allDay": false,
      "location": "Bridoux_TD 3",
      "description": "\n\nLP GDOSSL FI/FC\nMASTAGLI Maxime\n\n(Modifié le:08/12/2025 14:45)",
      "status": "",
      "url": "",
      "lastModified": "2025-12-08T14:45:00+01:00"
    },
    {
      "id": "ADE60322e706c616e6e696e67554c5f323032355f323032362d3139343837382d302d30",
      "title": "TP grp1  UE 922 - Formation SST",
      "start": "2026-01-12T08:30:00+01:00",
      "end": "2026-01-12T12:30:00+01:00",
      "allDay": false,
      "location": "Bridoux_TP Start up 2 D16",
      "description": "\n\nTP GE\nHOFFMANN Mireille\n\n(Modifié le:20/10/2025 12:56)",
      "status": "",
      "url": "",
      "lastModified": "2025-10-20T12:56:00+02:00"
    },
    {
      "id": "ADE60322e706c616e6e696e67554c5f323032355f323032362d38393533392d322d30",
      "title": "EI ME830 Savoirs propres à la discipline et épistémologie",
      "start": "2026-01-12T09:00:00+01:00",
      "end": "2026-01-12T12:00:00+01:00",
      "allDay": false,
      "location": "Bridoux_TD 1",
      "description": "\n\nMONIER Brice\nPrépa CAPES STAPS EDT M1\nM1 MEEF EPS - Groupe A\nM1 MEEF EPS - Groupe B\n\n(Modifié le:02/12/2025 16:38)",
      "status": "",
      "url": "",
      "lastModified": "2025-12-02T16:38:00+01:00"
    },
    {
      "id": "ADE60322e706c616e6e696e67554c5f323032355f323032362d36313639382d302d39",
      "title": "TP A 306.1 Physique expérimentale 2",
      "start": "2026-01-12T09:00:00+01:00",
      "end": "2026-01-12T12:00:00+01:00",
      "allDay": false,
      "location": "Bridoux_TP Carnot H6",
      "description": "\n\nTP A L2 Physique\nLECLERC Arnaud\n\n(Modifié le:03/09/2025 12:54)",
      "status": "",
      "url": "",
      "lastModified": "2025-09-03T12:54:00+02:00"
    },
    {
      "id": "ADE60322e706c616e6e696e67554c5f323032355f323032362d39353635332d302d32",
      "title": "UE 801 EC2 CM Anthropologie de la maladie et handicap",
      "start": "2026-01-12T10:00:00+01:00",
      "end": "2026-01-12T12:00:00+01:00",
      "allDay": false,
      "location": "Bridoux_TP Start up 1 D14BIS",
      "description": "\n\nPromo complète M1 FA\nPromo complète M1 FI/FC\nARBORIO Sophie\n\n(Modifié le:03/11/2025 15:36)",
      "status": "",
      "url": "",
      "lastModified": "2025-11-03T15:36:00+01:00"
    },
    {
      "id": "ADE60322e706c616e6e696e67554c5f323032355f323032362d31313231392d312d30",
      "title": "CM Physiotoxicology",
      "start": "2026-01-12T10:15:00+01:00",
      "end": "2026-01-12T12:15:00+01:00",
      "allDay": false,
      "location": "Bridoux_Salle des Actes B14",
      "description": "\n\nTP  D*\nTP  C*\nFAUPIN Solène\n\n(Modifié le:10/12/2025 16:04)",
      "status": "",
      "url": "",
      "lastModified": "2025-12-10T16:04:00+01:00"
    },
    {
      "id": "ADE60322e706c616e6e696e67554c5f323032355f323032362d31363831312d302d30",
      "title": "CM EC 602.1 Propagation dans les milieux",
      "start": "2026-01-12T10:15:00+01:00",
      "end": "2026-01-12T12:15:00+01:00",
      "allDay": false,
      "location": "Bridoux_TD 18",
      "description": "\n\nMESSINA René\nL3 Physique FC\nL3 Physique LAS\nTD L3 Physique\n\n(Modifié le:28/11/2025 16:55)",
      "status": "",
      "url": "",
      "lastModified": "2025-11-28T16:55:00+01:00"
    },
    {
      "id": "ADE60322e706c616e6e696e67554c5f323032355f323032362d36313736392d332d30",
      "title": "CM UE 816 - Techniques de dépollution des sol",
      "start": "2026-01-12T10:15:00+01:00",
      "end": "2026-01-12T12:15:00+01:00",
      "allDay": false,
      "location": "Bridoux_TD 27",
      "description": "\n\nMASFARAUD Jean-François\nCM GE\n\n(Modifié le:08/12/2025 16:41)",
      "status": "",
      "url": "",
      "lastModified": "2025-12-08T16:41:00+01:00"
    },
    {
      "id": "ADE60322e706c616e6e696e67554c5f323032355f323032362d31303938382d332d30",
      "title": "CM EC 401.1 Thermodynamique de la réaction chimique",
      "start": "2026-01-12T10:15:00+01:00",
      "end": "2026-01-12T12:15:00+01:00",
      "allDay": false,
      "location": "Bridoux_TD 15",
      "description": "\n\nACHARD Christian\nL2 Chimie FC\nL2 Chimie LAS\nL2 PC\nL2 PC LAS\nL2 Chimie PE\nL2 PC PE\nTD A L2 Chimie\n\n(Modifié le:24/11/2025 11:52)",
      "status": "",
      "url": "",
      "lastModified": "2025-11-24T11:52:00+01:00"
    },
    {
      "id": "ADE60322e706c616e6e696e67554c5f323032355f323032362d34313231302d31332d30",
      "title": "Réservation de salle tiers-temps ALIMOHAMMADZADEH TAHER",
      "start": "2026-01-12T10:15:00+01:00",
      "end": "2026-01-12T13:15:00+01:00",
      "allDay": false,
      "location": "",
      "description": "\n\n\n\n(Modifié le:04/12/2025 11:24)",
      "status": "",
      "url": "",
      "lastModified": "2025-12-04T11:24:00+01:00"
    },
    {
      "id": "ADE60322e706c616e6e696e67554c5f323032355f323032362d33373532392d312d30",
      "title": "Manon BADURAUX",
      "start": "2026-01-12T10:15:00+01:00",
      "end": "2026-01-12T17:00:00+01:00",
      "allDay": false,
      "location": "",
      "description": "\n\n\n\n(Modifié le:04/11/2025 10:01)",
      "status": "",
      "url": "",
      "lastModified": "2025-11-04T10:01:00+01:00"
    },
    {
      "id": "ADE60322e706c616e6e696e67554c5f323032355f323032362d31313238302d312d30",
      "title": "CM Ecophysiologie microbienne",
      "start": "2026-01-12T10:15:00+01:00",
      "end": "2026-01-12T12:15:00+01:00",
      "allDay": false,
      "location": "Bridoux_TD 5",
      "description": "\n\nPAGNOUT Christophe\nTP  A*\nTP  B*\n\n(Modifié le:05/12/2025 14:30)",
      "status": "",
      "url": "",
      "lastModified": "2025-12-05T14:30:00+01:00"
    },
    {
      "id": "ADE60322e706c616e6e696e67554c5f323032355f323032362d3136373931362d352d30",
      "title": "EI ME830 Mobiliser les savoirs propres à la discipline des LC-2",
      "start": "2026-01-12T10:15:00+01:00",
      "end": "2026-01-12T12:15:00+01:00",
      "allDay": false,
      "location": "Bridoux_TD 28",
      "description": "\n\nM1 MEEF PC\nHESSE Stéphanie\n\n(Modifié le:07/11/2025 16:42)",
      "status": "",
      "url": "",
      "lastModified": "2025-11-07T16:42:00+01:00"
    },
    {
      "id": "ADE60322e706c616e6e696e67554c5f323032355f323032362d343832332d322d30",
      "title": "UE 801 EC3 CM Socio de la prise en charge : vieill et resp soc",
      "start": "2026-01-12T13:00:00+01:00",
      "end": "2026-01-12T17:00:00+01:00",
      "allDay": false,
      "location": "Bridoux_TP Start up 1 D14BIS",
      "description": "\n\nMORALES LA MURA Raul\nPromo complète M1 FA\nPromo complète M1 FI/FC\n\n(Modifié le:03/11/2025 15:36)",
      "status": "",
      "url": "",
      "lastModified": "2025-11-03T15:36:00+01:00"
    },
    {
      "id": "ADE60322e706c616e6e696e67554c5f323032355f323032362d39353538322d302d30",
      "title": "6.02 EI Droit du travail",
      "start": "2026-01-12T13:00:00+01:00",
      "end": "2026-01-12T17:00:00+01:00",
      "allDay": false,
      "location": "Bridoux_TP Damasio D3",
      "description": "\n\nROTH David\nLP GDOSSL FI/FC\nLic Pro GDOSSL FA\n\n(Modifié le:13/10/2025 11:02)",
      "status": "",
      "url": "",
      "lastModified": "2025-10-13T11:02:00+02:00"
    },
    {
      "id": "ADE60322e706c616e6e696e67554c5f323032355f323032362d39333132362d332d30",
      "title": "EI ME1030 Savoirs propres à la discipline et épistémologie",
      "start": "2026-01-12T13:30:00+01:00",
      "end": "2026-01-12T16:30:00+01:00",
      "allDay": false,
      "location": "Bridoux_TD 1",
      "description": "\n\nM2 MEEF EPS\nMONIER Brice\n\n(Modifié le:22/09/2025 11:05)",
      "status": "",
      "url": "",
      "lastModified": "2025-09-22T11:05:00+02:00"
    },
    {
      "id": "ADE60322e706c616e6e696e67554c5f323032355f323032362d3137313432342d302d30",
      "title": "TP ME961 Usage du numérique en Maths, Physique Chimie 1",
      "start": "2026-01-12T13:30:00+01:00",
      "end": "2026-01-12T15:30:00+01:00",
      "allDay": false,
      "location": "Bridoux_TP Hertz H13",
      "description": "\n\nCHAPRON David\nM2 M-PC\nM2 MEEF PC\n\n(Modifié le:03/12/2025 09:53)",
      "status": "",
      "url": "",
      "lastModified": "2025-12-03T09:53:00+01:00"
    },
    {
      "id": "ADE60322e706c616e6e696e67554c5f323032355f323032362d31313238382d312d30",
      "title": "CM Toxicologie fondamentale",
      "start": "2026-01-12T13:30:00+01:00",
      "end": "2026-01-12T15:30:00+01:00",
      "allDay": false,
      "location": "Bridoux_TD 16",
      "description": "\n\nFAUPIN Solène\nTP  A*\nTP  B*\n\n(Modifié le:05/12/2025 11:56)",
      "status": "",
      "url": "",
      "lastModified": "2025-12-05T11:56:00+01:00"
    },
    {
      "id": "ADE60322e706c616e6e696e67554c5f323032355f323032362d36313736372d302d30",
      "title": "TD UE 816 - Techniques de dépollution des sol",
      "start": "2026-01-12T13:30:00+01:00",
      "end": "2026-01-12T17:30:00+01:00",
      "allDay": false,
      "location": "Bridoux_TP Info6 F2",
      "description": "\n\nMASFARAUD Jean-François\nTD GE\n\n(Modifié le:11/12/2025 11:14)",
      "status": "",
      "url": "",
      "lastModified": "2025-12-11T11:14:00+01:00"
    },
    {
      "id": "ADE60322e706c616e6e696e67554c5f323032355f323032362d363438362d302d30",
      "title": "EI AB Algorithmique",
      "start": "2026-01-12T13:30:00+01:00",
      "end": "2026-01-12T15:30:00+01:00",
      "allDay": false,
      "location": "Bridoux_TD 14",
      "description": "\n\nTP  A*\nTP  B*\nCAMARA Baba Issa\n\n(Modifié le:03/12/2025 16:41)",
      "status": "",
      "url": "",
      "lastModified": "2025-12-03T16:41:00+01:00"
    },
    {
      "id": "ADE60322e706c616e6e696e67554c5f323032355f323032362d3139353136312d302d30",
      "title": "TP grp 2 UE 922 - Formation SST",
      "start": "2026-01-12T13:30:00+01:00",
      "end": "2026-01-12T17:30:00+01:00",
      "allDay": false,
      "location": "Bridoux_TP Start up 2 D16",
      "description": "\n\nHOFFMANN Mireille\nTP GE\n\n(Modifié le:20/10/2025 12:56)",
      "status": "",
      "url": "",
      "lastModified": "2025-10-20T12:56:00+02:00"
    },
    {
      "id": "ADE60322e706c616e6e696e67554c5f323032355f323032362d39323535302d302d30",
      "title": "EI GH 206.1 Chimie Organique pour la Biologie",
      "start": "2026-01-12T13:30:00+01:00",
      "end": "2026-01-12T15:30:00+01:00",
      "allDay": false,
      "location": "Bridoux_TD 18",
      "description": "\n\nHESSE Stéphanie\nTP  H*\nTP  G*\n\n(Modifié le:11/12/2025 12:18)",
      "status": "",
      "url": "",
      "lastModified": "2025-12-11T12:18:00+01:00"
    },
    {
      "id": "ADE60322e706c616e6e696e67554c5f323032355f323032362d3233303139332d342d30",
      "title": "EI ME830 Mobiliser les savoirs propres à la discipline des LC-2",
      "start": "2026-01-12T13:30:00+01:00",
      "end": "2026-01-12T15:30:00+01:00",
      "allDay": false,
      "location": "Bridoux_TD 29",
      "description": "\n\nM1 MEEF PC\nM1 MEEF M-PC\nANCARANI Lorenzo\n\n(Modifié le:12/12/2025 12:05)",
      "status": "",
      "url": "",
      "lastModified": "2025-12-12T12:05:00+01:00"
    },
    {
      "id": "ADE60322e706c616e6e696e67554c5f323032355f323032362d31303831352d302d30",
      "title": "CM EC 402.1 Chimie organique 2",
      "start": "2026-01-12T15:45:00+01:00",
      "end": "2026-01-12T17:45:00+01:00",
      "allDay": false,
      "location": "Bridoux_TD 15",
      "description": "\n\nL2 Chimie FC\nL2 Chimie LAS\nL2 PC\nL2 PC LAS\nL2 Chimie PE\nL2 PC PE\nTD A L2 Chimie\nSINDT Michèle\n\n(Modifié le:28/11/2025 11:46)",
      "status": "",
      "url": "",
      "lastModified": "2025-11-28T11:46:00+01:00"
    },
    {
      "id": "ADE60322e706c616e6e696e67554c5f323032355f323032362d31313237372d322d30",
      "title": "CM Physiologie: régulation des fonctions",
      "start": "2026-01-12T15:45:00+01:00",
      "end": "2026-01-12T17:45:00+01:00",
      "allDay": false,
      "location": "Bridoux_TD 3",
      "description": "\n\nTP  A*\nTP  B*\nFELTEN Vincent\n\n(Modifié le:09/12/2025 15:56)",
      "status": "",
      "url": "",
      "lastModified": "2025-12-09T15:56:00+01:00"
    },
    {
      "id": "ADE60322e706c616e6e696e67554c5f323032355f323032362d36333232362d302d30",
      "title": "EI CD Algorithmique",
      "start": "2026-01-12T15:45:00+01:00",
      "end": "2026-01-12T17:45:00+01:00",
      "allDay": false,
      "location": "Bridoux_TD 14",
      "description": "\n\nTP  C*\nTP  D*\nCAMARA Baba Issa\n\n(Modifié le:03/12/2025 16:41)",
      "status": "",
      "url": "",
      "lastModified": "2025-12-03T16:41:00+01:00"
    },
    {
      "id": "ADE60322e706c616e6e696e67554c5f323032355f323032362d3139363038382d302d30",
      "title": "EI IJ 206.1 Chimie Organique pour la Biologie",
      "start": "2026-01-12T15:45:00+01:00",
      "end": "2026-01-12T17:45:00+01:00",
      "allDay": false,
      "location": "Bridoux_TD 18",
      "description": "\n\nHESSE Stéphanie\nTP I*\nTP J*\n\n(Modifié le:01/12/2025 13:16)",
      "status": "",
      "url": "",
      "lastModified": "2025-12-01T13:16:00+01:00"
    },
    {
      "id": "ADE60322e706c616e6e696e67554c5f323032355f323032362d3134323139342d31352d31",
      "title": "Travaux service technique",
      "start": "2026-01-13T07:00:00+01:00",
      "end": "2026-01-13T19:00:00+01:00",
      "allDay": false,
      "location": "",
      "description": "\n\n\n\n(Modifié le:11/12/2025 11:40)",
      "status": "",
      "url": "",
      "lastModified": "2025-12-11T11:40:00+01:00"
    },
    {
      "id": "ADE60322e706c616e6e696e67554c5f323032355f323032362d39353538382d352d30",
      "title": "6.03 EI Management et gestion des structures et des services",
      "start": "2026-01-13T08:00:00+01:00",
      "end": "2026-01-13T12:00:00+01:00",
      "allDay": false,
      "location": "Bridoux_TP Start up 1 D14BIS",
      "description": "\n\nLP GDOSSL FI/FC\nWALTER Christophe\n\n(Modifié le:13/10/2025 11:02)",
      "status": "",
      "url": "",
      "lastModified": "2025-10-13T11:02:00+02:00"
    },
    {
      "id": "ADE60322e706c616e6e696e67554c5f323032355f323032362d31363236322d302d31",
      "title": "CM EC 403.2 Chimie minérale 3",
      "start": "2026-01-13T08:00:00+01:00",
      "end": "2026-01-13T10:00:00+01:00",
      "allDay": false,
      "location": "Bridoux_TD 17",
      "description": "\n\nL2 Chimie FC\nL2 Chimie LAS\nL2 Chimie PE\nTD A L2 Chimie\nMEUX Éric\n\n(Modifié le:09/12/2025 13:00)",
      "status": "",
      "url": "",
      "lastModified": "2025-12-09T13:00:00+01:00"
    },
    {
      "id": "ADE60322e706c616e6e696e67554c5f323032355f323032362d33373532392d322d30",
      "title": "Manon BADURAUX",
      "start": "2026-01-13T08:45:00+01:00",
      "end": "2026-01-13T17:00:00+01:00",
      "allDay": false,
      "location": "",
      "description": "\n\n\n\n(Modifié le:04/11/2025 10:01)",
      "status": "",
      "url": "",
      "lastModified": "2025-11-04T10:01:00+01:00"
    },
    {
      "id": "ADE60322e706c616e6e696e67554c5f323032355f323032362d34313231302d32302d30",
      "title": "Réservation de salle tiers-temps ALIMOHAMMADZADEH TAHER",
      "start": "2026-01-13T08:45:00+01:00",
      "end": "2026-01-13T17:45:00+01:00",
      "allDay": false,
      "location": "",
      "description": "\n\n\n\n(Modifié le:04/12/2025 11:22)",
      "status": "",
      "url": "",
      "lastModified": "2025-12-04T11:22:00+01:00"
    },
    {
      "id": "ADE60322e706c616e6e696e67554c5f323032355f323032362d36313139312d312d30",
      "title": "CM UE 806 - Restauration et Ingénierie écologique",
      "start": "2026-01-13T09:00:00+01:00",
      "end": "2026-01-13T12:00:00+01:00",
      "allDay": false,
      "location": "Bridoux_TD 9",
      "description": "\n\nROBIN Vincent\nCM GEMAREC\n\n(Modifié le:20/11/2025 16:41)",
      "status": "",
      "url": "",
      "lastModified": "2025-11-20T16:41:00+01:00"
    },
    {
      "id": "ADE60322e706c616e6e696e67554c5f323032355f323032362d3139393833372d312d30",
      "title": "TP1 UE 803 - SIG I",
      "start": "2026-01-13T09:00:00+01:00",
      "end": "2026-01-13T12:00:00+01:00",
      "allDay": false,
      "location": "Bridoux_TP Info2 C5",
      "description": "\n\nZELL BOUTTER Sandrine\nTP GRP 1\n\n(Modifié le:24/11/2025 10:56)",
      "status": "",
      "url": "",
      "lastModified": "2025-11-24T10:56:00+01:00"
    },
    {
      "id": "ADE60322e706c616e6e696e67554c5f323032355f323032362d39323038342d322d30",
      "title": "TD ME863  Gérer une classe, avoir une approche réflexive",
      "start": "2026-01-13T09:00:00+01:00",
      "end": "2026-01-13T12:00:00+01:00",
      "allDay": false,
      "location": "Bridoux_TD 2",
      "description": "\n\nVINCENT Cyrille\nPrépa CAPES STAPS EDT M1\nM1 MEEF EPS - Groupe A\nM1 MEEF EPS - Groupe B\n\n(Modifié le:22/09/2025 11:04)",
      "status": "",
      "url": "",
      "lastModified": "2025-09-22T11:04:00+02:00"
    },
    {
      "id": "ADE60322e706c616e6e696e67554c5f323032355f323032362d36313736322d302d30",
      "title": "CM UE 814 - Traitement physico-chimique des déchets",
      "start": "2026-01-13T10:15:00+01:00",
      "end": "2026-01-13T12:15:00+01:00",
      "allDay": false,
      "location": "Bridoux_TD 1",
      "description": "\n\nMEUX Éric\nCM GE\n\n(Modifié le:18/11/2025 17:49)",
      "status": "",
      "url": "",
      "lastModified": "2025-11-18T17:49:00+01:00"
    },
    {
      "id": "ADE60322e706c616e6e696e67554c5f323032355f323032362d31303933382d302d32",
      "title": "TD EC 406.2 PPP 1",
      "start": "2026-01-13T10:15:00+01:00",
      "end": "2026-01-13T12:15:00+01:00",
      "allDay": false,
      "location": "Bridoux_TP Info6 F2",
      "description": "\n\nHATIM Oumaima\nL2 Chimie FC\nL2 PC\nTD A L2 Chimie\n\n(Modifié le:24/11/2025 11:54)",
      "status": "",
      "url": "",
      "lastModified": "2025-11-24T11:54:00+01:00"
    },
    {
      "id": "ADE60322e706c616e6e696e67554c5f323032355f323032362d31313131302d322d30",
      "title": "CM Géologie et pédologie approfondies",
      "start": "2026-01-13T10:15:00+01:00",
      "end": "2026-01-13T12:15:00+01:00",
      "allDay": false,
      "location": "Bridoux_TD 3",
      "description": "\n\nARAN Delphine\nTP  D*Option Géologie & pédologie \nTP  C*Option Géologie & pédologie \n\n(Modifié le:04/12/2025 15:16)",
      "status": "",
      "url": "",
      "lastModified": "2025-12-04T15:16:00+01:00"
    },
    {
      "id": "ADE60322e706c616e6e696e67554c5f323032355f323032362d39353536392d332d30",
      "title": "UE 6.01 EI Technique de communication liées aux A.P.S",
      "start": "2026-01-13T13:00:00+01:00",
      "end": "2026-01-13T16:00:00+01:00",
      "allDay": false,
      "location": "Bridoux_TP Start up 2 D16",
      "description": "\n\nSALING Emmanuel\nLP GDOSSL FI/FC\n\n(Modifié le:13/10/2025 11:02)",
      "status": "",
      "url": "",
      "lastModified": "2025-10-13T11:02:00+02:00"
    },
    {
      "id": "ADE60322e706c616e6e696e67554c5f323032355f323032362d3234333532392d302d30",
      "title": "M2 M-PC Oraux de chimie ",
      "start": "2026-01-13T13:30:00+01:00",
      "end": "2026-01-13T17:30:00+01:00",
      "allDay": false,
      "location": "Bridoux_TP Delesse A3",
      "description": "\n\nM2 M-PC\nCOURILLEAU-GOBRY Anne\n\n(Modifié le:12/11/2025 15:52)",
      "status": "",
      "url": "",
      "lastModified": "2025-11-12T15:52:00+01:00"
    },
    {
      "id": "ADE60322e706c616e6e696e67554c5f323032355f323032362d39323534332d302d30",
      "title": "EI F 206.1 Chimie Organique pour la Biologie",
      "start": "2026-01-13T13:30:00+01:00",
      "end": "2026-01-13T15:30:00+01:00",
      "allDay": false,
      "location": "Bridoux_TD 12",
      "description": "\n\nTP  F*\nBUHAIBEH Ruqaya\n\n(Modifié le:01/12/2025 13:16)",
      "status": "",
      "url": "",
      "lastModified": "2025-12-01T13:16:00+01:00"
    },
    {
      "id": "ADE60322e706c616e6e696e67554c5f323032355f323032362d39323534322d302d30",
      "title": "EI CD 206.1 Chimie Organique pour la Biologie",
      "start": "2026-01-13T13:30:00+01:00",
      "end": "2026-01-13T15:30:00+01:00",
      "allDay": false,
      "location": "Bridoux_TD 3",
      "description": "\n\nCOMOY Corinne\nTP  C*\nTP  D*\n\n(Modifié le:01/12/2025 13:16)",
      "status": "",
      "url": "",
      "lastModified": "2025-12-01T13:16:00+01:00"
    },
    {
      "id": "ADE60322e706c616e6e696e67554c5f323032355f323032362d31313237372d342d30",
      "title": "CM Physiologie: régulation des fonctions",
      "start": "2026-01-13T13:30:00+01:00",
      "end": "2026-01-13T15:30:00+01:00",
      "allDay": false,
      "location": "Bridoux_TD 9",
      "description": "\n\nFELTEN Vincent\nTP  A*\nTP  B*\n\n(Modifié le:09/12/2025 15:57)",
      "status": "",
      "url": "",
      "lastModified": "2025-12-09T15:57:00+01:00"
    },
    {
      "id": "ADE60322e706c616e6e696e67554c5f323032355f323032362d39333132362d312d30",
      "title": "EI ME1030 Savoirs propres à la discipline et épistémologie",
      "start": "2026-01-13T13:30:00+01:00",
      "end": "2026-01-13T17:30:00+01:00",
      "allDay": false,
      "location": "Bridoux_TD 1",
      "description": "\n\nM2 MEEF EPS\nVINCENT Cyrille\n\n(Modifié le:22/09/2025 11:05)",
      "status": "",
      "url": "",
      "lastModified": "2025-09-22T11:05:00+02:00"
    },
    {
      "id": "ADE60322e706c616e6e696e67554c5f323032355f323032362d36333635392d302d30",
      "title": "EI GH Algorithmique",
      "start": "2026-01-13T13:30:00+01:00",
      "end": "2026-01-13T15:30:00+01:00",
      "allDay": false,
      "location": "Bridoux_TD 14",
      "description": "\n\nTP  G*\nTP  H*\nCAMARA Baba Issa\n\n(Modifié le:11/12/2025 12:18)",
      "status": "",
      "url": "",
      "lastModified": "2025-12-11T12:18:00+01:00"
    },
    {
      "id": "ADE60322e706c616e6e696e67554c5f323032355f323032362d3139393833382d312d30",
      "title": "TP2 UE 803 - SIG I",
      "start": "2026-01-13T14:00:00+01:00",
      "end": "2026-01-13T17:00:00+01:00",
      "allDay": false,
      "location": "Bridoux_TP Info2 C5",
      "description": "\n\nZELL BOUTTER Sandrine\nTP GRP 2\n\n(Modifié le:24/11/2025 10:59)",
      "status": "",
      "url": "",
      "lastModified": "2025-11-24T10:59:00+01:00"
    },
    {
      "id": "ADE60322e706c616e6e696e67554c5f323032355f323032362d38383732312d362d30",
      "title": "TD ME740 Savoirs didact. discipl. mise en oeuvre des programmes",
      "start": "2026-01-13T14:00:00+01:00",
      "end": "2026-01-13T15:00:00+01:00",
      "allDay": false,
      "location": "Bridoux_TD 2",
      "description": "\n\nZANNETTI Yannick\nPrépa CAPES STAPS EDT M1\nM1 MEEF EPS - Groupe A\nM1 MEEF EPS - Groupe B\n\n(Modifié le:06/11/2025 15:21)",
      "status": "",
      "url": "",
      "lastModified": "2025-11-06T15:21:00+01:00"
    },
    {
      "id": "ADE60322e706c616e6e696e67554c5f323032355f323032362d31313638342d302d39",
      "title": "TP B 306.1 Physique expérimentale 2",
      "start": "2026-01-13T14:00:00+01:00",
      "end": "2026-01-13T17:00:00+01:00",
      "allDay": false,
      "location": "Bridoux_TP Carnot H6",
      "description": "\n\nL2 Physique FC\nL2 Physique LAS\nL2 Physique PE\nTP B L2 Physique\nLECLERC Arnaud\n\n(Modifié le:26/09/2025 12:22)",
      "status": "",
      "url": "",
      "lastModified": "2025-09-26T12:22:00+02:00"
    },
    {
      "id": "ADE60322e706c616e6e696e67554c5f323032355f323032362d39353638322d302d30",
      "title": "UE 804 CM EC2 Outils pour la réadaptation",
      "start": "2026-01-13T15:30:00+01:00",
      "end": "2026-01-13T17:30:00+01:00",
      "allDay": false,
      "location": "Bridoux_TP Info1 C1",
      "description": "\n\nPromo complète M1 FA\nPromo complète M1 FI/FC\nHAINAUT Jean-Philippe\n\n(Modifié le:04/12/2025 12:12)",
      "status": "",
      "url": "",
      "lastModified": "2025-12-04T12:12:00+01:00"
    },
    {
      "id": "ADE60322e706c616e6e696e67554c5f323032355f323032362d36333238342d302d30",
      "title": "EI EF Algorithmique",
      "start": "2026-01-13T15:45:00+01:00",
      "end": "2026-01-13T17:45:00+01:00",
      "allDay": false,
      "location": "Bridoux_TD 14",
      "description": "\n\nTP  E*\nTP  F*\nCAMARA Baba Issa\n\n(Modifié le:03/12/2025 16:42)",
      "status": "",
      "url": "",
      "lastModified": "2025-12-03T16:42:00+01:00"
    },
    {
      "id": "ADE60322e706c616e6e696e67554c5f323032355f323032362d39353538342d332d30",
      "title": "6.02 EI Administration des services sportifs et politique",
      "start": "2026-01-13T16:30:00+01:00",
      "end": "2026-01-13T18:30:00+01:00",
      "allDay": false,
      "location": "Bridoux_TP Start up 2 D16",
      "description": "\n\nAGAZZI Frédéric\nLP GDOSSL FI/FC\n\n(Modifié le:13/10/2025 11:02)",
      "status": "",
      "url": "",
      "lastModified": "2025-10-13T11:02:00+02:00"
    },
    {
      "id": "ADE60322e706c616e6e696e67554c5f323032355f323032362d3134323139342d31332d32",
      "title": "Travaux service technique",
      "start": "2026-01-14T07:00:00+01:00",
      "end": "2026-01-14T19:00:00+01:00",
      "allDay": false,
      "location": "",
      "description": "\n\n\n\n(Modifié le:11/12/2025 11:40)",
      "status": "",
      "url": "",
      "lastModified": "2025-12-11T11:40:00+01:00"
    },
    {
      "id": "ADE60322e706c616e6e696e67554c5f323032355f323032362d34313231302d32312d30",
      "title": "Réservation de salle tiers-temps ALIMOHAMMADZADEH TAHER",
      "start": "2026-01-14T07:45:00+01:00",
      "end": "2026-01-14T17:15:00+01:00",
      "allDay": false,
      "location": "",
      "description": "\n\n\n\n(Modifié le:04/12/2025 11:23)",
      "status": "",
      "url": "",
      "lastModified": "2025-12-04T11:23:00+01:00"
    },
    {
      "id": "ADE60322e706c616e6e696e67554c5f323032355f323032362d3134393930312d302d36",
      "title": "Réservation Victor",
      "start": "2026-01-14T08:00:00+01:00",
      "end": "2026-01-14T10:00:00+01:00",
      "allDay": false,
      "location": "",
      "description": "\nCC2 303.2 RM\n\n\n(Modifié le:03/10/2025 12:59)",
      "status": "",
      "url": "",
      "lastModified": "2025-10-03T12:59:00+02:00"
    },
    {
      "id": "ADE60322e706c616e6e696e67554c5f323032355f323032362d3231333839352d302d30",
      "title": "TD GR1 EC 801.1 Sauveteurs et Secouristes du Travail",
      "start": "2026-01-14T08:00:00+01:00",
      "end": "2026-01-14T13:00:00+01:00",
      "allDay": false,
      "location": "Bridoux_TP Start up 2 D16",
      "description": "\n\nGroupe 1 M1 Chimie\nCREMONI Jerome\n\n(Modifié le:15/12/2025 10:19)",
      "status": "",
      "url": "",
      "lastModified": "2025-12-15T10:19:00+01:00"
    },
    {
      "id": "ADE60322e706c616e6e696e67554c5f323032355f323032362d3130353431362d302d30",
      "title": "CC2 UE 303.2 Electromagnétisme 2",
      "start": "2026-01-14T08:00:00+01:00",
      "end": "2026-01-14T09:30:00+01:00",
      "allDay": false,
      "location": "Bridoux_Salle des Actes B14",
      "description": "\n\nTD L2 Physique\nL2 Physique FC\nL2 Physique LAS\nL2 PC\nL2 PC LAS\nL2 Physique PE\nMESSINA René\nWAX Jean-François\n\n(Modifié le:03/10/2025 12:59)",
      "status": "",
      "url": "",
      "lastModified": "2025-10-03T12:59:00+02:00"
    },
    {
      "id": "ADE60322e706c616e6e696e67554c5f323032355f323032362d33373532392d332d30",
      "title": "Manon BADURAUX",
      "start": "2026-01-14T08:45:00+01:00",
      "end": "2026-01-14T17:00:00+01:00",
      "allDay": false,
      "location": "",
      "description": "\n\n\n\n(Modifié le:04/11/2025 10:01)",
      "status": "",
      "url": "",
      "lastModified": "2025-11-04T10:01:00+01:00"
    },
    {
      "id": "ADE60322e706c616e6e696e67554c5f323032355f323032362d38323335392d312d30",
      "title": "UE 804 TP EC1 Outils pour l'évaluation",
      "start": "2026-01-14T09:00:00+01:00",
      "end": "2026-01-14T12:00:00+01:00",
      "allDay": false,
      "location": "Bridoux_TD 18",
      "description": "\n\nDUBOIS Amandine\nPromo complète M1 FA\nPromo complète M1 FI/FC\n\n(Modifié le:08/12/2025 12:16)",
      "status": "",
      "url": "",
      "lastModified": "2025-12-08T12:16:00+01:00"
    },
    {
      "id": "ADE60322e706c616e6e696e67554c5f323032355f323032362d3137313530382d302d31",
      "title": "TD ME1051Concevoir une transposition didactique en M-PC 2",
      "start": "2026-01-14T09:00:00+01:00",
      "end": "2026-01-14T12:00:00+01:00",
      "allDay": false,
      "location": "Bridoux_TP Hertz H13",
      "description": "\n\nM2 M-PC\nREVEILLIEZ Christophe\n\n(Modifié le:12/11/2025 10:48)",
      "status": "",
      "url": "",
      "lastModified": "2025-11-12T10:48:00+01:00"
    },
    {
      "id": "ADE60322e706c616e6e696e67554c5f323032355f323032362d3137313333372d302d30",
      "title": "TD ME1051 Concevoir une transposition didactique en LC2",
      "start": "2026-01-14T09:00:00+01:00",
      "end": "2026-01-14T12:00:00+01:00",
      "allDay": false,
      "location": "Bridoux_TD 28",
      "description": "\n\nNADLER Caroline\nM2 MEEF PC\n\n(Modifié le:06/11/2025 16:58)",
      "status": "",
      "url": "",
      "lastModified": "2025-11-06T16:58:00+01:00"
    },
    {
      "id": "ADE60322e706c616e6e696e67554c5f323032355f323032362d36393632332d302d30",
      "title": "CC 717 Analyse du Cycle de Vie / Méthodologie Sites et Sols Pollués",
      "start": "2026-01-14T09:00:00+01:00",
      "end": "2026-01-14T10:30:00+01:00",
      "allDay": false,
      "location": "Bridoux_TD 4",
      "description": "\n\nTP GRP 3\nMASFARAUD Jean-François\n\n(Modifié le:09/12/2025 17:48)",
      "status": "",
      "url": "",
      "lastModified": "2025-12-09T17:48:00+01:00"
    },
    {
      "id": "ADE60322e706c616e6e696e67554c5f323032355f323032362d3134393930312d302d37",
      "title": "Réservation Victor",
      "start": "2026-01-14T10:15:00+01:00",
      "end": "2026-01-14T12:15:00+01:00",
      "allDay": false,
      "location": "",
      "description": "\nCC2 303.1 JCT\n\n\n(Modifié le:03/10/2025 13:00)",
      "status": "",
      "url": "",
      "lastModified": "2025-10-03T13:00:00+02:00"
    },
    {
      "id": "ADE60322e706c616e6e696e67554c5f323032355f323032362d31313236302d352d30",
      "title": "CM Immunologie approfondie",
      "start": "2026-01-14T10:15:00+01:00",
      "end": "2026-01-14T12:15:00+01:00",
      "allDay": false,
      "location": "Bridoux_TD 14",
      "description": "\n\nRODIUS François\nGroupe A Immunologie\nGroupe B immunologie\n\n(Modifié le:08/12/2025 15:05)",
      "status": "",
      "url": "",
      "lastModified": "2025-12-08T15:05:00+01:00"
    },
    {
      "id": "ADE60322e706c616e6e696e67554c5f323032355f323032362d3130353431372d302d30",
      "title": "CC2 UE 303.1 Ondes et vibrations",
      "start": "2026-01-14T10:15:00+01:00",
      "end": "2026-01-14T11:45:00+01:00",
      "allDay": false,
      "location": "Bridoux_Salle des Actes B14",
      "description": "\n\nTD L2 Physique\nL2 Physique FC\nL2 Physique LAS\nL2 PC\nL2 Physique PE\nTREMBLAY Jean-Christophe\n\n(Modifié le:03/10/2025 13:00)",
      "status": "",
      "url": "",
      "lastModified": "2025-10-03T13:00:00+02:00"
    },
    {
      "id": "ADE60322e706c616e6e696e67554c5f323032355f323032362d31353731362d302d32",
      "title": "CM EC 405.1 Biochimie",
      "start": "2026-01-14T10:15:00+01:00",
      "end": "2026-01-14T12:15:00+01:00",
      "allDay": false,
      "location": "Bridoux_TD 2",
      "description": "\n\nPARANT Marc\nL2 Chimie FC\nL2 Chimie PE\nTD A L2 Chimie\nL2 Chimie LAS\n\n(Modifié le:08/12/2025 12:34)",
      "status": "",
      "url": "",
      "lastModified": "2025-12-08T12:34:00+01:00"
    },
    {
      "id": "ADE60322e706c616e6e696e67554c5f323032355f323032362d36393632332d312d30",
      "title": "CC 717 Analyse du Cycle de Vie / Méthodologie Sites et Sols Pollués",
      "start": "2026-01-14T10:45:00+01:00",
      "end": "2026-01-14T11:30:00+01:00",
      "allDay": false,
      "location": "Bridoux_TD 4",
      "description": "\n\nTP GRP 3\nMASFARAUD Jean-François\n\n(Modifié le:09/12/2025 17:50)",
      "status": "",
      "url": "",
      "lastModified": "2025-12-09T17:50:00+01:00"
    },
    {
      "id": "ADE60322e706c616e6e696e67554c5f323032355f323032362d39353538332d332d30",
      "title": "6.02 EI Droit des sociétés",
      "start": "2026-01-14T13:00:00+01:00",
      "end": "2026-01-14T17:00:00+01:00",
      "allDay": false,
      "location": "Bridoux_TP Start up 2 D16",
      "description": "\n\nLP GDOSSL FI/FC\nLic Pro GDOSSL FA\nROTH David\n\n(Modifié le:13/10/2025 11:02)",
      "status": "",
      "url": "",
      "lastModified": "2025-10-13T11:02:00+02:00"
    },
    {
      "id": "ADE60322e706c616e6e696e67554c5f323032355f323032362d3133313238322d332d30",
      "title": "CM EC Droit du travail et Fiscalité",
      "start": "2026-01-14T13:00:00+01:00",
      "end": "2026-01-14T15:00:00+01:00",
      "allDay": false,
      "location": "Bridoux_TD 8",
      "description": "\n\nCM EC Droit du travail et Fiscalité\nCM EC Droit du travail et Fiscalité\nCM EC Droit du travail et Fiscalité\nUE ALT 02\nCM EC Droit du travail et Fiscalité\nCM EC Droit du travail et Fiscalité\nCM EC Droit du travail et Fiscalité\nUE ALT 02\nNICOLAS Helene\n\n(Modifié le:20/10/2025 12:57)",
      "status": "",
      "url": "",
      "lastModified": "2025-10-20T12:57:00+02:00"
    },
    {
      "id": "ADE60322e706c616e6e696e67554c5f323032355f323032362d38323335392d302d30",
      "title": "UE 804 TP EC1 Outils pour l'évaluation",
      "start": "2026-01-14T13:00:00+01:00",
      "end": "2026-01-14T16:00:00+01:00",
      "allDay": false,
      "location": "Bridoux_TD 18",
      "description": "\n\nDUBOIS Amandine\nPromo complète M1 FA\nPromo complète M1 FI/FC\n\n(Modifié le:08/12/2025 12:16)",
      "status": "",
      "url": "",
      "lastModified": "2025-12-08T12:16:00+01:00"
    },
    {
      "id": "ADE60322e706c616e6e696e67554c5f323032355f323032362d3136373932322d302d30",
      "title": "TD ME851 Concevoir une transposition didactique en LC- 2",
      "start": "2026-01-14T13:30:00+01:00",
      "end": "2026-01-14T16:30:00+01:00",
      "allDay": false,
      "location": "Bridoux_TD 28",
      "description": "\n\nNADLER Caroline\nM1 MEEF PC\n\n(Modifié le:06/11/2025 16:34)",
      "status": "",
      "url": "",
      "lastModified": "2025-11-06T16:34:00+01:00"
    },
    {
      "id": "ADE60322e706c616e6e696e67554c5f323032355f323032362d31313238382d322d30",
      "title": "CM Toxicologie fondamentale",
      "start": "2026-01-14T13:30:00+01:00",
      "end": "2026-01-14T15:30:00+01:00",
      "allDay": false,
      "location": "Bridoux_TD 2",
      "description": "\n\nFAUPIN Solène\nTP  A*\nTP  B*\n\n(Modifié le:05/12/2025 11:56)",
      "status": "",
      "url": "",
      "lastModified": "2025-12-05T11:56:00+01:00"
    },
    {
      "id": "ADE60322e706c616e6e696e67554c5f323032355f323032362d31313231342d302d30",
      "title": "TD CD Physiotoxicology",
      "start": "2026-01-14T13:30:00+01:00",
      "end": "2026-01-14T15:30:00+01:00",
      "allDay": false,
      "location": "Bridoux_TD 3",
      "description": "\n\nBAIN Manon\nTP  D*\nTP  C*\n\n(Modifié le:10/12/2025 16:04)",
      "status": "",
      "url": "",
      "lastModified": "2025-12-10T16:04:00+01:00"
    },
    {
      "id": "ADE60322e706c616e6e696e67554c5f323032355f323032362d31313334392d302d30",
      "title": "TD GR2 EC 801.1 Sauveteurs et Secouristes du Travail",
      "start": "2026-01-14T13:30:00+01:00",
      "end": "2026-01-14T18:30:00+01:00",
      "allDay": false,
      "location": "Bridoux_TD 17",
      "description": "\n\nCREMONI Jerome\nGroupe 2 M1 Chimie\n\n(Modifié le:15/12/2025 10:20)",
      "status": "",
      "url": "",
      "lastModified": "2025-12-15T10:20:00+01:00"
    },
    {
      "id": "ADE60322e706c616e6e696e67554c5f323032355f323032362d31313132352d322d30",
      "title": "CM Ecologie du paysage et phytosociologie",
      "start": "2026-01-14T15:45:00+01:00",
      "end": "2026-01-14T17:45:00+01:00",
      "allDay": false,
      "location": "Bridoux_TD 15",
      "description": "\n\nROBIN Vincent\nTP  C*Option Ecologie du paysage & phytosocio\nTP  D*Option Ecologie du paysage & phytosocio\n\n(Modifié le:10/12/2025 15:02)",
      "status": "",
      "url": "",
      "lastModified": "2025-12-10T15:02:00+01:00"
    },
    {
      "id": "ADE60322e706c616e6e696e67554c5f323032355f323032362d31313237372d372d30",
      "title": "CM Physiologie: régulation des fonctions",
      "start": "2026-01-14T15:45:00+01:00",
      "end": "2026-01-14T17:45:00+01:00",
      "allDay": false,
      "location": "Bridoux_TD 8",
      "description": "\n\nFELTEN Vincent\nTP  A*\nTP  B*\n\n(Modifié le:12/12/2025 09:57)",
      "status": "",
      "url": "",
      "lastModified": "2025-12-12T09:57:00+01:00"
    },
    {
      "id": "ADE60322e706c616e6e696e67554c5f323032355f323032362d3134323139342d31352d30",
      "title": "Travaux service technique",
      "start": "2026-01-15T07:00:00+01:00",
      "end": "2026-01-15T19:00:00+01:00",
      "allDay": false,
      "location": "",
      "description": "\n\n\n\n(Modifié le:11/12/2025 11:40)",
      "status": "",
      "url": "",
      "lastModified": "2025-12-11T11:40:00+01:00"
    },
    {
      "id": "ADE60322e706c616e6e696e67554c5f323032355f323032362d33373532392d31372d30",
      "title": "Manon BADURAUX",
      "start": "2026-01-15T08:00:00+01:00",
      "end": "2026-01-15T17:30:00+01:00",
      "allDay": false,
      "location": "",
      "description": "\n\n\n\n(Modifié le:04/12/2025 11:21)",
      "status": "",
      "url": "",
      "lastModified": "2025-12-04T11:21:00+01:00"
    },
    {
      "id": "ADE60322e706c616e6e696e67554c5f323032355f323032362d3138353239322d302d3239",
      "title": "Prêt salle IFSI TD 17 MU",
      "start": "2026-01-15T08:00:00+01:00",
      "end": "2026-01-15T10:00:00+01:00",
      "allDay": false,
      "location": "Bridoux_TD 17",
      "description": "\n\nTD IFSI PRET SALLE\nUBASSY Mickaël\n\n(Modifié le:13/05/2025 13:01)",
      "status": "",
      "url": "",
      "lastModified": "2025-05-13T13:01:00+02:00"
    },
    {
      "id": "ADE60322e706c616e6e696e67554c5f323032355f323032362d3137373836392d302d30",
      "title": "CC UE 106/OS Remédiation en chimie 1",
      "start": "2026-01-15T08:00:00+01:00",
      "end": "2026-01-15T09:30:00+01:00",
      "allDay": false,
      "location": "Bridoux_TD 4",
      "description": "\n\nCOURILLEAU-GOBRY Anne\nTD 4 Porail PC\n\n(Modifié le:14/10/2025 13:36)",
      "status": "",
      "url": "",
      "lastModified": "2025-10-14T13:36:00+02:00"
    },
    {
      "id": "ADE60322e706c616e6e696e67554c5f323032355f323032362d37333937362d302d3237",
      "title": "Prêt salle IFSI TD 16 SN",
      "start": "2026-01-15T08:00:00+01:00",
      "end": "2026-01-15T10:00:00+01:00",
      "allDay": false,
      "location": "Bridoux_TD 16",
      "description": "\n1688628002552\nNAVARRO Sylvain\nTD IFSI PRET SALLE\n\n(Modifié le:13/05/2025 12:38)",
      "status": "",
      "url": "",
      "lastModified": "2025-05-13T12:38:00+02:00"
    },
    {
      "id": "ADE60322e706c616e6e696e67554c5f323032355f323032362d3136383038312d322d30",
      "title": "TD ME1042 Savoirs discipl. appliqués à l'enseign. de MPC en LC2",
      "start": "2026-01-15T09:00:00+01:00",
      "end": "2026-01-15T12:00:00+01:00",
      "allDay": false,
      "location": "Bridoux_TD 28",
      "description": "\n\nGERMAIN Bertrand\nM2 M-PC\n\n(Modifié le:12/12/2025 11:28)",
      "status": "",
      "url": "",
      "lastModified": "2025-12-12T11:28:00+01:00"
    },
    {
      "id": "ADE60322e706c616e6e696e67554c5f323032355f323032362d39353630322d34392d30",
      "title": "PRJ Préparation du projet tutoré",
      "start": "2026-01-15T09:00:00+01:00",
      "end": "2026-01-15T11:00:00+01:00",
      "allDay": false,
      "location": "Bridoux_TP Start up 1 D14BIS",
      "description": "\n\nLP GDOSSL FI/FC\n\n(Modifié le:08/12/2025 14:52)",
      "status": "",
      "url": "",
      "lastModified": "2025-12-08T14:52:00+01:00"
    },
    {
      "id": "ADE60322e706c616e6e696e67554c5f323032355f323032362d39303432312d332d30",
      "title": "EI ME840 Didact. disciplinaire et mise en ?uvre des programmes",
      "start": "2026-01-15T09:00:00+01:00",
      "end": "2026-01-15T12:00:00+01:00",
      "allDay": false,
      "location": "Bridoux_TD 5",
      "description": "\n\nPrépa CAPES STAPS EDT M1\nM1 MEEF EPS - Groupe A\nM1 MEEF EPS - Groupe B\nPESCARA Sylvain\n\n(Modifié le:22/09/2025 11:04)",
      "status": "",
      "url": "",
      "lastModified": "2025-09-22T11:04:00+02:00"
    },
    {
      "id": "ADE60322e706c616e6e696e67554c5f323032355f323032362d37333937362d302d3238",
      "title": "Prêt salle IFSI TD 16 SN",
      "start": "2026-01-15T10:00:00+01:00",
      "end": "2026-01-15T12:00:00+01:00",
      "allDay": false,
      "location": "Bridoux_TD 16",
      "description": "\n1688628002751\nNAVARRO Sylvain\nTD IFSI PRET SALLE\n\n(Modifié le:13/05/2025 12:22)",
      "status": "",
      "url": "",
      "lastModified": "2025-05-13T12:22:00+02:00"
    },
    {
      "id": "ADE60322e706c616e6e696e67554c5f323032355f323032362d3137373836342d302d30",
      "title": "CC UE 105/OS Remédiation en mathématiques 1",
      "start": "2026-01-15T10:00:00+01:00",
      "end": "2026-01-15T11:30:00+01:00",
      "allDay": false,
      "location": "Bridoux_TD 4",
      "description": "\n\nDALMASSO Stéphane\nTD 4 Porail PC\nGREFFIER Olivier\n\n(Modifié le:03/12/2025 09:31)",
      "status": "",
      "url": "",
      "lastModified": "2025-12-03T09:31:00+01:00"
    },
    {
      "id": "ADE60322e706c616e6e696e67554c5f323032355f323032362d39353730362d302d30",
      "title": "UE 1002 CM EC2 EBP et séminaires en APA ",
      "start": "2026-01-15T10:00:00+01:00",
      "end": "2026-01-15T12:00:00+01:00",
      "allDay": false,
      "location": "Bridoux_TP Start up 2 D16",
      "description": "\n\nPromo complète M2 FA\nPromo complète M2 FI/FC\nBOUSMIA Johanne\n\n(Modifié le:25/09/2025 12:01)",
      "status": "",
      "url": "",
      "lastModified": "2025-09-25T12:01:00+02:00"
    },
    {
      "id": "ADE60322e706c616e6e696e67554c5f323032355f323032362d39303031352d302d30",
      "title": "Seconde chance UE 304 Chimiométrie",
      "start": "2026-01-15T10:00:00+01:00",
      "end": "2026-01-15T11:30:00+01:00",
      "allDay": false,
      "location": "Bridoux_TD 15",
      "description": "\n\nCHAIMBAULT Patrick\nL2 Chimie FC\nTD A L2 Chimie\n\n(Modifié le:16/09/2025 10:21)",
      "status": "",
      "url": "",
      "lastModified": "2025-09-16T10:21:00+02:00"
    },
    {
      "id": "ADE60322e706c616e6e696e67554c5f323032355f323032362d3138353239322d302d3330",
      "title": "Prêt salle IFSI TD 17 MU",
      "start": "2026-01-15T10:00:00+01:00",
      "end": "2026-01-15T12:00:00+01:00",
      "allDay": false,
      "location": "Bridoux_TD 17",
      "description": "\n\nTD IFSI PRET SALLE\nUBASSY Mickaël\n\n(Modifié le:13/05/2025 13:01)",
      "status": "",
      "url": "",
      "lastModified": "2025-05-13T13:01:00+02:00"
    },
    {
      "id": "ADE60322e706c616e6e696e67554c5f323032355f323032362d39353639302d312d30",
      "title": "UE 805 CM EC2 Mise en œuvre en APA des réseaux professionnels",
      "start": "2026-01-15T10:00:00+01:00",
      "end": "2026-01-15T12:00:00+01:00",
      "allDay": false,
      "location": "Bridoux_TD 2",
      "description": "\n\nPromo complète M1 FA\nPromo complète M1 FI/FC\nBOUTTET Flavien\n\n(Modifié le:04/12/2025 15:21)",
      "status": "",
      "url": "",
      "lastModified": "2025-12-04T15:21:00+01:00"
    },
    {
      "id": "ADE60322e706c616e6e696e67554c5f323032355f323032362d31343239382d302d31",
      "title": "CM 404.1 Mécanique des fluides",
      "start": "2026-01-15T10:15:00+01:00",
      "end": "2026-01-15T12:15:00+01:00",
      "allDay": false,
      "location": "Bridoux_TD 12",
      "description": "\n\nXU Hong\nL2 Physique PE\nTD L2 Physique\n\n(Modifié le:04/12/2025 11:21)",
      "status": "",
      "url": "",
      "lastModified": "2025-12-04T11:21:00+01:00"
    },
    {
      "id": "ADE60322e706c616e6e696e67554c5f323032355f323032362d36313739312d372d30",
      "title": "CM UE 817 - Caractérisation et traitement de l'air",
      "start": "2026-01-15T10:15:00+01:00",
      "end": "2026-01-15T12:15:00+01:00",
      "allDay": false,
      "location": "Bridoux_TD 8",
      "description": "\n\nCOTELLE Sylvie\nCM GE\n\n(Modifié le:11/12/2025 17:07)",
      "status": "",
      "url": "",
      "lastModified": "2025-12-11T17:07:00+01:00"
    },
    {
      "id": "ADE60322e706c616e6e696e67554c5f323032355f323032362d3136373939382d302d30",
      "title": "TD ME1042 Savoirs discipl. appliqués à l'enseign. de MPC en LC2",
      "start": "2026-01-15T13:00:00+01:00",
      "end": "2026-01-15T15:00:00+01:00",
      "allDay": false,
      "location": "Bridoux_TD 28",
      "description": "\n\nGERMAIN Bertrand\nM2 M-PC\n\n(Modifié le:12/12/2025 11:26)",
      "status": "",
      "url": "",
      "lastModified": "2025-12-12T11:26:00+01:00"
    },
    {
      "id": "ADE60322e706c616e6e696e67554c5f323032355f323032362d3139383134382d302d30",
      "title": "UE 806 TP EC1 Pratiques innovantes",
      "start": "2026-01-15T13:00:00+01:00",
      "end": "2026-01-15T17:00:00+01:00",
      "allDay": false,
      "location": "Bridoux_Salle des Actes B14",
      "description": "\n\nBOUSMIA Johanne\nPromo complète M1 FA\nPromo complète M1 FI/FC\nGymnase Bridoux P1\n\n(Modifié le:03/11/2025 15:36)",
      "status": "",
      "url": "",
      "lastModified": "2025-11-03T15:36:00+01:00"
    },
    {
      "id": "ADE60322e706c616e6e696e67554c5f323032355f323032362d39353630322d35322d30",
      "title": "PRJ Préparation du projet tutoré",
      "start": "2026-01-15T13:00:00+01:00",
      "end": "2026-01-15T15:00:00+01:00",
      "allDay": false,
      "location": "Bridoux_TD 7",
      "description": "\n\nLP GDOSSL FI/FC\n\n(Modifié le:10/12/2025 10:21)",
      "status": "",
      "url": "",
      "lastModified": "2025-12-10T10:21:00+01:00"
    },
    {
      "id": "ADE60322e706c616e6e696e67554c5f323032355f323032362d37373435372d302d30",
      "title": "UE 1002 TD EC2 EBP et séminaires en APA application et mise en pratique",
      "start": "2026-01-15T13:00:00+01:00",
      "end": "2026-01-15T17:00:00+01:00",
      "allDay": false,
      "location": "Bridoux_TP Start up 1 D14BIS",
      "description": "\nThomas Clément\nCLEMENT Thomas\nPromo complète M2 FA\nPromo complète M2 FI/FC\n\n(Modifié le:05/12/2025 10:22)",
      "status": "",
      "url": "",
      "lastModified": "2025-12-05T10:22:00+01:00"
    },
    {
      "id": "ADE60322e706c616e6e696e67554c5f323032355f323032362d34313231302d31312d30",
      "title": "Réservation de salle tiers-temps ALIMOHAMMADZADEH TAHER",
      "start": "2026-01-15T13:30:00+01:00",
      "end": "2026-01-15T16:30:00+01:00",
      "allDay": false,
      "location": "",
      "description": "\n\n\n\n(Modifié le:04/12/2025 11:23)",
      "status": "",
      "url": "",
      "lastModified": "2025-12-04T11:23:00+01:00"
    },
    {
      "id": "ADE60322e706c616e6e696e67554c5f323032355f323032362d39333531352d312d30",
      "title": "EI ME1040 Didactique disciplinaire, mise en oeuvre des program.",
      "start": "2026-01-15T13:30:00+01:00",
      "end": "2026-01-15T16:30:00+01:00",
      "allDay": false,
      "location": "Bridoux_TD 27",
      "description": "\n\nPESCARA Sylvain\nM2 MEEF EPS\n\n(Modifié le:22/09/2025 11:05)",
      "status": "",
      "url": "",
      "lastModified": "2025-09-22T11:05:00+02:00"
    },
    {
      "id": "ADE60322e706c616e6e696e67554c5f323032355f323032362d36363434312d322d30",
      "title": "TD2 UE 901 - Humanités",
      "start": "2026-01-15T13:30:00+01:00",
      "end": "2026-01-15T15:30:00+01:00",
      "allDay": false,
      "location": "Bridoux_TD 5",
      "description": "\nEnseignant 1 = Pauline OLIVIER\nHEIN Fabien\nTD GE\n\n(Modifié le:15/12/2025 10:53)",
      "status": "",
      "url": "",
      "lastModified": "2025-12-15T10:53:00+01:00"
    },
    {
      "id": "ADE60322e706c616e6e696e67554c5f323032355f323032362d3231333839352d302d31",
      "title": "TD GR1 EC 801.1 Sauveteurs et Secouristes du Travail",
      "start": "2026-01-15T13:30:00+01:00",
      "end": "2026-01-15T18:30:00+01:00",
      "allDay": false,
      "location": "Bridoux_TP Start up 2 D16",
      "description": "\n\nGroupe 1 M1 Chimie\nCREMONI Jerome\n\n(Modifié le:10/12/2025 11:23)",
      "status": "",
      "url": "",
      "lastModified": "2025-12-10T11:23:00+01:00"
    },
    {
      "id": "ADE60322e706c616e6e696e67554c5f323032355f323032362d33383633392d302d30",
      "title": "Seconde chance UE 303.2 Atomistique quantique",
      "start": "2026-01-15T13:30:00+01:00",
      "end": "2026-01-15T15:00:00+01:00",
      "allDay": false,
      "location": "Bridoux_TD 24",
      "description": "\n\nAUBRIET Frédéric\nL2 Chimie LAS\nL2 Chimie FC\nTD A L2 Chimie\nL2 Chimie PE\nCARRE Vincent\n\n(Modifié le:17/11/2025 11:11)",
      "status": "",
      "url": "",
      "lastModified": "2025-11-17T11:11:00+01:00"
    },
    {
      "id": "ADE60322e706c616e6e696e67554c5f323032355f323032362d31363539302d302d30",
      "title": "TD 401.1 Analyse 4",
      "start": "2026-01-15T13:30:00+01:00",
      "end": "2026-01-15T15:30:00+01:00",
      "allDay": false,
      "location": "Bridoux_TD 15",
      "description": "\n\nL2 Physique FC\nL2 Physique LAS\nL2 Physique PE\nTD L2 Physique\nMÜLLER Martin\n\n(Modifié le:28/11/2025 11:13)",
      "status": "",
      "url": "",
      "lastModified": "2025-11-28T11:13:00+01:00"
    },
    {
      "id": "ADE60322e706c616e6e696e67554c5f323032355f323032362d353239362d322d30",
      "title": "TD AB Génétique fondamentale",
      "start": "2026-01-15T13:30:00+01:00",
      "end": "2026-01-15T15:30:00+01:00",
      "allDay": false,
      "location": "Bridoux_TD 2",
      "description": "\n\nRODIUS François\nTP  A*\nTP  B*\n\n(Modifié le:08/12/2025 15:13)",
      "status": "",
      "url": "",
      "lastModified": "2025-12-08T15:13:00+01:00"
    },
    {
      "id": "ADE60322e706c616e6e696e67554c5f323032355f323032362d38393033362d302d30",
      "title": "TD ME830 Savoirs propres à la discipline et épistémologie",
      "start": "2026-01-15T13:30:00+01:00",
      "end": "2026-01-15T17:30:00+01:00",
      "allDay": false,
      "location": "Bridoux_TD 1",
      "description": "\n\nVINCENT Cyrille\nPrépa CAPES STAPS EDT M1\nM1 MEEF EPS - Groupe A\nM1 MEEF EPS - Groupe B\n\n(Modifié le:22/09/2025 11:04)",
      "status": "",
      "url": "",
      "lastModified": "2025-09-22T11:04:00+02:00"
    },
    {
      "id": "ADE60322e706c616e6e696e67554c5f323032355f323032362d3139393833392d312d30",
      "title": "TP3 UE 803 - SIG I",
      "start": "2026-01-15T14:00:00+01:00",
      "end": "2026-01-15T17:00:00+01:00",
      "allDay": false,
      "location": "Bridoux_TP Info2 C5",
      "description": "\n\nZELL BOUTTER Sandrine\nTP GRP 3\n\n(Modifié le:24/11/2025 11:45)",
      "status": "",
      "url": "",
      "lastModified": "2025-11-24T11:45:00+01:00"
    },
    {
      "id": "ADE60322e706c616e6e696e67554c5f323032355f323032362d31313231392d352d30",
      "title": "CM Physiotoxicology",
      "start": "2026-01-15T15:45:00+01:00",
      "end": "2026-01-15T17:45:00+01:00",
      "allDay": false,
      "location": "Bridoux_TD 18",
      "description": "\n\nMASFARAUD Jean-François\nTP  D*\nTP  C*\n\n(Modifié le:11/12/2025 10:29)",
      "status": "",
      "url": "",
      "lastModified": "2025-12-11T10:29:00+01:00"
    },
    {
      "id": "ADE60322e706c616e6e696e67554c5f323032355f323032362d36323438342d312d30",
      "title": "TD CD Génétique fondamentale",
      "start": "2026-01-15T15:45:00+01:00",
      "end": "2026-01-15T17:45:00+01:00",
      "allDay": false,
      "location": "Bridoux_TD 2",
      "description": "\n\nRODIUS François\nTP  C*\nTP  D*\n\n(Modifié le:08/12/2025 15:13)",
      "status": "",
      "url": "",
      "lastModified": "2025-12-08T15:13:00+01:00"
    },
    {
      "id": "ADE60322e706c616e6e696e67554c5f323032355f323032362d3134323139342d31352d33",
      "title": "Travaux service technique",
      "start": "2026-01-16T07:00:00+01:00",
      "end": "2026-01-16T19:00:00+01:00",
      "allDay": false,
      "location": "",
      "description": "\n\n\n\n(Modifié le:11/12/2025 11:40)",
      "status": "",
      "url": "",
      "lastModified": "2025-12-11T11:40:00+01:00"
    },
    {
      "id": "ADE60322e706c616e6e696e67554c5f323032355f323032362d32383230302d302d38",
      "title": "UE 909 TP ANGLAIS - GR. C",
      "start": "2026-01-16T08:00:00+01:00",
      "end": "2026-01-16T10:00:00+01:00",
      "allDay": false,
      "location": "Bridoux_TD 17",
      "description": "\n\nUBASSY Mickaël\nTP ANGLAIS - GR C\n\n(Modifié le:13/05/2025 15:20)",
      "status": "",
      "url": "",
      "lastModified": "2025-05-13T15:20:00+02:00"
    },
    {
      "id": "ADE60322e706c616e6e696e67554c5f323032355f323032362d3130353431382d302d30",
      "title": "Seconde chance UE 301.2 Algébre",
      "start": "2026-01-16T08:00:00+01:00",
      "end": "2026-01-16T09:30:00+01:00",
      "allDay": false,
      "location": "Bridoux_TD 4",
      "description": "\n\nL2 Physique LAS\nL2 Physique PE\nTD L2 Physique\nGRANDATI Yves\n\n(Modifié le:10/11/2025 15:42)",
      "status": "",
      "url": "",
      "lastModified": "2025-11-10T15:42:00+01:00"
    },
    {
      "id": "ADE60322e706c616e6e696e67554c5f323032355f323032362d32383139352d302d38",
      "title": "UE 909 TP ANGLAIS - GR. B",
      "start": "2026-01-16T08:00:00+01:00",
      "end": "2026-01-16T10:00:00+01:00",
      "allDay": false,
      "location": "Bridoux_TD 18",
      "description": "\n\nMATHIS-BUTIN Catherine\nTP ANGLAIS - GR B\n\n(Modifié le:13/05/2025 15:16)",
      "status": "",
      "url": "",
      "lastModified": "2025-05-13T15:16:00+02:00"
    },
    {
      "id": "ADE60322e706c616e6e696e67554c5f323032355f323032362d363638322d302d38",
      "title": "UE 909 TP ANGLAIS - GR. A",
      "start": "2026-01-16T08:00:00+01:00",
      "end": "2026-01-16T10:00:00+01:00",
      "allDay": false,
      "location": "Bridoux_TD 15",
      "description": "\n\nTP ANGLAIS - GR A\nPACE Laetitia\n\n(Modifié le:03/07/2025 10:30)",
      "status": "",
      "url": "",
      "lastModified": "2025-07-03T10:30:00+02:00"
    },
    {
      "id": "ADE60322e706c616e6e696e67554c5f323032355f323032362d3137373836352d302d30",
      "title": "CC UE 106/OS Remédiation en physique 1",
      "start": "2026-01-16T08:00:00+01:00",
      "end": "2026-01-16T09:30:00+01:00",
      "allDay": false,
      "location": "Bridoux_TD 1",
      "description": "\n\nDALMASSO Stéphane\nTD 4 Porail PC\nGREFFIER Olivier\n\n(Modifié le:14/10/2025 13:36)",
      "status": "",
      "url": "",
      "lastModified": "2025-10-14T13:36:00+02:00"
    },
    {
      "id": "ADE60322e706c616e6e696e67554c5f323032355f323032362d39353630322d35312d30",
      "title": "PRJ Préparation du projet tutoré",
      "start": "2026-01-16T09:00:00+01:00",
      "end": "2026-01-16T11:00:00+01:00",
      "allDay": false,
      "location": "Bridoux_TP Start up 1 D14BIS",
      "description": "\n\nLP GDOSSL FI/FC\n\n(Modifié le:08/12/2025 14:52)",
      "status": "",
      "url": "",
      "lastModified": "2025-12-08T14:52:00+01:00"
    },
    {
      "id": "ADE60322e706c616e6e696e67554c5f323032355f323032362d39323038342d312d30",
      "title": "TD ME863  Gérer une classe, avoir une approche réflexive",
      "start": "2026-01-16T09:00:00+01:00",
      "end": "2026-01-16T12:00:00+01:00",
      "allDay": false,
      "location": "Bridoux_TD 2",
      "description": "\n\nCREMONI Jerome\nPrépa CAPES STAPS EDT M1\nM1 MEEF EPS - Groupe A\nM1 MEEF EPS - Groupe B\n\n(Modifié le:22/09/2025 11:04)",
      "status": "",
      "url": "",
      "lastModified": "2025-09-22T11:04:00+02:00"
    },
    {
      "id": "ADE60322e706c616e6e696e67554c5f323032355f323032362d39353730342d322d30",
      "title": "UE 1002 TD EC1 EC1 Motivation et Estime de soi en APA-S",
      "start": "2026-01-16T09:00:00+01:00",
      "end": "2026-01-16T12:00:00+01:00",
      "allDay": false,
      "location": "Bridoux_TP Start up 2 D16",
      "description": "\n\nMASTAGLI Maxime\nPromo complète M2 FA\nPromo complète M2 FI/FC\n\n(Modifié le:01/12/2025 10:36)",
      "status": "",
      "url": "",
      "lastModified": "2025-12-01T10:36:00+01:00"
    },
    {
      "id": "ADE60322e706c616e6e696e67554c5f323032355f323032362d36363039392d302d30",
      "title": "Seconde chance UE 306 Chimie de notre environnement",
      "start": "2026-01-16T10:00:00+01:00",
      "end": "2026-01-16T11:30:00+01:00",
      "allDay": false,
      "location": "Bridoux_TD 14",
      "description": "\n\nL2 Chimie LAS\nL2 Chimie FC\nTD A L2 Chimie\nACHARD Christian\nCOURILLEAU-GOBRY Anne\nSCHRAMM Sébastien\n\n(Modifié le:03/12/2025 10:29)",
      "status": "",
      "url": "",
      "lastModified": "2025-12-03T10:29:00+01:00"
    },
    {
      "id": "ADE60322e706c616e6e696e67554c5f323032355f323032362d3134393930312d302d3137",
      "title": "Réservation Victor",
      "start": "2026-01-16T10:00:00+01:00",
      "end": "2026-01-16T12:00:00+01:00",
      "allDay": false,
      "location": "",
      "description": "\nSeconde chance 301.2 HG\n\n\n(Modifié le:03/10/2025 13:01)",
      "status": "",
      "url": "",
      "lastModified": "2025-10-03T13:01:00+02:00"
    },
    {
      "id": "ADE60322e706c616e6e696e67554c5f323032355f323032362d32383230302d302d39",
      "title": "UE 909 TP ANGLAIS - GR. C",
      "start": "2026-01-16T10:00:00+01:00",
      "end": "2026-01-16T12:00:00+01:00",
      "allDay": false,
      "location": "Bridoux_TD 17",
      "description": "\n\nUBASSY Mickaël\nTP ANGLAIS - GR C\n\n(Modifié le:13/05/2025 15:20)",
      "status": "",
      "url": "",
      "lastModified": "2025-05-13T15:20:00+02:00"
    },
    {
      "id": "ADE60322e706c616e6e696e67554c5f323032355f323032362d363638322d302d39",
      "title": "UE 909 TP ANGLAIS - GR. A",
      "start": "2026-01-16T10:00:00+01:00",
      "end": "2026-01-16T12:00:00+01:00",
      "allDay": false,
      "location": "Bridoux_TD 15",
      "description": "\n\nTP ANGLAIS - GR A\nPACE Laetitia\n\n(Modifié le:03/07/2025 10:30)",
      "status": "",
      "url": "",
      "lastModified": "2025-07-03T10:30:00+02:00"
    },
    {
      "id": "ADE60322e706c616e6e696e67554c5f323032355f323032362d32383139352d302d39",
      "title": "UE 909 TP ANGLAIS - GR. B",
      "start": "2026-01-16T10:00:00+01:00",
      "end": "2026-01-16T12:00:00+01:00",
      "allDay": false,
      "location": "Bridoux_TD 18",
      "description": "\n\nMATHIS-BUTIN Catherine\nTP ANGLAIS - GR B\n\n(Modifié le:13/05/2025 15:16)",
      "status": "",
      "url": "",
      "lastModified": "2025-05-13T15:16:00+02:00"
    },
    {
      "id": "ADE60322e706c616e6e696e67554c5f323032355f323032362d36313731352d362d30",
      "title": "CM UE 805 - Ressources Naturelles",
      "start": "2026-01-16T10:15:00+01:00",
      "end": "2026-01-16T12:15:00+01:00",
      "allDay": false,
      "location": "Bridoux_TD 7",
      "description": "\n\nCM ETOX\nCM GEMAREC\nARAN Delphine\n\n(Modifié le:08/12/2025 11:55)",
      "status": "",
      "url": "",
      "lastModified": "2025-12-08T11:55:00+01:00"
    },
    {
      "id": "ADE60322e706c616e6e696e67554c5f323032355f323032362d36323638382d312d30",
      "title": "TD EF Génétique fondamentale",
      "start": "2026-01-16T10:15:00+01:00",
      "end": "2026-01-16T12:15:00+01:00",
      "allDay": false,
      "location": "Bridoux_TD 1",
      "description": "\n\nRODIUS François\nTP  E*\nTP  F*\n\n(Modifié le:08/12/2025 15:14)",
      "status": "",
      "url": "",
      "lastModified": "2025-12-08T15:14:00+01:00"
    },
    {
      "id": "ADE60322e706c616e6e696e67554c5f323032355f323032362d39353638332d302d30",
      "title": "UE 804 TD EC2 Outils pour la réadaptation",
      "start": "2026-01-16T10:15:00+01:00",
      "end": "2026-01-16T12:15:00+01:00",
      "allDay": false,
      "location": "Bridoux_TP Info1 C1",
      "description": "\n\nPromo complète M1 FA\nPromo complète M1 FI/FC\nHAINAUT Jean-Philippe\n\n(Modifié le:04/12/2025 12:15)",
      "status": "",
      "url": "",
      "lastModified": "2025-12-04T12:15:00+01:00"
    },
    {
      "id": "ADE60322e706c616e6e696e67554c5f323032355f323032362d39353630322d35342d30",
      "title": "PRJ Préparation du projet tutoré",
      "start": "2026-01-16T13:00:00+01:00",
      "end": "2026-01-16T15:00:00+01:00",
      "allDay": false,
      "location": "Bridoux_TP Start up 1 D14BIS",
      "description": "\n\nLP GDOSSL FI/FC\n\n(Modifié le:08/12/2025 14:52)",
      "status": "",
      "url": "",
      "lastModified": "2025-12-08T14:52:00+01:00"
    },
    {
      "id": "ADE60322e706c616e6e696e67554c5f323032355f323032362d36323732372d322d30",
      "title": "TD GH Génétique fondamentale",
      "start": "2026-01-16T13:30:00+01:00",
      "end": "2026-01-16T15:30:00+01:00",
      "allDay": false,
      "location": "Bridoux_TD 2",
      "description": "\n\nRODIUS François\nTP  G*\nTP  H*\n\n(Modifié le:11/12/2025 12:18)",
      "status": "",
      "url": "",
      "lastModified": "2025-12-11T12:18:00+01:00"
    },
    {
      "id": "ADE60322e706c616e6e696e67554c5f323032355f323032362d36353235332d302d38",
      "title": "TPL EC Langues - ANGLAIS LV1 GRP B",
      "start": "2026-01-16T13:30:00+01:00",
      "end": "2026-01-16T15:30:00+01:00",
      "allDay": false,
      "location": "Bridoux_TD 17",
      "description": "\n\nUBASSY Mickaël\n LV1 ANGLAIS GRP B\n\n(Modifié le:16/09/2025 13:05)",
      "status": "",
      "url": "",
      "lastModified": "2025-09-16T13:05:00+02:00"
    },
    {
      "id": "ADE60322e706c616e6e696e67554c5f323032355f323032362d31323431302d372d30",
      "title": "TP EC 705.2 Communication professionnelle en Anglais",
      "start": "2026-01-16T13:30:00+01:00",
      "end": "2026-01-16T15:30:00+01:00",
      "allDay": false,
      "location": "Bridoux_Langue 1",
      "description": "\n\nM1 PAIP TPL ANGLAIS\nHOFFART Christine\n\n(Modifié le:27/06/2025 13:22)",
      "status": "",
      "url": "",
      "lastModified": "2025-06-27T13:22:00+02:00"
    },
    {
      "id": "ADE60322e706c616e6e696e67554c5f323032355f323032362d31313334392d302d32",
      "title": "TD GR2 EC 801.1 Sauveteurs et Secouristes du Travail",
      "start": "2026-01-16T13:30:00+01:00",
      "end": "2026-01-16T18:30:00+01:00",
      "allDay": false,
      "location": "Bridoux_TP Start up 2 D16",
      "description": "\n\nGroupe 2 M1 Chimie\nCREMONI Jerome\n\n(Modifié le:10/12/2025 11:23)",
      "status": "",
      "url": "",
      "lastModified": "2025-12-10T11:23:00+01:00"
    },
    {
      "id": "ADE60322e706c616e6e696e67554c5f323032355f323032362d36313838392d302d38",
      "title": "TPL EC Langues - ANGLAIS LV1 GRP A",
      "start": "2026-01-16T13:30:00+01:00",
      "end": "2026-01-16T15:30:00+01:00",
      "allDay": false,
      "location": "Bridoux_TD 18",
      "description": "\n\nMATHIS-BUTIN Catherine\nLV1 ANGLAIS GRP A\n\n(Modifié le:15/09/2025 16:50)",
      "status": "",
      "url": "",
      "lastModified": "2025-09-15T16:50:00+02:00"
    },
    {
      "id": "ADE60322e706c616e6e696e67554c5f323032355f323032362d36333733392d302d30",
      "title": "EI IJ Algorithmique",
      "start": "2026-01-16T13:30:00+01:00",
      "end": "2026-01-16T15:30:00+01:00",
      "allDay": false,
      "location": "Bridoux_TD 12",
      "description": "\n\nTP I*\nTP J*\nCAMARA Baba Issa\n\n(Modifié le:03/12/2025 16:43)",
      "status": "",
      "url": "",
      "lastModified": "2025-12-03T16:43:00+01:00"
    },
    {
      "id": "ADE60322e706c616e6e696e67554c5f323032355f323032362d39353736302d31312d30",
      "title": "TPL EC Anglais",
      "start": "2026-01-16T13:30:00+01:00",
      "end": "2026-01-16T15:30:00+01:00",
      "allDay": false,
      "location": "Bridoux_TD 16",
      "description": "\n\nPromo complète M2 FI/FC\nPromo complète M2 FA\nNAVARRO Sylvain\n\n(Modifié le:25/09/2025 12:01)",
      "status": "",
      "url": "",
      "lastModified": "2025-09-25T12:01:00+02:00"
    },
    {
      "id": "ADE60322e706c616e6e696e67554c5f323032355f323032362d3132353934372d312d30",
      "title": "UE 801 EC1 CM Socio-histoire du handicap",
      "start": "2026-01-16T13:30:00+01:00",
      "end": "2026-01-16T15:30:00+01:00",
      "allDay": false,
      "location": "Bridoux_TP Damasio D3,En direct à distance",
      "description": "\n\nLE BRAS Anatole\nPromo complète M1 FA\nPromo complète M1 FI/FC\n\n(Modifié le:10/12/2025 10:22)",
      "status": "",
      "url": "",
      "lastModified": "2025-12-10T10:22:00+01:00"
    },
    {
      "id": "ADE60322e706c616e6e696e67554c5f323032355f323032362d31313136362d312d30",
      "title": "CM  Physicochimie et biomarqueurs",
      "start": "2026-01-16T15:15:00+01:00",
      "end": "2026-01-16T17:15:00+01:00",
      "allDay": false,
      "location": "Bridoux_TD 1",
      "description": "\n\nMASFARAUD Jean-François\nTP  D*\nTP  C*\n\n(Modifié le:11/12/2025 10:38)",
      "status": "",
      "url": "",
      "lastModified": "2025-12-11T10:38:00+01:00"
    },
    {
      "id": "ADE60322e706c616e6e696e67554c5f323032355f323032362d36353235332d302d39",
      "title": "TPL EC Langues - ANGLAIS LV1 GRP B",
      "start": "2026-01-16T15:30:00+01:00",
      "end": "2026-01-16T17:30:00+01:00",
      "allDay": false,
      "location": "Bridoux_TD 17",
      "description": "\n\nUBASSY Mickaël\n LV1 ANGLAIS GRP B\n\n(Modifié le:16/09/2025 13:05)",
      "status": "",
      "url": "",
      "lastModified": "2025-09-16T13:05:00+02:00"
    },
    {
      "id": "ADE60322e706c616e6e696e67554c5f323032355f323032362d39353639382d302d30",
      "title": "UE 806 TD EC1 Pratiques innovantes",
      "start": "2026-01-16T15:30:00+01:00",
      "end": "2026-01-16T18:00:00+01:00",
      "allDay": false,
      "location": "Bridoux_TP Damasio D3",
      "description": "\n\nBOUSMIA Johanne\nPromo complète M1 FA\nPromo complète M1 FI/FC\n\n(Modifié le:10/12/2025 10:22)",
      "status": "",
      "url": "",
      "lastModified": "2025-12-10T10:22:00+01:00"
    },
    {
      "id": "ADE60322e706c616e6e696e67554c5f323032355f323032362d31323431302d392d30",
      "title": "TP EC 705.2 Communication professionnelle en Anglais",
      "start": "2026-01-16T15:30:00+01:00",
      "end": "2026-01-16T17:30:00+01:00",
      "allDay": false,
      "location": "Bridoux_Langue 1",
      "description": "\n\nM1 PAIP TPL ANGLAIS\nHOFFART Christine\n\n(Modifié le:27/06/2025 13:22)",
      "status": "",
      "url": "",
      "lastModified": "2025-06-27T13:22:00+02:00"
    },
    {
      "id": "ADE60322e706c616e6e696e67554c5f323032355f323032362d36313838392d302d39",
      "title": "TPL EC Langues - ANGLAIS LV1 GRP A",
      "start": "2026-01-16T15:30:00+01:00",
      "end": "2026-01-16T17:30:00+01:00",
      "allDay": false,
      "location": "Bridoux_TD 18",
      "description": "\n\nMATHIS-BUTIN Catherine\nLV1 ANGLAIS GRP A\n\n(Modifié le:15/09/2025 16:50)",
      "status": "",
      "url": "",
      "lastModified": "2025-09-15T16:50:00+02:00"
    },
    {
      "id": "ADE60322e706c616e6e696e67554c5f323032355f323032362d36323832372d322d30",
      "title": "TD IJ Génétique fondamentale",
      "start": "2026-01-16T15:45:00+01:00",
      "end": "2026-01-16T17:45:00+01:00",
      "allDay": false,
      "location": "Bridoux_TD 2",
      "description": "\n\nRODIUS François\nTP I*\nTP J*\n\n(Modifié le:08/12/2025 15:14)",
      "status": "",
      "url": "",
      "lastModified": "2025-12-08T15:14:00+01:00"
    },
    {
      "id": "ADE60322e706c616e6e696e67554c5f323032355f323032362d3134323139342d31352d32",
      "title": "Travaux service technique",
      "start": "2026-01-19T07:00:00+01:00",
      "end": "2026-01-19T19:00:00+01:00",
      "allDay": false,
      "location": "",
      "description": "\n\n\n\n(Modifié le:11/12/2025 11:41)",
      "status": "",
      "url": "",
      "lastModified": "2025-12-11T11:41:00+01:00"
    },
    {
      "id": "ADE60322e706c616e6e696e67554c5f323032355f323032362d39353539352d312d30",
      "title": "6.05 EI Gestion Ressources Humaines & Tech. Recherche Emploi",
      "start": "2026-01-19T08:00:00+01:00",
      "end": "2026-01-19T10:00:00+01:00",
      "allDay": false,
      "location": "Bridoux_TP Start up 1 D14BIS",
      "description": "\n\nLP GDOSSL FI/FC\nPETIT Édith\n\n(Modifié le:27/11/2025 11:00)",
      "status": "",
      "url": "",
      "lastModified": "2025-11-27T11:00:00+01:00"
    },
    {
      "id": "ADE60322e706c616e6e696e67554c5f323032355f323032362d31313536342d302d30",
      "title": "CM 403.2 Optique physique",
      "start": "2026-01-19T08:00:00+01:00",
      "end": "2026-01-19T10:00:00+01:00",
      "allDay": false,
      "location": "Bridoux_TD 1",
      "description": "\n\nL2 Physique FC\nL2 Physique LAS\nL2 PC\nL2 PC LAS\nL2 Physique PE\nL2 PC PE\nTD L2 Physique\nJOHANN Luc\n\n(Modifié le:28/11/2025 11:49)",
      "status": "",
      "url": "",
      "lastModified": "2025-11-28T11:49:00+01:00"
    },
    {
      "id": "ADE60322e706c616e6e696e67554c5f323032355f323032362d31303738342d302d30",
      "title": "TD Analyse de la conception des projets éducatifs",
      "start": "2026-01-19T08:00:00+01:00",
      "end": "2026-01-19T12:00:00+01:00",
      "allDay": false,
      "location": "Bridoux_TD 3",
      "description": "\n\nTD EM LAS\nTD EM\nGANDAR Benjamin\n\n(Modifié le:27/11/2025 10:51)",
      "status": "",
      "url": "",
      "lastModified": "2025-11-27T10:51:00+01:00"
    },
    {
      "id": "ADE60322e706c616e6e696e67554c5f323032355f323032362d31313239302d312d30",
      "title": "CM Toxicologie systémique et appliquée",
      "start": "2026-01-19T08:00:00+01:00",
      "end": "2026-01-19T10:00:00+01:00",
      "allDay": false,
      "location": "Bridoux_TD 17",
      "description": "\n\nFAUPIN Solène\nTP  A*\nTP  B*\n\n(Modifié le:05/12/2025 11:59)",
      "status": "",
      "url": "",
      "lastModified": "2025-12-05T11:59:00+01:00"
    },
    {
      "id": "ADE60322e706c616e6e696e67554c5f323032355f323032362d3233303139332d362d30",
      "title": "EI ME830 Mobiliser les savoirs propres à la discipline des LC-2",
      "start": "2026-01-19T08:00:00+01:00",
      "end": "2026-01-19T10:00:00+01:00",
      "allDay": false,
      "location": "Bridoux_TD 24",
      "description": "\n\nM1 MEEF PC\nM1 MEEF M-PC\nCODA-BOUCHOT Virginie\n\n(Modifié le:06/11/2025 18:00)",
      "status": "",
      "url": "",
      "lastModified": "2025-11-06T18:00:00+01:00"
    },
    {
      "id": "ADE60322e706c616e6e696e67554c5f323032355f323032362d3230373735352d302d30",
      "title": "UE 804 TP1 EC2 Outils pour la réadaptation",
      "start": "2026-01-19T08:00:00+01:00",
      "end": "2026-01-19T10:00:00+01:00",
      "allDay": false,
      "location": "Bridoux_TP Info1 C1",
      "description": "\n\nHAINAUT Jean-Philippe\nM1 APAS - Groupe TP 1 \n\n(Modifié le:04/12/2025 15:52)",
      "status": "",
      "url": "",
      "lastModified": "2025-12-04T15:52:00+01:00"
    },
    {
      "id": "ADE60322e706c616e6e696e67554c5f323032355f323032362d3139353136312d312d30",
      "title": "TP grp 2 UE 922 - Formation SST",
      "start": "2026-01-19T08:30:00+01:00",
      "end": "2026-01-19T12:30:00+01:00",
      "allDay": false,
      "location": "Bridoux_TP Start up 2 D16",
      "description": "\n\nHOFFMANN Mireille\nTP GE\n\n(Modifié le:20/10/2025 12:56)",
      "status": "",
      "url": "",
      "lastModified": "2025-10-20T12:56:00+02:00"
    },
    {
      "id": "ADE60322e706c616e6e696e67554c5f323032355f323032362d32323736332d31322d30",
      "title": "EI UE 505 Enjeux sanitaires et environne. de l'agroécologie",
      "start": "2026-01-19T09:00:00+01:00",
      "end": "2026-01-19T12:00:00+01:00",
      "allDay": false,
      "location": "Bridoux_TD 2",
      "description": "\n\nLPRO Agro ADNT\nPAGNOUT Christophe\n\n(Modifié le:06/11/2025 14:56)",
      "status": "",
      "url": "",
      "lastModified": "2025-11-06T14:56:00+01:00"
    },
    {
      "id": "ADE60322e706c616e6e696e67554c5f323032355f323032362d3139393833372d322d30",
      "title": "TP1 UE 803 - SIG I",
      "start": "2026-01-19T09:00:00+01:00",
      "end": "2026-01-19T12:00:00+01:00",
      "allDay": false,
      "location": "Bridoux_TP Info2 C5",
      "description": "\n\nZELL BOUTTER Sandrine\nTP GRP 1\n\n(Modifié le:24/11/2025 11:36)",
      "status": "",
      "url": "",
      "lastModified": "2025-11-24T11:36:00+01:00"
    },
    {
      "id": "ADE60322e706c616e6e696e67554c5f323032355f323032362d393737392d322d30",
      "title": "TD Pratiques spécifiques en APAS 2",
      "start": "2026-01-19T09:30:00+01:00",
      "end": "2026-01-19T11:30:00+01:00",
      "allDay": false,
      "location": "Bridoux_TP Damasio D3",
      "description": "\n\nTD APAS\nTD APAS LAS\nBUATOIS Severine\n\n(Modifié le:27/11/2025 10:51)",
      "status": "",
      "url": "",
      "lastModified": "2025-11-27T10:51:00+01:00"
    },
    {
      "id": "ADE60322e706c616e6e696e67554c5f323032355f323032362d39353635332d302d33",
      "title": "UE 801 EC2 CM Anthropologie de la maladie et handicap",
      "start": "2026-01-19T10:00:00+01:00",
      "end": "2026-01-19T12:00:00+01:00",
      "allDay": false,
      "location": "Bridoux_TP Start up 1 D14BIS",
      "description": "\n\nPromo complète M1 FA\nPromo complète M1 FI/FC\nARBORIO Sophie\n\n(Modifié le:03/11/2025 15:36)",
      "status": "",
      "url": "",
      "lastModified": "2025-11-03T15:36:00+01:00"
    },
    {
      "id": "ADE60322e706c616e6e696e67554c5f323032355f323032362d38393033362d322d30",
      "title": "TD ME830 Savoirs propres à la discipline et épistémologie",
      "start": "2026-01-19T10:00:00+01:00",
      "end": "2026-01-19T12:00:00+01:00",
      "allDay": false,
      "location": "Bridoux_TD 1",
      "description": "\n\nMONIER Brice\nPrépa CAPES STAPS EDT M1\nM1 MEEF EPS - Groupe A\nM1 MEEF EPS - Groupe B\n\n(Modifié le:22/09/2025 11:04)",
      "status": "",
      "url": "",
      "lastModified": "2025-09-22T11:04:00+02:00"
    },
    {
      "id": "ADE60322e706c616e6e696e67554c5f323032355f323032362d3136373931362d312d30",
      "title": "EI ME830 Mobiliser les savoirs propres à la discipline des LC-2",
      "start": "2026-01-19T10:15:00+01:00",
      "end": "2026-01-19T12:15:00+01:00",
      "allDay": false,
      "location": "Bridoux_TD 28",
      "description": "\n\nM1 MEEF PC\nHESSE Stéphanie\n\n(Modifié le:07/11/2025 16:42)",
      "status": "",
      "url": "",
      "lastModified": "2025-11-07T16:42:00+01:00"
    },
    {
      "id": "ADE60322e706c616e6e696e67554c5f323032355f323032362d39353537302d302d32",
      "title": "TPL Anglais",
      "start": "2026-01-19T10:15:00+01:00",
      "end": "2026-01-19T12:15:00+01:00",
      "allDay": false,
      "location": "Bridoux_TD 18",
      "description": "\n\nMATHIS-BUTIN Catherine\nLP GDOSSL FI/FC\n\n(Modifié le:13/10/2025 11:02)",
      "status": "",
      "url": "",
      "lastModified": "2025-10-13T11:02:00+02:00"
    },
    {
      "id": "ADE60322e706c616e6e696e67554c5f323032355f323032362d31303938382d372d30",
      "title": "CM EC 401.1 Thermodynamique de la réaction chimique",
      "start": "2026-01-19T10:15:00+01:00",
      "end": "2026-01-19T12:15:00+01:00",
      "allDay": false,
      "location": "Bridoux_TD 7",
      "description": "\n\nACHARD Christian\nL2 Chimie FC\nL2 Chimie LAS\nL2 PC\nL2 PC LAS\nL2 Chimie PE\nL2 PC PE\nTD A L2 Chimie\n\n(Modifié le:28/11/2025 11:15)",
      "status": "",
      "url": "",
      "lastModified": "2025-11-28T11:15:00+01:00"
    },
    {
      "id": "ADE60322e706c616e6e696e67554c5f323032355f323032362d3130343839352d332d30",
      "title": "CM 401.2 Algèbre 4",
      "start": "2026-01-19T10:15:00+01:00",
      "end": "2026-01-19T12:15:00+01:00",
      "allDay": false,
      "location": "Bridoux_TD 9",
      "description": "\n\nGRANDATI Yves\nL2 Physique FC\nL2 Physique LAS\nL2 Physique PE\nTD L2 Physique\n\n(Modifié le:10/12/2025 15:34)",
      "status": "",
      "url": "",
      "lastModified": "2025-12-10T15:34:00+01:00"
    },
    {
      "id": "ADE60322e706c616e6e696e67554c5f323032355f323032362d32393931352d312d30",
      "title": "TP GR.1 Pratiques spécifiques en APAS 2",
      "start": "2026-01-19T12:30:00+01:00",
      "end": "2026-01-19T14:30:00+01:00",
      "allDay": false,
      "location": "Bridoux_TP Damasio D3",
      "description": "\n\nTP APAS GR.1\nTP APAS GR.1 LAS\nBUATOIS Severine\n\n(Modifié le:19/11/2025 11:40)",
      "status": "",
      "url": "",
      "lastModified": "2025-11-19T11:40:00+01:00"
    },
    {
      "id": "ADE60322e706c616e6e696e67554c5f323032355f323032362d39353538322d332d30",
      "title": "6.02 EI Droit du travail",
      "start": "2026-01-19T13:00:00+01:00",
      "end": "2026-01-19T17:00:00+01:00",
      "allDay": false,
      "location": "Bridoux_TP Start up 1 D14BIS",
      "description": "\n\nROTH David\nLP GDOSSL FI/FC\nLic Pro GDOSSL FA\n\n(Modifié le:13/10/2025 11:02)",
      "status": "",
      "url": "",
      "lastModified": "2025-10-13T11:02:00+02:00"
    },
    {
      "id": "ADE60322e706c616e6e696e67554c5f323032355f323032362d38343737382d322d30",
      "title": "EI 1 Management, encadrement et communication",
      "start": "2026-01-19T13:00:00+01:00",
      "end": "2026-01-19T15:30:00+01:00",
      "allDay": false,
      "location": "Bridoux_TD 8",
      "description": "\n\nLPRO Agro AAU\nEBOLI Jeremie\n\n(Modifié le:15/12/2025 10:21)",
      "status": "",
      "url": "",
      "lastModified": "2025-12-15T10:21:00+01:00"
    },
    {
      "id": "ADE60322e706c616e6e696e67554c5f323032355f323032362d31313238302d322d30",
      "title": "CM Ecophysiologie microbienne",
      "start": "2026-01-19T13:30:00+01:00",
      "end": "2026-01-19T15:30:00+01:00",
      "allDay": false,
      "location": "Bridoux_TD 6",
      "description": "\n\nPAGNOUT Christophe\nTP  A*\nTP  B*\n\n(Modifié le:05/12/2025 14:30)",
      "status": "",
      "url": "",
      "lastModified": "2025-12-05T14:30:00+01:00"
    },
    {
      "id": "ADE60322e706c616e6e696e67554c5f323032355f323032362d3139343837382d312d30",
      "title": "TP grp1  UE 922 - Formation SST",
      "start": "2026-01-19T13:30:00+01:00",
      "end": "2026-01-19T17:30:00+01:00",
      "allDay": false,
      "location": "Bridoux_TP Start up 2 D16",
      "description": "\n\nTP GE\nHOFFMANN Mireille\n\n(Modifié le:20/10/2025 12:56)",
      "status": "",
      "url": "",
      "lastModified": "2025-10-20T12:56:00+02:00"
    },
    {
      "id": "ADE60322e706c616e6e696e67554c5f323032355f323032362d39323534332d312d30",
      "title": "EI F 206.1 Chimie Organique pour la Biologie",
      "start": "2026-01-19T13:30:00+01:00",
      "end": "2026-01-19T15:30:00+01:00",
      "allDay": false,
      "location": "Bridoux_TD 14",
      "description": "\n\nTP  F*\nBUHAIBEH Ruqaya\n\n(Modifié le:01/12/2025 13:18)",
      "status": "",
      "url": "",
      "lastModified": "2025-12-01T13:18:00+01:00"
    },
    {
      "id": "ADE60322e706c616e6e696e67554c5f323032355f323032362d3132353834342d302d30",
      "title": "TP A EC NUMOC 2 - PC",
      "start": "2026-01-19T13:30:00+01:00",
      "end": "2026-01-19T16:30:00+01:00",
      "allDay": false,
      "location": "Bridoux_TP Info4 C11",
      "description": "\n\nTP A Portail PC\nCAPPELAERE Emmanuel\n\n(Modifié le:12/12/2025 13:12)",
      "status": "",
      "url": "",
      "lastModified": "2025-12-12T13:12:00+01:00"
    },
    {
      "id": "ADE60322e706c616e6e696e67554c5f323032355f323032362d31303434372d302d30",
      "title": "TPL EC 1 Anglais 4 D1",
      "start": "2026-01-19T13:30:00+01:00",
      "end": "2026-01-19T15:30:00+01:00",
      "allDay": false,
      "location": "Bridoux_TD 17",
      "description": "\n\nUBASSY Mickaël\nGR 1 - Anglais GRP D1\n\n(Modifié le:02/09/2025 09:58)",
      "status": "",
      "url": "",
      "lastModified": "2025-09-02T09:58:00+02:00"
    },
    {
      "id": "ADE60322e706c616e6e696e67554c5f323032355f323032362d3139323639342d302d30",
      "title": "TPL EC 1 Anglais 4 E1",
      "start": "2026-01-19T13:30:00+01:00",
      "end": "2026-01-19T15:30:00+01:00",
      "allDay": false,
      "location": "Bridoux_TD 15",
      "description": "\n\nLIU Haoran\nGR 1 - Anglais GRP E1\n\n(Modifié le:02/09/2025 10:04)",
      "status": "",
      "url": "",
      "lastModified": "2025-09-02T10:04:00+02:00"
    },
    {
      "id": "ADE60322e706c616e6e696e67554c5f323032355f323032362d3233303139332d31322d30",
      "title": "EI ME830 Mobiliser les savoirs propres à la discipline des LC-2",
      "start": "2026-01-19T13:30:00+01:00",
      "end": "2026-01-19T15:30:00+01:00",
      "allDay": false,
      "location": "Bridoux_TD 24",
      "description": "\n\nM1 MEEF PC\nM1 MEEF M-PC\nBECU Lydiane\n\n(Modifié le:03/12/2025 09:47)",
      "status": "",
      "url": "",
      "lastModified": "2025-12-03T09:47:00+01:00"
    },
    {
      "id": "ADE60322e706c616e6e696e67554c5f323032355f323032362d363031372d302d30",
      "title": "TP A NUMOC",
      "start": "2026-01-19T13:30:00+01:00",
      "end": "2026-01-19T15:30:00+01:00",
      "allDay": false,
      "location": "Bridoux_TP Info1 C1",
      "description": "\n\nTP  A*\nGALLIZZI Adrienne\n\n(Modifié le:01/12/2025 11:33)",
      "status": "",
      "url": "",
      "lastModified": "2025-12-01T11:33:00+01:00"
    },
    {
      "id": "ADE60322e706c616e6e696e67554c5f323032355f323032362d32323736332d31352d30",
      "title": "EI UE 505 Enjeux sanitaires et environne. de l'agroécologie",
      "start": "2026-01-19T13:30:00+01:00",
      "end": "2026-01-19T15:30:00+01:00",
      "allDay": false,
      "location": "Bridoux_TD 2",
      "description": "\n\nLPRO Agro ADNT\nCOTELLE Sylvie\n\n(Modifié le:05/11/2025 09:36)",
      "status": "",
      "url": "",
      "lastModified": "2025-11-05T09:36:00+01:00"
    },
    {
      "id": "ADE60322e706c616e6e696e67554c5f323032355f323032362d39323535302d312d30",
      "title": "EI GH 206.1 Chimie Organique pour la Biologie",
      "start": "2026-01-19T13:30:00+01:00",
      "end": "2026-01-19T15:30:00+01:00",
      "allDay": false,
      "location": "Bridoux_TD 12",
      "description": "\n\nHESSE Stéphanie\nTP  H*\nTP  G*\n\n(Modifié le:11/12/2025 12:18)",
      "status": "",
      "url": "",
      "lastModified": "2025-12-11T12:18:00+01:00"
    },
    {
      "id": "ADE60322e706c616e6e696e67554c5f323032355f323032362d39353637342d302d30",
      "title": "UE 803 CM EC2 Douleur et APAS",
      "start": "2026-01-19T13:30:00+01:00",
      "end": "2026-01-19T16:00:00+01:00",
      "allDay": false,
      "location": "Bridoux_TD 4",
      "description": "\n\nBRIER Laurence\nPromo complète M1 FA\nPromo complète M1 FI/FC\n\n(Modifié le:03/11/2025 15:36)",
      "status": "",
      "url": "",
      "lastModified": "2025-11-03T15:36:00+01:00"
    },
    {
      "id": "ADE60322e706c616e6e696e67554c5f323032355f323032362d3133303933362d332d30",
      "title": "Seconde chance Anglais ",
      "start": "2026-01-19T13:30:00+01:00",
      "end": "2026-01-19T15:30:00+01:00",
      "allDay": false,
      "location": "Bridoux_Salle des Actes B14",
      "description": "\n\nPrêt salles et amphi\n\n(Modifié le:25/11/2025 11:05)",
      "status": "",
      "url": "",
      "lastModified": "2025-11-25T11:05:00+01:00"
    },
    {
      "id": "ADE60322e706c616e6e696e67554c5f323032355f323032362d3139323638362d302d30",
      "title": "TD 407.1 Anglais B1",
      "start": "2026-01-19T13:30:00+01:00",
      "end": "2026-01-19T15:30:00+01:00",
      "allDay": false,
      "location": "Bridoux_TD 16",
      "description": "\n\nNAVARRO Sylvain\nL2 Physique-Chimie - Anglais GRP B1\n\n(Modifié le:02/09/2025 09:41)",
      "status": "",
      "url": "",
      "lastModified": "2025-09-02T09:41:00+02:00"
    },
    {
      "id": "ADE60322e706c616e6e696e67554c5f323032355f323032362d3139323638372d302d39",
      "title": "TD 407.1 Anglais C1",
      "start": "2026-01-19T13:30:00+01:00",
      "end": "2026-01-19T15:30:00+01:00",
      "allDay": false,
      "location": "Bridoux_TD 18",
      "description": "\n\nMATHIS-BUTIN Catherine\nL2 Physique-Chimie - Anglais GRP C1\n\n(Modifié le:02/09/2025 09:57)",
      "status": "",
      "url": "",
      "lastModified": "2025-09-02T09:57:00+02:00"
    },
    {
      "id": "ADE60322e706c616e6e696e67554c5f323032355f323032362d3233313235372d302d30",
      "title": "TD ME1042 Savoirs discipl. appliqués à l'enseign. de MPC en LC2",
      "start": "2026-01-19T13:30:00+01:00",
      "end": "2026-01-19T16:30:00+01:00",
      "allDay": false,
      "location": "Bridoux_TD 28",
      "description": "\n\nM2 M-PC\nCOURILLEAU-GOBRY Anne\n\n(Modifié le:07/11/2025 17:05)",
      "status": "",
      "url": "",
      "lastModified": "2025-11-07T17:05:00+01:00"
    },
    {
      "id": "ADE60322e706c616e6e696e67554c5f323032355f323032362d36313733342d362d30",
      "title": "CM UE 811-Effets des polluants à diff. niveaux d'organisation I",
      "start": "2026-01-19T13:30:00+01:00",
      "end": "2026-01-19T15:30:00+01:00",
      "allDay": false,
      "location": "Bridoux_TD 3",
      "description": "\n\nCM ETOX\nGROSS Élisabeth Maria\n\n(Modifié le:18/11/2025 18:03)",
      "status": "",
      "url": "",
      "lastModified": "2025-11-18T18:03:00+01:00"
    },
    {
      "id": "ADE60322e706c616e6e696e67554c5f323032355f323032362d3133323131322d302d39",
      "title": "EI 2 206.1 Circuits électriques cours",
      "start": "2026-01-19T13:30:00+01:00",
      "end": "2026-01-19T15:30:00+01:00",
      "allDay": false,
      "location": "Bridoux_TD 27",
      "description": "\n\nTP C Portail PC\nTP D Portail PC\nMOHRBACH Hervé\n\n(Modifié le:12/12/2025 15:43)",
      "status": "",
      "url": "",
      "lastModified": "2025-12-12T15:43:00+01:00"
    },
    {
      "id": "ADE60322e706c616e6e696e67554c5f323032355f323032362d39333132362d342d30",
      "title": "EI ME1030 Savoirs propres à la discipline et épistémologie",
      "start": "2026-01-19T13:30:00+01:00",
      "end": "2026-01-19T16:30:00+01:00",
      "allDay": false,
      "location": "Bridoux_TD 1",
      "description": "\n\nM2 MEEF EPS\nMONIER Brice\n\n(Modifié le:22/09/2025 11:05)",
      "status": "",
      "url": "",
      "lastModified": "2025-09-22T11:05:00+02:00"
    },
    {
      "id": "ADE60322e706c616e6e696e67554c5f323032355f323032362d36323832372d332d30",
      "title": "TD IJ Génétique fondamentale",
      "start": "2026-01-19T13:30:00+01:00",
      "end": "2026-01-19T15:30:00+01:00",
      "allDay": false,
      "location": "Bridoux_TD 9",
      "description": "\n\nRODIUS François\nTP I*\nTP J*\n\n(Modifié le:08/12/2025 15:17)",
      "status": "",
      "url": "",
      "lastModified": "2025-12-08T15:17:00+01:00"
    },
    {
      "id": "ADE60322e706c616e6e696e67554c5f323032355f323032362d31313231392d322d30",
      "title": "CM Physiotoxicology",
      "start": "2026-01-19T13:30:00+01:00",
      "end": "2026-01-19T15:30:00+01:00",
      "allDay": false,
      "location": "Bridoux_TD 7",
      "description": "\n\nTP  D*\nTP  C*\nFAUPIN Solène\n\n(Modifié le:10/12/2025 16:04)",
      "status": "",
      "url": "",
      "lastModified": "2025-12-10T16:04:00+01:00"
    },
    {
      "id": "ADE60322e706c616e6e696e67554c5f323032355f323032362d31303938362d302d30",
      "title": "TD 407.1 Anglais A1",
      "start": "2026-01-19T13:30:00+01:00",
      "end": "2026-01-19T15:30:00+01:00",
      "allDay": false,
      "location": "Bridoux_TD 13",
      "description": "\n\nAGHA NAJA Joudy\nL2 Physique-Chimie - Anglais GRP A1\n\n(Modifié le:02/09/2025 09:31)",
      "status": "",
      "url": "",
      "lastModified": "2025-09-02T09:31:00+02:00"
    },
    {
      "id": "ADE60322e706c616e6e696e67554c5f323032355f323032362d3139393833392d322d30",
      "title": "TP3 UE 803 - SIG I",
      "start": "2026-01-19T14:00:00+01:00",
      "end": "2026-01-19T17:00:00+01:00",
      "allDay": false,
      "location": "Bridoux_TP Info2 C5",
      "description": "\n\nZELL BOUTTER Sandrine\nTP GRP 3\n\n(Modifié le:24/11/2025 11:46)",
      "status": "",
      "url": "",
      "lastModified": "2025-11-24T11:46:00+01:00"
    },
    {
      "id": "ADE60322e706c616e6e696e67554c5f323032355f323032362d31303937392d302d30",
      "title": "TD Théorie et pratique des APSA /Cirque-Gymnastique",
      "start": "2026-01-19T14:30:00+01:00",
      "end": "2026-01-19T17:30:00+01:00",
      "allDay": false,
      "location": "Bridoux_TD 5",
      "description": "\n\nTD EM\nTD EM LAS\nPEAN Laura\n\n(Modifié le:20/11/2025 11:14)",
      "status": "",
      "url": "",
      "lastModified": "2025-11-20T11:14:00+01:00"
    },
    {
      "id": "ADE60322e706c616e6e696e67554c5f323032355f323032362d393733312d332d30",
      "title": "TP GR.2 Pratiques spécifiques en APAS 2",
      "start": "2026-01-19T14:30:00+01:00",
      "end": "2026-01-19T16:30:00+01:00",
      "allDay": false,
      "location": "Bridoux_TP Damasio D3",
      "description": "\n\nTP APAS GR.2\nBUATOIS Severine\n\n(Modifié le:20/11/2025 11:15)",
      "status": "",
      "url": "",
      "lastModified": "2025-11-20T11:15:00+01:00"
    },
    {
      "id": "ADE60322e706c616e6e696e67554c5f323032355f323032362d31303831352d322d30",
      "title": "CM EC 402.1 Chimie organique 2",
      "start": "2026-01-19T15:45:00+01:00",
      "end": "2026-01-19T17:45:00+01:00",
      "allDay": false,
      "location": "Bridoux_TD 7",
      "description": "\n\nL2 Chimie FC\nL2 Chimie LAS\nL2 PC\nL2 PC LAS\nL2 Chimie PE\nL2 PC PE\nTD A L2 Chimie\nSINDT Michèle\n\n(Modifié le:28/11/2025 11:47)",
      "status": "",
      "url": "",
      "lastModified": "2025-11-28T11:47:00+01:00"
    },
    {
      "id": "ADE60322e706c616e6e696e67554c5f323032355f323032362d31313237372d382d30",
      "title": "CM Physiologie: régulation des fonctions",
      "start": "2026-01-19T15:45:00+01:00",
      "end": "2026-01-19T17:45:00+01:00",
      "allDay": false,
      "location": "Bridoux_TD 15",
      "description": "\n\nTP  A*\nTP  B*\nFELTEN Vincent\n\n(Modifié le:09/12/2025 15:58)",
      "status": "",
      "url": "",
      "lastModified": "2025-12-09T15:58:00+01:00"
    },
    {
      "id": "ADE60322e706c616e6e696e67554c5f323032355f323032362d3139363038382d312d30",
      "title": "EI IJ 206.1 Chimie Organique pour la Biologie",
      "start": "2026-01-19T15:45:00+01:00",
      "end": "2026-01-19T17:45:00+01:00",
      "allDay": false,
      "location": "Bridoux_TD 12",
      "description": "\n\nHESSE Stéphanie\nTP I*\nTP J*\n\n(Modifié le:01/12/2025 13:17)",
      "status": "",
      "url": "",
      "lastModified": "2025-12-01T13:17:00+01:00"
    },
    {
      "id": "ADE60322e706c616e6e696e67554c5f323032355f323032362d3139333633312d302d31",
      "title": "TPL Anglais D2",
      "start": "2026-01-19T15:45:00+01:00",
      "end": "2026-01-19T17:45:00+01:00",
      "allDay": false,
      "location": "Bridoux_TD 13",
      "description": "\n\nAGHA NAJA Joudy\nTP ANGLAIS GR.4\n\n(Modifié le:02/09/2025 11:24)",
      "status": "",
      "url": "",
      "lastModified": "2025-09-02T11:24:00+02:00"
    },
    {
      "id": "ADE60322e706c616e6e696e67554c5f323032355f323032362d32313034352d362d30",
      "title": "EI UE 503 Ressource en eau et hydrobiologie",
      "start": "2026-01-19T15:45:00+01:00",
      "end": "2026-01-19T17:45:00+01:00",
      "allDay": false,
      "location": "Bridoux_TD 2",
      "description": "\n\nLPRO Agro AAU\nLPRO Agro ADNT\nPAGNOUT Christophe\n\n(Modifié le:14/11/2025 18:22)",
      "status": "",
      "url": "",
      "lastModified": "2025-11-14T18:22:00+01:00"
    },
    {
      "id": "ADE60322e706c616e6e696e67554c5f323032355f323032362d383738382d302d30",
      "title": "TPL Anglais A2",
      "start": "2026-01-19T15:45:00+01:00",
      "end": "2026-01-19T17:45:00+01:00",
      "allDay": false,
      "location": "Bridoux_TD 18",
      "description": "\n\nTP ANGLAIS GR.1\nMATHIS-BUTIN Catherine\n\n(Modifié le:02/09/2025 11:10)",
      "status": "",
      "url": "",
      "lastModified": "2025-09-02T11:10:00+02:00"
    },
    {
      "id": "ADE60322e706c616e6e696e67554c5f323032355f323032362d36333930302d302d30",
      "title": "TP B NUMOC",
      "start": "2026-01-19T15:45:00+01:00",
      "end": "2026-01-19T17:45:00+01:00",
      "allDay": false,
      "location": "Bridoux_TP Info1 C1",
      "description": "\n\nTP  B*\nGALLIZZI Adrienne\n\n(Modifié le:01/12/2025 11:33)",
      "status": "",
      "url": "",
      "lastModified": "2025-12-01T11:33:00+01:00"
    },
    {
      "id": "ADE60322e706c616e6e696e67554c5f323032355f323032362d3139323639302d302d38",
      "title": "TPL Anglais C2",
      "start": "2026-01-19T15:45:00+01:00",
      "end": "2026-01-19T17:45:00+01:00",
      "allDay": false,
      "location": "Bridoux_TD 17",
      "description": "\n\nTP ANGLAIS GR.3\nUBASSY Mickaël\n\n(Modifié le:02/09/2025 11:17)",
      "status": "",
      "url": "",
      "lastModified": "2025-09-02T11:17:00+02:00"
    },
    {
      "id": "ADE60322e706c616e6e696e67554c5f323032355f323032362d3233303139332d352d30",
      "title": "EI ME830 Mobiliser les savoirs propres à la discipline des LC-2",
      "start": "2026-01-19T15:45:00+01:00",
      "end": "2026-01-19T17:45:00+01:00",
      "allDay": false,
      "location": "Bridoux_TD 29",
      "description": "\n\nM1 MEEF PC\nM1 MEEF M-PC\nANCARANI Lorenzo\n\n(Modifié le:12/12/2025 12:06)",
      "status": "",
      "url": "",
      "lastModified": "2025-12-12T12:06:00+01:00"
    },
    {
      "id": "ADE60322e706c616e6e696e67554c5f323032355f323032362d36323638382d322d30",
      "title": "TD EF Génétique fondamentale",
      "start": "2026-01-19T15:45:00+01:00",
      "end": "2026-01-19T17:45:00+01:00",
      "allDay": false,
      "location": "Bridoux_TD 3",
      "description": "\n\nRODIUS François\nTP  E*\nTP  F*\n\n(Modifié le:08/12/2025 15:17)",
      "status": "",
      "url": "",
      "lastModified": "2025-12-08T15:17:00+01:00"
    },
    {
      "id": "ADE60322e706c616e6e696e67554c5f323032355f323032362d3139323638392d302d38",
      "title": "TPL Anglais B2",
      "start": "2026-01-19T15:45:00+01:00",
      "end": "2026-01-19T17:45:00+01:00",
      "allDay": false,
      "location": "Bridoux_TD 16",
      "description": "\n\nNAVARRO Sylvain\nTP ANGLAIS GR.2\n\n(Modifié le:02/09/2025 11:15)",
      "status": "",
      "url": "",
      "lastModified": "2025-09-02T11:15:00+02:00"
    },
    {
      "id": "ADE60322e706c616e6e696e67554c5f323032355f323032362d39353637352d312d30",
      "title": "UE 803 TD EC2 Douleur et APAS",
      "start": "2026-01-19T16:00:00+01:00",
      "end": "2026-01-19T18:00:00+01:00",
      "allDay": false,
      "location": "Bridoux_TD 4",
      "description": "\n\nBRIER Laurence\nPromo complète M1 FA\nPromo complète M1 FI/FC\n\n(Modifié le:03/11/2025 15:36)",
      "status": "",
      "url": "",
      "lastModified": "2025-11-03T15:36:00+01:00"
    },
    {
      "id": "ADE60322e706c616e6e696e67554c5f323032355f323032362d3134323139342d362d30",
      "title": "Travaux service technique",
      "start": "2026-01-20T07:00:00+01:00",
      "end": "2026-01-20T19:00:00+01:00",
      "allDay": false,
      "location": "",
      "description": "\n\n\n\n(Modifié le:11/12/2025 11:41)",
      "status": "",
      "url": "",
      "lastModified": "2025-12-11T11:41:00+01:00"
    },
    {
      "id": "ADE60322e706c616e6e696e67554c5f323032355f323032362d32313431352d322d30",
      "title": "EI 1 Langues et internationalisation",
      "start": "2026-01-20T08:00:00+01:00",
      "end": "2026-01-20T10:00:00+01:00",
      "allDay": false,
      "location": "Bridoux_TD 17",
      "description": "\n\nUBASSY Mickaël\nLPRO Agro AAU\nLPRO Agro ADNT\n\n(Modifié le:05/11/2025 09:36)",
      "status": "",
      "url": "",
      "lastModified": "2025-11-05T09:36:00+01:00"
    },
    {
      "id": "ADE60322e706c616e6e696e67554c5f323032355f323032362d31363737372d302d30",
      "title": "EI EC 604.1 Projet professionnel personnalisé 2",
      "start": "2026-01-20T08:00:00+01:00",
      "end": "2026-01-20T10:00:00+01:00",
      "allDay": false,
      "location": "Bridoux_TD 13",
      "description": "\n\nL3 Physique FC\nL3 Physique LAS\nTD L3 Physique\nTITE Teddy\n\n(Modifié le:28/11/2025 17:01)",
      "status": "",
      "url": "",
      "lastModified": "2025-11-28T17:01:00+01:00"
    },
    {
      "id": "ADE60322e706c616e6e696e67554c5f323032355f323032362d36343338312d302d30",
      "title": "TD 910 Societies and health cultures",
      "start": "2026-01-20T08:00:00+01:00",
      "end": "2026-01-20T10:00:00+01:00",
      "allDay": false,
      "location": "Bridoux_TD 18",
      "description": "\n\nM2 A3R\nMATHIS-BUTIN Catherine\n\n(Modifié le:13/10/2025 18:02)",
      "status": "",
      "url": "",
      "lastModified": "2025-10-13T18:02:00+02:00"
    },
    {
      "id": "ADE60322e706c616e6e696e67554c5f323032355f323032362d39353539362d312d30",
      "title": "6.05 EI Gestion des conflits et des risques",
      "start": "2026-01-20T08:00:00+01:00",
      "end": "2026-01-20T12:00:00+01:00",
      "allDay": false,
      "location": "Bridoux_TP Start up 1 D14BIS",
      "description": "\n\nMASTAGLI Maxime\nLP GDOSSL FI/FC\n\n(Modifié le:08/12/2025 14:45)",
      "status": "",
      "url": "",
      "lastModified": "2025-12-08T14:45:00+01:00"
    },
    {
      "id": "ADE60322e706c616e6e696e67554c5f323032355f323032362d31303933382d302d31",
      "title": "TD EC 406.2 PPP 1",
      "start": "2026-01-20T08:00:00+01:00",
      "end": "2026-01-20T10:00:00+01:00",
      "allDay": false,
      "location": "Bridoux_TP Info1 C1",
      "description": "\n\nHATIM Oumaima\nL2 Chimie FC\nL2 PC\nTD A L2 Chimie\n\n(Modifié le:28/11/2025 11:33)",
      "status": "",
      "url": "",
      "lastModified": "2025-11-28T11:33:00+01:00"
    },
    {
      "id": "ADE60322e706c616e6e696e67554c5f323032355f323032362d31313239302d322d30",
      "title": "CM Toxicologie systémique et appliquée",
      "start": "2026-01-20T08:00:00+01:00",
      "end": "2026-01-20T10:00:00+01:00",
      "allDay": false,
      "location": "Bridoux_TD 16",
      "description": "\n\nGALLIZZI Adrienne\nTP  A*\nTP  B*\n\n(Modifié le:01/12/2025 16:50)",
      "status": "",
      "url": "",
      "lastModified": "2025-12-01T16:50:00+01:00"
    },
    {
      "id": "ADE60322e706c616e6e696e67554c5f323032355f323032362d31303834352d372d30",
      "title": "CM Approche socio-historique des pédagogies corporelles",
      "start": "2026-01-20T08:00:00+01:00",
      "end": "2026-01-20T10:00:00+01:00",
      "allDay": false,
      "location": "Bridoux_TD 1",
      "description": "\n\nCM EM\nCM EM LAS\nCREMONI Jerome\n\n(Modifié le:01/12/2025 15:53)",
      "status": "",
      "url": "",
      "lastModified": "2025-12-01T15:53:00+01:00"
    },
    {
      "id": "ADE60322e706c616e6e696e67554c5f323032355f323032362d39353637382d302d30",
      "title": "UE 804 CM EC1 Outils pour l'évaluation",
      "start": "2026-01-20T08:00:00+01:00",
      "end": "2026-01-20T10:00:00+01:00",
      "allDay": false,
      "location": "Bridoux_TP Info2 C5",
      "description": "\n\nDUBOIS Amandine\nPromo complète M1 FA\nPromo complète M1 FI/FC\n\n(Modifié le:04/12/2025 11:06)",
      "status": "",
      "url": "",
      "lastModified": "2025-12-04T11:06:00+01:00"
    },
    {
      "id": "ADE60322e706c616e6e696e67554c5f323032355f323032362d34333036352d302d30",
      "title": "TD GR.APA/GDOSSL Badminton",
      "start": "2026-01-20T08:00:00+01:00",
      "end": "2026-01-20T10:00:00+01:00",
      "allDay": false,
      "location": "Bridoux_TD 9",
      "description": "\n\nGR.TD/TP APA/GDOSSL/LAS\nMINAR Yann\n\n(Modifié le:04/12/2025 09:43)",
      "status": "",
      "url": "",
      "lastModified": "2025-12-04T09:43:00+01:00"
    },
    {
      "id": "ADE60322e706c616e6e696e67554c5f323032355f323032362d393131332d302d31",
      "title": "EI 1 EC 203.2 Chimie des solutions aqueuses",
      "start": "2026-01-20T08:00:00+01:00",
      "end": "2026-01-20T10:00:00+01:00",
      "allDay": false,
      "location": "Bridoux_TD 24",
      "description": "\n\nMEUX Éric\nTP A Portail PC\nTP B Portail PC\n\n(Modifié le:12/12/2025 13:32)",
      "status": "",
      "url": "",
      "lastModified": "2025-12-12T13:32:00+01:00"
    },
    {
      "id": "ADE60322e706c616e6e696e67554c5f323032355f323032362d393737392d352d30",
      "title": "TD Pratiques spécifiques en APAS 2",
      "start": "2026-01-20T09:00:00+01:00",
      "end": "2026-01-20T10:00:00+01:00",
      "allDay": false,
      "location": "Bridoux_TD 6",
      "description": "\n\nTD APAS\nTD APAS LAS\nASSELIN Marine\n\n(Modifié le:24/11/2025 13:25)",
      "status": "",
      "url": "",
      "lastModified": "2025-11-24T13:25:00+01:00"
    },
    {
      "id": "ADE60322e706c616e6e696e67554c5f323032355f323032362d39353637332d302d31",
      "title": "UE 803 TD EC1 Psychophysiologie de la fatigue",
      "start": "2026-01-20T10:00:00+01:00",
      "end": "2026-01-20T12:00:00+01:00",
      "allDay": false,
      "location": "Bridoux_TP Start up 2 D16",
      "description": "\n\nBARBRY Alexis\nPromo complète M1 FA\nPromo complète M1 FI/FC\n\n(Modifié le:27/11/2025 16:18)",
      "status": "",
      "url": "",
      "lastModified": "2025-11-27T16:18:00+01:00"
    },
    {
      "id": "ADE60322e706c616e6e696e67554c5f323032355f323032362d383433302d302d31",
      "title": "TD GR.EM1 Badminton",
      "start": "2026-01-20T10:00:00+01:00",
      "end": "2026-01-20T12:00:00+01:00",
      "allDay": false,
      "location": "Bridoux_TD 9",
      "description": "\n\nGR. TD/TP EM1+LAS\nMINAR Yann\n\n(Modifié le:08/12/2025 09:37)",
      "status": "",
      "url": "",
      "lastModified": "2025-12-08T09:37:00+01:00"
    },
    {
      "id": "ADE60322e706c616e6e696e67554c5f323032355f323032362d39343238362d322d30",
      "title": "TD ME1071 Construire une posture réflexive",
      "start": "2026-01-20T10:15:00+01:00",
      "end": "2026-01-20T12:15:00+01:00",
      "allDay": false,
      "location": "Bridoux_TP Info1 C1",
      "description": "\n\nDUBOIS Amandine\nM2 MEEF EPS\n\n(Modifié le:04/12/2025 11:02)",
      "status": "",
      "url": "",
      "lastModified": "2025-12-04T11:02:00+01:00"
    },
    {
      "id": "ADE60322e706c616e6e696e67554c5f323032355f323032362d31313237372d312d30",
      "title": "CM Physiologie: régulation des fonctions",
      "start": "2026-01-20T10:15:00+01:00",
      "end": "2026-01-20T12:15:00+01:00",
      "allDay": false,
      "location": "Bridoux_TD 2",
      "description": "\n\nNEGUESQUE Adrien\nTP  A*\nTP  B*\n\n(Modifié le:01/12/2025 16:50)",
      "status": "",
      "url": "",
      "lastModified": "2025-12-01T16:50:00+01:00"
    },
    {
      "id": "ADE60322e706c616e6e696e67554c5f323032355f323032362d36343337352d302d30",
      "title": "CM UE 909 EC 1 Approche pluridisciplinaire pour maintien de l'autonomie",
      "start": "2026-01-20T10:15:00+01:00",
      "end": "2026-01-20T12:15:00+01:00",
      "allDay": false,
      "location": "Bridoux_TD 27",
      "description": "\n\nASSELIN Marine\nM2 A3R\n\n(Modifié le:01/12/2025 11:59)",
      "status": "",
      "url": "",
      "lastModified": "2025-12-01T11:59:00+01:00"
    },
    {
      "id": "ADE60322e706c616e6e696e67554c5f323032355f323032362d32393931392d302d39",
      "title": "TP Anglais GR C",
      "start": "2026-01-20T10:15:00+01:00",
      "end": "2026-01-20T12:15:00+01:00",
      "allDay": false,
      "location": "Bridoux_TD 15",
      "description": "\n\nTP ANGLAIS APAS GR 1\nTP ANGLAIS EM GR.1\n\n(Modifié le:24/11/2025 14:03)",
      "status": "",
      "url": "",
      "lastModified": "2025-11-24T14:03:00+01:00"
    },
    {
      "id": "ADE60322e706c616e6e696e67554c5f323032355f323032362d3133303833302d31392d30",
      "title": "EI 1 UE 201 Mathématiques 2",
      "start": "2026-01-20T10:15:00+01:00",
      "end": "2026-01-20T12:15:00+01:00",
      "allDay": false,
      "location": "Bridoux_TD 13",
      "description": "\n\nGRANDCOLAS Michel\nTP A Portail PC\nTP B Portail PC\n\n(Modifié le:12/12/2025 13:48)",
      "status": "",
      "url": "",
      "lastModified": "2025-12-12T13:48:00+01:00"
    },
    {
      "id": "ADE60322e706c616e6e696e67554c5f323032355f323032362d3135393238312d302d39",
      "title": "TP Anglais GR B",
      "start": "2026-01-20T10:15:00+01:00",
      "end": "2026-01-20T12:15:00+01:00",
      "allDay": false,
      "location": "Bridoux_TD 18",
      "description": "\n\nMATHIS-BUTIN Catherine\nTP ANGLAIS APAS GR 3\n\n(Modifié le:02/09/2025 11:55)",
      "status": "",
      "url": "",
      "lastModified": "2025-09-02T11:55:00+02:00"
    },
    {
      "id": "ADE60322e706c616e6e696e67554c5f323032355f323032362d32323335382d342d30",
      "title": "EI 2 Gestion et analyse de données",
      "start": "2026-01-20T10:15:00+01:00",
      "end": "2026-01-20T12:15:00+01:00",
      "allDay": false,
      "location": "Bridoux_TD 8",
      "description": "\n\nQUEVREUX Pierre\nLPRO Agro AAU\nLPRO Agro ADNT\n\n(Modifié le:03/12/2025 12:21)",
      "status": "",
      "url": "",
      "lastModified": "2025-12-03T12:21:00+01:00"
    },
    {
      "id": "ADE60322e706c616e6e696e67554c5f323032355f323032362d32393932312d302d30",
      "title": "TP Anglais GR D",
      "start": "2026-01-20T10:15:00+01:00",
      "end": "2026-01-20T12:15:00+01:00",
      "allDay": false,
      "location": "Bridoux_TD 17",
      "description": "\n\nTP ANGLAIS APAS GR 2\nTP ANGLAIS EM GR.2\nUBASSY Mickaël\n\n(Modifié le:02/09/2025 11:51)",
      "status": "",
      "url": "",
      "lastModified": "2025-09-02T11:51:00+02:00"
    },
    {
      "id": "ADE60322e706c616e6e696e67554c5f323032355f323032362d33323431392d302d30",
      "title": "Anglais GRP A",
      "start": "2026-01-20T10:15:00+01:00",
      "end": "2026-01-20T12:15:00+01:00",
      "allDay": false,
      "location": "Bridoux_TD 16",
      "description": "\n\nNAVARRO Sylvain\nL3 Physique FC\nL3 Physique LAS\nTD L3 Physique\n\n(Modifié le:05/09/2025 11:11)",
      "status": "",
      "url": "",
      "lastModified": "2025-09-05T11:11:00+02:00"
    },
    {
      "id": "ADE60322e706c616e6e696e67554c5f323032355f323032362d31313230352d302d30",
      "title": "CM 402.1 Thermodynamique",
      "start": "2026-01-20T10:15:00+01:00",
      "end": "2026-01-20T12:15:00+01:00",
      "allDay": false,
      "location": "Bridoux_TD 12",
      "description": "\n\nL2 Physique FC\nL2 Physique LAS\nL2 PC\nL2 PC LAS\nL2 Physique PE\nL2 PC PE\nTD L2 Physique\nWAX Jean-François\n\n(Modifié le:28/11/2025 11:33)",
      "status": "",
      "url": "",
      "lastModified": "2025-11-28T11:33:00+01:00"
    },
    {
      "id": "ADE60322e706c616e6e696e67554c5f323032355f323032362d39353539302d332d30",
      "title": "6.04 EI Comptabilité générale et fiscalité",
      "start": "2026-01-20T13:00:00+01:00",
      "end": "2026-01-20T17:00:00+01:00",
      "allDay": false,
      "location": "Bridoux_TP Start up 1 D14BIS",
      "description": "\n\nROTH David\nLP GDOSSL FI/FC\nLic Pro GDOSSL FA\n\n(Modifié le:13/10/2025 11:02)",
      "status": "",
      "url": "",
      "lastModified": "2025-10-13T11:02:00+02:00"
    },
    {
      "id": "ADE60322e706c616e6e696e67554c5f323032355f323032362d39353636322d312d30",
      "title": "UE 802 CM EC2 Prise en charge et prévention",
      "start": "2026-01-20T13:00:00+01:00",
      "end": "2026-01-20T15:00:00+01:00",
      "allDay": false,
      "location": "Bridoux_TP Damasio D3",
      "description": "\n\nPARIS Bruno\nPromo complète M1 FA\nPromo complète M1 FI/FC\n\n(Modifié le:10/12/2025 10:22)",
      "status": "",
      "url": "",
      "lastModified": "2025-12-10T10:22:00+01:00"
    },
    {
      "id": "ADE60322e706c616e6e696e67554c5f323032355f323032362d32343034352d312d30",
      "title": "EI UE 506 Agroéquipements innovants",
      "start": "2026-01-20T13:00:00+01:00",
      "end": "2026-01-20T17:00:00+01:00",
      "allDay": false,
      "location": "Bridoux_TD 1",
      "description": "\n\nLPRO Agro ADNT\nBELNER Alexandre\n\n(Modifié le:21/11/2025 16:24)",
      "status": "",
      "url": "",
      "lastModified": "2025-11-21T16:24:00+01:00"
    },
    {
      "id": "ADE60322e706c616e6e696e67554c5f323032355f323032362d31303834352d352d30",
      "title": "CM Approche socio-historique des pédagogies corporelles",
      "start": "2026-01-20T13:15:00+01:00",
      "end": "2026-01-20T15:45:00+01:00",
      "allDay": false,
      "location": "Bridoux_TD 2",
      "description": "\n\nCM EM\nCM EM LAS\nHAUBER-MULLER Thomas\n\n(Modifié le:01/12/2025 16:01)",
      "status": "",
      "url": "",
      "lastModified": "2025-12-01T16:01:00+01:00"
    },
    {
      "id": "ADE60322e706c616e6e696e67554c5f323032355f323032362d393531312d302d30",
      "title": "CM Problématiques sociales, besoins spécifiques et interv. APAS",
      "start": "2026-01-20T13:30:00+01:00",
      "end": "2026-01-20T16:30:00+01:00",
      "allDay": false,
      "location": "Bridoux_TD 3",
      "description": "\n\nCM APAS\nBARRAL Fanny\n\n(Modifié le:27/11/2025 10:48)",
      "status": "",
      "url": "",
      "lastModified": "2025-11-27T10:48:00+01:00"
    },
    {
      "id": "ADE60322e706c616e6e696e67554c5f323032355f323032362d3138383833342d302d39",
      "title": "TPL EC Langues - ANG GR B",
      "start": "2026-01-20T13:30:00+01:00",
      "end": "2026-01-20T15:30:00+01:00",
      "allDay": false,
      "location": "Bridoux_TD 16",
      "description": "\n\nNAVARRO Sylvain\nTD 2 Anglais Gr B\n\n(Modifié le:18/09/2025 16:14)",
      "status": "",
      "url": "",
      "lastModified": "2025-09-18T16:14:00+02:00"
    },
    {
      "id": "ADE60322e706c616e6e696e67554c5f323032355f323032362d36313833392d302d31",
      "title": "TPL EC Langues - ANG GR A",
      "start": "2026-01-20T13:30:00+01:00",
      "end": "2026-01-20T15:30:00+01:00",
      "allDay": false,
      "location": "Bridoux_TD 18",
      "description": "\n\nMATHIS-BUTIN Catherine\nTD 1 Anglais Gr A\n\n(Modifié le:18/09/2025 16:14)",
      "status": "",
      "url": "",
      "lastModified": "2025-09-18T16:14:00+02:00"
    },
    {
      "id": "ADE60322e706c616e6e696e67554c5f323032355f323032362d34343834332d302d30",
      "title": "TD Analyse de l'intervention",
      "start": "2026-01-20T13:30:00+01:00",
      "end": "2026-01-20T16:00:00+01:00",
      "allDay": false,
      "location": "Bridoux_Salle des Actes B14",
      "description": "\n\nJESSEL Jean-Jacques\nGR. EM\n\n(Modifié le:15/12/2025 09:37)",
      "status": "",
      "url": "",
      "lastModified": "2025-12-15T09:37:00+01:00"
    },
    {
      "id": "ADE60322e706c616e6e696e67554c5f323032355f323032362d31313236302d362d30",
      "title": "CM Immunologie approfondie",
      "start": "2026-01-20T13:30:00+01:00",
      "end": "2026-01-20T15:30:00+01:00",
      "allDay": false,
      "location": "Bridoux_TD 14",
      "description": "\n\nRODIUS François\nGroupe A Immunologie\nGroupe B immunologie\n\n(Modifié le:08/12/2025 15:06)",
      "status": "",
      "url": "",
      "lastModified": "2025-12-08T15:06:00+01:00"
    },
    {
      "id": "ADE60322e706c616e6e696e67554c5f323032355f323032362d31343635342d302d30",
      "title": "TD 404.1 Mécanique des fluides",
      "start": "2026-01-20T13:30:00+01:00",
      "end": "2026-01-20T15:30:00+01:00",
      "allDay": false,
      "location": "Bridoux_TD 17",
      "description": "\n\nL2 Physique PE\nTD L2 Physique\nBECU Lydiane\n\n(Modifié le:28/11/2025 11:34)",
      "status": "",
      "url": "",
      "lastModified": "2025-11-28T11:34:00+01:00"
    },
    {
      "id": "ADE60322e706c616e6e696e67554c5f323032355f323032362d3137313336322d302d30",
      "title": "TP ME1061 Usage du numérique en Maths, Physique Chimie 2",
      "start": "2026-01-20T13:30:00+01:00",
      "end": "2026-01-20T15:30:00+01:00",
      "allDay": false,
      "location": "Bridoux_TP Hertz H13",
      "description": "\n\nM2 M-PC\nM2 MEEF PC\nCHAPRON David\n\n(Modifié le:12/11/2025 10:31)",
      "status": "",
      "url": "",
      "lastModified": "2025-11-12T10:31:00+01:00"
    },
    {
      "id": "ADE60322e706c616e6e696e67554c5f323032355f323032362d31303835342d302d32",
      "title": "TD EC 402.1 Chimie organique 2",
      "start": "2026-01-20T13:30:00+01:00",
      "end": "2026-01-20T15:30:00+01:00",
      "allDay": false,
      "location": "Bridoux_TD 9",
      "description": "\n\nL2 Chimie FC\nL2 Chimie LAS\nL2 PC\nL2 PC LAS\nL2 Chimie PE\nL2 PC PE\nTD A L2 Chimie\nSINDT Michèle\n\n(Modifié le:24/11/2025 12:07)",
      "status": "",
      "url": "",
      "lastModified": "2025-11-24T12:07:00+01:00"
    },
    {
      "id": "ADE60322e706c616e6e696e67554c5f323032355f323032362d383839342d302d30",
      "title": "EI 1 EC 202.1 Electromagnétisme ",
      "start": "2026-01-20T13:30:00+01:00",
      "end": "2026-01-20T15:30:00+01:00",
      "allDay": false,
      "location": "Bridoux_TD 12",
      "description": "\n\nTP A Portail PC\nTP B Portail PC\nWAX Jean-François\n\n(Modifié le:12/12/2025 14:51)",
      "status": "",
      "url": "",
      "lastModified": "2025-12-12T14:51:00+01:00"
    },
    {
      "id": "ADE60322e706c616e6e696e67554c5f323032355f323032362d3231333839352d302d32",
      "title": "TD GR1 EC 801.1 Sauveteurs et Secouristes du Travail",
      "start": "2026-01-20T13:30:00+01:00",
      "end": "2026-01-20T18:30:00+01:00",
      "allDay": false,
      "location": "Bridoux_TP Start up 2 D16",
      "description": "\n\nGroupe 1 M1 Chimie\nCREMONI Jerome\n\n(Modifié le:10/12/2025 11:23)",
      "status": "",
      "url": "",
      "lastModified": "2025-12-10T11:23:00+01:00"
    },
    {
      "id": "ADE60322e706c616e6e696e67554c5f323032355f323032362d36343336322d302d30",
      "title": "CM UE 908 EC 1 Management de la diversité",
      "start": "2026-01-20T14:00:00+01:00",
      "end": "2026-01-20T16:00:00+01:00",
      "allDay": false,
      "location": "Bridoux_TD 27",
      "description": "\n\nM2 A3R\nLEYMARIE Stéphane\n\n(Modifié le:20/10/2025 11:40)",
      "status": "",
      "url": "",
      "lastModified": "2025-10-20T11:40:00+02:00"
    },
    {
      "id": "ADE60322e706c616e6e696e67554c5f323032355f323032362d39333039302d312d30",
      "title": "TD ME1030 Savoirs propres à la discipline et épistémologie",
      "start": "2026-01-20T14:00:00+01:00",
      "end": "2026-01-20T17:00:00+01:00",
      "allDay": false,
      "location": "Bridoux_TD 4",
      "description": "\n\nVINCENT Cyrille\nM2 MEEF EPS\n\n(Modifié le:22/09/2025 11:05)",
      "status": "",
      "url": "",
      "lastModified": "2025-09-22T11:05:00+02:00"
    },
    {
      "id": "ADE60322e706c616e6e696e67554c5f323032355f323032362d39353636342d302d30",
      "title": "UE 802 TD EC2 Prise en charge et prévention",
      "start": "2026-01-20T15:00:00+01:00",
      "end": "2026-01-20T16:00:00+01:00",
      "allDay": false,
      "location": "Bridoux_TP Damasio D3",
      "description": "\n\nPARIS Bruno\nPromo complète M1 FA\nPromo complète M1 FI/FC\n\n(Modifié le:10/12/2025 10:23)",
      "status": "",
      "url": "",
      "lastModified": "2025-12-10T10:23:00+01:00"
    },
    {
      "id": "ADE60322e706c616e6e696e67554c5f323032355f323032362d31313235392d322d30",
      "title": "TD AB Immunologie approfondie",
      "start": "2026-01-20T15:45:00+01:00",
      "end": "2026-01-20T17:45:00+01:00",
      "allDay": false,
      "location": "Bridoux_TD 14",
      "description": "\n\nRODIUS François\nGroupe A Immunologie\nGroupe B immunologie\n\n(Modifié le:08/12/2025 15:06)",
      "status": "",
      "url": "",
      "lastModified": "2025-12-08T15:06:00+01:00"
    },
    {
      "id": "ADE60322e706c616e6e696e67554c5f323032355f323032362d39353636322d302d30",
      "title": "UE 802 CM EC2 Prise en charge et prévention",
      "start": "2026-01-20T16:00:00+01:00",
      "end": "2026-01-20T19:00:00+01:00",
      "allDay": false,
      "location": "Bridoux_TP Damasio D3",
      "description": "\n\nDULEBA Stephane\nPromo complète M1 FA\nPromo complète M1 FI/FC\n\n(Modifié le:10/12/2025 10:23)",
      "status": "",
      "url": "",
      "lastModified": "2025-12-10T10:23:00+01:00"
    },
    {
      "id": "ADE60322e706c616e6e696e67554c5f323032355f323032362d36343336342d302d30",
      "title": "EI UE 908 EC 1 Management de la diversité",
      "start": "2026-01-20T16:00:00+01:00",
      "end": "2026-01-20T17:00:00+01:00",
      "allDay": false,
      "location": "Bridoux_TD 27",
      "description": "\n\nM2 A3R\nLEYMARIE Stéphane\n\n(Modifié le:20/10/2025 11:41)",
      "status": "",
      "url": "",
      "lastModified": "2025-10-20T11:41:00+02:00"
    },
    {
      "id": "ADE60322e706c616e6e696e67554c5f323032355f323032362d39333138362d322d30",
      "title": "TD ME1040 Didactique disciplinaire, mise en oeuvre des program.",
      "start": "2026-01-20T17:00:00+01:00",
      "end": "2026-01-20T19:00:00+01:00",
      "allDay": false,
      "location": "Bridoux_TD 4",
      "description": "\n\nM2 MEEF EPS\nFRIEDRICH Jonathan\n\n(Modifié le:22/09/2025 11:05)",
      "status": "",
      "url": "",
      "lastModified": "2025-09-22T11:05:00+02:00"
    },
    {
      "id": "ADE60322e706c616e6e696e67554c5f323032355f323032362d3134323139342d302d31",
      "title": "Travaux service technique",
      "start": "2026-01-21T07:00:00+01:00",
      "end": "2026-01-21T19:00:00+01:00",
      "allDay": false,
      "location": "",
      "description": "\n\n\n\n(Modifié le:11/12/2025 11:41)",
      "status": "",
      "url": "",
      "lastModified": "2025-12-11T11:41:00+01:00"
    },
    {
      "id": "ADE60322e706c616e6e696e67554c5f323032355f323032362d39353630332d332d30",
      "title": "EI Préparation du projet tutoré",
      "start": "2026-01-21T08:00:00+01:00",
      "end": "2026-01-21T10:00:00+01:00",
      "allDay": false,
      "location": "Bridoux_TP Start up 2 D16",
      "description": "\n\nMICHEL Sarah\nLP GDOSSL FI/FC\n\n(Modifié le:10/11/2025 17:08)",
      "status": "",
      "url": "",
      "lastModified": "2025-11-10T17:08:00+01:00"
    },
    {
      "id": "ADE60322e706c616e6e696e67554c5f323032355f323032362d31323432372d302d39",
      "title": "TP Anglais GR.G",
      "start": "2026-01-21T08:00:00+01:00",
      "end": "2026-01-21T10:00:00+01:00",
      "allDay": false,
      "location": "Bridoux_TD 17",
      "description": "\n\nUBASSY Mickaël\nTP ANGLAIS GR.7\n\n(Modifié le:01/09/2025 20:34)",
      "status": "",
      "url": "",
      "lastModified": "2025-09-01T20:34:00+02:00"
    },
    {
      "id": "ADE60322e706c616e6e696e67554c5f323032355f323032362d31323433302d302d30",
      "title": "TP Anglais GR.F",
      "start": "2026-01-21T08:00:00+01:00",
      "end": "2026-01-21T10:00:00+01:00",
      "allDay": false,
      "location": "Bridoux_TD 18",
      "description": "\n\nTP ANGLAIS GR.6\nMATHIS-BUTIN Catherine\n\n(Modifié le:01/09/2025 20:31)",
      "status": "",
      "url": "",
      "lastModified": "2025-09-01T20:31:00+02:00"
    },
    {
      "id": "ADE60322e706c616e6e696e67554c5f323032355f323032362d31323531332d302d39",
      "title": "TP Anglais GR.E",
      "start": "2026-01-21T08:00:00+01:00",
      "end": "2026-01-21T10:00:00+01:00",
      "allDay": false,
      "location": "Bridoux_TD 7",
      "description": "\n\nDAHMANI Faouzia\nTD/TP GR.E\n\n(Modifié le:17/09/2025 17:17)",
      "status": "",
      "url": "",
      "lastModified": "2025-09-17T17:17:00+02:00"
    },
    {
      "id": "ADE60322e706c616e6e696e67554c5f323032355f323032362d393130312d31332d30",
      "title": "EI 2 EC 203.1 Introduction à la chimie organique ",
      "start": "2026-01-21T08:00:00+01:00",
      "end": "2026-01-21T10:00:00+01:00",
      "allDay": false,
      "location": "Bridoux_TD 2",
      "description": "\n\nTP C Portail PC\nTP D Portail PC\nCOMOY Corinne\n\n(Modifié le:12/12/2025 17:05)",
      "status": "",
      "url": "",
      "lastModified": "2025-12-12T17:05:00+01:00"
    },
    {
      "id": "ADE60322e706c616e6e696e67554c5f323032355f323032362d363530362d302d30",
      "title": "TPL EC1 Anglais GR H",
      "start": "2026-01-21T08:00:00+01:00",
      "end": "2026-01-21T10:00:00+01:00",
      "allDay": false,
      "location": "Bridoux_TD 9",
      "description": "\n\nAGHA NAJA Joudy\nGR1 - Anglais\n\n(Modifié le:01/09/2025 20:35)",
      "status": "",
      "url": "",
      "lastModified": "2025-09-01T20:35:00+02:00"
    },
    {
      "id": "ADE60322e706c616e6e696e67554c5f323032355f323032362d3139323934302d302d39",
      "title": "TPL EC1 Anglais GR I",
      "start": "2026-01-21T08:00:00+01:00",
      "end": "2026-01-21T10:00:00+01:00",
      "allDay": false,
      "location": "Bridoux_TD 16",
      "description": "\n\nNAVARRO Sylvain\nGR2 - Anglais\n\n(Modifié le:01/09/2025 20:38)",
      "status": "",
      "url": "",
      "lastModified": "2025-09-01T20:38:00+02:00"
    },
    {
      "id": "ADE60322e706c616e6e696e67554c5f323032355f323032362d31303737372d322d30",
      "title": "CM Pédagogie, didactique des APSA à des fins éducatives",
      "start": "2026-01-21T08:00:00+01:00",
      "end": "2026-01-21T11:00:00+01:00",
      "allDay": false,
      "location": "Bridoux_TD 4",
      "description": "\n\nSIMON Luc\nCM EM\nCM EM LAS\n\n(Modifié le:10/11/2025 09:45)",
      "status": "",
      "url": "",
      "lastModified": "2025-11-10T09:45:00+01:00"
    },
    {
      "id": "ADE60322e706c616e6e696e67554c5f323032355f323032362d31323439362d302d30",
      "title": "TP Anglais GR.D",
      "start": "2026-01-21T08:00:00+01:00",
      "end": "2026-01-21T10:00:00+01:00",
      "allDay": false,
      "location": "Bridoux_TD 13",
      "description": "\n\nHOFFART Christine\nTP ANGLAIS GR.4\n\n(Modifié le:01/09/2025 20:07)",
      "status": "",
      "url": "",
      "lastModified": "2025-09-01T20:07:00+02:00"
    },
    {
      "id": "ADE60322e706c616e6e696e67554c5f323032355f323032362d32323335382d372d30",
      "title": "EI 2 Gestion et analyse de données",
      "start": "2026-01-21T09:00:00+01:00",
      "end": "2026-01-21T12:00:00+01:00",
      "allDay": false,
      "location": "Bridoux_TD 1",
      "description": "\n\nNOESSER Frédéric\nLPRO Agro AAU\nLPRO Agro ADNT\n\n(Modifié le:05/11/2025 09:36)",
      "status": "",
      "url": "",
      "lastModified": "2025-11-05T09:36:00+01:00"
    },
    {
      "id": "ADE60322e706c616e6e696e67554c5f323032355f323032362d31343638342d302d32",
      "title": "TP EC 603.2 Physique expérimentale 3",
      "start": "2026-01-21T09:00:00+01:00",
      "end": "2026-01-21T12:00:00+01:00",
      "allDay": false,
      "location": "Bridoux_TP Carnot H6",
      "description": "\n\nLECLERC Arnaud\nL3 Physique FC\nL3 Physique LAS\nTD L3 Physique\n\n(Modifié le:28/11/2025 17:02)",
      "status": "",
      "url": "",
      "lastModified": "2025-11-28T17:02:00+01:00"
    },
    {
      "id": "ADE60322e706c616e6e696e67554c5f323032355f323032362d3137313530382d302d30",
      "title": "TD ME1051Concevoir une transposition didactique en M-PC 2",
      "start": "2026-01-21T09:00:00+01:00",
      "end": "2026-01-21T12:00:00+01:00",
      "allDay": false,
      "location": "Bridoux_TD 24",
      "description": "\n\nM2 M-PC\nREVEILLIEZ Christophe\n\n(Modifié le:12/11/2025 10:48)",
      "status": "",
      "url": "",
      "lastModified": "2025-11-12T10:48:00+01:00"
    },
    {
      "id": "ADE60322e706c616e6e696e67554c5f323032355f323032362d3137313335372d302d32",
      "title": "TD ME1052 Mis en oeuvre des apps.disciplin. et transversaux LC2",
      "start": "2026-01-21T09:00:00+01:00",
      "end": "2026-01-21T12:00:00+01:00",
      "allDay": false,
      "location": "Bridoux_TD 28",
      "description": "\n\nNADLER Caroline\nM2 MEEF PC\n\n(Modifié le:06/11/2025 16:58)",
      "status": "",
      "url": "",
      "lastModified": "2025-11-06T16:58:00+01:00"
    },
    {
      "id": "ADE60322e706c616e6e696e67554c5f323032355f323032362d36313830312d322d30",
      "title": "TP UE 818 - Ecole de Terrain",
      "start": "2026-01-21T09:00:00+01:00",
      "end": "2026-01-21T10:00:00+01:00",
      "allDay": false,
      "location": "Bridoux_TD 5",
      "description": "\n\nARAN Delphine\nTP GE\n\n(Modifié le:08/12/2025 15:00)",
      "status": "",
      "url": "",
      "lastModified": "2025-12-08T15:00:00+01:00"
    },
    {
      "id": "ADE60322e706c616e6e696e67554c5f323032355f323032362d3132353834332d302d35",
      "title": "TP B EC NUMOC 2 - PC",
      "start": "2026-01-21T09:00:00+01:00",
      "end": "2026-01-21T12:00:00+01:00",
      "allDay": false,
      "location": "Bridoux_TP Info4 C11",
      "description": "\n\nTP B Portail PC\nCAPPELAERE Emmanuel\n\n(Modifié le:12/12/2025 13:12)",
      "status": "",
      "url": "",
      "lastModified": "2025-12-12T13:12:00+01:00"
    },
    {
      "id": "ADE60322e706c616e6e696e67554c5f323032355f323032362d3130353431392d302d30",
      "title": "Seconde chance UE 301.1 Analyse",
      "start": "2026-01-21T10:00:00+01:00",
      "end": "2026-01-21T11:30:00+01:00",
      "allDay": false,
      "location": "Bridoux_TD 2",
      "description": "\n\nTD L2 Physique\nL2 Physique FC\nL2 Physique LAS\nL2 PC\nL2 Physique PE\nMOHRBACH Hervé\n\n(Modifié le:15/09/2025 16:06)",
      "status": "",
      "url": "",
      "lastModified": "2025-09-15T16:06:00+02:00"
    },
    {
      "id": "ADE60322e706c616e6e696e67554c5f323032355f323032362d39353538382d332d30",
      "title": "6.03 EI Management et gestion des structures et des services",
      "start": "2026-01-21T10:00:00+01:00",
      "end": "2026-01-21T12:00:00+01:00",
      "allDay": false,
      "location": "Bridoux_TP Start up 2 D16",
      "description": "\n\nLP GDOSSL FI/FC\nMICHEL Sarah\n\n(Modifié le:10/11/2025 17:08)",
      "status": "",
      "url": "",
      "lastModified": "2025-11-10T17:08:00+01:00"
    },
    {
      "id": "ADE60322e706c616e6e696e67554c5f323032355f323032362d3134393930312d302d3132",
      "title": "Réservation Victor",
      "start": "2026-01-21T10:00:00+01:00",
      "end": "2026-01-21T12:00:00+01:00",
      "allDay": false,
      "location": "",
      "description": "\nSeconde chance 301. HM\n\n\n(Modifié le:03/10/2025 13:02)",
      "status": "",
      "url": "",
      "lastModified": "2025-10-03T13:02:00+02:00"
    },
    {
      "id": "ADE60322e706c616e6e696e67554c5f323032355f323032362d31323432392d302d39",
      "title": "TP Anglais GR.C",
      "start": "2026-01-21T10:15:00+01:00",
      "end": "2026-01-21T12:15:00+01:00",
      "allDay": false,
      "location": "Bridoux_TD 16",
      "description": "\n\nNAVARRO Sylvain\nTP ANGLAIS GR.3\n\n(Modifié le:01/09/2025 20:06)",
      "status": "",
      "url": "",
      "lastModified": "2025-09-01T20:06:00+02:00"
    },
    {
      "id": "ADE60322e706c616e6e696e67554c5f323032355f323032362d31323432382d302d30",
      "title": "TP Anglais GR.B",
      "start": "2026-01-21T10:15:00+01:00",
      "end": "2026-01-21T12:15:00+01:00",
      "allDay": false,
      "location": "Bridoux_TD 17",
      "description": "\n\nUBASSY Mickaël\nTP ANGLAIS GR.2\n\n(Modifié le:01/09/2025 20:29)",
      "status": "",
      "url": "",
      "lastModified": "2025-09-01T20:29:00+02:00"
    },
    {
      "id": "ADE60322e706c616e6e696e67554c5f323032355f323032362d373334362d302d30",
      "title": "TP Anglais GR.A",
      "start": "2026-01-21T10:15:00+01:00",
      "end": "2026-01-21T12:15:00+01:00",
      "allDay": false,
      "location": "Bridoux_TD 18",
      "description": "\n\nTP ANGLAIS GR.1\nMATHIS-BUTIN Catherine\n\n(Modifié le:01/09/2025 19:49)",
      "status": "",
      "url": "",
      "lastModified": "2025-09-01T19:49:00+02:00"
    },
    {
      "id": "ADE60322e706c616e6e696e67554c5f323032355f323032362d36313639372d302d30",
      "title": "EI UE809 -Typologie des Milieux Aquatiques et des Zones Humides",
      "start": "2026-01-21T10:15:00+01:00",
      "end": "2026-01-21T11:45:00+01:00",
      "allDay": false,
      "location": "Bridoux_TD 8",
      "description": "\n\nFAUPIN Solène\nCM GEMAREC\n\n(Modifié le:08/12/2025 11:57)",
      "status": "",
      "url": "",
      "lastModified": "2025-12-08T11:57:00+01:00"
    },
    {
      "id": "ADE60322e706c616e6e696e67554c5f323032355f323032362d36313739312d302d30",
      "title": "CM UE 817 - Caractérisation et traitement de l'air",
      "start": "2026-01-21T10:15:00+01:00",
      "end": "2026-01-21T12:15:00+01:00",
      "allDay": false,
      "location": "Bridoux_TD 27",
      "description": "\n\nPIERRAT Christophe\nCM GE\n\n(Modifié le:10/12/2025 14:57)",
      "status": "",
      "url": "",
      "lastModified": "2025-12-10T14:57:00+01:00"
    },
    {
      "id": "ADE60322e706c616e6e696e67554c5f323032355f323032362d3133303736372d332d30",
      "title": "EI 2 UE 201 Mathématiques 2",
      "start": "2026-01-21T10:15:00+01:00",
      "end": "2026-01-21T12:15:00+01:00",
      "allDay": false,
      "location": "Bridoux_TD 14",
      "description": "\n\nTP C Portail PC\nTP D Portail PC\nGLEIZE Jérôme\n\n(Modifié le:12/12/2025 16:19)",
      "status": "",
      "url": "",
      "lastModified": "2025-12-12T16:19:00+01:00"
    },
    {
      "id": "ADE60322e706c616e6e696e67554c5f323032355f323032362d31353731362d302d34",
      "title": "CM EC 405.1 Biochimie",
      "start": "2026-01-21T10:15:00+01:00",
      "end": "2026-01-21T12:15:00+01:00",
      "allDay": false,
      "location": "Bridoux_TD 12",
      "description": "\n\nPARANT Marc\nL2 Chimie FC\nL2 Chimie PE\nTD A L2 Chimie\nL2 Chimie LAS\n\n(Modifié le:08/12/2025 12:34)",
      "status": "",
      "url": "",
      "lastModified": "2025-12-08T12:34:00+01:00"
    },
    {
      "id": "ADE60322e706c616e6e696e67554c5f323032355f323032362d3139323935382d302d39",
      "title": "TPL EC1 Anglais GR M",
      "start": "2026-01-21T10:15:00+01:00",
      "end": "2026-01-21T12:15:00+01:00",
      "allDay": false,
      "location": "Bridoux_TD 15",
      "description": "\n\nLIU Haoran\nGR6 - Anglais\n\n(Modifié le:01/09/2025 20:52)",
      "status": "",
      "url": "",
      "lastModified": "2025-09-01T20:52:00+02:00"
    },
    {
      "id": "ADE60322e706c616e6e696e67554c5f323032355f323032362d3139323935322d302d39",
      "title": "TPL EC1 Anglais GR K",
      "start": "2026-01-21T10:15:00+01:00",
      "end": "2026-01-21T12:15:00+01:00",
      "allDay": false,
      "location": "Bridoux_TD 9",
      "description": "\n\nAGHA NAJA Joudy\nGR4 - Anglais\n\n(Modifié le:01/09/2025 20:41)",
      "status": "",
      "url": "",
      "lastModified": "2025-09-01T20:41:00+02:00"
    },
    {
      "id": "ADE60322e706c616e6e696e67554c5f323032355f323032362d3139323935302d302d30",
      "title": "TPL EC1 Anglais GR J",
      "start": "2026-01-21T10:15:00+01:00",
      "end": "2026-01-21T12:15:00+01:00",
      "allDay": false,
      "location": "Bridoux_TD 7",
      "description": "\n\nDAHMANI Faouzia\nGR3 - Anglais\n\n(Modifié le:01/09/2025 20:38)",
      "status": "",
      "url": "",
      "lastModified": "2025-09-01T20:38:00+02:00"
    },
    {
      "id": "ADE60322e706c616e6e696e67554c5f323032355f323032362d34313433342d302d30",
      "title": "CM E.MATHIS  Problématiques sociales, besoins spécifiques et interv. APAS",
      "start": "2026-01-21T10:15:00+01:00",
      "end": "2026-01-21T12:15:00+01:00",
      "allDay": false,
      "location": "Bridoux_TD 5",
      "description": "\n\nMATHIS Emmanuelle\nCM APAS\n\n(Modifié le:02/12/2025 10:05)",
      "status": "",
      "url": "",
      "lastModified": "2025-12-02T10:05:00+01:00"
    },
    {
      "id": "ADE60322e706c616e6e696e67554c5f323032355f323032362d3139323935332d302d30",
      "title": "TPL EC1 Anglais GR L",
      "start": "2026-01-21T10:15:00+01:00",
      "end": "2026-01-21T12:15:00+01:00",
      "allDay": false,
      "location": "Bridoux_TD 13",
      "description": "\n\nHOFFART Christine\nGR5 - Anglais\n\n(Modifié le:01/09/2025 20:42)",
      "status": "",
      "url": "",
      "lastModified": "2025-09-01T20:42:00+02:00"
    },
    {
      "id": "ADE60322e706c616e6e696e67554c5f323032355f323032362d31303738312d322d30",
      "title": "TD Pédagogie, didactique des APSA à des fins éducatives",
      "start": "2026-01-21T11:00:00+01:00",
      "end": "2026-01-21T12:15:00+01:00",
      "allDay": false,
      "location": "Bridoux_TD 4",
      "description": "\n\nSIMON Luc\nTD EM LAS\nTD EM\n\n(Modifié le:07/11/2025 17:34)",
      "status": "",
      "url": "",
      "lastModified": "2025-11-07T17:34:00+01:00"
    },
    {
      "id": "ADE60322e706c616e6e696e67554c5f323032355f323032362d39353538332d342d30",
      "title": "6.02 EI Droit des sociétés",
      "start": "2026-01-21T13:00:00+01:00",
      "end": "2026-01-21T17:00:00+01:00",
      "allDay": false,
      "location": "Bridoux_TP Start up 2 D16",
      "description": "\n\nLP GDOSSL FI/FC\nLic Pro GDOSSL FA\nROTH David\n\n(Modifié le:13/10/2025 11:02)",
      "status": "",
      "url": "",
      "lastModified": "2025-10-13T11:02:00+02:00"
    },
    {
      "id": "ADE60322e706c616e6e696e67554c5f323032355f323032362d3133313238322d342d30",
      "title": "CM EC Droit du travail et Fiscalité",
      "start": "2026-01-21T13:00:00+01:00",
      "end": "2026-01-21T15:00:00+01:00",
      "allDay": false,
      "location": "Bridoux_TD 5",
      "description": "\n\nNICOLAS Helene\nCM EC Droit du travail et Fiscalité\nCM EC Droit du travail et Fiscalité\nCM EC Droit du travail et Fiscalité\nUE ALT 02\nCM EC Droit du travail et Fiscalité\nCM EC Droit du travail et Fiscalité\nCM EC Droit du travail et Fiscalité\nUE ALT 02\n\n(Modifié le:20/10/2025 12:57)",
      "status": "",
      "url": "",
      "lastModified": "2025-10-20T12:57:00+02:00"
    },
    {
      "id": "ADE60322e706c616e6e696e67554c5f323032355f323032362d31303738312d362d30",
      "title": "TD Pédagogie, didactique des APSA à des fins éducatives",
      "start": "2026-01-21T13:15:00+01:00",
      "end": "2026-01-21T14:15:00+01:00",
      "allDay": false,
      "location": "Bridoux_TD 4",
      "description": "\n\nSIMON Luc\nTD EM LAS\nTD EM\n\n(Modifié le:07/11/2025 17:35)",
      "status": "",
      "url": "",
      "lastModified": "2025-11-07T17:35:00+01:00"
    },
    {
      "id": "ADE60322e706c616e6e696e67554c5f323032355f323032362d36323136342d322d30",
      "title": "TP UE 910 - SIG II",
      "start": "2026-01-21T13:15:00+01:00",
      "end": "2026-01-21T16:15:00+01:00",
      "allDay": false,
      "location": "Bridoux_TP Info6 F2",
      "description": "\n\nSIGNORET-TALANDIER Sandrine\nTP GEMAREC\n\n(Modifié le:08/09/2025 11:35)",
      "status": "",
      "url": "",
      "lastModified": "2025-09-08T11:35:00+02:00"
    },
    {
      "id": "ADE60322e706c616e6e696e67554c5f323032355f323032362d393731332d302d31",
      "title": "CM Savoirs scientifiques en APAS 2",
      "start": "2026-01-21T13:15:00+01:00",
      "end": "2026-01-21T15:15:00+01:00",
      "allDay": false,
      "location": "Bridoux_TD 3",
      "description": "\n\nCM APAS\nCM APAS LAS\nHAINAUT Jean-Philippe\n\n(Modifié le:02/12/2025 16:01)",
      "status": "",
      "url": "",
      "lastModified": "2025-12-02T16:01:00+01:00"
    },
    {
      "id": "ADE60322e706c616e6e696e67554c5f323032355f323032362d3139333235312d302d30",
      "title": "TD UE207 Langue Intern GRE",
      "start": "2026-01-21T13:30:00+01:00",
      "end": "2026-01-21T15:30:00+01:00",
      "allDay": false,
      "location": "Bridoux_TD 18",
      "description": "\n\nAGHA NAJA Joudy\nL1 PC - Anglais GRP E\n\n(Modifié le:29/09/2025 22:47)",
      "status": "",
      "url": "",
      "lastModified": "2025-09-29T22:47:00+02:00"
    },
    {
      "id": "ADE60322e706c616e6e696e67554c5f323032355f323032362d36313139312d322d30",
      "title": "CM UE 806 - Restauration et Ingénierie écologique",
      "start": "2026-01-21T13:30:00+01:00",
      "end": "2026-01-21T17:30:00+01:00",
      "allDay": false,
      "location": "Bridoux_TD 9",
      "description": "\n\nMULLER Timothe\nCM GEMAREC\n\n(Modifié le:10/12/2025 14:57)",
      "status": "",
      "url": "",
      "lastModified": "2025-12-10T14:57:00+01:00"
    },
    {
      "id": "ADE60322e706c616e6e696e67554c5f323032355f323032362d32323736332d342d30",
      "title": "EI UE 505 Enjeux sanitaires et environne. de l'agroécologie",
      "start": "2026-01-21T13:30:00+01:00",
      "end": "2026-01-21T15:30:00+01:00",
      "allDay": false,
      "location": "Bridoux_TD 2",
      "description": "\n\nLPRO Agro ADNT\nCOTELLE Sylvie\n\n(Modifié le:05/11/2025 09:36)",
      "status": "",
      "url": "",
      "lastModified": "2025-11-05T09:36:00+01:00"
    },
    {
      "id": "ADE60322e706c616e6e696e67554c5f323032355f323032362d3133303933362d312d30",
      "title": "Seconde chance Anglais ",
      "start": "2026-01-21T13:30:00+01:00",
      "end": "2026-01-21T15:30:00+01:00",
      "allDay": false,
      "location": "Bridoux_Salle des Actes B14",
      "description": "\n\nPrêt salles et amphi\n\n(Modifié le:17/11/2025 10:27)",
      "status": "",
      "url": "",
      "lastModified": "2025-11-17T10:27:00+01:00"
    },
    {
      "id": "ADE60322e706c616e6e696e67554c5f323032355f323032362d36313739312d352d30",
      "title": "CM UE 817 - Caractérisation et traitement de l'air",
      "start": "2026-01-21T13:30:00+01:00",
      "end": "2026-01-21T17:30:00+01:00",
      "allDay": false,
      "location": "Bridoux_TD 27",
      "description": "\n\nPIERRAT Christophe\nCM GE\n\n(Modifié le:10/12/2025 14:58)",
      "status": "",
      "url": "",
      "lastModified": "2025-12-10T14:58:00+01:00"
    },
    {
      "id": "ADE60322e706c616e6e696e67554c5f323032355f323032362d3136373932322d312d30",
      "title": "TD ME851 Concevoir une transposition didactique en LC- 2",
      "start": "2026-01-21T13:30:00+01:00",
      "end": "2026-01-21T16:30:00+01:00",
      "allDay": false,
      "location": "Bridoux_TD 28",
      "description": "\n\nNADLER Caroline\nM1 MEEF PC\n\n(Modifié le:06/11/2025 16:20)",
      "status": "",
      "url": "",
      "lastModified": "2025-11-06T16:20:00+01:00"
    },
    {
      "id": "ADE60322e706c616e6e696e67554c5f323032355f323032362d3139333234372d302d30",
      "title": "TD UE207 Langue Intern GRD",
      "start": "2026-01-21T13:30:00+01:00",
      "end": "2026-01-21T15:30:00+01:00",
      "allDay": false,
      "location": "Bridoux_TD 17",
      "description": "\n\nWATRIN Pascale\nL1 PC - Anglais GRP D\n\n(Modifié le:29/09/2025 22:47)",
      "status": "",
      "url": "",
      "lastModified": "2025-09-29T22:47:00+02:00"
    },
    {
      "id": "ADE60322e706c616e6e696e67554c5f323032355f323032362d3139333234352d302d30",
      "title": "TD UE207 Langue Intern GRB",
      "start": "2026-01-21T13:30:00+01:00",
      "end": "2026-01-21T15:30:00+01:00",
      "allDay": false,
      "location": "Bridoux_TD 16",
      "description": "\n\nNAVARRO Sylvain\nL1 PC - Anglais GRP B\n\n(Modifié le:02/09/2025 13:13)",
      "status": "",
      "url": "",
      "lastModified": "2025-09-02T13:13:00+02:00"
    },
    {
      "id": "ADE60322e706c616e6e696e67554c5f323032355f323032362d3139333234362d302d39",
      "title": "TD UE207 Langue Intern GRC",
      "start": "2026-01-21T13:30:00+01:00",
      "end": "2026-01-21T15:30:00+01:00",
      "allDay": false,
      "location": "Bridoux_TD 13",
      "description": "\n\nHOFFART Christine\nL1 PC - Anglais GRP C\n\n(Modifié le:02/09/2025 16:26)",
      "status": "",
      "url": "",
      "lastModified": "2025-09-02T16:26:00+02:00"
    },
    {
      "id": "ADE60322e706c616e6e696e67554c5f323032355f323032362d38343738322d312d30",
      "title": "EI 2 Paysage et innovation",
      "start": "2026-01-21T13:30:00+01:00",
      "end": "2026-01-21T17:30:00+01:00",
      "allDay": false,
      "location": "Bridoux_TD 6",
      "description": "\n\nLPRO Agro AAU\nDINSENMEYER Thibaut\n\n(Modifié le:03/12/2025 10:40)",
      "status": "",
      "url": "",
      "lastModified": "2025-12-03T10:40:00+01:00"
    },
    {
      "id": "ADE60322e706c616e6e696e67554c5f323032355f323032362d31363236322d302d35",
      "title": "CM EC 403.2 Chimie minérale 3",
      "start": "2026-01-21T13:30:00+01:00",
      "end": "2026-01-21T15:30:00+01:00",
      "allDay": false,
      "location": "Bridoux_TD 14",
      "description": "\n\nL2 Chimie FC\nL2 Chimie LAS\nL2 Chimie PE\nTD A L2 Chimie\nMEUX Éric\n\n(Modifié le:24/11/2025 12:08)",
      "status": "",
      "url": "",
      "lastModified": "2025-11-24T12:08:00+01:00"
    },
    {
      "id": "ADE60322e706c616e6e696e67554c5f323032355f323032362d3230363630352d302d30",
      "title": "*TD Spécifique pharmacie G04",
      "start": "2026-01-21T14:00:00+01:00",
      "end": "2026-01-21T15:30:00+01:00",
      "allDay": false,
      "location": "Bridoux_TD 29",
      "description": "\n\nNDIAYE Ndeye Coumba\nGroupe 04 Bridoux\n\n(Modifié le:02/12/2025 15:25)",
      "status": "",
      "url": "",
      "lastModified": "2025-12-02T15:25:00+01:00"
    },
    {
      "id": "ADE60322e706c616e6e696e67554c5f323032355f323032362d31303737372d312d30",
      "title": "CM Pédagogie, didactique des APSA à des fins éducatives",
      "start": "2026-01-21T14:30:00+01:00",
      "end": "2026-01-21T18:30:00+01:00",
      "allDay": false,
      "location": "Bridoux_TD 1",
      "description": "\n\nCM EM\nCM EM LAS\nFRIEDRICH Jonathan\n\n(Modifié le:10/11/2025 09:46)",
      "status": "",
      "url": "",
      "lastModified": "2025-11-10T09:46:00+01:00"
    },
    {
      "id": "ADE60322e706c616e6e696e67554c5f323032355f323032362d393731312d302d30",
      "title": "CM Outils et méthodes de recherche 2",
      "start": "2026-01-21T15:30:00+01:00",
      "end": "2026-01-21T17:30:00+01:00",
      "allDay": false,
      "location": "Bridoux_TD 3",
      "description": "\n\nCM APAS\nCM APAS LAS\nHAINAUT Jean-Philippe\n\n(Modifié le:11/12/2025 11:45)",
      "status": "",
      "url": "",
      "lastModified": "2025-12-11T11:45:00+01:00"
    },
    {
      "id": "ADE60322e706c616e6e696e67554c5f323032355f323032362d393430302d302d30",
      "title": "TD UE207 Langue Intern GRA",
      "start": "2026-01-21T15:45:00+01:00",
      "end": "2026-01-21T17:45:00+01:00",
      "allDay": false,
      "location": "Bridoux_TD 16",
      "description": "\n\nNAVARRO Sylvain\nL1 PC - Anglais GRP A\n\n(Modifié le:02/09/2025 13:13)",
      "status": "",
      "url": "",
      "lastModified": "2025-09-02T13:13:00+02:00"
    },
    {
      "id": "ADE60322e706c616e6e696e67554c5f323032355f323032362d3230363539322d302d37",
      "title": "*TD Spécifique pharmacie G03",
      "start": "2026-01-21T15:45:00+01:00",
      "end": "2026-01-21T17:15:00+01:00",
      "allDay": false,
      "location": "Bridoux_TD 29",
      "description": "\n\nNDIAYE Ndeye Coumba\nGroupe 03 Bridoux\n\n(Modifié le:02/12/2025 15:25)",
      "status": "",
      "url": "",
      "lastModified": "2025-12-02T15:25:00+01:00"
    },
    {
      "id": "ADE60322e706c616e6e696e67554c5f323032355f323032362d3134323139342d31352d34",
      "title": "Travaux service technique",
      "start": "2026-01-22T07:00:00+01:00",
      "end": "2026-01-22T19:00:00+01:00",
      "allDay": false,
      "location": "",
      "description": "\n\n\n\n(Modifié le:11/12/2025 11:41)",
      "status": "",
      "url": "",
      "lastModified": "2025-12-11T11:41:00+01:00"
    },
    {
      "id": "ADE60322e706c616e6e696e67554c5f323032355f323032362d37333937362d302d3239",
      "title": "Prêt salle IFSI TD 16 SN",
      "start": "2026-01-22T08:00:00+01:00",
      "end": "2026-01-22T10:00:00+01:00",
      "allDay": false,
      "location": "Bridoux_TD 16",
      "description": "\n\nNAVARRO Sylvain\nTD IFSI PRET SALLE\n\n(Modifié le:13/05/2025 12:38)",
      "status": "",
      "url": "",
      "lastModified": "2025-05-13T12:38:00+02:00"
    },
    {
      "id": "ADE60322e706c616e6e696e67554c5f323032355f323032362d36313731352d372d30",
      "title": "CM UE 805 - Ressources Naturelles",
      "start": "2026-01-22T08:00:00+01:00",
      "end": "2026-01-22T10:00:00+01:00",
      "allDay": false,
      "location": "Bridoux_TD 9",
      "description": "\n\nCM ETOX\nCM GEMAREC\nARAN Delphine\n\n(Modifié le:08/12/2025 14:58)",
      "status": "",
      "url": "",
      "lastModified": "2025-12-08T14:58:00+01:00"
    },
    {
      "id": "ADE60322e706c616e6e696e67554c5f323032355f323032362d3138353239322d302d3238",
      "title": "Prêt salle IFSI TD 17 MU",
      "start": "2026-01-22T08:00:00+01:00",
      "end": "2026-01-22T10:00:00+01:00",
      "allDay": false,
      "location": "Bridoux_TD 17",
      "description": "\n\nTD IFSI PRET SALLE\nUBASSY Mickaël\n\n(Modifié le:13/05/2025 13:01)",
      "status": "",
      "url": "",
      "lastModified": "2025-05-13T13:01:00+02:00"
    },
    {
      "id": "ADE60322e706c616e6e696e67554c5f323032355f323032362d36333932302d302d30",
      "title": "TP C NUMOC",
      "start": "2026-01-22T08:00:00+01:00",
      "end": "2026-01-22T10:00:00+01:00",
      "allDay": false,
      "location": "Bridoux_TP Info1 C1",
      "description": "\n\nTP  C*\nGALLIZZI Adrienne\n\n(Modifié le:01/12/2025 11:33)",
      "status": "",
      "url": "",
      "lastModified": "2025-12-01T11:33:00+01:00"
    },
    {
      "id": "ADE60322e706c616e6e696e67554c5f323032355f323032362d363438362d312d30",
      "title": "EI AB Algorithmique",
      "start": "2026-01-22T08:00:00+01:00",
      "end": "2026-01-22T10:00:00+01:00",
      "allDay": false,
      "location": "Bridoux_TD 14",
      "description": "\n\nTP  A*\nTP  B*\nCAMARA Baba Issa\n\n(Modifié le:03/12/2025 16:44)",
      "status": "",
      "url": "",
      "lastModified": "2025-12-03T16:44:00+01:00"
    },
    {
      "id": "ADE60322e706c616e6e696e67554c5f323032355f323032362d31303831352d312d30",
      "title": "CM EC 402.1 Chimie organique 2",
      "start": "2026-01-22T08:00:00+01:00",
      "end": "2026-01-22T10:00:00+01:00",
      "allDay": false,
      "location": "Bridoux_TD 8",
      "description": "\n\nL2 Chimie FC\nL2 Chimie LAS\nL2 PC\nL2 PC LAS\nL2 Chimie PE\nL2 PC PE\nTD A L2 Chimie\nSINDT Michèle\n\n(Modifié le:25/11/2025 15:24)",
      "status": "",
      "url": "",
      "lastModified": "2025-11-25T15:24:00+01:00"
    },
    {
      "id": "ADE60322e706c616e6e696e67554c5f323032355f323032362d3130343839352d322d30",
      "title": "CM 401.2 Algèbre 4",
      "start": "2026-01-22T08:00:00+01:00",
      "end": "2026-01-22T10:00:00+01:00",
      "allDay": false,
      "location": "Bridoux_TD 15",
      "description": "\n\nGRANDATI Yves\nL2 Physique FC\nL2 Physique LAS\nL2 Physique PE\nTD L2 Physique\n\n(Modifié le:10/12/2025 15:35)",
      "status": "",
      "url": "",
      "lastModified": "2025-12-10T15:35:00+01:00"
    },
    {
      "id": "ADE60322e706c616e6e696e67554c5f323032355f323032362d3133313031322d312d30",
      "title": "EI 2 EC 202.1 Electromagnétisme ",
      "start": "2026-01-22T08:00:00+01:00",
      "end": "2026-01-22T10:00:00+01:00",
      "allDay": false,
      "location": "Bridoux_TD 28",
      "description": "\n\nTP C Portail PC\nTP D Portail PC\nDALMASSO Stéphane\n\n(Modifié le:15/12/2025 09:33)",
      "status": "",
      "url": "",
      "lastModified": "2025-12-15T09:33:00+01:00"
    },
    {
      "id": "ADE60322e706c616e6e696e67554c5f323032355f323032362d3133313936382d312d30",
      "title": "EI 1 EC 203.1 Introduction à la chimie organique ",
      "start": "2026-01-22T08:00:00+01:00",
      "end": "2026-01-22T10:00:00+01:00",
      "allDay": false,
      "location": "Bridoux_TD 18",
      "description": "\n\nTP A Portail PC\nTP B Portail PC\nCOMOY Corinne\n\n(Modifié le:12/12/2025 15:06)",
      "status": "",
      "url": "",
      "lastModified": "2025-12-12T15:06:00+01:00"
    },
    {
      "id": "ADE60322e706c616e6e696e67554c5f323032355f323032362d3230383539372d302d30",
      "title": "TD 1020 Contexte d'exercice du métier EPA+EPR/Groupe5",
      "start": "2026-01-22T09:00:00+01:00",
      "end": "2026-01-22T12:00:00+01:00",
      "allDay": false,
      "location": "",
      "description": "\n\n\n\n(Modifié le:05/09/2025 11:41)",
      "status": "",
      "url": "",
      "lastModified": "2025-09-05T11:41:00+02:00"
    },
    {
      "id": "ADE60322e706c616e6e696e67554c5f323032355f323032362d39353630322d35302d30",
      "title": "PRJ Préparation du projet tutoré",
      "start": "2026-01-22T09:00:00+01:00",
      "end": "2026-01-22T11:00:00+01:00",
      "allDay": false,
      "location": "Bridoux_TP Start up 1 D14BIS",
      "description": "\n\nLP GDOSSL FI/FC\n\n(Modifié le:08/12/2025 14:52)",
      "status": "",
      "url": "",
      "lastModified": "2025-12-08T14:52:00+01:00"
    },
    {
      "id": "ADE60322e706c616e6e696e67554c5f323032355f323032362d3137313333322d332d30",
      "title": "TD 1020 Contexte d'exercice du métier EPA+EPR/Groupe4",
      "start": "2026-01-22T09:00:00+01:00",
      "end": "2026-01-22T12:00:00+01:00",
      "allDay": false,
      "location": "",
      "description": "\n\n\n\n(Modifié le:15/10/2025 12:43)",
      "status": "",
      "url": "",
      "lastModified": "2025-10-15T12:43:00+02:00"
    },
    {
      "id": "ADE60322e706c616e6e696e67554c5f323032355f323032362d38393832322d312d30",
      "title": "TD ME840 Didact. disciplinaire et mise en ?uvre des programmes",
      "start": "2026-01-22T09:00:00+01:00",
      "end": "2026-01-22T12:00:00+01:00",
      "allDay": false,
      "location": "Bridoux_TD 24",
      "description": "\n\nPESCARA Sylvain\nPrépa CAPES STAPS EDT M1\nM1 MEEF EPS - Groupe A\nM1 MEEF EPS - Groupe B\n\n(Modifié le:22/09/2025 11:04)",
      "status": "",
      "url": "",
      "lastModified": "2025-09-22T11:04:00+02:00"
    },
    {
      "id": "ADE60322e706c616e6e696e67554c5f323032355f323032362d3230383538372d302d30",
      "title": "TD 1020 Contexte d'exercice du métier EPA+EPR/Groupe3",
      "start": "2026-01-22T09:00:00+01:00",
      "end": "2026-01-22T12:00:00+01:00",
      "allDay": false,
      "location": "",
      "description": "\n\n\n\n(Modifié le:20/06/2025 12:43)",
      "status": "",
      "url": "",
      "lastModified": "2025-06-20T12:43:00+02:00"
    },
    {
      "id": "ADE60322e706c616e6e696e67554c5f323032355f323032362d37333937362d302d3330",
      "title": "Prêt salle IFSI TD 16 SN",
      "start": "2026-01-22T10:00:00+01:00",
      "end": "2026-01-22T12:00:00+01:00",
      "allDay": false,
      "location": "Bridoux_TD 16",
      "description": "\n1688628007611\nNAVARRO Sylvain\nTD IFSI PRET SALLE\n\n(Modifié le:13/05/2025 12:38)",
      "status": "",
      "url": "",
      "lastModified": "2025-05-13T12:38:00+02:00"
    },
    {
      "id": "ADE60322e706c616e6e696e67554c5f323032355f323032362d3138353239322d302d3331",
      "title": "Prêt salle IFSI TD 17 MU",
      "start": "2026-01-22T10:00:00+01:00",
      "end": "2026-01-22T12:00:00+01:00",
      "allDay": false,
      "location": "Bridoux_TD 17",
      "description": "\n\nTD IFSI PRET SALLE\nUBASSY Mickaël\n\n(Modifié le:13/05/2025 13:01)",
      "status": "",
      "url": "",
      "lastModified": "2025-05-13T13:01:00+02:00"
    },
    {
      "id": "ADE60322e706c616e6e696e67554c5f323032355f323032362d31313231392d342d30",
      "title": "CM Physiotoxicology",
      "start": "2026-01-22T10:15:00+01:00",
      "end": "2026-01-22T12:15:00+01:00",
      "allDay": false,
      "location": "Bridoux_TD 15",
      "description": "\n\nMASFARAUD Jean-François\nTP  D*\nTP  C*\n\n(Modifié le:10/12/2025 16:04)",
      "status": "",
      "url": "",
      "lastModified": "2025-12-10T16:04:00+01:00"
    },
    {
      "id": "ADE60322e706c616e6e696e67554c5f323032355f323032362d32323335382d352d30",
      "title": "EI 2 Gestion et analyse de données",
      "start": "2026-01-22T10:15:00+01:00",
      "end": "2026-01-22T12:15:00+01:00",
      "allDay": false,
      "location": "Bridoux_TD 18",
      "description": "\n\nQUEVREUX Pierre\nLPRO Agro AAU\nLPRO Agro ADNT\n\n(Modifié le:03/12/2025 12:21)",
      "status": "",
      "url": "",
      "lastModified": "2025-12-03T12:21:00+01:00"
    },
    {
      "id": "ADE60322e706c616e6e696e67554c5f323032355f323032362d36333238342d312d30",
      "title": "EI EF Algorithmique",
      "start": "2026-01-22T10:15:00+01:00",
      "end": "2026-01-22T12:15:00+01:00",
      "allDay": false,
      "location": "Bridoux_TD 14",
      "description": "\n\nTP  E*\nTP  F*\nCAMARA Baba Issa\n\n(Modifié le:03/12/2025 16:44)",
      "status": "",
      "url": "",
      "lastModified": "2025-12-03T16:44:00+01:00"
    },
    {
      "id": "ADE60322e706c616e6e696e67554c5f323032355f323032362d3133303736372d322d30",
      "title": "EI 2 UE 201 Mathématiques 2",
      "start": "2026-01-22T10:15:00+01:00",
      "end": "2026-01-22T12:15:00+01:00",
      "allDay": false,
      "location": "Bridoux_TD 28",
      "description": "\n\nTP C Portail PC\nTP D Portail PC\nGLEIZE Jérôme\n\n(Modifié le:12/12/2025 16:19)",
      "status": "",
      "url": "",
      "lastModified": "2025-12-12T16:19:00+01:00"
    },
    {
      "id": "ADE60322e706c616e6e696e67554c5f323032355f323032362d31303938382d302d30",
      "title": "CM EC 401.1 Thermodynamique de la réaction chimique",
      "start": "2026-01-22T10:15:00+01:00",
      "end": "2026-01-22T12:15:00+01:00",
      "allDay": false,
      "location": "Bridoux_TD 7",
      "description": "\n\nACHARD Christian\nL2 Chimie FC\nL2 Chimie LAS\nL2 PC\nL2 PC LAS\nL2 Chimie PE\nL2 PC PE\nTD A L2 Chimie\n\n(Modifié le:25/11/2025 15:24)",
      "status": "",
      "url": "",
      "lastModified": "2025-11-25T15:24:00+01:00"
    },
    {
      "id": "ADE60322e706c616e6e696e67554c5f323032355f323032362d383839342d332d30",
      "title": "EI 1 EC 202.1 Electromagnétisme ",
      "start": "2026-01-22T10:15:00+01:00",
      "end": "2026-01-22T12:15:00+01:00",
      "allDay": false,
      "location": "Bridoux_TD 13",
      "description": "\n\nTP A Portail PC\nTP B Portail PC\nWAX Jean-François\n\n(Modifié le:12/12/2025 14:51)",
      "status": "",
      "url": "",
      "lastModified": "2025-12-12T14:51:00+01:00"
    },
    {
      "id": "ADE60322e706c616e6e696e67554c5f323032355f323032362d393531392d302d31",
      "title": "TD Projet Professionnel Personnalisé en APAS",
      "start": "2026-01-22T10:15:00+01:00",
      "end": "2026-01-22T12:15:00+01:00",
      "allDay": false,
      "location": "Bridoux_TP Start up 2 D16",
      "description": "\n\nTD APAS\nASSELIN Marine\n\n(Modifié le:05/12/2025 16:17)",
      "status": "",
      "url": "",
      "lastModified": "2025-12-05T16:17:00+01:00"
    },
    {
      "id": "ADE60322e706c616e6e696e67554c5f323032355f323032362d31343239382d302d30",
      "title": "CM 404.1 Mécanique des fluides",
      "start": "2026-01-22T10:15:00+01:00",
      "end": "2026-01-22T12:15:00+01:00",
      "allDay": false,
      "location": "Bridoux_TD 12",
      "description": "\n\nXU Hong\nL2 Physique PE\nTD L2 Physique\n\n(Modifié le:28/11/2025 11:35)",
      "status": "",
      "url": "",
      "lastModified": "2025-11-28T11:35:00+01:00"
    },
    {
      "id": "ADE60322e706c616e6e696e67554c5f323032355f323032362d31313237372d392d30",
      "title": "CM Physiologie: régulation des fonctions",
      "start": "2026-01-22T10:15:00+01:00",
      "end": "2026-01-22T12:15:00+01:00",
      "allDay": false,
      "location": "Bridoux_TD 8",
      "description": "\n\nFELTEN Vincent\nTP  A*\nTP  B*\n\n(Modifié le:09/12/2025 16:01)",
      "status": "",
      "url": "",
      "lastModified": "2025-12-09T16:01:00+01:00"
    },
    {
      "id": "ADE60322e706c616e6e696e67554c5f323032355f323032362d36333939372d302d30",
      "title": "TP D NUMOC",
      "start": "2026-01-22T10:15:00+01:00",
      "end": "2026-01-22T12:15:00+01:00",
      "allDay": false,
      "location": "Bridoux_TP Info1 C1",
      "description": "\n\nTP  D*\nGALLIZZI Adrienne\n\n(Modifié le:01/12/2025 11:33)",
      "status": "",
      "url": "",
      "lastModified": "2025-12-01T11:33:00+01:00"
    },
    {
      "id": "ADE60322e706c616e6e696e67554c5f323032355f323032362d36313736322d352d30",
      "title": "CM UE 814 - Traitement physico-chimique des déchets",
      "start": "2026-01-22T10:15:00+01:00",
      "end": "2026-01-22T12:15:00+01:00",
      "allDay": false,
      "location": "Bridoux_TD 27",
      "description": "\n\nMEUX Éric\nCM GE\n\n(Modifié le:18/11/2025 17:49)",
      "status": "",
      "url": "",
      "lastModified": "2025-11-18T17:49:00+01:00"
    },
    {
      "id": "ADE60322e706c616e6e696e67554c5f323032355f323032362d31303835372d332d30",
      "title": "TD Approche socio-historique des pédagogies corporelles",
      "start": "2026-01-22T10:15:00+01:00",
      "end": "2026-01-22T12:15:00+01:00",
      "allDay": false,
      "location": "Bridoux_TD 5",
      "description": "\n\nCREMONI Jerome\nTD EM LAS\nTD EM\n\n(Modifié le:03/12/2025 10:08)",
      "status": "",
      "url": "",
      "lastModified": "2025-12-03T10:08:00+01:00"
    },
    {
      "id": "ADE60322e706c616e6e696e67554c5f323032355f323032362d39303432312d302d30",
      "title": "EI ME840 Didact. disciplinaire et mise en ?uvre des programmes",
      "start": "2026-01-22T13:00:00+01:00",
      "end": "2026-01-22T16:00:00+01:00",
      "allDay": false,
      "location": "Bridoux_TD 1",
      "description": "\n\nPrépa CAPES STAPS EDT M1\nM1 MEEF EPS - Groupe A\nM1 MEEF EPS - Groupe B\nVINCENT Cyrille\n\n(Modifié le:22/09/2025 11:04)",
      "status": "",
      "url": "",
      "lastModified": "2025-09-22T11:04:00+02:00"
    },
    {
      "id": "ADE60322e706c616e6e696e67554c5f323032355f323032362d38343736362d31322d30",
      "title": "EI Paysage et vie du sol : botanique et écologie urbaine",
      "start": "2026-01-22T13:00:00+01:00",
      "end": "2026-01-22T17:00:00+01:00",
      "allDay": false,
      "location": "Bridoux_TD 4",
      "description": "\n\nLPRO Agro AAU\nEnseignant 2\n\n(Modifié le:15/12/2025 09:37)",
      "status": "",
      "url": "",
      "lastModified": "2025-12-15T09:37:00+01:00"
    },
    {
      "id": "ADE60322e706c616e6e696e67554c5f323032355f323032362d393531342d302d30",
      "title": "TD Conception et organisation de projets/événements en APAS 2",
      "start": "2026-01-22T13:15:00+01:00",
      "end": "2026-01-22T15:15:00+01:00",
      "allDay": false,
      "location": "Bridoux_TP Start up 1 D14BIS",
      "description": "\n\nTD APAS\nASSELIN Marine\n\n(Modifié le:05/12/2025 16:22)",
      "status": "",
      "url": "",
      "lastModified": "2025-12-05T16:22:00+01:00"
    },
    {
      "id": "ADE60322e706c616e6e696e67554c5f323032355f323032362d36323136342d342d30",
      "title": "TP UE 910 - SIG II",
      "start": "2026-01-22T13:15:00+01:00",
      "end": "2026-01-22T16:15:00+01:00",
      "allDay": false,
      "location": "Bridoux_TP Info6 F2",
      "description": "\n\nSIGNORET-TALANDIER Sandrine\nTP GEMAREC\n\n(Modifié le:08/09/2025 11:35)",
      "status": "",
      "url": "",
      "lastModified": "2025-09-08T11:35:00+02:00"
    },
    {
      "id": "ADE60322e706c616e6e696e67554c5f323032355f323032362d3136343638362d302d30",
      "title": "Examen 964/1064",
      "start": "2026-01-22T13:30:00+01:00",
      "end": "2026-01-22T15:30:00+01:00",
      "allDay": false,
      "location": "Bridoux_TD 28",
      "description": "\n\nM2 M-PC\nM2 MEEF PC\nCOSTELLA Stephanie\nREVEILLIEZ Christophe\n\n(Modifié le:12/11/2025 15:39)",
      "status": "",
      "url": "",
      "lastModified": "2025-11-12T15:39:00+01:00"
    },
    {
      "id": "ADE60322e706c616e6e696e67554c5f323032355f323032362d36313739312d362d30",
      "title": "CM UE 817 - Caractérisation et traitement de l'air",
      "start": "2026-01-22T13:30:00+01:00",
      "end": "2026-01-22T16:30:00+01:00",
      "allDay": false,
      "location": "Bridoux_TD 27",
      "description": "\n\nPIERRAT Christophe\nCM GE\n\n(Modifié le:10/12/2025 15:01)",
      "status": "",
      "url": "",
      "lastModified": "2025-12-10T15:01:00+01:00"
    },
    {
      "id": "ADE60322e706c616e6e696e67554c5f323032355f323032362d39333138362d312d30",
      "title": "TD ME1040 Didactique disciplinaire, mise en oeuvre des program.",
      "start": "2026-01-22T13:30:00+01:00",
      "end": "2026-01-22T16:30:00+01:00",
      "allDay": false,
      "location": "Bridoux_TD 24",
      "description": "\n\nM2 MEEF EPS\nPESCARA Sylvain\n\n(Modifié le:22/09/2025 11:05)",
      "status": "",
      "url": "",
      "lastModified": "2025-09-22T11:05:00+02:00"
    },
    {
      "id": "ADE60322e706c616e6e696e67554c5f323032355f323032362d31313039332d302d30",
      "title": "CM EC 401.2 Cinétique chimique",
      "start": "2026-01-22T13:30:00+01:00",
      "end": "2026-01-22T15:30:00+01:00",
      "allDay": false,
      "location": "Bridoux_TD 18",
      "description": "\n\nGHARRED Nawres\nL2 Chimie FC\nL2 Chimie LAS\nL2 PC\nL2 PC LAS\nL2 PC PE\nTD A L2 Chimie\n\n(Modifié le:25/11/2025 15:24)",
      "status": "",
      "url": "",
      "lastModified": "2025-11-25T15:24:00+01:00"
    },
    {
      "id": "ADE60322e706c616e6e696e67554c5f323032355f323032362d34333036302d302d30",
      "title": "TD GR.EM2  Badminton",
      "start": "2026-01-22T13:30:00+01:00",
      "end": "2026-01-22T15:30:00+01:00",
      "allDay": false,
      "location": "Bridoux_TD 12",
      "description": "\n\nGR.TD/TP EM2\nMINAR Yann\n\n(Modifié le:15/12/2025 09:37)",
      "status": "",
      "url": "",
      "lastModified": "2025-12-15T09:37:00+01:00"
    },
    {
      "id": "ADE60322e706c616e6e696e67554c5f323032355f323032362d31313238362d302d30",
      "title": "TD AB Toxicologie fondamentale",
      "start": "2026-01-22T13:30:00+01:00",
      "end": "2026-01-22T15:30:00+01:00",
      "allDay": false,
      "location": "Bridoux_TD 15",
      "description": "\n\nFAUPIN Solène\nTP  A*\nTP  B*\n\n(Modifié le:05/12/2025 11:57)",
      "status": "",
      "url": "",
      "lastModified": "2025-12-05T11:57:00+01:00"
    },
    {
      "id": "ADE60322e706c616e6e696e67554c5f323032355f323032362d36333333342d302d30",
      "title": "TD EF Projet Personnel et Professionnel",
      "start": "2026-01-22T13:30:00+01:00",
      "end": "2026-01-22T15:30:00+01:00",
      "allDay": false,
      "location": "Bridoux_TP Info3 C7",
      "description": "\n\nTP  E*\nTP  F*\nDUVAL Alienor\n\n(Modifié le:12/12/2025 15:42)",
      "status": "",
      "url": "",
      "lastModified": "2025-12-12T15:42:00+01:00"
    },
    {
      "id": "ADE60322e706c616e6e696e67554c5f323032355f323032362d3133303833302d32302d30",
      "title": "EI 1 UE 201 Mathématiques 2",
      "start": "2026-01-22T13:30:00+01:00",
      "end": "2026-01-22T15:30:00+01:00",
      "allDay": false,
      "location": "Bridoux_TD 2",
      "description": "\n\nGRANDCOLAS Michel\nTP A Portail PC\nTP B Portail PC\n\n(Modifié le:12/12/2025 13:48)",
      "status": "",
      "url": "",
      "lastModified": "2025-12-12T13:48:00+01:00"
    },
    {
      "id": "ADE60322e706c616e6e696e67554c5f323032355f323032362d31363536362d302d30",
      "title": "CM 401.1 Analyse 4",
      "start": "2026-01-22T13:30:00+01:00",
      "end": "2026-01-22T16:30:00+01:00",
      "allDay": false,
      "location": "Bridoux_TD 9",
      "description": "\n\nL2 Physique FC\nL2 Physique LAS\nL2 Physique PE\nTD L2 Physique\nMÜLLER Martin\n\n(Modifié le:28/11/2025 11:36)",
      "status": "",
      "url": "",
      "lastModified": "2025-11-28T11:36:00+01:00"
    },
    {
      "id": "ADE60322e706c616e6e696e67554c5f323032355f323032362d3139333237382d302d30",
      "title": "UE 809 TP ANGLAIS - GR. B",
      "start": "2026-01-22T13:30:00+01:00",
      "end": "2026-01-22T15:30:00+01:00",
      "allDay": false,
      "location": "Bridoux_TD 17",
      "description": "\n\nUBASSY Mickaël\nTP ANGLAIS - GRP B\n\n(Modifié le:13/05/2025 13:28)",
      "status": "",
      "url": "",
      "lastModified": "2025-05-13T13:28:00+02:00"
    },
    {
      "id": "ADE60322e706c616e6e696e67554c5f323032355f323032362d31313334392d302d31",
      "title": "TD GR2 EC 801.1 Sauveteurs et Secouristes du Travail",
      "start": "2026-01-22T13:30:00+01:00",
      "end": "2026-01-22T18:30:00+01:00",
      "allDay": false,
      "location": "Bridoux_TP Start up 2 D16",
      "description": "\n\nGroupe 2 M1 Chimie\nCREMONI Jerome\n\n(Modifié le:10/12/2025 11:23)",
      "status": "",
      "url": "",
      "lastModified": "2025-12-10T11:23:00+01:00"
    },
    {
      "id": "ADE60322e706c616e6e696e67554c5f323032355f323032362d31303734352d302d30",
      "title": "TD Prof. Écoles / contexte et ouverture",
      "start": "2026-01-22T13:30:00+01:00",
      "end": "2026-01-22T15:30:00+01:00",
      "allDay": false,
      "location": "Bridoux_TD 5",
      "description": "\n\nTD EM\nJESSEL Jean-Jacques\n\n(Modifié le:01/12/2025 13:27)",
      "status": "",
      "url": "",
      "lastModified": "2025-12-01T13:27:00+01:00"
    },
    {
      "id": "ADE60322e706c616e6e696e67554c5f323032355f323032362d39353630322d35332d30",
      "title": "PRJ Préparation du projet tutoré",
      "start": "2026-01-22T13:30:00+01:00",
      "end": "2026-01-22T15:30:00+01:00",
      "allDay": false,
      "location": "Bridoux_TD 8",
      "description": "\n\nLP GDOSSL FI/FC\n\n(Modifié le:08/12/2025 14:52)",
      "status": "",
      "url": "",
      "lastModified": "2025-12-08T14:52:00+01:00"
    },
    {
      "id": "ADE60322e706c616e6e696e67554c5f323032355f323032362d373539342d302d30",
      "title": "UE 809 TP ANGLAIS - GR. A",
      "start": "2026-01-22T13:30:00+01:00",
      "end": "2026-01-22T15:30:00+01:00",
      "allDay": false,
      "location": "Bridoux_TD 16",
      "description": "\n\nNAVARRO Sylvain\nTP ANGLAIS - GRP A\n\n(Modifié le:13/05/2025 13:19)",
      "status": "",
      "url": "",
      "lastModified": "2025-05-13T13:19:00+02:00"
    },
    {
      "id": "ADE60322e706c616e6e696e67554c5f323032355f323032362d353239362d332d30",
      "title": "TD AB Génétique fondamentale",
      "start": "2026-01-22T13:30:00+01:00",
      "end": "2026-01-22T15:30:00+01:00",
      "allDay": false,
      "location": "Bridoux_TD 14",
      "description": "\n\nRODIUS François\nTP  A*\nTP  B*\n\n(Modifié le:08/12/2025 15:16)",
      "status": "",
      "url": "",
      "lastModified": "2025-12-08T15:16:00+01:00"
    },
    {
      "id": "ADE60322e706c616e6e696e67554c5f323032355f323032362d3139393833382d332d30",
      "title": "TP2 UE 803 - SIG I",
      "start": "2026-01-22T14:00:00+01:00",
      "end": "2026-01-22T17:00:00+01:00",
      "allDay": false,
      "location": "Bridoux_TP Info2 C5",
      "description": "\n\nZELL BOUTTER Sandrine\nTP GRP 2\n\n(Modifié le:24/11/2025 11:36)",
      "status": "",
      "url": "",
      "lastModified": "2025-11-24T11:36:00+01:00"
    },
    {
      "id": "ADE60322e706c616e6e696e67554c5f323032355f323032362d31313730312d302d30",
      "title": "CM EC Marketing",
      "start": "2026-01-22T14:00:00+01:00",
      "end": "2026-01-22T17:00:00+01:00",
      "allDay": false,
      "location": "Bridoux_TD 7",
      "description": "\n\nWOLLJUNG Serge\nUE ALT 04\nCM EC Marketing\nCM EC Marketing\nCM EC Marketing\nUE ALT 04\nCM EC Marketing\nCM EC Marketing\nCM EC Marketing\n\n(Modifié le:10/12/2025 15:00)",
      "status": "",
      "url": "",
      "lastModified": "2025-12-10T15:00:00+01:00"
    },
    {
      "id": "ADE60322e706c616e6e696e67554c5f323032355f323032362d3230363539302d302d30",
      "title": "*TD Spécifique pharmacie G02",
      "start": "2026-01-22T14:00:00+01:00",
      "end": "2026-01-22T15:30:00+01:00",
      "allDay": false,
      "location": "Bridoux_TD 29",
      "description": "\n\nNDIAYE Ndeye Coumba\nGroupe 02 Bridoux\n\n(Modifié le:02/12/2025 15:26)",
      "status": "",
      "url": "",
      "lastModified": "2025-12-02T15:26:00+01:00"
    },
    {
      "id": "ADE60322e706c616e6e696e67554c5f323032355f323032362d3135373433352d302d30",
      "title": "TD Pratiques d'intervention et programmes APAS",
      "start": "2026-01-22T15:30:00+01:00",
      "end": "2026-01-22T17:30:00+01:00",
      "allDay": false,
      "location": "Bridoux_TP Start up 1 D14BIS",
      "description": "\n\nASSELIN Marine\nTD APAS\nTD APAS LAS\n\n(Modifié le:11/12/2025 16:31)",
      "status": "",
      "url": "",
      "lastModified": "2025-12-11T16:31:00+01:00"
    },
    {
      "id": "ADE60322e706c616e6e696e67554c5f323032355f323032362d3139333237382d302d31",
      "title": "UE 809 TP ANGLAIS - GR. B",
      "start": "2026-01-22T15:30:00+01:00",
      "end": "2026-01-22T17:30:00+01:00",
      "allDay": false,
      "location": "Bridoux_TD 17",
      "description": "\n\nUBASSY Mickaël\nTP ANGLAIS - GRP B\n\n(Modifié le:13/05/2025 13:28)",
      "status": "",
      "url": "",
      "lastModified": "2025-05-13T13:28:00+02:00"
    },
    {
      "id": "ADE60322e706c616e6e696e67554c5f323032355f323032362d373539342d302d31",
      "title": "UE 809 TP ANGLAIS - GR. A",
      "start": "2026-01-22T15:30:00+01:00",
      "end": "2026-01-22T17:30:00+01:00",
      "allDay": false,
      "location": "Bridoux_TD 16",
      "description": "\n\nNAVARRO Sylvain\nTP ANGLAIS - GRP A\n\n(Modifié le:13/05/2025 13:19)",
      "status": "",
      "url": "",
      "lastModified": "2025-05-13T13:19:00+02:00"
    },
    {
      "id": "ADE60322e706c616e6e696e67554c5f323032355f323032362d31303834352d302d30",
      "title": "CM Approche socio-historique des pédagogies corporelles",
      "start": "2026-01-22T15:45:00+01:00",
      "end": "2026-01-22T17:45:00+01:00",
      "allDay": false,
      "location": "Bridoux_TD 3",
      "description": "\n\nCM EM\nCM EM LAS\nHAUBER-MULLER Thomas\n\n(Modifié le:01/12/2025 15:54)",
      "status": "",
      "url": "",
      "lastModified": "2025-12-01T15:54:00+01:00"
    },
    {
      "id": "ADE60322e706c616e6e696e67554c5f323032355f323032362d36323438342d332d30",
      "title": "TD CD Génétique fondamentale",
      "start": "2026-01-22T15:45:00+01:00",
      "end": "2026-01-22T17:45:00+01:00",
      "allDay": false,
      "location": "Bridoux_TD 14",
      "description": "\n\nRODIUS François\nTP  C*\nTP  D*\n\n(Modifié le:08/12/2025 15:16)",
      "status": "",
      "url": "",
      "lastModified": "2025-12-08T15:16:00+01:00"
    },
    {
      "id": "ADE60322e706c616e6e696e67554c5f323032355f323032362d3230363538322d302d37",
      "title": "*TD Spécifique pharmacie G01",
      "start": "2026-01-22T15:45:00+01:00",
      "end": "2026-01-22T17:15:00+01:00",
      "allDay": false,
      "location": "Bridoux_TD 29",
      "description": "\n\nNDIAYE Ndeye Coumba\nGroupe 01 Bridoux\n\n(Modifié le:02/12/2025 15:26)",
      "status": "",
      "url": "",
      "lastModified": "2025-12-02T15:26:00+01:00"
    },
    {
      "id": "ADE60322e706c616e6e696e67554c5f323032355f323032362d39343238352d302d30",
      "title": "TD ME1062 Gérer une classe, avoir une apporoche réflexive",
      "start": "2026-01-22T16:30:00+01:00",
      "end": "2026-01-22T18:30:00+01:00",
      "allDay": false,
      "location": "Bridoux_TD 24",
      "description": "\n\nPESCARA Sylvain\nM2 MEEF EPS\n\n(Modifié le:22/09/2025 11:05)",
      "status": "",
      "url": "",
      "lastModified": "2025-09-22T11:05:00+02:00"
    },
    {
      "id": "ADE60322e706c616e6e696e67554c5f323032355f323032362d3134323139342d362d32",
      "title": "Travaux service technique",
      "start": "2026-01-23T07:00:00+01:00",
      "end": "2026-01-23T19:00:00+01:00",
      "allDay": false,
      "location": "",
      "description": "\n\n\n\n(Modifié le:11/12/2025 11:41)",
      "status": "",
      "url": "",
      "lastModified": "2025-12-11T11:41:00+01:00"
    },
    {
      "id": "ADE60322e706c616e6e696e67554c5f323032355f323032362d31313230352d302d31",
      "title": "CM 402.1 Thermodynamique",
      "start": "2026-01-23T08:00:00+01:00",
      "end": "2026-01-23T10:00:00+01:00",
      "allDay": false,
      "location": "Bridoux_TD 13",
      "description": "\n\nL2 Physique FC\nL2 Physique LAS\nL2 PC\nL2 PC LAS\nL2 Physique PE\nL2 PC PE\nTD L2 Physique\nWAX Jean-François\n\n(Modifié le:28/11/2025 11:36)",
      "status": "",
      "url": "",
      "lastModified": "2025-11-28T11:36:00+01:00"
    },
    {
      "id": "ADE60322e706c616e6e696e67554c5f323032355f323032362d31313130352d342d30",
      "title": "TP C Géologie et pédologie approfondies",
      "start": "2026-01-23T08:00:00+01:00",
      "end": "2026-01-23T12:00:00+01:00",
      "allDay": false,
      "location": "Bridoux_TP Cuenot E1",
      "description": "\n\nARAN Delphine\nTP  C*Option Géologie & pédologie \n\n(Modifié le:04/12/2025 15:14)",
      "status": "",
      "url": "",
      "lastModified": "2025-12-04T15:14:00+01:00"
    },
    {
      "id": "ADE60322e706c616e6e696e67554c5f323032355f323032362d31343732342d302d32",
      "title": "CM EC 601.1 Bases d'électrochimie",
      "start": "2026-01-23T08:00:00+01:00",
      "end": "2026-01-23T10:00:00+01:00",
      "allDay": false,
      "location": "Bridoux_TD 12",
      "description": "\n\nBOULANGER Clotilde\nL3 Chimie FC\nL3 Chimie LAS\nTD - L3 Chimie\n\n(Modifié le:25/11/2025 12:32)",
      "status": "",
      "url": "",
      "lastModified": "2025-11-25T12:32:00+01:00"
    },
    {
      "id": "ADE60322e706c616e6e696e67554c5f323032355f323032362d32383139352d302d3130",
      "title": "UE 909 TP ANGLAIS - GR. B",
      "start": "2026-01-23T08:00:00+01:00",
      "end": "2026-01-23T10:00:00+01:00",
      "allDay": false,
      "location": "Bridoux_TD 18",
      "description": "\n\nMATHIS-BUTIN Catherine\nTP ANGLAIS - GR B\n\n(Modifié le:13/05/2025 15:16)",
      "status": "",
      "url": "",
      "lastModified": "2025-05-13T15:16:00+02:00"
    },
    {
      "id": "ADE60322e706c616e6e696e67554c5f323032355f323032362d32383230302d302d3130",
      "title": "UE 909 TP ANGLAIS - GR. C",
      "start": "2026-01-23T08:00:00+01:00",
      "end": "2026-01-23T10:00:00+01:00",
      "allDay": false,
      "location": "Bridoux_TD 17",
      "description": "\n\nUBASSY Mickaël\nTP ANGLAIS - GR C\n\n(Modifié le:13/05/2025 15:21)",
      "status": "",
      "url": "",
      "lastModified": "2025-05-13T15:21:00+02:00"
    },
    {
      "id": "ADE60322e706c616e6e696e67554c5f323032355f323032362d36343037312d302d30",
      "title": "TP E NUMOC",
      "start": "2026-01-23T08:00:00+01:00",
      "end": "2026-01-23T10:00:00+01:00",
      "allDay": false,
      "location": "Bridoux_TP Info1 C1",
      "description": "\n\nTP  E*\nGALLIZZI Adrienne\n\n(Modifié le:01/12/2025 11:34)",
      "status": "",
      "url": "",
      "lastModified": "2025-12-01T11:34:00+01:00"
    },
    {
      "id": "ADE60322e706c616e6e696e67554c5f323032355f323032362d3133303735372d362d30",
      "title": "EI 2 EC 203.2 Chimie des solutions aqueuses",
      "start": "2026-01-23T08:00:00+01:00",
      "end": "2026-01-23T10:00:00+01:00",
      "allDay": false,
      "location": "Bridoux_TD 24",
      "description": "\n\nTP C Portail PC\nTP D Portail PC\nACHARD Christian\n\n(Modifié le:15/12/2025 09:57)",
      "status": "",
      "url": "",
      "lastModified": "2025-12-15T09:57:00+01:00"
    },
    {
      "id": "ADE60322e706c616e6e696e67554c5f323032355f323032362d363638322d302d3130",
      "title": "UE 909 TP ANGLAIS - GR. A",
      "start": "2026-01-23T08:00:00+01:00",
      "end": "2026-01-23T10:00:00+01:00",
      "allDay": false,
      "location": "Bridoux_TD 15",
      "description": "\n\nTP ANGLAIS - GR A\nPACE Laetitia\n\n(Modifié le:03/07/2025 10:30)",
      "status": "",
      "url": "",
      "lastModified": "2025-07-03T10:30:00+02:00"
    },
    {
      "id": "ADE60322e706c616e6e696e67554c5f323032355f323032362d32363838372d352d30",
      "title": "EI 1 Le monde pro et les différents supports de communication",
      "start": "2026-01-23T08:00:00+01:00",
      "end": "2026-01-23T12:00:00+01:00",
      "allDay": false,
      "location": "Bridoux_TD 1",
      "description": "\n\nFLEURENCE Stephanie\nLPRO Agro ADNT\n\n(Modifié le:05/11/2025 09:36)",
      "status": "",
      "url": "",
      "lastModified": "2025-11-05T09:36:00+01:00"
    },
    {
      "id": "ADE60322e706c616e6e696e67554c5f323032355f323032362d36333232362d312d30",
      "title": "EI CD Algorithmique",
      "start": "2026-01-23T08:00:00+01:00",
      "end": "2026-01-23T10:00:00+01:00",
      "allDay": false,
      "location": "Bridoux_TD 16",
      "description": "\n\nTP  C*\nTP  D*\nCAMARA Baba Issa\n\n(Modifié le:03/12/2025 16:44)",
      "status": "",
      "url": "",
      "lastModified": "2025-12-03T16:44:00+01:00"
    },
    {
      "id": "ADE60322e706c616e6e696e67554c5f323032355f323032362d36343037362d302d30",
      "title": "TP F Projet Personnel et Professionnel",
      "start": "2026-01-23T08:00:00+01:00",
      "end": "2026-01-23T10:00:00+01:00",
      "allDay": false,
      "location": "Bridoux_TP Info2 C5",
      "description": "\n\nTP  F*\nDUVAL Alienor\n\n(Modifié le:12/12/2025 15:43)",
      "status": "",
      "url": "",
      "lastModified": "2025-12-12T15:43:00+01:00"
    },
    {
      "id": "ADE60322e706c616e6e696e67554c5f323032355f323032362d393432362d302d30",
      "title": "CM Troubles neurologiques et intervention en APAS",
      "start": "2026-01-23T08:30:00+01:00",
      "end": "2026-01-23T11:30:00+01:00",
      "allDay": false,
      "location": "Bridoux_TP Start up 2 D16",
      "description": "\n\nCM APAS\nCM APAS LAS\nBRIER Laurence\n\n(Modifié le:06/11/2025 17:35)",
      "status": "",
      "url": "",
      "lastModified": "2025-11-06T17:35:00+01:00"
    },
    {
      "id": "ADE60322e706c616e6e696e67554c5f323032355f323032362d39353630322d35352d30",
      "title": "PRJ Préparation du projet tutoré",
      "start": "2026-01-23T09:00:00+01:00",
      "end": "2026-01-23T11:00:00+01:00",
      "allDay": false,
      "location": "Bridoux_TP Start up 1 D14BIS",
      "description": "\n\nLP GDOSSL FI/FC\n\n(Modifié le:08/12/2025 14:52)",
      "status": "",
      "url": "",
      "lastModified": "2025-12-08T14:52:00+01:00"
    },
    {
      "id": "ADE60322e706c616e6e696e67554c5f323032355f323032362d39323038342d342d30",
      "title": "TD ME863  Gérer une classe, avoir une approche réflexive",
      "start": "2026-01-23T09:00:00+01:00",
      "end": "2026-01-23T12:00:00+01:00",
      "allDay": false,
      "location": "Bridoux_TD 2",
      "description": "\n\nCREMONI Jerome\nPrépa CAPES STAPS EDT M1\nM1 MEEF EPS - Groupe A\nM1 MEEF EPS - Groupe B\n\n(Modifié le:22/09/2025 11:04)",
      "status": "",
      "url": "",
      "lastModified": "2025-09-22T11:04:00+02:00"
    },
    {
      "id": "ADE60322e706c616e6e696e67554c5f323032355f323032362d32383230302d302d3131",
      "title": "UE 909 TP ANGLAIS - GR. C",
      "start": "2026-01-23T10:00:00+01:00",
      "end": "2026-01-23T12:00:00+01:00",
      "allDay": false,
      "location": "Bridoux_TD 17",
      "description": "\n\nUBASSY Mickaël\nTP ANGLAIS - GR C\n\n(Modifié le:13/05/2025 15:21)",
      "status": "",
      "url": "",
      "lastModified": "2025-05-13T15:21:00+02:00"
    },
    {
      "id": "ADE60322e706c616e6e696e67554c5f323032355f323032362d32383139352d302d3131",
      "title": "UE 909 TP ANGLAIS - GR. B",
      "start": "2026-01-23T10:00:00+01:00",
      "end": "2026-01-23T12:00:00+01:00",
      "allDay": false,
      "location": "Bridoux_TD 18",
      "description": "\n\nMATHIS-BUTIN Catherine\nTP ANGLAIS - GR B\n\n(Modifié le:13/05/2025 15:16)",
      "status": "",
      "url": "",
      "lastModified": "2025-05-13T15:16:00+02:00"
    },
    {
      "id": "ADE60322e706c616e6e696e67554c5f323032355f323032362d363638322d302d3131",
      "title": "UE 909 TP ANGLAIS - GR. A",
      "start": "2026-01-23T10:00:00+01:00",
      "end": "2026-01-23T12:00:00+01:00",
      "allDay": false,
      "location": "Bridoux_TD 15",
      "description": "\n\nTP ANGLAIS - GR A\nPACE Laetitia\n\n(Modifié le:03/07/2025 10:30)",
      "status": "",
      "url": "",
      "lastModified": "2025-07-03T10:30:00+02:00"
    },
    {
      "id": "ADE60322e706c616e6e696e67554c5f323032355f323032362d36343038312d302d30",
      "title": "TP F NUMOC",
      "start": "2026-01-23T10:15:00+01:00",
      "end": "2026-01-23T12:15:00+01:00",
      "allDay": false,
      "location": "Bridoux_TP Info1 C1",
      "description": "\n\nTP  F*\nGALLIZZI Adrienne\n\n(Modifié le:01/12/2025 11:35)",
      "status": "",
      "url": "",
      "lastModified": "2025-12-01T11:35:00+01:00"
    },
    {
      "id": "ADE60322e706c616e6e696e67554c5f323032355f323032362d36343037322d302d30",
      "title": "TP E Projet Personnel et Professionnel",
      "start": "2026-01-23T10:15:00+01:00",
      "end": "2026-01-23T12:15:00+01:00",
      "allDay": false,
      "location": "Bridoux_TP Info2 C5",
      "description": "\n\nTP  E*\nDUVAL Alienor\n\n(Modifié le:12/12/2025 15:43)",
      "status": "",
      "url": "",
      "lastModified": "2025-12-12T15:43:00+01:00"
    },
    {
      "id": "ADE60322e706c616e6e696e67554c5f323032355f323032362d36333635392d312d30",
      "title": "EI GH Algorithmique",
      "start": "2026-01-23T10:15:00+01:00",
      "end": "2026-01-23T12:15:00+01:00",
      "allDay": false,
      "location": "Bridoux_TD 16",
      "description": "\n\nTP  G*\nTP  H*\nCAMARA Baba Issa\n\n(Modifié le:11/12/2025 12:18)",
      "status": "",
      "url": "",
      "lastModified": "2025-12-11T12:18:00+01:00"
    },
    {
      "id": "ADE60322e706c616e6e696e67554c5f323032355f323032362d36323832372d342d30",
      "title": "TD IJ Génétique fondamentale",
      "start": "2026-01-23T10:15:00+01:00",
      "end": "2026-01-23T12:15:00+01:00",
      "allDay": false,
      "location": "Bridoux_TD 9",
      "description": "\n\nRODIUS François\nTP I*\nTP J*\n\n(Modifié le:08/12/2025 15:17)",
      "status": "",
      "url": "",
      "lastModified": "2025-12-08T15:17:00+01:00"
    },
    {
      "id": "ADE60322e706c616e6e696e67554c5f323032355f323032362d31393037372d302d30",
      "title": "EI 1 206.1 Circuits électriques cours",
      "start": "2026-01-23T10:15:00+01:00",
      "end": "2026-01-23T12:15:00+01:00",
      "allDay": false,
      "location": "Bridoux_TD 13",
      "description": "\n\nCODA-BOUCHOT Virginie\nTP A Portail PC\nTP B Portail PC\n\n(Modifié le:12/12/2025 15:12)",
      "status": "",
      "url": "",
      "lastModified": "2025-12-12T15:12:00+01:00"
    },
    {
      "id": "ADE60322e706c616e6e696e67554c5f323032355f323032362d3133353435362d342d30",
      "title": "EI 2 EC 202.1 Electromagnétisme ",
      "start": "2026-01-23T10:15:00+01:00",
      "end": "2026-01-23T12:15:00+01:00",
      "allDay": false,
      "location": "Bridoux_TD 12",
      "description": "\n\nTP C Portail PC\nTP D Portail PC\nDALMASSO Stéphane\n\n(Modifié le:15/12/2025 09:33)",
      "status": "",
      "url": "",
      "lastModified": "2025-12-15T09:33:00+01:00"
    },
    {
      "id": "ADE60322e706c616e6e696e67554c5f323032355f323032362d31313636372d302d30",
      "title": "TD 403.2 Optique physique",
      "start": "2026-01-23T10:15:00+01:00",
      "end": "2026-01-23T12:15:00+01:00",
      "allDay": false,
      "location": "Bridoux_TD 8",
      "description": "\n\nL2 Physique FC\nL2 Physique LAS\nL2 PC\nL2 PC LAS\nL2 Physique PE\nL2 PC PE\nTD L2 Physique\nJOHANN Luc\n\n(Modifié le:28/11/2025 11:36)",
      "status": "",
      "url": "",
      "lastModified": "2025-11-28T11:36:00+01:00"
    },
    {
      "id": "ADE60322e706c616e6e696e67554c5f323032355f323032362d393432372d322d30",
      "title": "TD Troubles neurologiques et intervention en APAS",
      "start": "2026-01-23T11:30:00+01:00",
      "end": "2026-01-23T12:30:00+01:00",
      "allDay": false,
      "location": "Bridoux_TP Start up 2 D16",
      "description": "\n\nTD APAS\nTD APAS LAS\nBRIER Laurence\n\n(Modifié le:06/11/2025 17:39)",
      "status": "",
      "url": "",
      "lastModified": "2025-11-06T17:39:00+01:00"
    },
    {
      "id": "ADE60322e706c616e6e696e67554c5f323032355f323032362d39323933322d342d30",
      "title": "TD ME871 Construire une posture réflexive à travers la recher.",
      "start": "2026-01-23T13:00:00+01:00",
      "end": "2026-01-23T15:00:00+01:00",
      "allDay": false,
      "location": "Bridoux_TP Info2 C5",
      "description": "\n\nDUBOIS Amandine\nPrépa CAPES STAPS EDT M1\nM1 MEEF EPS - Groupe A\nM1 MEEF EPS - Groupe B\n\n(Modifié le:04/12/2025 11:00)",
      "status": "",
      "url": "",
      "lastModified": "2025-12-04T11:00:00+01:00"
    },
    {
      "id": "ADE60322e706c616e6e696e67554c5f323032355f323032362d393532332d322d30",
      "title": "TD Méthodes d'intervention et stage 2",
      "start": "2026-01-23T13:15:00+01:00",
      "end": "2026-01-23T14:45:00+01:00",
      "allDay": false,
      "location": "Bridoux_TP Start up 1 D14BIS",
      "description": "\n\nTD APAS\nTD APAS LAS\nASSELIN Marine\n\n(Modifié le:21/10/2025 13:38)",
      "status": "",
      "url": "",
      "lastModified": "2025-10-21T13:38:00+02:00"
    },
    {
      "id": "ADE60322e706c616e6e696e67554c5f323032355f323032362d36343038342d302d30",
      "title": "TP G NUMOC",
      "start": "2026-01-23T13:30:00+01:00",
      "end": "2026-01-23T15:30:00+01:00",
      "allDay": false,
      "location": "Bridoux_TP Info1 C1",
      "description": "\n\nTP  G*\nGALLIZZI Adrienne\n\n(Modifié le:01/12/2025 11:35)",
      "status": "",
      "url": "",
      "lastModified": "2025-12-01T11:35:00+01:00"
    },
    {
      "id": "ADE60322e706c616e6e696e67554c5f323032355f323032362d36333733392d312d30",
      "title": "EI IJ Algorithmique",
      "start": "2026-01-23T13:30:00+01:00",
      "end": "2026-01-23T15:30:00+01:00",
      "allDay": false,
      "location": "Bridoux_TD 16",
      "description": "\n\nTP I*\nTP J*\nCAMARA Baba Issa\n\n(Modifié le:03/12/2025 16:44)",
      "status": "",
      "url": "",
      "lastModified": "2025-12-03T16:44:00+01:00"
    },
    {
      "id": "ADE60322e706c616e6e696e67554c5f323032355f323032362d3130343030362d302d31",
      "title": "TP D EC NUMOC 2 - PC",
      "start": "2026-01-23T13:30:00+01:00",
      "end": "2026-01-23T16:30:00+01:00",
      "allDay": false,
      "location": "Bridoux_TP Info4 C11",
      "description": "\n\nBITTNER Stefan\nTP D Portail PC\n\n(Modifié le:15/12/2025 09:59)",
      "status": "",
      "url": "",
      "lastModified": "2025-12-15T09:59:00+01:00"
    },
    {
      "id": "ADE60322e706c616e6e696e67554c5f323032355f323032362d39353630322d35362d30",
      "title": "PRJ Préparation du projet tutoré",
      "start": "2026-01-23T13:30:00+01:00",
      "end": "2026-01-23T15:30:00+01:00",
      "allDay": false,
      "location": "Bridoux_TP Start up 2 D16",
      "description": "\n\nLP GDOSSL FI/FC\n\n(Modifié le:08/12/2025 14:52)",
      "status": "",
      "url": "",
      "lastModified": "2025-12-08T14:52:00+01:00"
    },
    {
      "id": "ADE60322e706c616e6e696e67554c5f323032355f323032362d3131333834332d342d30",
      "title": "TP D Géologie et pédologie approfondies",
      "start": "2026-01-23T13:30:00+01:00",
      "end": "2026-01-23T17:30:00+01:00",
      "allDay": false,
      "location": "Bridoux_TP Cuenot E1",
      "description": "\n\nARAN Delphine\nTP  D*Option Géologie & pédologie \n\n(Modifié le:04/12/2025 15:14)",
      "status": "",
      "url": "",
      "lastModified": "2025-12-04T15:14:00+01:00"
    },
    {
      "id": "ADE60322e706c616e6e696e67554c5f323032355f323032362d38373736332d302d30",
      "title": "TD GR.1 EM1  Natation",
      "start": "2026-01-23T13:30:00+01:00",
      "end": "2026-01-23T15:30:00+01:00",
      "allDay": false,
      "location": "Bridoux_TD 7",
      "description": "\n\nCREMONI Jerome\nGR. TD/TP EM1+LAS\n\n(Modifié le:08/12/2025 09:37)",
      "status": "",
      "url": "",
      "lastModified": "2025-12-08T09:37:00+01:00"
    },
    {
      "id": "ADE60322e706c616e6e696e67554c5f323032355f323032362d3133313936382d31342d30",
      "title": "EI 1 EC 203.1 Introduction à la chimie organique ",
      "start": "2026-01-23T13:30:00+01:00",
      "end": "2026-01-23T16:30:00+01:00",
      "allDay": false,
      "location": "Bridoux_TD 24",
      "description": "\n\nTP A Portail PC\nTP B Portail PC\nCOMOY Corinne\n\n(Modifié le:12/12/2025 15:10)",
      "status": "",
      "url": "",
      "lastModified": "2025-12-12T15:10:00+01:00"
    },
    {
      "id": "ADE60322e706c616e6e696e67554c5f323032355f323032362d36313838352d312d30",
      "title": "TD1 UE 901 - Humanités",
      "start": "2026-01-23T13:30:00+01:00",
      "end": "2026-01-23T15:30:00+01:00",
      "allDay": false,
      "location": "Bridoux_TD 27",
      "description": "\nMadame Lucile OTTOLINI\nTD ETOX\nTD GEMAREC\nEnseignant 1\n\n(Modifié le:15/12/2025 10:49)",
      "status": "",
      "url": "",
      "lastModified": "2025-12-15T10:49:00+01:00"
    },
    {
      "id": "ADE60322e706c616e6e696e67554c5f323032355f323032362d37373137312d302d30",
      "title": "EXAMEN CC2 Langues et internationalisation",
      "start": "2026-01-23T13:30:00+01:00",
      "end": "2026-01-23T15:30:00+01:00",
      "allDay": false,
      "location": "Bridoux_TD 17",
      "description": "\n\nUBASSY Mickaël\nLPRO Agro AAU\nLPRO Agro ADNT\n\n(Modifié le:05/11/2025 09:36)",
      "status": "",
      "url": "",
      "lastModified": "2025-11-05T09:36:00+01:00"
    },
    {
      "id": "ADE60322e706c616e6e696e67554c5f323032355f323032362d393533332d312d30",
      "title": "TD Outils d'analyse, d'évaluation et de réadaptation en APAS",
      "start": "2026-01-23T15:00:00+01:00",
      "end": "2026-01-23T17:00:00+01:00",
      "allDay": false,
      "location": "Bridoux_TD 1",
      "description": "\n\nTD APAS\nTD APAS LAS\nBOUSMIA Johanne\n\n(Modifié le:23/10/2025 16:00)",
      "status": "",
      "url": "",
      "lastModified": "2025-10-23T16:00:00+02:00"
    },
    {
      "id": "ADE60322e706c616e6e696e67554c5f323032355f323032362d36363434312d312d30",
      "title": "TD2 UE 901 - Humanités",
      "start": "2026-01-23T15:45:00+01:00",
      "end": "2026-01-23T17:45:00+01:00",
      "allDay": false,
      "location": "Bridoux_TD 27",
      "description": "\nMadame Lucile OTTOLINI\nTD GE\nEnseignant 1\n\n(Modifié le:15/12/2025 10:52)",
      "status": "",
      "url": "",
      "lastModified": "2025-12-15T10:52:00+01:00"
    },
    {
      "id": "ADE60322e706c616e6e696e67554c5f323032355f323032362d383338372d302d30",
      "title": "TD GR.2 EM2  Natation",
      "start": "2026-01-23T15:45:00+01:00",
      "end": "2026-01-23T17:45:00+01:00",
      "allDay": false,
      "location": "Bridoux_TD 7",
      "description": "\n\nCREMONI Jerome\nGR.TD/TP EM2\n\n(Modifié le:15/12/2025 09:37)",
      "status": "",
      "url": "",
      "lastModified": "2025-12-15T09:37:00+01:00"
    },
    {
      "id": "ADE60322e706c616e6e696e67554c5f323032355f323032362d36343038352d302d30",
      "title": "TP H NUMOC",
      "start": "2026-01-23T15:45:00+01:00",
      "end": "2026-01-23T17:45:00+01:00",
      "allDay": false,
      "location": "Bridoux_TP Info1 C1",
      "description": "\n\nTP  H*\nGALLIZZI Adrienne\n\n(Modifié le:11/12/2025 12:18)",
      "status": "",
      "url": "",
      "lastModified": "2025-12-11T12:18:00+01:00"
    },
    {
      "id": "ADE60322e706c616e6e696e67554c5f323032355f323032362d31303339322d302d30",
      "title": "TD AB Métabolisme énergétique",
      "start": "2026-01-26T08:00:00+01:00",
      "end": "2026-01-26T10:00:00+01:00",
      "allDay": false,
      "location": "Bridoux_TD 9",
      "description": "\n\nDUBOIS-POT-SCHNEIDER Hélène\nTP  A*\nTP  B*\n\n(Modifié le:27/11/2025 11:16)",
      "status": "",
      "url": "",
      "lastModified": "2025-11-27T11:16:00+01:00"
    },
    {
      "id": "ADE60322e706c616e6e696e67554c5f323032355f323032362d39353539362d322d30",
      "title": "6.05 EI Gestion des conflits et des risques",
      "start": "2026-01-26T08:00:00+01:00",
      "end": "2026-01-26T10:00:00+01:00",
      "allDay": false,
      "location": "Bridoux_TP Start up 1 D14BIS",
      "description": "\n\nMASTAGLI Maxime\nLP GDOSSL FI/FC\n\n(Modifié le:08/12/2025 14:45)",
      "status": "",
      "url": "",
      "lastModified": "2025-12-08T14:45:00+01:00"
    },
    {
      "id": "ADE60322e706c616e6e696e67554c5f323032355f323032362d33303037312d302d30",
      "title": "TD GR.E Acrosport-Gymnastique",
      "start": "2026-01-26T08:00:00+01:00",
      "end": "2026-01-26T10:00:00+01:00",
      "allDay": false,
      "location": "Bridoux_TD 8",
      "description": "\n\nTD/TP GR.E\nSAGRAFENA Hugo\n\n(Modifié le:13/11/2025 16:40)",
      "status": "",
      "url": "",
      "lastModified": "2025-11-13T16:40:00+01:00"
    },
    {
      "id": "ADE60322e706c616e6e696e67554c5f323032355f323032362d3233303139332d31302d30",
      "title": "EI ME830 Mobiliser les savoirs propres à la discipline des LC-2",
      "start": "2026-01-26T08:00:00+01:00",
      "end": "2026-01-26T10:00:00+01:00",
      "allDay": false,
      "location": "Bridoux_TD 24",
      "description": "\n\nM1 MEEF PC\nM1 MEEF M-PC\nCODA-BOUCHOT Virginie\n\n(Modifié le:06/11/2025 18:01)",
      "status": "",
      "url": "",
      "lastModified": "2025-11-06T18:01:00+01:00"
    },
    {
      "id": "ADE60322e706c616e6e696e67554c5f323032355f323032362d3138353239322d302d3237",
      "title": "Prêt salle IFSI TD 17 MU",
      "start": "2026-01-26T08:00:00+01:00",
      "end": "2026-01-26T10:00:00+01:00",
      "allDay": false,
      "location": "Bridoux_TD 17",
      "description": "\n\nTD IFSI PRET SALLE\nUBASSY Mickaël\n\n(Modifié le:13/05/2025 13:01)",
      "status": "",
      "url": "",
      "lastModified": "2025-05-13T13:01:00+02:00"
    },
    {
      "id": "ADE60322e706c616e6e696e67554c5f323032355f323032362d31303738342d302d31",
      "title": "TD Analyse de la conception des projets éducatifs",
      "start": "2026-01-26T08:00:00+01:00",
      "end": "2026-01-26T12:00:00+01:00",
      "allDay": false,
      "location": "Bridoux_TP Damasio D3",
      "description": "\n\nTD EM LAS\nTD EM\nGANDAR Benjamin\n\n(Modifié le:15/10/2025 13:32)",
      "status": "",
      "url": "",
      "lastModified": "2025-10-15T13:32:00+02:00"
    },
    {
      "id": "ADE60322e706c616e6e696e67554c5f323032355f323032362d34333032352d302d30",
      "title": "TD GR 3 APA/GDOSSL Natation",
      "start": "2026-01-26T08:00:00+01:00",
      "end": "2026-01-26T10:00:00+01:00",
      "allDay": false,
      "location": "Bridoux_TD 7",
      "description": "\n\nCREMONI Jerome\nGR.TD/TP APA/GDOSSL/LAS\n\n(Modifié le:03/12/2025 15:01)",
      "status": "",
      "url": "",
      "lastModified": "2025-12-03T15:01:00+01:00"
    },
    {
      "id": "ADE60322e706c616e6e696e67554c5f323032355f323032362d39353637332d302d32",
      "title": "UE 803 TD EC1 Psychophysiologie de la fatigue",
      "start": "2026-01-26T08:00:00+01:00",
      "end": "2026-01-26T10:00:00+01:00",
      "allDay": false,
      "location": "Bridoux_TP Start up 2 D16",
      "description": "\n\nBARBRY Alexis\nPromo complète M1 FA\nPromo complète M1 FI/FC\n\n(Modifié le:27/11/2025 16:19)",
      "status": "",
      "url": "",
      "lastModified": "2025-11-27T16:19:00+01:00"
    },
    {
      "id": "ADE60322e706c616e6e696e67554c5f323032355f323032362d37333937362d302d3331",
      "title": "Prêt salle IFSI TD 16 SN",
      "start": "2026-01-26T08:00:00+01:00",
      "end": "2026-01-26T10:00:00+01:00",
      "allDay": false,
      "location": "Bridoux_TD 16",
      "description": "\n1688628007825\nNAVARRO Sylvain\nTD IFSI PRET SALLE\n\n(Modifié le:13/05/2025 12:23)",
      "status": "",
      "url": "",
      "lastModified": "2025-05-13T12:23:00+02:00"
    },
    {
      "id": "ADE60322e706c616e6e696e67554c5f323032355f323032362d31363831312d332d30",
      "title": "CM EC 602.1 Propagation dans les milieux",
      "start": "2026-01-26T08:00:00+01:00",
      "end": "2026-01-26T09:30:00+01:00",
      "allDay": false,
      "location": "Bridoux_TD 14",
      "description": "\n\nMESSINA René\nL3 Physique FC\nL3 Physique LAS\nTD L3 Physique\n\n(Modifié le:28/11/2025 17:04)",
      "status": "",
      "url": "",
      "lastModified": "2025-11-28T17:04:00+01:00"
    },
    {
      "id": "ADE60322e706c616e6e696e67554c5f323032355f323032362d31313536342d302d31",
      "title": "CM 403.2 Optique physique",
      "start": "2026-01-26T08:00:00+01:00",
      "end": "2026-01-26T10:00:00+01:00",
      "allDay": false,
      "location": "Bridoux_TD 15",
      "description": "\n\nL2 Physique FC\nL2 Physique LAS\nL2 PC\nL2 PC LAS\nL2 Physique PE\nL2 PC PE\nTD L2 Physique\nJOHANN Luc\n\n(Modifié le:28/11/2025 11:49)",
      "status": "",
      "url": "",
      "lastModified": "2025-11-28T11:49:00+01:00"
    },
    {
      "id": "ADE60322e706c616e6e696e67554c5f323032355f323032362d38393033362d332d30",
      "title": "TD ME830 Savoirs propres à la discipline et épistémologie",
      "start": "2026-01-26T09:00:00+01:00",
      "end": "2026-01-26T12:00:00+01:00",
      "allDay": false,
      "location": "Bridoux_TD 1",
      "description": "\n\nMONIER Brice\nPrépa CAPES STAPS EDT M1\nM1 MEEF EPS - Groupe A\nM1 MEEF EPS - Groupe B\n\n(Modifié le:22/09/2025 11:04)",
      "status": "",
      "url": "",
      "lastModified": "2025-09-22T11:04:00+02:00"
    },
    {
      "id": "ADE60322e706c616e6e696e67554c5f323032355f323032362d3132393936312d302d30",
      "title": "Seconde chance 506 Physique des milieux continus",
      "start": "2026-01-26T10:00:00+01:00",
      "end": "2026-01-26T12:00:00+01:00",
      "allDay": false,
      "location": "Bridoux_TD 18",
      "description": "\n\nXU Hong\nL3 Physique FC\nL3 Physique LAS\nTD L3 Physique\nPOSTNIKOV Andrey\n\n(Modifié le:05/09/2025 11:11)",
      "status": "",
      "url": "",
      "lastModified": "2025-09-05T11:11:00+02:00"
    },
    {
      "id": "ADE60322e706c616e6e696e67554c5f323032355f323032362d39353635332d302d30",
      "title": "UE 801 EC2 CM Anthropologie de la maladie et handicap",
      "start": "2026-01-26T10:00:00+01:00",
      "end": "2026-01-26T12:00:00+01:00",
      "allDay": false,
      "location": "Bridoux_TP Start up 1 D14BIS",
      "description": "\n\nPromo complète M1 FA\nPromo complète M1 FI/FC\nARBORIO Sophie\n\n(Modifié le:03/11/2025 15:36)",
      "status": "",
      "url": "",
      "lastModified": "2025-11-03T15:36:00+01:00"
    },
    {
      "id": "ADE60322e706c616e6e696e67554c5f323032355f323032362d3138353239322d302d3332",
      "title": "Prêt salle IFSI TD 17 MU",
      "start": "2026-01-26T10:00:00+01:00",
      "end": "2026-01-26T12:00:00+01:00",
      "allDay": false,
      "location": "Bridoux_TD 17",
      "description": "\n\nTD IFSI PRET SALLE\nUBASSY Mickaël\n\n(Modifié le:13/05/2025 13:01)",
      "status": "",
      "url": "",
      "lastModified": "2025-05-13T13:01:00+02:00"
    },
    {
      "id": "ADE60322e706c616e6e696e67554c5f323032355f323032362d37333937362d302d3332",
      "title": "Prêt salle IFSI TD 16 SN",
      "start": "2026-01-26T10:00:00+01:00",
      "end": "2026-01-26T12:00:00+01:00",
      "allDay": false,
      "location": "Bridoux_TD 16",
      "description": "\n\nNAVARRO Sylvain\nTD IFSI PRET SALLE\n\n(Modifié le:13/05/2025 12:23)",
      "status": "",
      "url": "",
      "lastModified": "2025-05-13T12:23:00+02:00"
    },
    {
      "id": "ADE60322e706c616e6e696e67554c5f323032355f323032362d3139373033382d302d30",
      "title": "Seconde chance UE 101 Mathématiques",
      "start": "2026-01-26T10:00:00+01:00",
      "end": "2026-01-26T11:30:00+01:00",
      "allDay": false,
      "location": "Bridoux_TD 8,Bridoux_Darwin",
      "description": "\n\nTP A Portail PC\nTP B Portail PC\nTP C Portail PC\nTP D Portail PC\nTP E Portail PC\nTP F Portail PC\nFARDET Anne-Laure\nGLEIZE Jérôme\nGRANDCOLAS Michel\nJABER Hassan\n\n(Modifié le:27/11/2025 11:27)",
      "status": "",
      "url": "",
      "lastModified": "2025-11-27T11:27:00+01:00"
    },
    {
      "id": "ADE60322e706c616e6e696e67554c5f323032355f323032362d3135373535302d302d30",
      "title": "TD Pratiques d'intervention et programmes APAS",
      "start": "2026-01-26T10:00:00+01:00",
      "end": "2026-01-26T12:00:00+01:00",
      "allDay": false,
      "location": "Bridoux_TP Start up 2 D16",
      "description": "\n\nASSELIN Marine\nTD APAS\nTD APAS LAS\nGymnase Bridoux P3\n\n(Modifié le:11/12/2025 16:32)",
      "status": "",
      "url": "",
      "lastModified": "2025-12-11T16:32:00+01:00"
    },
    {
      "id": "ADE60322e706c616e6e696e67554c5f323032355f323032362d32323335382d362d30",
      "title": "EI 2 Gestion et analyse de données",
      "start": "2026-01-26T10:15:00+01:00",
      "end": "2026-01-26T12:15:00+01:00",
      "allDay": false,
      "location": "Bridoux_TP Info1 C1",
      "description": "\n\nQUEVREUX Pierre\nLPRO Agro AAU\nLPRO Agro ADNT\n\n(Modifié le:03/12/2025 12:22)",
      "status": "",
      "url": "",
      "lastModified": "2025-12-03T12:22:00+01:00"
    },
    {
      "id": "ADE60322e706c616e6e696e67554c5f323032355f323032362d31303938382d342d30",
      "title": "CM EC 401.1 Thermodynamique de la réaction chimique",
      "start": "2026-01-26T10:15:00+01:00",
      "end": "2026-01-26T12:15:00+01:00",
      "allDay": false,
      "location": "Bridoux_TD 15",
      "description": "\n\nACHARD Christian\nL2 Chimie FC\nL2 Chimie LAS\nL2 PC\nL2 PC LAS\nL2 Chimie PE\nL2 PC PE\nTD A L2 Chimie\n\n(Modifié le:24/11/2025 11:59)",
      "status": "",
      "url": "",
      "lastModified": "2025-11-24T11:59:00+01:00"
    },
    {
      "id": "ADE60322e706c616e6e696e67554c5f323032355f323032362d36313639362d322d30",
      "title": "CM UE809 -Typologie des Milieux Aquatiques et des Zones Humides",
      "start": "2026-01-26T10:15:00+01:00",
      "end": "2026-01-26T11:15:00+01:00",
      "allDay": false,
      "location": "Bridoux_TD 7",
      "description": "\n\nROBIN Vincent\nCM GEMAREC\n\n(Modifié le:20/11/2025 16:49)",
      "status": "",
      "url": "",
      "lastModified": "2025-11-20T16:49:00+01:00"
    },
    {
      "id": "ADE60322e706c616e6e696e67554c5f323032355f323032362d3130343839382d302d30",
      "title": "TD 401.2 Algèbre 4",
      "start": "2026-01-26T10:15:00+01:00",
      "end": "2026-01-26T12:15:00+01:00",
      "allDay": false,
      "location": "Bridoux_TD 24",
      "description": "\n\nMOHRBACH Hervé\nL2 Physique FC\nL2 Physique LAS\nL2 Physique PE\nTD L2 Physique\n\n(Modifié le:28/11/2025 11:50)",
      "status": "",
      "url": "",
      "lastModified": "2025-11-28T11:50:00+01:00"
    },
    {
      "id": "ADE60322e706c616e6e696e67554c5f323032355f323032362d3136373931362d31322d30",
      "title": "EI ME830 Mobiliser les savoirs propres à la discipline des LC-2",
      "start": "2026-01-26T10:15:00+01:00",
      "end": "2026-01-26T12:15:00+01:00",
      "allDay": false,
      "location": "Bridoux_TD 28",
      "description": "\n\nM1 MEEF PC\nCOURILLEAU-GOBRY Anne\n\n(Modifié le:07/11/2025 16:44)",
      "status": "",
      "url": "",
      "lastModified": "2025-11-07T16:44:00+01:00"
    },
    {
      "id": "ADE60322e706c616e6e696e67554c5f323032355f323032362d3131313534312d302d30",
      "title": "TD CD Métabolisme énergétique",
      "start": "2026-01-26T10:15:00+01:00",
      "end": "2026-01-26T12:15:00+01:00",
      "allDay": false,
      "location": "Bridoux_TD 9",
      "description": "\n\nDUBOIS-POT-SCHNEIDER Hélène\nTP  C*\nTP  D*\n\n(Modifié le:27/11/2025 15:21)",
      "status": "",
      "url": "",
      "lastModified": "2025-11-27T15:21:00+01:00"
    },
    {
      "id": "ADE60322e706c616e6e696e67554c5f323032355f323032362d39353537302d302d34",
      "title": "TPL Anglais",
      "start": "2026-01-26T10:15:00+01:00",
      "end": "2026-01-26T12:15:00+01:00",
      "allDay": false,
      "location": "Bridoux_TD 13",
      "description": "\n\nLP GDOSSL FI/FC\nMATHIS-BUTIN Catherine\n\n(Modifié le:13/10/2025 11:02)",
      "status": "",
      "url": "",
      "lastModified": "2025-10-13T11:02:00+02:00"
    },
    {
      "id": "ADE60322e706c616e6e696e67554c5f323032355f323032362d36313639372d322d30",
      "title": "EI UE809 -Typologie des Milieux Aquatiques et des Zones Humides",
      "start": "2026-01-26T11:15:00+01:00",
      "end": "2026-01-26T12:15:00+01:00",
      "allDay": false,
      "location": "Bridoux_TD 7",
      "description": "\n\nCM GEMAREC\nROBIN Vincent\n\n(Modifié le:20/11/2025 16:50)",
      "status": "",
      "url": "",
      "lastModified": "2025-11-20T16:50:00+01:00"
    },
    {
      "id": "ADE60322e706c616e6e696e67554c5f323032355f323032362d39353538322d322d30",
      "title": "6.02 EI Droit du travail",
      "start": "2026-01-26T13:00:00+01:00",
      "end": "2026-01-26T17:00:00+01:00",
      "allDay": false,
      "location": "Bridoux_TP Start up 1 D14BIS",
      "description": "\n\nROTH David\nLP GDOSSL FI/FC\nLic Pro GDOSSL FA\n\n(Modifié le:13/10/2025 11:02)",
      "status": "",
      "url": "",
      "lastModified": "2025-10-13T11:02:00+02:00"
    },
    {
      "id": "ADE60322e706c616e6e696e67554c5f323032355f323032362d36313731322d302d30",
      "title": "TD UE 805 - Ressources Naturelles",
      "start": "2026-01-26T13:30:00+01:00",
      "end": "2026-01-26T15:30:00+01:00",
      "allDay": false,
      "location": "Bridoux_TD 7",
      "description": "\n\nARAN Delphine\nTD GRP 1\n\n(Modifié le:08/12/2025 14:57)",
      "status": "",
      "url": "",
      "lastModified": "2025-12-08T14:57:00+01:00"
    },
    {
      "id": "ADE60322e706c616e6e696e67554c5f323032355f323032362d3137313332322d302d31",
      "title": "TD ME1042 Savoirs discipli. appliqués à l'enseign. de PC en LC2",
      "start": "2026-01-26T13:30:00+01:00",
      "end": "2026-01-26T16:30:00+01:00",
      "allDay": false,
      "location": "Bridoux_TD 28",
      "description": "\n\nCOURILLEAU-GOBRY Anne\nM2 MEEF PC\n\n(Modifié le:18/11/2025 16:49)",
      "status": "",
      "url": "",
      "lastModified": "2025-11-18T16:49:00+01:00"
    },
    {
      "id": "ADE60322e706c616e6e696e67554c5f323032355f323032362d31303938362d302d31",
      "title": "TD 407.1 Anglais A1",
      "start": "2026-01-26T13:30:00+01:00",
      "end": "2026-01-26T15:30:00+01:00",
      "allDay": false,
      "location": "Bridoux_TD 13",
      "description": "\n\nAGHA NAJA Joudy\nL2 Physique-Chimie - Anglais GRP A1\n\n(Modifié le:02/09/2025 09:31)",
      "status": "",
      "url": "",
      "lastModified": "2025-09-02T09:31:00+02:00"
    },
    {
      "id": "ADE60322e706c616e6e696e67554c5f323032355f323032362d39333039302d322d30",
      "title": "TD ME1030 Savoirs propres à la discipline et épistémologie",
      "start": "2026-01-26T13:30:00+01:00",
      "end": "2026-01-26T16:30:00+01:00",
      "allDay": false,
      "location": "Bridoux_TD 1",
      "description": "\n\nMONIER Brice\nM2 MEEF EPS\n\n(Modifié le:22/09/2025 11:05)",
      "status": "",
      "url": "",
      "lastModified": "2025-09-22T11:05:00+02:00"
    },
    {
      "id": "ADE60322e706c616e6e696e67554c5f323032355f323032362d33353535372d302d33",
      "title": "CM EC 603.2 Chimie organique 7",
      "start": "2026-01-26T13:30:00+01:00",
      "end": "2026-01-26T15:30:00+01:00",
      "allDay": false,
      "location": "Bridoux_TD 14",
      "description": "\n\nCOMOY Corinne\nL3 Chimie FC\nTD - L3 Chimie\nL3 Chimie LAS\n\n(Modifié le:28/11/2025 14:44)",
      "status": "",
      "url": "",
      "lastModified": "2025-11-28T14:44:00+01:00"
    },
    {
      "id": "ADE60322e706c616e6e696e67554c5f323032355f323032362d31303434372d302d31",
      "title": "TPL EC 1 Anglais 4 D1",
      "start": "2026-01-26T13:30:00+01:00",
      "end": "2026-01-26T15:30:00+01:00",
      "allDay": false,
      "location": "Bridoux_TD 17",
      "description": "\n\nUBASSY Mickaël\nGR 1 - Anglais GRP D1\n\n(Modifié le:02/09/2025 09:58)",
      "status": "",
      "url": "",
      "lastModified": "2025-09-02T09:58:00+02:00"
    },
    {
      "id": "ADE60322e706c616e6e696e67554c5f323032355f323032362d36323438342d342d30",
      "title": "TD CD Génétique fondamentale",
      "start": "2026-01-26T13:30:00+01:00",
      "end": "2026-01-26T15:30:00+01:00",
      "allDay": false,
      "location": "Bridoux_TD 25",
      "description": "\n\nTP  C*\nTP  D*\nRODIUS François\n\n(Modifié le:08/12/2025 15:18)",
      "status": "",
      "url": "",
      "lastModified": "2025-12-08T15:18:00+01:00"
    },
    {
      "id": "ADE60322e706c616e6e696e67554c5f323032355f323032362d3139323639342d302d31",
      "title": "TPL EC 1 Anglais 4 E1",
      "start": "2026-01-26T13:30:00+01:00",
      "end": "2026-01-26T15:30:00+01:00",
      "allDay": false,
      "location": "Bridoux_TD 15",
      "description": "\n\nLIU Haoran\nGR 1 - Anglais GRP E1\n\n(Modifié le:02/09/2025 10:04)",
      "status": "",
      "url": "",
      "lastModified": "2025-09-02T10:04:00+02:00"
    },
    {
      "id": "ADE60322e706c616e6e696e67554c5f323032355f323032362d36313739312d322d30",
      "title": "CM UE 817 - Caractérisation et traitement de l'air",
      "start": "2026-01-26T13:30:00+01:00",
      "end": "2026-01-26T15:30:00+01:00",
      "allDay": false,
      "location": "Bridoux_TD 27",
      "description": "\n\nCOTELLE Sylvie\nCM GE\n\n(Modifié le:09/12/2025 17:41)",
      "status": "",
      "url": "",
      "lastModified": "2025-12-09T17:41:00+01:00"
    },
    {
      "id": "ADE60322e706c616e6e696e67554c5f323032355f323032362d3133323131322d302d37",
      "title": "EI 2 206.1 Circuits électriques cours",
      "start": "2026-01-26T13:30:00+01:00",
      "end": "2026-01-26T15:30:00+01:00",
      "allDay": false,
      "location": "Bridoux_TD 5",
      "description": "\n\nMOHRBACH Hervé\nTP C Portail PC\nTP D Portail PC\n\n(Modifié le:12/12/2025 15:44)",
      "status": "",
      "url": "",
      "lastModified": "2025-12-12T15:44:00+01:00"
    },
    {
      "id": "ADE60322e706c616e6e696e67554c5f323032355f323032362d3139343837382d322d30",
      "title": "TP grp1  UE 922 - Formation SST",
      "start": "2026-01-26T13:30:00+01:00",
      "end": "2026-01-26T15:30:00+01:00",
      "allDay": false,
      "location": "Bridoux_TP Start up 2 D16",
      "description": "\n\nTP GE\nHOFFMANN Mireille\n\n(Modifié le:20/10/2025 12:56)",
      "status": "",
      "url": "",
      "lastModified": "2025-10-20T12:56:00+02:00"
    },
    {
      "id": "ADE60322e706c616e6e696e67554c5f323032355f323032362d363438362d322d30",
      "title": "EI AB Algorithmique",
      "start": "2026-01-26T13:30:00+01:00",
      "end": "2026-01-26T15:30:00+01:00",
      "allDay": false,
      "location": "Bridoux_TD 3",
      "description": "\n\nTP  A*\nTP  B*\nCAMARA Baba Issa\n\n(Modifié le:03/12/2025 16:45)",
      "status": "",
      "url": "",
      "lastModified": "2025-12-03T16:45:00+01:00"
    },
    {
      "id": "ADE60322e706c616e6e696e67554c5f323032355f323032362d36343038382d302d30",
      "title": "TP I NUMOC",
      "start": "2026-01-26T13:30:00+01:00",
      "end": "2026-01-26T15:30:00+01:00",
      "allDay": false,
      "location": "Bridoux_TP Info1 C1",
      "description": "\n\nTP I*\nGALLIZZI Adrienne\n\n(Modifié le:01/12/2025 11:35)",
      "status": "",
      "url": "",
      "lastModified": "2025-12-01T11:35:00+01:00"
    },
    {
      "id": "ADE60322e706c616e6e696e67554c5f323032355f323032362d39353637342d322d30",
      "title": "UE 803 CM EC2 Douleur et APAS",
      "start": "2026-01-26T13:30:00+01:00",
      "end": "2026-01-26T16:00:00+01:00",
      "allDay": false,
      "location": "Bridoux_TP Damasio D3",
      "description": "\n\nBRIER Laurence\nPromo complète M1 FA\nPromo complète M1 FI/FC\n\n(Modifié le:03/11/2025 15:36)",
      "status": "",
      "url": "",
      "lastModified": "2025-11-03T15:36:00+01:00"
    },
    {
      "id": "ADE60322e706c616e6e696e67554c5f323032355f323032362d393737392d302d30",
      "title": "TD Pratiques spécifiques en APAS 2",
      "start": "2026-01-26T13:30:00+01:00",
      "end": "2026-01-26T15:00:00+01:00",
      "allDay": false,
      "location": "Bridoux_TD 6",
      "description": "\n\nTD APAS\nTD APAS LAS\nASSELIN Marine\n\n(Modifié le:24/11/2025 13:25)",
      "status": "",
      "url": "",
      "lastModified": "2025-11-24T13:25:00+01:00"
    },
    {
      "id": "ADE60322e706c616e6e696e67554c5f323032355f323032362d39323535302d322d30",
      "title": "EI GH 206.1 Chimie Organique pour la Biologie",
      "start": "2026-01-26T13:30:00+01:00",
      "end": "2026-01-26T15:30:00+01:00",
      "allDay": false,
      "location": "Bridoux_TD 9",
      "description": "\n\nHESSE Stéphanie\nTP  H*\nTP  G*\n\n(Modifié le:11/12/2025 12:18)",
      "status": "",
      "url": "",
      "lastModified": "2025-12-11T12:18:00+01:00"
    },
    {
      "id": "ADE60322e706c616e6e696e67554c5f323032355f323032362d3233303139332d31332d30",
      "title": "EI ME830 Mobiliser les savoirs propres à la discipline des LC-2",
      "start": "2026-01-26T13:30:00+01:00",
      "end": "2026-01-26T15:30:00+01:00",
      "allDay": false,
      "location": "Bridoux_TD 24",
      "description": "\n\nM1 MEEF PC\nM1 MEEF M-PC\nGREFFIER Olivier\n\n(Modifié le:03/12/2025 09:47)",
      "status": "",
      "url": "",
      "lastModified": "2025-12-03T09:47:00+01:00"
    },
    {
      "id": "ADE60322e706c616e6e696e67554c5f323032355f323032362d3132393938392d302d30",
      "title": "Seconde chance 505 Transferts thermiques",
      "start": "2026-01-26T13:30:00+01:00",
      "end": "2026-01-26T15:30:00+01:00",
      "allDay": false,
      "location": "Bridoux_TD 12",
      "description": "\n\nTALOTTA Francesco\nTD L3 Physique\nL3 Physique LAS\nXU Hong\n\n(Modifié le:05/09/2025 11:11)",
      "status": "",
      "url": "",
      "lastModified": "2025-09-05T11:11:00+02:00"
    },
    {
      "id": "ADE60322e706c616e6e696e67554c5f323032355f323032362d39323038342d332d30",
      "title": "TD ME863  Gérer une classe, avoir une approche réflexive",
      "start": "2026-01-26T13:30:00+01:00",
      "end": "2026-01-26T15:30:00+01:00",
      "allDay": false,
      "location": "Bridoux_TD 2",
      "description": "\n\nCREMONI Jerome\nPrépa CAPES STAPS EDT M1\nM1 MEEF EPS - Groupe A\nM1 MEEF EPS - Groupe B\n\n(Modifié le:22/09/2025 11:04)",
      "status": "",
      "url": "",
      "lastModified": "2025-09-22T11:04:00+02:00"
    },
    {
      "id": "ADE60322e706c616e6e696e67554c5f323032355f323032362d3139323638362d302d31",
      "title": "TD 407.1 Anglais B1",
      "start": "2026-01-26T13:30:00+01:00",
      "end": "2026-01-26T15:30:00+01:00",
      "allDay": false,
      "location": "Bridoux_TD 16",
      "description": "\n\nNAVARRO Sylvain\nL2 Physique-Chimie - Anglais GRP B1\n\n(Modifié le:02/09/2025 09:44)",
      "status": "",
      "url": "",
      "lastModified": "2025-09-02T09:44:00+02:00"
    },
    {
      "id": "ADE60322e706c616e6e696e67554c5f323032355f323032362d3139323638372d302d38",
      "title": "TD 407.1 Anglais C1",
      "start": "2026-01-26T13:30:00+01:00",
      "end": "2026-01-26T15:30:00+01:00",
      "allDay": false,
      "location": "Bridoux_TD 18",
      "description": "\n\nMATHIS-BUTIN Catherine\nL2 Physique-Chimie - Anglais GRP C1\n\n(Modifié le:02/09/2025 09:56)",
      "status": "",
      "url": "",
      "lastModified": "2025-09-02T09:56:00+02:00"
    },
    {
      "id": "ADE60322e706c616e6e696e67554c5f323032355f323032362d33303036342d302d31",
      "title": "TD GR.F Acrosport-Gymnastique",
      "start": "2026-01-26T15:30:00+01:00",
      "end": "2026-01-26T17:30:00+01:00",
      "allDay": false,
      "location": "Bridoux_TD 9",
      "description": "\n\nTD/TP GR.F\nSAGRAFENA Hugo\n\n(Modifié le:27/11/2025 14:22)",
      "status": "",
      "url": "",
      "lastModified": "2025-11-27T14:22:00+01:00"
    },
    {
      "id": "ADE60322e706c616e6e696e67554c5f323032355f323032362d3139353136312d322d30",
      "title": "TP grp 2 UE 922 - Formation SST",
      "start": "2026-01-26T15:30:00+01:00",
      "end": "2026-01-26T17:30:00+01:00",
      "allDay": false,
      "location": "Bridoux_TP Start up 2 D16",
      "description": "\n\nHOFFMANN Mireille\nTP GE\n\n(Modifié le:20/10/2025 12:56)",
      "status": "",
      "url": "",
      "lastModified": "2025-10-20T12:56:00+02:00"
    },
    {
      "id": "ADE60322e706c616e6e696e67554c5f323032355f323032362d31363738382d302d30",
      "title": "CM UE 605 Optique moderne et spectroscopie",
      "start": "2026-01-26T15:45:00+01:00",
      "end": "2026-01-26T17:45:00+01:00",
      "allDay": false,
      "location": "Bridoux_TD 12",
      "description": "\n\nBITTNER Stefan\nL3 Physique FC\nL3 Physique LAS\nTD L3 Physique\n\n(Modifié le:28/11/2025 17:07)",
      "status": "",
      "url": "",
      "lastModified": "2025-11-28T17:07:00+01:00"
    },
    {
      "id": "ADE60322e706c616e6e696e67554c5f323032355f323032362d383738382d302d31",
      "title": "TPL Anglais A2",
      "start": "2026-01-26T15:45:00+01:00",
      "end": "2026-01-26T17:45:00+01:00",
      "allDay": false,
      "location": "Bridoux_TD 18",
      "description": "\n\nTP ANGLAIS GR.1\nMATHIS-BUTIN Catherine\n\n(Modifié le:02/09/2025 11:10)",
      "status": "",
      "url": "",
      "lastModified": "2025-09-02T11:10:00+02:00"
    },
    {
      "id": "ADE60322e706c616e6e696e67554c5f323032355f323032362d31303835342d302d36",
      "title": "TD EC 402.1 Chimie organique 2",
      "start": "2026-01-26T15:45:00+01:00",
      "end": "2026-01-26T17:45:00+01:00",
      "allDay": false,
      "location": "Bridoux_TD 15",
      "description": "\n\nL2 Chimie FC\nL2 Chimie LAS\nL2 PC\nL2 PC LAS\nL2 Chimie PE\nL2 PC PE\nTD A L2 Chimie\nSINDT Michèle\n\n(Modifié le:28/11/2025 11:47)",
      "status": "",
      "url": "",
      "lastModified": "2025-11-28T11:47:00+01:00"
    },
    {
      "id": "ADE60322e706c616e6e696e67554c5f323032355f323032362d3139363233302d302d30",
      "title": "TP J NUMOC",
      "start": "2026-01-26T15:45:00+01:00",
      "end": "2026-01-26T17:45:00+01:00",
      "allDay": false,
      "location": "Bridoux_TP Info1 C1",
      "description": "\n\nGALLIZZI Adrienne\nTP J*\n\n(Modifié le:01/12/2025 11:36)",
      "status": "",
      "url": "",
      "lastModified": "2025-12-01T11:36:00+01:00"
    },
    {
      "id": "ADE60322e706c616e6e696e67554c5f323032355f323032362d3139323639302d302d37",
      "title": "TPL Anglais C2",
      "start": "2026-01-26T15:45:00+01:00",
      "end": "2026-01-26T17:45:00+01:00",
      "allDay": false,
      "location": "Bridoux_TD 17",
      "description": "\n\nTP ANGLAIS GR.3\nUBASSY Mickaël\n\n(Modifié le:02/09/2025 11:17)",
      "status": "",
      "url": "",
      "lastModified": "2025-09-02T11:17:00+02:00"
    },
    {
      "id": "ADE60322e706c616e6e696e67554c5f323032355f323032362d33303033302d302d30",
      "title": "TD GR.A Tennis de table",
      "start": "2026-01-26T15:45:00+01:00",
      "end": "2026-01-26T17:45:00+01:00",
      "allDay": false,
      "location": "Bridoux_TD 2",
      "description": "\n\nTD/TP GR.A\nTD/TP GR.A LAS\nCREMONI Jerome\n\n(Modifié le:17/11/2025 10:13)",
      "status": "",
      "url": "",
      "lastModified": "2025-11-17T10:13:00+01:00"
    },
    {
      "id": "ADE60322e706c616e6e696e67554c5f323032355f323032362d3139333633312d302d32",
      "title": "TPL Anglais D2",
      "start": "2026-01-26T15:45:00+01:00",
      "end": "2026-01-26T17:45:00+01:00",
      "allDay": false,
      "location": "Bridoux_TD 13",
      "description": "\n\nAGHA NAJA Joudy\nTP ANGLAIS GR.4\n\n(Modifié le:02/09/2025 11:24)",
      "status": "",
      "url": "",
      "lastModified": "2025-09-02T11:24:00+02:00"
    },
    {
      "id": "ADE60322e706c616e6e696e67554c5f323032355f323032362d393731332d302d30",
      "title": "CM Savoirs scientifiques en APAS 2",
      "start": "2026-01-26T15:45:00+01:00",
      "end": "2026-01-26T17:45:00+01:00",
      "allDay": false,
      "location": "Bridoux_TD 4",
      "description": "\n\nCM APAS\nCM APAS LAS\nHAINAUT Jean-Philippe\n\n(Modifié le:02/12/2025 16:00)",
      "status": "",
      "url": "",
      "lastModified": "2025-12-02T16:00:00+01:00"
    },
    {
      "id": "ADE60322e706c616e6e696e67554c5f323032355f323032362d353239362d342d30",
      "title": "TD AB Génétique fondamentale",
      "start": "2026-01-26T15:45:00+01:00",
      "end": "2026-01-26T17:45:00+01:00",
      "allDay": false,
      "location": "Bridoux_TD 25",
      "description": "\n\nRODIUS François\nTP  A*\nTP  B*\n\n(Modifié le:08/12/2025 15:18)",
      "status": "",
      "url": "",
      "lastModified": "2025-12-08T15:18:00+01:00"
    },
    {
      "id": "ADE60322e706c616e6e696e67554c5f323032355f323032362d3139323638392d302d36",
      "title": "TPL Anglais B2",
      "start": "2026-01-26T15:45:00+01:00",
      "end": "2026-01-26T17:45:00+01:00",
      "allDay": false,
      "location": "Bridoux_TD 16",
      "description": "\n\nNAVARRO Sylvain\nTP ANGLAIS GR.2\n\n(Modifié le:02/09/2025 11:14)",
      "status": "",
      "url": "",
      "lastModified": "2025-09-02T11:14:00+02:00"
    },
    {
      "id": "ADE60322e706c616e6e696e67554c5f323032355f323032362d36333232362d322d30",
      "title": "EI CD Algorithmique",
      "start": "2026-01-26T15:45:00+01:00",
      "end": "2026-01-26T17:45:00+01:00",
      "allDay": false,
      "location": "Bridoux_TD 3",
      "description": "\n\nTP  C*\nTP  D*\nCAMARA Baba Issa\n\n(Modifié le:03/12/2025 16:45)",
      "status": "",
      "url": "",
      "lastModified": "2025-12-03T16:45:00+01:00"
    },
    {
      "id": "ADE60322e706c616e6e696e67554c5f323032355f323032362d39353637352d332d30",
      "title": "UE 803 TD EC2 Douleur et APAS",
      "start": "2026-01-26T16:00:00+01:00",
      "end": "2026-01-26T18:00:00+01:00",
      "allDay": false,
      "location": "Bridoux_TP Damasio D3",
      "description": "\n\nBRIER Laurence\nPromo complète M1 FA\nPromo complète M1 FI/FC\n\n(Modifié le:03/11/2025 15:36)",
      "status": "",
      "url": "",
      "lastModified": "2025-11-03T15:36:00+01:00"
    },
    {
      "id": "ADE60322e706c616e6e696e67554c5f323032355f323032362d31313239302d332d30",
      "title": "CM Toxicologie systémique et appliquée",
      "start": "2026-01-27T08:00:00+01:00",
      "end": "2026-01-27T10:00:00+01:00",
      "allDay": false,
      "location": "Bridoux_TD 17",
      "description": "\n\nFAUPIN Solène\nTP  A*\nTP  B*\n\n(Modifié le:05/12/2025 11:59)",
      "status": "",
      "url": "",
      "lastModified": "2025-12-05T11:59:00+01:00"
    },
    {
      "id": "ADE60322e706c616e6e696e67554c5f323032355f323032362d31343733312d302d30",
      "title": "TD EC 601.1 Bases d'électrochimie",
      "start": "2026-01-27T08:00:00+01:00",
      "end": "2026-01-27T10:00:00+01:00",
      "allDay": false,
      "location": "Bridoux_TD 15",
      "description": "\n\nZIMMER Alexandre\nL3 Chimie FC\nL3 Chimie LAS\nTD - L3 Chimie\n\n(Modifié le:25/11/2025 11:31)",
      "status": "",
      "url": "",
      "lastModified": "2025-11-25T11:31:00+01:00"
    },
    {
      "id": "ADE60322e706c616e6e696e67554c5f323032355f323032362d31313839362d302d30",
      "title": "TD EC 905.1 Valorisation des matériaux inorganiques",
      "start": "2026-01-27T08:00:00+01:00",
      "end": "2026-01-27T12:00:00+01:00",
      "allDay": false,
      "location": "Bridoux_TP Start up 2 D16",
      "description": "\n\nM2 Chimie\nMEUX Éric\n\n(Modifié le:23/09/2025 15:38)",
      "status": "",
      "url": "",
      "lastModified": "2025-09-23T15:38:00+02:00"
    },
    {
      "id": "ADE60322e706c616e6e696e67554c5f323032355f323032362d34353130372d302d30",
      "title": "TD GR.D Tennis de table",
      "start": "2026-01-27T08:00:00+01:00",
      "end": "2026-01-27T10:00:00+01:00",
      "allDay": false,
      "location": "Bridoux_TD 7",
      "description": "\n\nCREMONI Jerome\nTD/TP GR.D\n\n(Modifié le:01/12/2025 17:59)",
      "status": "",
      "url": "",
      "lastModified": "2025-12-01T17:59:00+01:00"
    },
    {
      "id": "ADE60322e706c616e6e696e67554c5f323032355f323032362d3133313031362d31352d30",
      "title": "EI 1 EC 202.1 Electromagnétisme ",
      "start": "2026-01-27T08:00:00+01:00",
      "end": "2026-01-27T10:00:00+01:00",
      "allDay": false,
      "location": "Bridoux_TD 27",
      "description": "\n\nTP A Portail PC\nTP B Portail PC\nWAX Jean-François\n\n(Modifié le:12/12/2025 14:59)",
      "status": "",
      "url": "",
      "lastModified": "2025-12-12T14:59:00+01:00"
    },
    {
      "id": "ADE60322e706c616e6e696e67554c5f323032355f323032362d33303036392d302d30",
      "title": "TD GR.C Acrosport-Gymnastique",
      "start": "2026-01-27T08:00:00+01:00",
      "end": "2026-01-27T10:00:00+01:00",
      "allDay": false,
      "location": "Bridoux_TD 12",
      "description": "\n\nTD/TP GR.C\nSAGRAFENA Hugo\n\n(Modifié le:13/11/2025 16:36)",
      "status": "",
      "url": "",
      "lastModified": "2025-11-13T16:36:00+01:00"
    },
    {
      "id": "ADE60322e706c616e6e696e67554c5f323032355f323032362d31303636362d302d30",
      "title": "CM Connaissances fondamentales et appliquées en recherche SVS",
      "start": "2026-01-27T08:00:00+01:00",
      "end": "2026-01-27T10:00:00+01:00",
      "allDay": false,
      "location": "Bridoux_TD 1",
      "description": "\n\nCM EM\nCM EM LAS\nDUBOIS Amandine\n\n(Modifié le:03/12/2025 16:34)",
      "status": "",
      "url": "",
      "lastModified": "2025-12-03T16:34:00+01:00"
    },
    {
      "id": "ADE60322e706c616e6e696e67554c5f323032355f323032362d38393432332d332d30",
      "title": "EI EC Projet International",
      "start": "2026-01-27T08:00:00+01:00",
      "end": "2026-01-27T10:00:00+01:00",
      "allDay": false,
      "location": "Bridoux_TD 16",
      "description": "\n\nAROUXET Andrea\nCM GE\n\n(Modifié le:20/10/2025 12:55)",
      "status": "",
      "url": "",
      "lastModified": "2025-10-20T12:55:00+02:00"
    },
    {
      "id": "ADE60322e706c616e6e696e67554c5f323032355f323032362d34333036352d302d31",
      "title": "TD GR.APA/GDOSSL Badminton",
      "start": "2026-01-27T08:00:00+01:00",
      "end": "2026-01-27T10:00:00+01:00",
      "allDay": false,
      "location": "Bridoux_TD 8",
      "description": "\n\nGR.TD/TP APA/GDOSSL/LAS\nMINAR Yann\n\n(Modifié le:10/12/2025 14:49)",
      "status": "",
      "url": "",
      "lastModified": "2025-12-10T14:49:00+01:00"
    },
    {
      "id": "ADE60322e706c616e6e696e67554c5f323032355f323032362d393733302d302d30",
      "title": "TD Nouvelles technologies en APAS",
      "start": "2026-01-27T08:00:00+01:00",
      "end": "2026-01-27T10:00:00+01:00",
      "allDay": false,
      "location": "Bridoux_TP Damasio D3",
      "description": "\n\nAIT CHEKDHIDH Miassa\nTD APAS\nTD APAS LAS\n\n(Modifié le:11/12/2025 16:54)",
      "status": "",
      "url": "",
      "lastModified": "2025-12-11T16:54:00+01:00"
    },
    {
      "id": "ADE60322e706c616e6e696e67554c5f323032355f323032362d31313136342d302d30",
      "title": "TD CD Physicochimie et biomarqueurs",
      "start": "2026-01-27T08:00:00+01:00",
      "end": "2026-01-27T10:00:00+01:00",
      "allDay": false,
      "location": "Bridoux_TD 18",
      "description": "\n\nMASFARAUD Jean-François\nTP  D*\nTP  C*\n\n(Modifié le:11/12/2025 14:52)",
      "status": "",
      "url": "",
      "lastModified": "2025-12-11T14:52:00+01:00"
    },
    {
      "id": "ADE60322e706c616e6e696e67554c5f323032355f323032362d31363737372d302d31",
      "title": "EI EC 604.1 Projet professionnel personnalisé 2",
      "start": "2026-01-27T08:00:00+01:00",
      "end": "2026-01-27T10:00:00+01:00",
      "allDay": false,
      "location": "Bridoux_TD 14",
      "description": "\n\nL3 Physique FC\nL3 Physique LAS\nTD L3 Physique\nTITE Teddy\n\n(Modifié le:28/11/2025 17:07)",
      "status": "",
      "url": "",
      "lastModified": "2025-11-28T17:07:00+01:00"
    },
    {
      "id": "ADE60322e706c616e6e696e67554c5f323032355f323032362d3136373932352d302d30",
      "title": "TP ME862 Mettre en oeuvre des dispositifs péda. numériques - 2",
      "start": "2026-01-27T09:00:00+01:00",
      "end": "2026-01-27T12:00:00+01:00",
      "allDay": false,
      "location": "Bridoux_TP Hertz H13",
      "description": "\n\nM1 MEEF PC\nCHAPRON David\n\n(Modifié le:12/11/2025 10:27)",
      "status": "",
      "url": "",
      "lastModified": "2025-11-12T10:27:00+01:00"
    },
    {
      "id": "ADE60322e706c616e6e696e67554c5f323032355f323032362d39353538372d352d30",
      "title": "6.03 EI Marketing des services sportifs",
      "start": "2026-01-27T09:00:00+01:00",
      "end": "2026-01-27T12:00:00+01:00",
      "allDay": false,
      "location": "Bridoux_TP Start up 1 D14BIS",
      "description": "\n\nLP GDOSSL FI/FC\nLic Pro GDOSSL FA\nPIERRE Julien\n\n(Modifié le:13/10/2025 11:02)",
      "status": "",
      "url": "",
      "lastModified": "2025-10-13T11:02:00+02:00"
    },
    {
      "id": "ADE60322e706c616e6e696e67554c5f323032355f323032362d39353635382d312d30",
      "title": "UE 802 CM EC1 Pathologies et troubles métaboliques",
      "start": "2026-01-27T09:00:00+01:00",
      "end": "2026-01-27T12:00:00+01:00",
      "allDay": false,
      "location": "Bridoux_TD 3",
      "description": "\n\nASSELIN Marine\nPromo complète M1 FA\nPromo complète M1 FI/FC\n\n(Modifié le:27/11/2025 16:07)",
      "status": "",
      "url": "",
      "lastModified": "2025-11-27T16:07:00+01:00"
    },
    {
      "id": "ADE60322e706c616e6e696e67554c5f323032355f323032362d3132353834322d302d33",
      "title": "TP C EC NUMOC 2 - PC",
      "start": "2026-01-27T09:00:00+01:00",
      "end": "2026-01-27T12:00:00+01:00",
      "allDay": false,
      "location": "Bridoux_TP Info4 C11",
      "description": "\n\nTP C Portail PC\nBITTNER Stefan\n\n(Modifié le:15/12/2025 10:07)",
      "status": "",
      "url": "",
      "lastModified": "2025-12-15T10:07:00+01:00"
    },
    {
      "id": "ADE60322e706c616e6e696e67554c5f323032355f323032362d383433302d302d30",
      "title": "TD GR.EM1 Badminton",
      "start": "2026-01-27T10:00:00+01:00",
      "end": "2026-01-27T12:00:00+01:00",
      "allDay": false,
      "location": "Bridoux_TD 8",
      "description": "\n\nGR. TD/TP EM1+LAS\nMINAR Yann\n\n(Modifié le:10/12/2025 14:49)",
      "status": "",
      "url": "",
      "lastModified": "2025-12-10T14:49:00+01:00"
    },
    {
      "id": "ADE60322e706c616e6e696e67554c5f323032355f323032362d34343838342d302d30",
      "title": "TD Mise en œuvre du projet en lien avec les pratiques d'APS",
      "start": "2026-01-27T10:15:00+01:00",
      "end": "2026-01-27T12:15:00+01:00",
      "allDay": false,
      "location": "Bridoux_TD 7",
      "description": "\n\nPIERRE Christophe\nGR. GDOSSL\n\n(Modifié le:10/12/2025 14:50)",
      "status": "",
      "url": "",
      "lastModified": "2025-12-10T14:50:00+01:00"
    },
    {
      "id": "ADE60322e706c616e6e696e67554c5f323032355f323032362d31313231392d332d30",
      "title": "CM Physiotoxicology",
      "start": "2026-01-27T10:15:00+01:00",
      "end": "2026-01-27T12:15:00+01:00",
      "allDay": false,
      "location": "Bridoux_TD 14",
      "description": "\n\nMASFARAUD Jean-François\nTP  D*\nTP  C*\n\n(Modifié le:10/12/2025 16:04)",
      "status": "",
      "url": "",
      "lastModified": "2025-12-10T16:04:00+01:00"
    },
    {
      "id": "ADE60322e706c616e6e696e67554c5f323032355f323032362d3133303933362d302d30",
      "title": "Seconde chance Anglais ",
      "start": "2026-01-27T10:15:00+01:00",
      "end": "2026-01-27T12:15:00+01:00",
      "allDay": false,
      "location": "Bridoux_Salle des Actes B14",
      "description": "\n\nPrêt salles et amphi\n\n(Modifié le:17/11/2025 14:25)",
      "status": "",
      "url": "",
      "lastModified": "2025-11-17T14:25:00+01:00"
    },
    {
      "id": "ADE60322e706c616e6e696e67554c5f323032355f323032362d33323431392d302d31",
      "title": "Anglais GRP A",
      "start": "2026-01-27T10:15:00+01:00",
      "end": "2026-01-27T12:15:00+01:00",
      "allDay": false,
      "location": "Bridoux_TD 16",
      "description": "\n\nNAVARRO Sylvain\nL3 Physique FC\nL3 Physique LAS\nTD L3 Physique\n\n(Modifié le:05/09/2025 11:11)",
      "status": "",
      "url": "",
      "lastModified": "2025-09-05T11:11:00+02:00"
    },
    {
      "id": "ADE60322e706c616e6e696e67554c5f323032355f323032362d32393931392d302d38",
      "title": "TP Anglais GR C",
      "start": "2026-01-27T10:15:00+01:00",
      "end": "2026-01-27T12:15:00+01:00",
      "allDay": false,
      "location": "Bridoux_TD 15",
      "description": "\n\nTP ANGLAIS APAS GR 1\nTP ANGLAIS EM GR.1\n\n(Modifié le:24/11/2025 14:03)",
      "status": "",
      "url": "",
      "lastModified": "2025-11-24T14:03:00+01:00"
    },
    {
      "id": "ADE60322e706c616e6e696e67554c5f323032355f323032362d36313732352d312d30",
      "title": "TD UE 811-Effets des polluants à diff. niveaux d'organisation I",
      "start": "2026-01-27T10:15:00+01:00",
      "end": "2026-01-27T12:15:00+01:00",
      "allDay": false,
      "location": "Bridoux_TD 9",
      "description": "\n\nPRUD'HOMME Sophie\nTD ETOX\n\n(Modifié le:11/12/2025 15:29)",
      "status": "",
      "url": "",
      "lastModified": "2025-12-11T15:29:00+01:00"
    },
    {
      "id": "ADE60322e706c616e6e696e67554c5f323032355f323032362d32393932312d302d31",
      "title": "TP Anglais GR D",
      "start": "2026-01-27T10:15:00+01:00",
      "end": "2026-01-27T12:15:00+01:00",
      "allDay": false,
      "location": "Bridoux_TD 17",
      "description": "\n\nTP ANGLAIS APAS GR 2\nTP ANGLAIS EM GR.2\nUBASSY Mickaël\n\n(Modifié le:02/09/2025 11:51)",
      "status": "",
      "url": "",
      "lastModified": "2025-09-02T11:51:00+02:00"
    },
    {
      "id": "ADE60322e706c616e6e696e67554c5f323032355f323032362d31313230352d302d32",
      "title": "CM 402.1 Thermodynamique",
      "start": "2026-01-27T10:15:00+01:00",
      "end": "2026-01-27T12:15:00+01:00",
      "allDay": false,
      "location": "Bridoux_TD 2",
      "description": "\n\nL2 Physique FC\nL2 Physique LAS\nL2 PC\nL2 PC LAS\nL2 Physique PE\nL2 PC PE\nTD L2 Physique\nWAX Jean-François\n\n(Modifié le:28/11/2025 11:51)",
      "status": "",
      "url": "",
      "lastModified": "2025-11-28T11:51:00+01:00"
    },
    {
      "id": "ADE60322e706c616e6e696e67554c5f323032355f323032362d3135393238312d302d38",
      "title": "TP Anglais GR B",
      "start": "2026-01-27T10:15:00+01:00",
      "end": "2026-01-27T12:15:00+01:00",
      "allDay": false,
      "location": "Bridoux_TD 18",
      "description": "\n\nMATHIS-BUTIN Catherine\nTP ANGLAIS APAS GR 3\n\n(Modifié le:02/09/2025 11:55)",
      "status": "",
      "url": "",
      "lastModified": "2025-09-02T11:55:00+02:00"
    },
    {
      "id": "ADE60322e706c616e6e696e67554c5f323032355f323032362d333838362d302d30",
      "title": "TD EC 874.2 Méthode régulation numérique",
      "start": "2026-01-27T10:15:00+01:00",
      "end": "2026-01-27T12:15:00+01:00",
      "allDay": false,
      "location": "Bridoux_TD 25",
      "description": "\n\nCM/TD ISHM\nHORN Odile\n\n(Modifié le:01/12/2025 16:48)",
      "status": "",
      "url": "",
      "lastModified": "2025-12-01T16:48:00+01:00"
    },
    {
      "id": "ADE60322e706c616e6e696e67554c5f323032355f323032362d36313639372d312d30",
      "title": "EI UE809 -Typologie des Milieux Aquatiques et des Zones Humides",
      "start": "2026-01-27T10:15:00+01:00",
      "end": "2026-01-27T11:45:00+01:00",
      "allDay": false,
      "location": "Bridoux_TP Info2 C5",
      "description": "\n\nFAUPIN Solène\nCM GEMAREC\n\n(Modifié le:08/12/2025 11:58)",
      "status": "",
      "url": "",
      "lastModified": "2025-12-08T11:58:00+01:00"
    },
    {
      "id": "ADE60322e706c616e6e696e67554c5f323032355f323032362d31313236302d322d30",
      "title": "CM Immunologie approfondie",
      "start": "2026-01-27T10:15:00+01:00",
      "end": "2026-01-27T12:15:00+01:00",
      "allDay": false,
      "location": "Bridoux_TD 1",
      "description": "\n\nGroupe A Immunologie\nGroupe B immunologie\nNEGUESQUE Adrien\n\n(Modifié le:01/12/2025 16:10)",
      "status": "",
      "url": "",
      "lastModified": "2025-12-01T16:10:00+01:00"
    },
    {
      "id": "ADE60322e706c616e6e696e67554c5f323032355f323032362d3133303833302d31372d30",
      "title": "EI 1 UE 201 Mathématiques 2",
      "start": "2026-01-27T10:15:00+01:00",
      "end": "2026-01-27T12:15:00+01:00",
      "allDay": false,
      "location": "Bridoux_TD 13",
      "description": "\n\nGRANDCOLAS Michel\nTP A Portail PC\nTP B Portail PC\n\n(Modifié le:12/12/2025 13:48)",
      "status": "",
      "url": "",
      "lastModified": "2025-12-12T13:48:00+01:00"
    },
    {
      "id": "ADE60322e706c616e6e696e67554c5f323032355f323032362d39353538372d312d30",
      "title": "6.03 EI Marketing des services sportifs",
      "start": "2026-01-27T12:30:00+01:00",
      "end": "2026-01-27T16:30:00+01:00",
      "allDay": false,
      "location": "Bridoux_TP Start up 1 D14BIS",
      "description": "\n\nLP GDOSSL FI/FC\nLic Pro GDOSSL FA\nPIERRE Julien\n\n(Modifié le:13/10/2025 11:02)",
      "status": "",
      "url": "",
      "lastModified": "2025-10-13T11:02:00+02:00"
    },
    {
      "id": "ADE60322e706c616e6e696e67554c5f323032355f323032362d3138383833342d302d38",
      "title": "TPL EC Langues - ANG GR B",
      "start": "2026-01-27T13:30:00+01:00",
      "end": "2026-01-27T15:30:00+01:00",
      "allDay": false,
      "location": "Bridoux_TD 16",
      "description": "\n\nNAVARRO Sylvain\nTD 2 Anglais Gr B\n\n(Modifié le:18/09/2025 16:14)",
      "status": "",
      "url": "",
      "lastModified": "2025-09-18T16:14:00+02:00"
    },
    {
      "id": "ADE60322e706c616e6e696e67554c5f323032355f323032362d36333635392d322d30",
      "title": "EI GH Algorithmique",
      "start": "2026-01-27T13:30:00+01:00",
      "end": "2026-01-27T15:30:00+01:00",
      "allDay": false,
      "location": "Bridoux_TD 15",
      "description": "\n\nTP  G*\nTP  H*\nCAMARA Baba Issa\n\n(Modifié le:11/12/2025 12:18)",
      "status": "",
      "url": "",
      "lastModified": "2025-12-11T12:18:00+01:00"
    },
    {
      "id": "ADE60322e706c616e6e696e67554c5f323032355f323032362d39333139352d302d30",
      "title": "TD CD Internationalisation 2",
      "start": "2026-01-27T13:30:00+01:00",
      "end": "2026-01-27T15:30:00+01:00",
      "allDay": false,
      "location": "Bridoux_TP Start up 2 D16",
      "description": "\n\nTP  C*\nTP  D*\nGALLIZZI Adrienne\n\n(Modifié le:01/12/2025 12:13)",
      "status": "",
      "url": "",
      "lastModified": "2025-12-01T12:13:00+01:00"
    },
    {
      "id": "ADE60322e706c616e6e696e67554c5f323032355f323032362d393531312d312d30",
      "title": "CM Problématiques sociales, besoins spécifiques et interv. APAS",
      "start": "2026-01-27T13:30:00+01:00",
      "end": "2026-01-27T16:30:00+01:00",
      "allDay": false,
      "location": "Bridoux_TD 3",
      "description": "\n\nCM APAS\nBARRAL Fanny\n\n(Modifié le:27/11/2025 10:48)",
      "status": "",
      "url": "",
      "lastModified": "2025-11-27T10:48:00+01:00"
    },
    {
      "id": "ADE60322e706c616e6e696e67554c5f323032355f323032362d31303734352d312d30",
      "title": "TD Prof. Écoles / contexte et ouverture",
      "start": "2026-01-27T13:30:00+01:00",
      "end": "2026-01-27T15:30:00+01:00",
      "allDay": false,
      "location": "Bridoux_TD 2",
      "description": "\n\nTD EM\nJESSEL Jean-Jacques\n\n(Modifié le:01/12/2025 13:27)",
      "status": "",
      "url": "",
      "lastModified": "2025-12-01T13:27:00+01:00"
    },
    {
      "id": "ADE60322e706c616e6e696e67554c5f323032355f323032362d36323832372d352d30",
      "title": "TD IJ Génétique fondamentale",
      "start": "2026-01-27T13:30:00+01:00",
      "end": "2026-01-27T15:30:00+01:00",
      "allDay": false,
      "location": "Bridoux_TD 9",
      "description": "\n\nRODIUS François\nTP I*\nTP J*\n\n(Modifié le:08/12/2025 15:19)",
      "status": "",
      "url": "",
      "lastModified": "2025-12-08T15:19:00+01:00"
    },
    {
      "id": "ADE60322e706c616e6e696e67554c5f323032355f323032362d36313833392d302d30",
      "title": "TPL EC Langues - ANG GR A",
      "start": "2026-01-27T13:30:00+01:00",
      "end": "2026-01-27T15:30:00+01:00",
      "allDay": false,
      "location": "Bridoux_TD 18",
      "description": "\n\nMATHIS-BUTIN Catherine\nTD 1 Anglais Gr A\n\n(Modifié le:18/09/2025 16:14)",
      "status": "",
      "url": "",
      "lastModified": "2025-09-18T16:14:00+02:00"
    },
    {
      "id": "ADE60322e706c616e6e696e67554c5f323032355f323032362d39323534332d322d30",
      "title": "EI F 206.1 Chimie Organique pour la Biologie",
      "start": "2026-01-27T13:30:00+01:00",
      "end": "2026-01-27T15:30:00+01:00",
      "allDay": false,
      "location": "Bridoux_TD 12",
      "description": "\n\nTP  F*\nBUHAIBEH Ruqaya\n\n(Modifié le:01/12/2025 13:19)",
      "status": "",
      "url": "",
      "lastModified": "2025-12-01T13:19:00+01:00"
    },
    {
      "id": "ADE60322e706c616e6e696e67554c5f323032355f323032362d31313238302d332d30",
      "title": "CM Ecophysiologie microbienne",
      "start": "2026-01-27T13:30:00+01:00",
      "end": "2026-01-27T15:30:00+01:00",
      "allDay": false,
      "location": "Bridoux_TD 6",
      "description": "\n\nPAGNOUT Christophe\nTP  A*\nTP  B*\n\n(Modifié le:05/12/2025 14:30)",
      "status": "",
      "url": "",
      "lastModified": "2025-12-05T14:30:00+01:00"
    },
    {
      "id": "ADE60322e706c616e6e696e67554c5f323032355f323032362d31313136342d312d30",
      "title": "TD CD Physicochimie et biomarqueurs",
      "start": "2026-01-27T13:30:00+01:00",
      "end": "2026-01-27T15:30:00+01:00",
      "allDay": false,
      "location": "Bridoux_TD 14",
      "description": "\n\nMASFARAUD Jean-François\nTP  D*\nTP  C*\n\n(Modifié le:11/12/2025 14:52)",
      "status": "",
      "url": "",
      "lastModified": "2025-12-11T14:52:00+01:00"
    },
    {
      "id": "ADE60322e706c616e6e696e67554c5f323032355f323032362d39353637302d302d30",
      "title": "UE 802 EC3 TD Programmes APA",
      "start": "2026-01-27T13:30:00+01:00",
      "end": "2026-01-27T15:00:00+01:00",
      "allDay": false,
      "location": "Bridoux_TP Damasio D3",
      "description": "\n\nASSELIN Marine\nPromo complète M1 FI/FC\n\n(Modifié le:04/12/2025 15:05)",
      "status": "",
      "url": "",
      "lastModified": "2025-12-04T15:05:00+01:00"
    },
    {
      "id": "ADE60322e706c616e6e696e67554c5f323032355f323032362d31343635342d302d35",
      "title": "TD 404.1 Mécanique des fluides",
      "start": "2026-01-27T13:30:00+01:00",
      "end": "2026-01-27T15:30:00+01:00",
      "allDay": false,
      "location": "Bridoux_TD 4",
      "description": "\n\nL2 Physique PE\nTD L2 Physique\nBECU Lydiane\n\n(Modifié le:28/11/2025 12:09)",
      "status": "",
      "url": "",
      "lastModified": "2025-11-28T12:09:00+01:00"
    },
    {
      "id": "ADE60322e706c616e6e696e67554c5f323032355f323032362d31303831352d332d30",
      "title": "CM EC 402.1 Chimie organique 2",
      "start": "2026-01-27T13:30:00+01:00",
      "end": "2026-01-27T15:30:00+01:00",
      "allDay": false,
      "location": "Bridoux_TD 1",
      "description": "\n\nL2 Chimie FC\nL2 Chimie LAS\nL2 PC\nL2 PC LAS\nL2 Chimie PE\nL2 PC PE\nTD A L2 Chimie\nSINDT Michèle\n\n(Modifié le:24/11/2025 12:10)",
      "status": "",
      "url": "",
      "lastModified": "2025-11-24T12:10:00+01:00"
    },
    {
      "id": "ADE60322e706c616e6e696e67554c5f323032355f323032362d3133373235332d332d30",
      "title": "TD ME1042 Savoirs discipl. appliqués à l'enseign. de MPC en LC2",
      "start": "2026-01-27T13:30:00+01:00",
      "end": "2026-01-27T15:30:00+01:00",
      "allDay": false,
      "location": "Bridoux_TD 24",
      "description": "\n\nM2 M-PC\nM2 MEEF PC\nMÜLLER Martin\n\n(Modifié le:12/12/2025 11:28)",
      "status": "",
      "url": "",
      "lastModified": "2025-12-12T11:28:00+01:00"
    },
    {
      "id": "ADE60322e706c616e6e696e67554c5f323032355f323032362d36333238342d322d30",
      "title": "EI EF Algorithmique",
      "start": "2026-01-27T15:45:00+01:00",
      "end": "2026-01-27T17:45:00+01:00",
      "allDay": false,
      "location": "Bridoux_TD 15",
      "description": "\n\nTP  E*\nTP  F*\nCAMARA Baba Issa\n\n(Modifié le:03/12/2025 16:46)",
      "status": "",
      "url": "",
      "lastModified": "2025-12-03T16:46:00+01:00"
    },
    {
      "id": "ADE60322e706c616e6e696e67554c5f323032355f323032362d31303933382d302d30",
      "title": "TD EC 406.2 PPP 1",
      "start": "2026-01-27T15:45:00+01:00",
      "end": "2026-01-27T17:45:00+01:00",
      "allDay": false,
      "location": "Bridoux_TP Info6 F2",
      "description": "\n\nHATIM Oumaima\nL2 Chimie FC\nL2 PC\nTD A L2 Chimie\n\n(Modifié le:28/11/2025 11:50)",
      "status": "",
      "url": "",
      "lastModified": "2025-11-28T11:50:00+01:00"
    },
    {
      "id": "ADE60322e706c616e6e696e67554c5f323032355f323032362d31313138312d312d30",
      "title": "CM  Ecosystèmes de référence et anthropisés",
      "start": "2026-01-27T15:45:00+01:00",
      "end": "2026-01-27T17:45:00+01:00",
      "allDay": false,
      "location": "Bridoux_TD 1",
      "description": "\n\nROBIN Vincent\nTP  C*\nTP  D*\n\n(Modifié le:10/12/2025 16:04)",
      "status": "",
      "url": "",
      "lastModified": "2025-12-10T16:04:00+01:00"
    },
    {
      "id": "ADE60322e706c616e6e696e67554c5f323032355f323032362d39323534322d312d30",
      "title": "EI CD 206.1 Chimie Organique pour la Biologie",
      "start": "2026-01-27T15:45:00+01:00",
      "end": "2026-01-27T17:45:00+01:00",
      "allDay": false,
      "location": "Bridoux_TD 16",
      "description": "\n\nCOMOY Corinne\nTP  C*\nTP  D*\n\n(Modifié le:01/12/2025 13:19)",
      "status": "",
      "url": "",
      "lastModified": "2025-12-01T13:19:00+01:00"
    },
    {
      "id": "ADE60322e706c616e6e696e67554c5f323032355f323032362d36323732372d332d30",
      "title": "TD GH Génétique fondamentale",
      "start": "2026-01-27T15:45:00+01:00",
      "end": "2026-01-27T17:45:00+01:00",
      "allDay": false,
      "location": "Bridoux_TD 9",
      "description": "\n\nRODIUS François\nTP  G*\nTP  H*\n\n(Modifié le:11/12/2025 12:18)",
      "status": "",
      "url": "",
      "lastModified": "2025-12-11T12:18:00+01:00"
    },
    {
      "id": "ADE60322e706c616e6e696e67554c5f323032355f323032362d34373034372d372d30",
      "title": "TD ME1042 Savoirs discipli. appliqués à l'enseign. de PC en LC2",
      "start": "2026-01-27T15:45:00+01:00",
      "end": "2026-01-27T17:45:00+01:00",
      "allDay": false,
      "location": "Bridoux_TD 28",
      "description": "\n\nM2 MEEF PC\nXU Hong\n\n(Modifié le:27/11/2025 15:18)",
      "status": "",
      "url": "",
      "lastModified": "2025-11-27T15:18:00+01:00"
    },
    {
      "id": "ADE60322e706c616e6e696e67554c5f323032355f323032362d39353636322d322d30",
      "title": "UE 802 CM EC2 Prise en charge et prévention",
      "start": "2026-01-27T16:00:00+01:00",
      "end": "2026-01-27T19:00:00+01:00",
      "allDay": false,
      "location": "Bridoux_TP Start up 2 D16",
      "description": "\n\nMALDERA Lola\nPromo complète M1 FA\nPromo complète M1 FI/FC\n\n(Modifié le:03/11/2025 15:36)",
      "status": "",
      "url": "",
      "lastModified": "2025-11-03T15:36:00+01:00"
    },
    {
      "id": "ADE60322e706c616e6e696e67554c5f323032355f323032362d39353538342d342d30",
      "title": "6.02 EI Administration des services sportifs et politique",
      "start": "2026-01-27T16:30:00+01:00",
      "end": "2026-01-27T18:30:00+01:00",
      "allDay": false,
      "location": "Bridoux_TP Start up 1 D14BIS",
      "description": "\n\nAGAZZI Frédéric\nLP GDOSSL FI/FC\n\n(Modifié le:13/10/2025 11:02)",
      "status": "",
      "url": "",
      "lastModified": "2025-10-13T11:02:00+02:00"
    },
    {
      "id": "ADE60322e706c616e6e696e67554c5f323032355f323032362d39333531352d332d30",
      "title": "EI ME1040 Didactique disciplinaire, mise en oeuvre des program.",
      "start": "2026-01-27T17:00:00+01:00",
      "end": "2026-01-27T17:30:00+01:00",
      "allDay": false,
      "location": "Bridoux_TD 24",
      "description": "\n\nM2 MEEF EPS\nFRIEDRICH Jonathan\n\n(Modifié le:22/09/2025 11:05)",
      "status": "",
      "url": "",
      "lastModified": "2025-09-22T11:05:00+02:00"
    },
    {
      "id": "ADE60322e706c616e6e696e67554c5f323032355f323032362d39333138362d332d30",
      "title": "TD ME1040 Didactique disciplinaire, mise en oeuvre des program.",
      "start": "2026-01-27T17:30:00+01:00",
      "end": "2026-01-27T19:00:00+01:00",
      "allDay": false,
      "location": "Bridoux_TD 24",
      "description": "\n\nM2 MEEF EPS\nFRIEDRICH Jonathan\n\n(Modifié le:22/09/2025 11:05)",
      "status": "",
      "url": "",
      "lastModified": "2025-09-22T11:05:00+02:00"
    },
    {
      "id": "ADE60322e706c616e6e696e67554c5f323032355f323032362d3134393930312d302d39",
      "title": "Réservation Victor",
      "start": "2026-01-28T08:00:00+01:00",
      "end": "2026-01-28T10:00:00+01:00",
      "allDay": false,
      "location": "",
      "description": "\nSeconde chance 303.2 RM\n\n\n(Modifié le:03/10/2025 13:04)",
      "status": "",
      "url": "",
      "lastModified": "2025-10-03T13:04:00+02:00"
    },
    {
      "id": "ADE60322e706c616e6e696e67554c5f323032355f323032362d34363036362d302d30",
      "title": "Seconde chance UE 102.1 Mécanique du point ",
      "start": "2026-01-28T08:00:00+01:00",
      "end": "2026-01-28T09:30:00+01:00",
      "allDay": false,
      "location": "Bridoux_Berthelot,Bridoux_TD 8",
      "description": "\n\nTP A Portail PC\nTP B Portail PC\nTP C Portail PC\nTP D Portail PC\nTP E Portail PC\nTP F Portail PC\nGREFFIER Olivier\nCREOLA-CHIVERS Theo\nLECLERC Arnaud\n\n(Modifié le:27/11/2025 11:34)",
      "status": "",
      "url": "",
      "lastModified": "2025-11-27T11:34:00+01:00"
    },
    {
      "id": "ADE60322e706c616e6e696e67554c5f323032355f323032362d31323531332d302d38",
      "title": "TP Anglais GR.E",
      "start": "2026-01-28T08:00:00+01:00",
      "end": "2026-01-28T10:00:00+01:00",
      "allDay": false,
      "location": "Bridoux_TD 7",
      "description": "\n\nDAHMANI Faouzia\nTD/TP GR.E\n\n(Modifié le:17/09/2025 17:17)",
      "status": "",
      "url": "",
      "lastModified": "2025-09-17T17:17:00+02:00"
    },
    {
      "id": "ADE60322e706c616e6e696e67554c5f323032355f323032362d39333430302d302d30",
      "title": "Seconde chance UE 305.1 Transformée de Fourier",
      "start": "2026-01-28T08:00:00+01:00",
      "end": "2026-01-28T09:30:00+01:00",
      "allDay": false,
      "location": "Bridoux_TD 15",
      "description": "\n\nL2 Chimie FC\nTD A L2 Chimie\nTREMBLAY Jean-Christophe\n\n(Modifié le:03/12/2025 11:52)",
      "status": "",
      "url": "",
      "lastModified": "2025-12-03T11:52:00+01:00"
    },
    {
      "id": "ADE60322e706c616e6e696e67554c5f323032355f323032362d32323335382d382d30",
      "title": "EI 2 Gestion et analyse de données",
      "start": "2026-01-28T08:00:00+01:00",
      "end": "2026-01-28T12:00:00+01:00",
      "allDay": false,
      "location": "Bridoux_TP Info1 C1",
      "description": "\n\nNOESSER Frédéric\nLPRO Agro AAU\nLPRO Agro ADNT\n\n(Modifié le:05/11/2025 09:36)",
      "status": "",
      "url": "",
      "lastModified": "2025-11-05T09:36:00+01:00"
    },
    {
      "id": "ADE60322e706c616e6e696e67554c5f323032355f323032362d3130353432302d302d30",
      "title": "Seconde chance UE 303.2 Electromagnétisme 2",
      "start": "2026-01-28T08:00:00+01:00",
      "end": "2026-01-28T09:30:00+01:00",
      "allDay": false,
      "location": "Bridoux_TD 4",
      "description": "\n\nTD L2 Physique\nL2 Physique FC\nL2 Physique LAS\nL2 PC\nL2 PC LAS\nL2 Physique PE\nMESSINA René\nWAX Jean-François\n\n(Modifié le:03/10/2025 13:04)",
      "status": "",
      "url": "",
      "lastModified": "2025-10-03T13:04:00+02:00"
    },
    {
      "id": "ADE60322e706c616e6e696e67554c5f323032355f323032362d31323432372d302d38",
      "title": "TP Anglais GR.G",
      "start": "2026-01-28T08:00:00+01:00",
      "end": "2026-01-28T10:00:00+01:00",
      "allDay": false,
      "location": "Bridoux_TD 17",
      "description": "\n\nUBASSY Mickaël\nTP ANGLAIS GR.7\n\n(Modifié le:01/09/2025 20:34)",
      "status": "",
      "url": "",
      "lastModified": "2025-09-01T20:34:00+02:00"
    },
    {
      "id": "ADE60322e706c616e6e696e67554c5f323032355f323032362d31323439362d302d31",
      "title": "TP Anglais GR.D",
      "start": "2026-01-28T08:00:00+01:00",
      "end": "2026-01-28T10:00:00+01:00",
      "allDay": false,
      "location": "Bridoux_TD 13",
      "description": "\n\nHOFFART Christine\nTP ANGLAIS GR.4\n\n(Modifié le:01/09/2025 20:07)",
      "status": "",
      "url": "",
      "lastModified": "2025-09-01T20:07:00+02:00"
    },
    {
      "id": "ADE60322e706c616e6e696e67554c5f323032355f323032362d3139323934302d302d38",
      "title": "TPL EC1 Anglais GR I",
      "start": "2026-01-28T08:00:00+01:00",
      "end": "2026-01-28T10:00:00+01:00",
      "allDay": false,
      "location": "Bridoux_TD 16",
      "description": "\n\nNAVARRO Sylvain\nGR2 - Anglais\n\n(Modifié le:01/09/2025 20:38)",
      "status": "",
      "url": "",
      "lastModified": "2025-09-01T20:38:00+02:00"
    },
    {
      "id": "ADE60322e706c616e6e696e67554c5f323032355f323032362d31313231342d312d30",
      "title": "TD CD Physiotoxicology",
      "start": "2026-01-28T08:00:00+01:00",
      "end": "2026-01-28T10:00:00+01:00",
      "allDay": false,
      "location": "Bridoux_TD 14",
      "description": "\n\nBAIN Manon\nTP  D*\nTP  C*\n\n(Modifié le:10/12/2025 16:04)",
      "status": "",
      "url": "",
      "lastModified": "2025-12-10T16:04:00+01:00"
    },
    {
      "id": "ADE60322e706c616e6e696e67554c5f323032355f323032362d31323433302d302d31",
      "title": "TP Anglais GR.F",
      "start": "2026-01-28T08:00:00+01:00",
      "end": "2026-01-28T10:00:00+01:00",
      "allDay": false,
      "location": "Bridoux_TD 18",
      "description": "\n\nTP ANGLAIS GR.6\nMATHIS-BUTIN Catherine\n\n(Modifié le:01/09/2025 20:31)",
      "status": "",
      "url": "",
      "lastModified": "2025-09-01T20:31:00+02:00"
    },
    {
      "id": "ADE60322e706c616e6e696e67554c5f323032355f323032362d363530362d302d31",
      "title": "TPL EC1 Anglais GR H",
      "start": "2026-01-28T08:00:00+01:00",
      "end": "2026-01-28T10:00:00+01:00",
      "allDay": false,
      "location": "Bridoux_TD 9",
      "description": "\n\nAGHA NAJA Joudy\nGR1 - Anglais\n\n(Modifié le:01/09/2025 20:36)",
      "status": "",
      "url": "",
      "lastModified": "2025-09-01T20:36:00+02:00"
    },
    {
      "id": "ADE60322e706c616e6e696e67554c5f323032355f323032362d31303133312d302d30",
      "title": "CM Opt° Bases de géologie et pédologie",
      "start": "2026-01-28T08:00:00+01:00",
      "end": "2026-01-28T10:00:00+01:00",
      "allDay": false,
      "location": "Bridoux_TD 2",
      "description": "\n\nARAN Delphine\nGroupe bases de géologie & pédologie\n\n(Modifié le:04/12/2025 15:17)",
      "status": "",
      "url": "",
      "lastModified": "2025-12-04T15:17:00+01:00"
    },
    {
      "id": "ADE60322e706c616e6e696e67554c5f323032355f323032362d39353539302d322d30",
      "title": "6.04 EI Comptabilité générale et fiscalité",
      "start": "2026-01-28T08:30:00+01:00",
      "end": "2026-01-28T10:30:00+01:00",
      "allDay": false,
      "location": "Bridoux_TP Start up 2 D16",
      "description": "\n\nROTH David\nLP GDOSSL FI/FC\nLic Pro GDOSSL FA\n\n(Modifié le:13/10/2025 11:02)",
      "status": "",
      "url": "",
      "lastModified": "2025-10-13T11:02:00+02:00"
    },
    {
      "id": "ADE60322e706c616e6e696e67554c5f323032355f323032362d34313435392d302d30",
      "title": "TD E.MATHIS Problématiques sociales, besoins spécifiques et interv. APAS",
      "start": "2026-01-28T09:00:00+01:00",
      "end": "2026-01-28T12:00:00+01:00",
      "allDay": false,
      "location": "Bridoux_TD 1",
      "description": "\n\nMATHIS Emmanuelle\nTD APAS\n\n(Modifié le:02/12/2025 10:07)",
      "status": "",
      "url": "",
      "lastModified": "2025-12-02T10:07:00+01:00"
    },
    {
      "id": "ADE60322e706c616e6e696e67554c5f323032355f323032362d39353638382d312d30",
      "title": "UE 805 EC1 CM Santé Publique",
      "start": "2026-01-28T09:00:00+01:00",
      "end": "2026-01-28T12:00:00+01:00",
      "allDay": false,
      "location": "Bridoux_TP Start up 1 D14BIS",
      "description": "\n\nPromo complète M1 FA\nPromo complète M1 FI/FC\nOBERLAENDER Aurélia\n\n(Modifié le:11/12/2025 15:31)",
      "status": "",
      "url": "",
      "lastModified": "2025-12-11T15:31:00+01:00"
    },
    {
      "id": "ADE60322e706c616e6e696e67554c5f323032355f323032362d3137313333372d302d31",
      "title": "TD ME1051 Concevoir une transposition didactique en LC2",
      "start": "2026-01-28T09:00:00+01:00",
      "end": "2026-01-28T12:00:00+01:00",
      "allDay": false,
      "location": "Bridoux_TD 28",
      "description": "\n\nCORDIER Frederic\nM2 MEEF PC\n\n(Modifié le:06/11/2025 16:58)",
      "status": "",
      "url": "",
      "lastModified": "2025-11-06T16:58:00+01:00"
    },
    {
      "id": "ADE60322e706c616e6e696e67554c5f323032355f323032362d3133323838362d302d30",
      "title": "Seconde chance UE 102.2 Optique géométrique",
      "start": "2026-01-28T10:15:00+01:00",
      "end": "2026-01-28T11:45:00+01:00",
      "allDay": false,
      "location": "Bridoux_Berthelot,Bridoux_TD 8",
      "description": "\n\nGREFFIER Olivier\nTP A Portail PC\nTP B Portail PC\nTP C Portail PC\nTP D Portail PC\nTP E Portail PC\nTP F Portail PC\nMAILLARD Regine\nDALMASSO Stéphane\n\n(Modifié le:27/11/2025 11:33)",
      "status": "",
      "url": "",
      "lastModified": "2025-11-27T11:33:00+01:00"
    },
    {
      "id": "ADE60322e706c616e6e696e67554c5f323032355f323032362d3139323935322d302d38",
      "title": "TPL EC1 Anglais GR K",
      "start": "2026-01-28T10:15:00+01:00",
      "end": "2026-01-28T12:15:00+01:00",
      "allDay": false,
      "location": "Bridoux_TD 9",
      "description": "\n\nAGHA NAJA Joudy\nGR4 - Anglais\n\n(Modifié le:01/09/2025 20:41)",
      "status": "",
      "url": "",
      "lastModified": "2025-09-01T20:41:00+02:00"
    },
    {
      "id": "ADE60322e706c616e6e696e67554c5f323032355f323032362d3134393930312d302d3130",
      "title": "Réservation Victor",
      "start": "2026-01-28T10:15:00+01:00",
      "end": "2026-01-28T12:15:00+01:00",
      "allDay": false,
      "location": "",
      "description": "\nSeconde chance 303.1 JCT\n\n\n(Modifié le:03/10/2025 13:04)",
      "status": "",
      "url": "",
      "lastModified": "2025-10-03T13:04:00+02:00"
    },
    {
      "id": "ADE60322e706c616e6e696e67554c5f323032355f323032362d33353535372d302d31",
      "title": "CM EC 603.2 Chimie organique 7",
      "start": "2026-01-28T10:15:00+01:00",
      "end": "2026-01-28T12:15:00+01:00",
      "allDay": false,
      "location": "Bridoux_TD 12",
      "description": "\n\nCOMOY Corinne\nL3 Chimie FC\nTD - L3 Chimie\nL3 Chimie LAS\n\n(Modifié le:12/12/2025 17:04)",
      "status": "",
      "url": "",
      "lastModified": "2025-12-12T17:04:00+01:00"
    },
    {
      "id": "ADE60322e706c616e6e696e67554c5f323032355f323032362d31323432392d302d38",
      "title": "TP Anglais GR.C",
      "start": "2026-01-28T10:15:00+01:00",
      "end": "2026-01-28T12:15:00+01:00",
      "allDay": false,
      "location": "Bridoux_TD 16",
      "description": "\n\nNAVARRO Sylvain\nTP ANGLAIS GR.3\n\n(Modifié le:01/09/2025 20:05)",
      "status": "",
      "url": "",
      "lastModified": "2025-09-01T20:05:00+02:00"
    },
    {
      "id": "ADE60322e706c616e6e696e67554c5f323032355f323032362d31353731362d302d30",
      "title": "CM EC 405.1 Biochimie",
      "start": "2026-01-28T10:15:00+01:00",
      "end": "2026-01-28T12:15:00+01:00",
      "allDay": false,
      "location": "Bridoux_TD 2",
      "description": "\n\nPARANT Marc\nL2 Chimie FC\nL2 Chimie PE\nTD A L2 Chimie\nL2 Chimie LAS\n\n(Modifié le:08/12/2025 12:34)",
      "status": "",
      "url": "",
      "lastModified": "2025-12-08T12:34:00+01:00"
    },
    {
      "id": "ADE60322e706c616e6e696e67554c5f323032355f323032362d3139323935332d302d31",
      "title": "TPL EC1 Anglais GR L",
      "start": "2026-01-28T10:15:00+01:00",
      "end": "2026-01-28T12:15:00+01:00",
      "allDay": false,
      "location": "Bridoux_TD 13",
      "description": "\n\nHOFFART Christine\nGR5 - Anglais\n\n(Modifié le:01/09/2025 20:42)",
      "status": "",
      "url": "",
      "lastModified": "2025-09-01T20:42:00+02:00"
    },
    {
      "id": "ADE60322e706c616e6e696e67554c5f323032355f323032362d31303734352d322d30",
      "title": "TD Prof. Écoles / contexte et ouverture",
      "start": "2026-01-28T10:15:00+01:00",
      "end": "2026-01-28T12:15:00+01:00",
      "allDay": false,
      "location": "Bridoux_TD 5",
      "description": "\n\nTD EM\nJESSEL Jean-Jacques\n\n(Modifié le:01/12/2025 13:27)",
      "status": "",
      "url": "",
      "lastModified": "2025-12-01T13:27:00+01:00"
    },
    {
      "id": "ADE60322e706c616e6e696e67554c5f323032355f323032362d3139323935302d302d31",
      "title": "TPL EC1 Anglais GR J",
      "start": "2026-01-28T10:15:00+01:00",
      "end": "2026-01-28T12:15:00+01:00",
      "allDay": false,
      "location": "Bridoux_TD 7",
      "description": "\n\nDAHMANI Faouzia\nGR3 - Anglais\n\n(Modifié le:01/09/2025 20:39)",
      "status": "",
      "url": "",
      "lastModified": "2025-09-01T20:39:00+02:00"
    },
    {
      "id": "ADE60322e706c616e6e696e67554c5f323032355f323032362d3139323935382d302d38",
      "title": "TPL EC1 Anglais GR M",
      "start": "2026-01-28T10:15:00+01:00",
      "end": "2026-01-28T12:15:00+01:00",
      "allDay": false,
      "location": "Bridoux_TD 15",
      "description": "\n\nLIU Haoran\nGR6 - Anglais\n\n(Modifié le:01/09/2025 20:52)",
      "status": "",
      "url": "",
      "lastModified": "2025-09-01T20:52:00+02:00"
    },
    {
      "id": "ADE60322e706c616e6e696e67554c5f323032355f323032362d3130353432312d302d30",
      "title": "Seconde chance UE 303.1 Ondes et vibrations",
      "start": "2026-01-28T10:15:00+01:00",
      "end": "2026-01-28T11:45:00+01:00",
      "allDay": false,
      "location": "Bridoux_TD 4",
      "description": "\n\nTD L2 Physique\nL2 Physique FC\nL2 Physique LAS\nL2 PC\nL2 Physique PE\nTREMBLAY Jean-Christophe\n\n(Modifié le:03/10/2025 13:04)",
      "status": "",
      "url": "",
      "lastModified": "2025-10-03T13:04:00+02:00"
    },
    {
      "id": "ADE60322e706c616e6e696e67554c5f323032355f323032362d31323432382d302d31",
      "title": "TP Anglais GR.B",
      "start": "2026-01-28T10:15:00+01:00",
      "end": "2026-01-28T12:15:00+01:00",
      "allDay": false,
      "location": "Bridoux_TD 17",
      "description": "\n\nUBASSY Mickaël\nTP ANGLAIS GR.2\n\n(Modifié le:01/09/2025 20:02)",
      "status": "",
      "url": "",
      "lastModified": "2025-09-01T20:02:00+02:00"
    },
    {
      "id": "ADE60322e706c616e6e696e67554c5f323032355f323032362d31313231342d332d30",
      "title": "TD CD Physiotoxicology",
      "start": "2026-01-28T10:15:00+01:00",
      "end": "2026-01-28T12:15:00+01:00",
      "allDay": false,
      "location": "Bridoux_TD 14",
      "description": "\n\nMASFARAUD Jean-François\nTP  D*\nTP  C*\n\n(Modifié le:11/12/2025 10:31)",
      "status": "",
      "url": "",
      "lastModified": "2025-12-11T10:31:00+01:00"
    },
    {
      "id": "ADE60322e706c616e6e696e67554c5f323032355f323032362d373334362d302d31",
      "title": "TP Anglais GR.A",
      "start": "2026-01-28T10:15:00+01:00",
      "end": "2026-01-28T12:15:00+01:00",
      "allDay": false,
      "location": "Bridoux_TD 18",
      "description": "\n\nTP ANGLAIS GR.1\nMATHIS-BUTIN Catherine\n\n(Modifié le:01/09/2025 19:49)",
      "status": "",
      "url": "",
      "lastModified": "2025-09-01T19:49:00+02:00"
    },
    {
      "id": "ADE60322e706c616e6e696e67554c5f323032355f323032362d39353538382d342d30",
      "title": "6.03 EI Management et gestion des structures et des services",
      "start": "2026-01-28T10:30:00+01:00",
      "end": "2026-01-28T12:30:00+01:00",
      "allDay": false,
      "location": "Bridoux_TP Start up 2 D16",
      "description": "\n\nLP GDOSSL FI/FC\nMICHEL Sarah\n\n(Modifié le:10/11/2025 17:11)",
      "status": "",
      "url": "",
      "lastModified": "2025-11-10T17:11:00+01:00"
    },
    {
      "id": "ADE60322e706c616e6e696e67554c5f323032355f323032362d38343738322d322d30",
      "title": "EI 2 Paysage et innovation",
      "start": "2026-01-28T13:00:00+01:00",
      "end": "2026-01-28T17:00:00+01:00",
      "allDay": false,
      "location": "Bridoux_TD 3",
      "description": "\n\nLPRO Agro AAU\nDINSENMEYER Thibaut\n\n(Modifié le:27/11/2025 09:18)",
      "status": "",
      "url": "",
      "lastModified": "2025-11-27T09:18:00+01:00"
    },
    {
      "id": "ADE60322e706c616e6e696e67554c5f323032355f323032362d31303434312d302d30",
      "title": "TP A Projet Personnel et Professionnel",
      "start": "2026-01-28T13:00:00+01:00",
      "end": "2026-01-28T15:00:00+01:00",
      "allDay": false,
      "location": "Bridoux_TP Info2 C5",
      "description": "\n\nFAUPIN Solène\nTP  A*\n\n(Modifié le:05/12/2025 11:31)",
      "status": "",
      "url": "",
      "lastModified": "2025-12-05T11:31:00+01:00"
    },
    {
      "id": "ADE60322e706c616e6e696e67554c5f323032355f323032362d393531332d302d30",
      "title": "TD Problématiques sociales, besoins spécifiques et interv. APAS",
      "start": "2026-01-28T13:00:00+01:00",
      "end": "2026-01-28T17:00:00+01:00",
      "allDay": false,
      "location": "Bridoux_TP Damasio D3",
      "description": "\n\nROGIER GERVAISE Lucille\nTD APAS\n\n(Modifié le:05/12/2025 16:38)",
      "status": "",
      "url": "",
      "lastModified": "2025-12-05T16:38:00+01:00"
    },
    {
      "id": "ADE60322e706c616e6e696e67554c5f323032355f323032362d39353638392d312d30",
      "title": "UE 805 EC1 TD Santé Publique",
      "start": "2026-01-28T13:00:00+01:00",
      "end": "2026-01-28T16:00:00+01:00",
      "allDay": false,
      "location": "Bridoux_TP Start up 1 D14BIS",
      "description": "\n\nPromo complète M1 FA\nPromo complète M1 FI/FC\nOBERLAENDER Aurélia\n\n(Modifié le:11/12/2025 15:31)",
      "status": "",
      "url": "",
      "lastModified": "2025-12-11T15:31:00+01:00"
    },
    {
      "id": "ADE60322e706c616e6e696e67554c5f323032355f323032362d31363236322d302d33",
      "title": "CM EC 403.2 Chimie minérale 3",
      "start": "2026-01-28T13:30:00+01:00",
      "end": "2026-01-28T15:30:00+01:00",
      "allDay": false,
      "location": "Bridoux_TD 14",
      "description": "\n\nL2 Chimie FC\nL2 Chimie LAS\nL2 Chimie PE\nTD A L2 Chimie\nMEUX Éric\n\n(Modifié le:24/11/2025 12:13)",
      "status": "",
      "url": "",
      "lastModified": "2025-11-24T12:13:00+01:00"
    },
    {
      "id": "ADE60322e706c616e6e696e67554c5f323032355f323032362d3139333234362d302d38",
      "title": "TD UE207 Langue Intern GRC",
      "start": "2026-01-28T13:30:00+01:00",
      "end": "2026-01-28T15:30:00+01:00",
      "allDay": false,
      "location": "Bridoux_TD 13",
      "description": "\n\nHOFFART Christine\nL1 PC - Anglais GRP C\n\n(Modifié le:02/09/2025 16:26)",
      "status": "",
      "url": "",
      "lastModified": "2025-09-02T16:26:00+02:00"
    },
    {
      "id": "ADE60322e706c616e6e696e67554c5f323032355f323032362d383035352d302d30",
      "title": "CM Histoire du sport",
      "start": "2026-01-28T13:30:00+01:00",
      "end": "2026-01-28T15:30:00+01:00",
      "allDay": false,
      "location": "Bridoux_Salle des Actes B14",
      "description": "\n\nHAUBER-MULLER Thomas\nGR. EM\n\n(Modifié le:15/12/2025 09:37)",
      "status": "",
      "url": "",
      "lastModified": "2025-12-15T09:37:00+01:00"
    },
    {
      "id": "ADE60322e706c616e6e696e67554c5f323032355f323032362d3139333235312d302d31",
      "title": "TD UE207 Langue Intern GRE",
      "start": "2026-01-28T13:30:00+01:00",
      "end": "2026-01-28T15:30:00+01:00",
      "allDay": false,
      "location": "Bridoux_TD 18",
      "description": "\n\nAGHA NAJA Joudy\nL1 PC - Anglais GRP E\n\n(Modifié le:29/09/2025 22:47)",
      "status": "",
      "url": "",
      "lastModified": "2025-09-29T22:47:00+02:00"
    },
    {
      "id": "ADE60322e706c616e6e696e67554c5f323032355f323032362d3139333234352d302d31",
      "title": "TD UE207 Langue Intern GRB",
      "start": "2026-01-28T13:30:00+01:00",
      "end": "2026-01-28T15:30:00+01:00",
      "allDay": false,
      "location": "Bridoux_TD 16",
      "description": "\n\nNAVARRO Sylvain\nL1 PC - Anglais GRP B\n\n(Modifié le:02/09/2025 13:13)",
      "status": "",
      "url": "",
      "lastModified": "2025-09-02T13:13:00+02:00"
    },
    {
      "id": "ADE60322e706c616e6e696e67554c5f323032355f323032362d3136373932322d322d30",
      "title": "TD ME851 Concevoir une transposition didactique en LC- 2",
      "start": "2026-01-28T13:30:00+01:00",
      "end": "2026-01-28T16:30:00+01:00",
      "allDay": false,
      "location": "Bridoux_TD 28",
      "description": "\n\nCORDIER Frederic\nM1 MEEF PC\n\n(Modifié le:06/11/2025 16:34)",
      "status": "",
      "url": "",
      "lastModified": "2025-11-06T16:34:00+01:00"
    },
    {
      "id": "ADE60322e706c616e6e696e67554c5f323032355f323032362d3131383632332d302d30",
      "title": "TP UE 806 - Restauration et Ingénierie écologique",
      "start": "2026-01-28T13:30:00+01:00",
      "end": "2026-01-28T17:30:00+01:00",
      "allDay": false,
      "location": "Bridoux_TP Info6 F2",
      "description": "\n\nMULLER Timothe\nTP GEMAREC\n\n(Modifié le:09/12/2025 12:34)",
      "status": "",
      "url": "",
      "lastModified": "2025-12-09T12:34:00+01:00"
    },
    {
      "id": "ADE60322e706c616e6e696e67554c5f323032355f323032362d39353538332d322d30",
      "title": "6.02 EI Droit des sociétés",
      "start": "2026-01-28T13:30:00+01:00",
      "end": "2026-01-28T17:30:00+01:00",
      "allDay": false,
      "location": "Bridoux_TP Start up 2 D16",
      "description": "\n\nLP GDOSSL FI/FC\nLic Pro GDOSSL FA\nROTH David\n\n(Modifié le:10/11/2025 17:11)",
      "status": "",
      "url": "",
      "lastModified": "2025-11-10T17:11:00+01:00"
    },
    {
      "id": "ADE60322e706c616e6e696e67554c5f323032355f323032362d31303738312d342d30",
      "title": "TD Pédagogie, didactique des APSA à des fins éducatives",
      "start": "2026-01-28T13:30:00+01:00",
      "end": "2026-01-28T17:30:00+01:00",
      "allDay": false,
      "location": "Bridoux_TD 2",
      "description": "\n\nTD EM LAS\nTD EM\nFRIEDRICH Jonathan\n\n(Modifié le:07/11/2025 17:34)",
      "status": "",
      "url": "",
      "lastModified": "2025-11-07T17:34:00+01:00"
    },
    {
      "id": "ADE60322e706c616e6e696e67554c5f323032355f323032362d3139333234372d302d31",
      "title": "TD UE207 Langue Intern GRD",
      "start": "2026-01-28T13:30:00+01:00",
      "end": "2026-01-28T15:30:00+01:00",
      "allDay": false,
      "location": "Bridoux_TD 17",
      "description": "\n\nWATRIN Pascale\nL1 PC - Anglais GRP D\n\n(Modifié le:29/09/2025 22:47)",
      "status": "",
      "url": "",
      "lastModified": "2025-09-29T22:47:00+02:00"
    },
    {
      "id": "ADE60322e706c616e6e696e67554c5f323032355f323032362d3230363630352d302d31",
      "title": "*TD Spécifique pharmacie G04",
      "start": "2026-01-28T14:00:00+01:00",
      "end": "2026-01-28T15:30:00+01:00",
      "allDay": false,
      "location": "Bridoux_TD 29",
      "description": "\n\nSAPIN-MINET Anne\nGroupe 04 Bridoux\n\n(Modifié le:02/12/2025 15:27)",
      "status": "",
      "url": "",
      "lastModified": "2025-12-02T15:27:00+01:00"
    },
    {
      "id": "ADE60322e706c616e6e696e67554c5f323032355f323032362d3139353732332d302d30",
      "title": "TD + EXAMEN Agroéquipements innovants",
      "start": "2026-01-28T14:00:00+01:00",
      "end": "2026-01-28T17:00:00+01:00",
      "allDay": false,
      "location": "Bridoux_TD 1",
      "description": "\n\nBELNER Alexandre\nLPRO Agro ADNT\n\n(Modifié le:17/11/2025 10:32)",
      "status": "",
      "url": "",
      "lastModified": "2025-11-17T10:32:00+01:00"
    },
    {
      "id": "ADE60322e706c616e6e696e67554c5f323032355f323032362d3132313737362d302d30",
      "title": "TP B Projet Personnel et Professionnel",
      "start": "2026-01-28T15:00:00+01:00",
      "end": "2026-01-28T17:00:00+01:00",
      "allDay": false,
      "location": "Bridoux_TP Info2 C5",
      "description": "\n\nFAUPIN Solène\nTP  B*\n\n(Modifié le:05/12/2025 11:32)",
      "status": "",
      "url": "",
      "lastModified": "2025-12-05T11:32:00+01:00"
    },
    {
      "id": "ADE60322e706c616e6e696e67554c5f323032355f323032362d383233352d302d34",
      "title": "CM Connaissance du système éducatif",
      "start": "2026-01-28T15:45:00+01:00",
      "end": "2026-01-28T17:45:00+01:00",
      "allDay": false,
      "location": "Bridoux_Salle des Actes B14",
      "description": "\n\nGR. EM\nHAUBER-MULLER Thomas\n\n(Modifié le:15/12/2025 09:37)",
      "status": "",
      "url": "",
      "lastModified": "2025-12-15T09:37:00+01:00"
    },
    {
      "id": "ADE60322e706c616e6e696e67554c5f323032355f323032362d3230363539322d302d31",
      "title": "*TD Spécifique pharmacie G03",
      "start": "2026-01-28T15:45:00+01:00",
      "end": "2026-01-28T17:15:00+01:00",
      "allDay": false,
      "location": "Bridoux_TD 29",
      "description": "\n\nSAPIN-MINET Anne\nGroupe 03 Bridoux\n\n(Modifié le:02/12/2025 15:27)",
      "status": "",
      "url": "",
      "lastModified": "2025-12-02T15:27:00+01:00"
    },
    {
      "id": "ADE60322e706c616e6e696e67554c5f323032355f323032362d393430302d302d31",
      "title": "TD UE207 Langue Intern GRA",
      "start": "2026-01-28T15:45:00+01:00",
      "end": "2026-01-28T17:45:00+01:00",
      "allDay": false,
      "location": "Bridoux_TD 16",
      "description": "\n\nNAVARRO Sylvain\nL1 PC - Anglais GRP A\n\n(Modifié le:02/09/2025 13:13)",
      "status": "",
      "url": "",
      "lastModified": "2025-09-02T13:13:00+02:00"
    },
    {
      "id": "ADE60322e706c616e6e696e67554c5f323032355f323032362d39353638342d302d30",
      "title": "UE 804 TP2 EC2 Outils pour la réadaptation",
      "start": "2026-01-28T16:00:00+01:00",
      "end": "2026-01-28T18:00:00+01:00",
      "allDay": false,
      "location": "Bridoux_TP Info1 C1",
      "description": "\n\nHAINAUT Jean-Philippe\nM1 APAS - Groupe TP 2\n\n(Modifié le:04/12/2025 15:52)",
      "status": "",
      "url": "",
      "lastModified": "2025-12-04T15:52:00+01:00"
    },
    {
      "id": "ADE60322e706c616e6e696e67554c5f323032355f323032362d31303835342d302d34",
      "title": "TD EC 402.1 Chimie organique 2",
      "start": "2026-01-29T08:00:00+01:00",
      "end": "2026-01-29T10:00:00+01:00",
      "allDay": false,
      "location": "Bridoux_TD 9",
      "description": "\n\nL2 Chimie FC\nL2 Chimie LAS\nL2 PC\nL2 PC LAS\nL2 Chimie PE\nL2 PC PE\nTD A L2 Chimie\nSINDT Michèle\n\n(Modifié le:25/11/2025 15:24)",
      "status": "",
      "url": "",
      "lastModified": "2025-11-25T15:24:00+01:00"
    },
    {
      "id": "ADE60322e706c616e6e696e67554c5f323032355f323032362d32363838372d342d30",
      "title": "EI 1 Le monde pro et les différents supports de communication",
      "start": "2026-01-29T08:00:00+01:00",
      "end": "2026-01-29T12:00:00+01:00",
      "allDay": false,
      "location": "Bridoux_TD 2",
      "description": "\n\nFLEURENCE Stephanie\nLPRO Agro ADNT\n\n(Modifié le:05/11/2025 09:36)",
      "status": "",
      "url": "",
      "lastModified": "2025-11-05T09:36:00+01:00"
    },
    {
      "id": "ADE60322e706c616e6e696e67554c5f323032355f323032362d3133313936382d342d30",
      "title": "EI 1 EC 203.1 Introduction à la chimie organique ",
      "start": "2026-01-29T08:00:00+01:00",
      "end": "2026-01-29T10:00:00+01:00",
      "allDay": false,
      "location": "Bridoux_TD 17",
      "description": "\n\nTP A Portail PC\nTP B Portail PC\nCOMOY Corinne\n\n(Modifié le:12/12/2025 15:06)",
      "status": "",
      "url": "",
      "lastModified": "2025-12-12T15:06:00+01:00"
    },
    {
      "id": "ADE60322e706c616e6e696e67554c5f323032355f323032362d343431302d362d30",
      "title": "TP A Diversité des eucaryotes 2",
      "start": "2026-01-29T08:00:00+01:00",
      "end": "2026-01-29T09:00:00+01:00",
      "allDay": false,
      "location": "Bridoux_TP Ranvier E2",
      "description": "\n\nNEGUESQUE Adrien\nTP  A*\n\n(Modifié le:01/12/2025 14:54)",
      "status": "",
      "url": "",
      "lastModified": "2025-12-01T14:54:00+01:00"
    },
    {
      "id": "ADE60322e706c616e6e696e67554c5f323032355f323032362d31343732342d302d31",
      "title": "CM EC 601.1 Bases d'électrochimie",
      "start": "2026-01-29T08:00:00+01:00",
      "end": "2026-01-29T10:00:00+01:00",
      "allDay": false,
      "location": "Bridoux_TD 13",
      "description": "\n\nBOULANGER Clotilde\nL3 Chimie FC\nL3 Chimie LAS\nTD - L3 Chimie\n\n(Modifié le:25/11/2025 11:37)",
      "status": "",
      "url": "",
      "lastModified": "2025-11-25T11:37:00+01:00"
    },
    {
      "id": "ADE60322e706c616e6e696e67554c5f323032355f323032362d3133353435362d362d30",
      "title": "EI 2 EC 202.1 Electromagnétisme ",
      "start": "2026-01-29T08:00:00+01:00",
      "end": "2026-01-29T10:00:00+01:00",
      "allDay": false,
      "location": "Bridoux_TD 28",
      "description": "\n\nTP C Portail PC\nTP D Portail PC\nDALMASSO Stéphane\n\n(Modifié le:15/12/2025 09:33)",
      "status": "",
      "url": "",
      "lastModified": "2025-12-15T09:33:00+01:00"
    },
    {
      "id": "ADE60322e706c616e6e696e67554c5f323032355f323032362d36303734352d362d30",
      "title": "TP B Diversité des eucaryotes 2",
      "start": "2026-01-29T09:00:00+01:00",
      "end": "2026-01-29T10:00:00+01:00",
      "allDay": false,
      "location": "Bridoux_TP Ranvier E2",
      "description": "\n\nNEGUESQUE Adrien\nTP  B*\n\n(Modifié le:01/12/2025 14:54)",
      "status": "",
      "url": "",
      "lastModified": "2025-12-01T14:54:00+01:00"
    },
    {
      "id": "ADE60322e706c616e6e696e67554c5f323032355f323032362d39343238352d362d30",
      "title": "TD ME1062 Gérer une classe, avoir une apporoche réflexive",
      "start": "2026-01-29T09:00:00+01:00",
      "end": "2026-01-29T12:00:00+01:00",
      "allDay": false,
      "location": "Bridoux_TD 3",
      "description": "\n\nPESCARA Sylvain\nM2 MEEF EPS\n\n(Modifié le:22/09/2025 11:05)",
      "status": "",
      "url": "",
      "lastModified": "2025-09-22T11:05:00+02:00"
    },
    {
      "id": "ADE60322e706c616e6e696e67554c5f323032355f323032362d38393033362d342d30",
      "title": "TD ME830 Savoirs propres à la discipline et épistémologie",
      "start": "2026-01-29T09:00:00+01:00",
      "end": "2026-01-29T12:00:00+01:00",
      "allDay": false,
      "location": "Bridoux_TD 1",
      "description": "\n\nVINCENT Cyrille\nPrépa CAPES STAPS EDT M1\nM1 MEEF EPS - Groupe A\nM1 MEEF EPS - Groupe B\n\n(Modifié le:22/09/2025 11:04)",
      "status": "",
      "url": "",
      "lastModified": "2025-09-22T11:04:00+02:00"
    },
    {
      "id": "ADE60322e706c616e6e696e67554c5f323032355f323032362d393737392d332d30",
      "title": "TD Pratiques spécifiques en APAS 2",
      "start": "2026-01-29T09:30:00+01:00",
      "end": "2026-01-29T11:30:00+01:00",
      "allDay": false,
      "location": "Bridoux_TP Damasio D3",
      "description": "\n\nTD APAS\nTD APAS LAS\nBUATOIS Severine\n\n(Modifié le:24/11/2025 13:23)",
      "status": "",
      "url": "",
      "lastModified": "2025-11-24T13:23:00+01:00"
    },
    {
      "id": "ADE60322e706c616e6e696e67554c5f323032355f323032362d36303737392d362d30",
      "title": "TP C Diversité des eucaryotes 2",
      "start": "2026-01-29T10:00:00+01:00",
      "end": "2026-01-29T11:00:00+01:00",
      "allDay": false,
      "location": "Bridoux_TP Ranvier E2",
      "description": "\n\nNEGUESQUE Adrien\nTP  C*\n\n(Modifié le:01/12/2025 14:55)",
      "status": "",
      "url": "",
      "lastModified": "2025-12-01T14:55:00+01:00"
    },
    {
      "id": "ADE60322e706c616e6e696e67554c5f323032355f323032362d3133303736372d302d30",
      "title": "EI 2 UE 201 Mathématiques 2",
      "start": "2026-01-29T10:15:00+01:00",
      "end": "2026-01-29T12:15:00+01:00",
      "allDay": false,
      "location": "Bridoux_TD 24",
      "description": "\n\nTP C Portail PC\nTP D Portail PC\nGLEIZE Jérôme\n\n(Modifié le:12/12/2025 16:17)",
      "status": "",
      "url": "",
      "lastModified": "2025-12-12T16:17:00+01:00"
    },
    {
      "id": "ADE60322e706c616e6e696e67554c5f323032355f323032362d31303133312d332d30",
      "title": "CM Opt° Bases de géologie et pédologie",
      "start": "2026-01-29T10:15:00+01:00",
      "end": "2026-01-29T12:15:00+01:00",
      "allDay": false,
      "location": "Bridoux_TD 15",
      "description": "\n\nARAN Delphine\nGroupe bases de géologie & pédologie\n\n(Modifié le:04/12/2025 15:20)",
      "status": "",
      "url": "",
      "lastModified": "2025-12-04T15:20:00+01:00"
    },
    {
      "id": "ADE60322e706c616e6e696e67554c5f323032355f323032362d31303834352d382d30",
      "title": "CM Approche socio-historique des pédagogies corporelles",
      "start": "2026-01-29T10:15:00+01:00",
      "end": "2026-01-29T12:15:00+01:00",
      "allDay": false,
      "location": "Bridoux_TD 5",
      "description": "\n\nCREMONI Jerome\nCM EM\nCM EM LAS\n\n(Modifié le:01/12/2025 15:53)",
      "status": "",
      "url": "",
      "lastModified": "2025-12-01T15:53:00+01:00"
    },
    {
      "id": "ADE60322e706c616e6e696e67554c5f323032355f323032362d363034362d332d30",
      "title": "CM EC 885.1 Télémesure et transmission",
      "start": "2026-01-29T10:15:00+01:00",
      "end": "2026-01-29T12:15:00+01:00",
      "allDay": false,
      "location": "Bridoux_TD 25",
      "description": "\n\nCM/TD MTI\nBOURHIS Guy\n\n(Modifié le:01/12/2025 16:48)",
      "status": "",
      "url": "",
      "lastModified": "2025-12-01T16:48:00+01:00"
    },
    {
      "id": "ADE60322e706c616e6e696e67554c5f323032355f323032362d3133313031362d352d30",
      "title": "EI 1 EC 202.1 Electromagnétisme ",
      "start": "2026-01-29T10:15:00+01:00",
      "end": "2026-01-29T12:15:00+01:00",
      "allDay": false,
      "location": "Bridoux_TD 9",
      "description": "\n\nTP A Portail PC\nTP B Portail PC\nWAX Jean-François\n\n(Modifié le:12/12/2025 14:53)",
      "status": "",
      "url": "",
      "lastModified": "2025-12-12T14:53:00+01:00"
    },
    {
      "id": "ADE60322e706c616e6e696e67554c5f323032355f323032362d31313037392d322d30",
      "title": "TD EC 401.1 Thermodynamique de la réaction chimique",
      "start": "2026-01-29T10:15:00+01:00",
      "end": "2026-01-29T12:15:00+01:00",
      "allDay": false,
      "location": "Bridoux_TD 16",
      "description": "\n\nACHARD Christian\nL2 Chimie FC\nL2 Chimie LAS\nL2 PC\nL2 PC LAS\nL2 Chimie PE\nL2 PC PE\nTD A L2 Chimie\n\n(Modifié le:25/11/2025 15:24)",
      "status": "",
      "url": "",
      "lastModified": "2025-11-25T15:24:00+01:00"
    },
    {
      "id": "ADE60322e706c616e6e696e67554c5f323032355f323032362d36313237312d362d30",
      "title": "TP D Diversité des eucaryotes 2",
      "start": "2026-01-29T11:00:00+01:00",
      "end": "2026-01-29T12:00:00+01:00",
      "allDay": false,
      "location": "Bridoux_TP Ranvier E2",
      "description": "\n\nNEGUESQUE Adrien\nTP  D*\n\n(Modifié le:01/12/2025 14:55)",
      "status": "",
      "url": "",
      "lastModified": "2025-12-01T14:55:00+01:00"
    },
    {
      "id": "ADE60322e706c616e6e696e67554c5f323032355f323032362d393531352d302d30",
      "title": "TP GR.1 Projet Professionnel Personnalisé en APAS",
      "start": "2026-01-29T12:30:00+01:00",
      "end": "2026-01-29T14:30:00+01:00",
      "allDay": false,
      "location": "Bridoux_TD 25",
      "description": "\n\nTP APAS GR.1\nASSELIN Marine\n\n(Modifié le:05/12/2025 16:19)",
      "status": "",
      "url": "",
      "lastModified": "2025-12-05T16:19:00+01:00"
    },
    {
      "id": "ADE60322e706c616e6e696e67554c5f323032355f323032362d393733312d372d30",
      "title": "TP GR.2 Pratiques spécifiques en APAS 2",
      "start": "2026-01-29T12:30:00+01:00",
      "end": "2026-01-29T14:30:00+01:00",
      "allDay": false,
      "location": "Bridoux_TP Damasio D3",
      "description": "\n\nTP APAS GR.2\nBUATOIS Severine\n\n(Modifié le:19/11/2025 11:41)",
      "status": "",
      "url": "",
      "lastModified": "2025-11-19T11:41:00+01:00"
    },
    {
      "id": "ADE60322e706c616e6e696e67554c5f323032355f323032362d36313338392d362d30",
      "title": "TP E Diversité des eucaryotes 2",
      "start": "2026-01-29T13:00:00+01:00",
      "end": "2026-01-29T14:00:00+01:00",
      "allDay": false,
      "location": "Bridoux_TP Ranvier E2",
      "description": "\n\nNEGUESQUE Adrien\nTP  E*\n\n(Modifié le:01/12/2025 14:56)",
      "status": "",
      "url": "",
      "lastModified": "2025-12-01T14:56:00+01:00"
    },
    {
      "id": "ADE60322e706c616e6e696e67554c5f323032355f323032362d31303834352d342d30",
      "title": "CM Approche socio-historique des pédagogies corporelles",
      "start": "2026-01-29T13:15:00+01:00",
      "end": "2026-01-29T15:45:00+01:00",
      "allDay": false,
      "location": "Bridoux_TD 5",
      "description": "\n\nHAUBER-MULLER Thomas\nCM EM\nCM EM LAS\n\n(Modifié le:01/12/2025 16:06)",
      "status": "",
      "url": "",
      "lastModified": "2025-12-01T16:06:00+01:00"
    },
    {
      "id": "ADE60322e706c616e6e696e67554c5f323032355f323032362d373539342d302d32",
      "title": "UE 809 TP ANGLAIS - GR. A",
      "start": "2026-01-29T13:30:00+01:00",
      "end": "2026-01-29T15:30:00+01:00",
      "allDay": false,
      "location": "Bridoux_TD 16",
      "description": "\n\nNAVARRO Sylvain\nTP ANGLAIS - GRP A\n\n(Modifié le:13/05/2025 13:19)",
      "status": "",
      "url": "",
      "lastModified": "2025-05-13T13:19:00+02:00"
    },
    {
      "id": "ADE60322e706c616e6e696e67554c5f323032355f323032362d3139333237382d302d32",
      "title": "UE 809 TP ANGLAIS - GR. B",
      "start": "2026-01-29T13:30:00+01:00",
      "end": "2026-01-29T15:30:00+01:00",
      "allDay": false,
      "location": "Bridoux_TD 17",
      "description": "\n\nUBASSY Mickaël\nTP ANGLAIS - GRP B\n\n(Modifié le:13/05/2025 13:28)",
      "status": "",
      "url": "",
      "lastModified": "2025-05-13T13:28:00+02:00"
    },
    {
      "id": "ADE60322e706c616e6e696e67554c5f323032355f323032362d36313736322d322d30",
      "title": "CM UE 814 - Traitement physico-chimique des déchets",
      "start": "2026-01-29T13:30:00+01:00",
      "end": "2026-01-29T15:30:00+01:00",
      "allDay": false,
      "location": "Bridoux_TD 1",
      "description": "\n\nMEUX Éric\nCM GE\n\n(Modifié le:18/11/2025 17:50)",
      "status": "",
      "url": "",
      "lastModified": "2025-11-18T17:50:00+01:00"
    },
    {
      "id": "ADE60322e706c616e6e696e67554c5f323032355f323032362d363131342d302d30",
      "title": "TD AB Projet Personnel et Professionnel",
      "start": "2026-01-29T13:30:00+01:00",
      "end": "2026-01-29T15:30:00+01:00",
      "allDay": false,
      "location": "Bridoux_TP Start up 1 D14BIS",
      "description": "\n\nFAUPIN Solène\nTP  A*\nTP  B*\n\n(Modifié le:05/12/2025 12:06)",
      "status": "",
      "url": "",
      "lastModified": "2025-12-05T12:06:00+01:00"
    },
    {
      "id": "ADE60322e706c616e6e696e67554c5f323032355f323032362d32323736332d302d30",
      "title": "EI UE 505 Enjeux sanitaires et environne. de l'agroécologie",
      "start": "2026-01-29T13:30:00+01:00",
      "end": "2026-01-29T15:30:00+01:00",
      "allDay": false,
      "location": "Bridoux_TD 2",
      "description": "\n\nLPRO Agro ADNT\nCOTELLE Sylvie\n\n(Modifié le:05/11/2025 09:36)",
      "status": "",
      "url": "",
      "lastModified": "2025-11-05T09:36:00+01:00"
    },
    {
      "id": "ADE60322e706c616e6e696e67554c5f323032355f323032362d39353630322d34332d30",
      "title": "PRJ Préparation du projet tutoré",
      "start": "2026-01-29T13:30:00+01:00",
      "end": "2026-01-29T15:30:00+01:00",
      "allDay": false,
      "location": "Bridoux_TD 7",
      "description": "\n\nLP GDOSSL FI/FC\n\n(Modifié le:08/12/2025 14:52)",
      "status": "",
      "url": "",
      "lastModified": "2025-12-08T14:52:00+01:00"
    },
    {
      "id": "ADE60322e706c616e6e696e67554c5f323032355f323032362d38373736332d302d31",
      "title": "TD GR.1 EM1  Natation",
      "start": "2026-01-29T13:30:00+01:00",
      "end": "2026-01-29T15:30:00+01:00",
      "allDay": false,
      "location": "Bridoux_TD 8",
      "description": "\n\nCREMONI Jerome\nGR. TD/TP EM1+LAS\n\n(Modifié le:08/12/2025 09:37)",
      "status": "",
      "url": "",
      "lastModified": "2025-12-08T09:37:00+01:00"
    },
    {
      "id": "ADE60322e706c616e6e696e67554c5f323032355f323032362d31313039332d302d33",
      "title": "CM EC 401.2 Cinétique chimique",
      "start": "2026-01-29T13:30:00+01:00",
      "end": "2026-01-29T15:30:00+01:00",
      "allDay": false,
      "location": "Bridoux_TD 12",
      "description": "\n\nGHARRED Nawres\nL2 Chimie FC\nL2 Chimie LAS\nL2 PC\nL2 PC LAS\nL2 PC PE\nTD A L2 Chimie\n\n(Modifié le:25/11/2025 15:24)",
      "status": "",
      "url": "",
      "lastModified": "2025-11-25T15:24:00+01:00"
    },
    {
      "id": "ADE60322e706c616e6e696e67554c5f323032355f323032362d31363539302d302d31",
      "title": "TD 401.1 Analyse 4",
      "start": "2026-01-29T13:30:00+01:00",
      "end": "2026-01-29T15:30:00+01:00",
      "allDay": false,
      "location": "Bridoux_TD 9",
      "description": "\n\nL2 Physique FC\nL2 Physique LAS\nL2 Physique PE\nTD L2 Physique\nMÜLLER Martin\n\n(Modifié le:28/11/2025 12:09)",
      "status": "",
      "url": "",
      "lastModified": "2025-11-28T12:09:00+01:00"
    },
    {
      "id": "ADE60322e706c616e6e696e67554c5f323032355f323032362d39303432312d382d30",
      "title": "EI ME840 Didact. disciplinaire et mise en ?uvre des programmes",
      "start": "2026-01-29T13:30:00+01:00",
      "end": "2026-01-29T15:00:00+01:00",
      "allDay": false,
      "location": "Bridoux_TD 3",
      "description": "\n\nPrépa CAPES STAPS EDT M1\nM1 MEEF EPS - Groupe A\nM1 MEEF EPS - Groupe B\nPESCARA Sylvain\n\n(Modifié le:22/09/2025 11:04)",
      "status": "",
      "url": "",
      "lastModified": "2025-09-22T11:04:00+02:00"
    },
    {
      "id": "ADE60322e706c616e6e696e67554c5f323032355f323032362d3133303833302d32322d30",
      "title": "EI 1 UE 201 Mathématiques 2",
      "start": "2026-01-29T13:30:00+01:00",
      "end": "2026-01-29T15:30:00+01:00",
      "allDay": false,
      "location": "Bridoux_TD 28",
      "description": "\n\nGRANDCOLAS Michel\nTP A Portail PC\nTP B Portail PC\n\n(Modifié le:12/12/2025 13:48)",
      "status": "",
      "url": "",
      "lastModified": "2025-12-12T13:48:00+01:00"
    },
    {
      "id": "ADE60322e706c616e6e696e67554c5f323032355f323032362d31313136342d332d30",
      "title": "TD CD Physicochimie et biomarqueurs",
      "start": "2026-01-29T13:30:00+01:00",
      "end": "2026-01-29T15:30:00+01:00",
      "allDay": false,
      "location": "Bridoux_TD 13",
      "description": "\n\nTP  D*\nTP  C*\nLOUIS Fanny\n\n(Modifié le:11/12/2025 14:52)",
      "status": "",
      "url": "",
      "lastModified": "2025-12-11T14:52:00+01:00"
    },
    {
      "id": "ADE60322e706c616e6e696e67554c5f323032355f323032362d3133303735372d302d30",
      "title": "EI 2 EC 203.2 Chimie des solutions aqueuses",
      "start": "2026-01-29T13:30:00+01:00",
      "end": "2026-01-29T15:30:00+01:00",
      "allDay": false,
      "location": "Bridoux_TD 18",
      "description": "\n\nTP C Portail PC\nTP D Portail PC\nACHARD Christian\n\n(Modifié le:15/12/2025 09:57)",
      "status": "",
      "url": "",
      "lastModified": "2025-12-15T09:57:00+01:00"
    },
    {
      "id": "ADE60322e706c616e6e696e67554c5f323032355f323032362d31313238392d302d30",
      "title": "TD AB Toxicologie systémique et appliquée",
      "start": "2026-01-29T13:30:00+01:00",
      "end": "2026-01-29T15:30:00+01:00",
      "allDay": false,
      "location": "Bridoux_TD 15",
      "description": "\n\nGALLIZZI Adrienne\nTP  A*\nTP  B*\n\n(Modifié le:01/12/2025 16:50)",
      "status": "",
      "url": "",
      "lastModified": "2025-12-01T16:50:00+01:00"
    },
    {
      "id": "ADE60322e706c616e6e696e67554c5f323032355f323032362d31343638342d302d37",
      "title": "TP EC 603.2 Physique expérimentale 3",
      "start": "2026-01-29T14:00:00+01:00",
      "end": "2026-01-29T17:00:00+01:00",
      "allDay": false,
      "location": "Bridoux_TP Carnot H6",
      "description": "\n\nLECLERC Arnaud\nL3 Physique FC\nL3 Physique LAS\nTD L3 Physique\n\n(Modifié le:28/11/2025 17:10)",
      "status": "",
      "url": "",
      "lastModified": "2025-11-28T17:10:00+01:00"
    },
    {
      "id": "ADE60322e706c616e6e696e67554c5f323032355f323032362d36313637322d362d30",
      "title": "TP F Diversité des eucaryotes 2",
      "start": "2026-01-29T14:00:00+01:00",
      "end": "2026-01-29T15:00:00+01:00",
      "allDay": false,
      "location": "Bridoux_TP Ranvier E2",
      "description": "\n\nNEGUESQUE Adrien\nTP  F*\n\n(Modifié le:01/12/2025 14:56)",
      "status": "",
      "url": "",
      "lastModified": "2025-12-01T14:56:00+01:00"
    },
    {
      "id": "ADE60322e706c616e6e696e67554c5f323032355f323032362d31313730312d342d30",
      "title": "CM EC Marketing",
      "start": "2026-01-29T14:00:00+01:00",
      "end": "2026-01-29T17:00:00+01:00",
      "allDay": false,
      "location": "Bridoux_TP Start up 2 D16",
      "description": "\n\nWOLLJUNG Serge\nUE ALT 04\nCM EC Marketing\nCM EC Marketing\nCM EC Marketing\nUE ALT 04\nCM EC Marketing\nCM EC Marketing\nCM EC Marketing\n\n(Modifié le:19/09/2025 11:00)",
      "status": "",
      "url": "",
      "lastModified": "2025-09-19T11:00:00+02:00"
    },
    {
      "id": "ADE60322e706c616e6e696e67554c5f323032355f323032362d39343238352d312d30",
      "title": "TD ME1062 Gérer une classe, avoir une apporoche réflexive",
      "start": "2026-01-29T14:00:00+01:00",
      "end": "2026-01-29T17:00:00+01:00",
      "allDay": false,
      "location": "Bridoux_TD 24",
      "description": "\n\nDI POL Luc\nM2 MEEF EPS\n\n(Modifié le:22/09/2025 11:05)",
      "status": "",
      "url": "",
      "lastModified": "2025-09-22T11:05:00+02:00"
    },
    {
      "id": "ADE60322e706c616e6e696e67554c5f323032355f323032362d3230363539302d302d31",
      "title": "*TD Spécifique pharmacie G02",
      "start": "2026-01-29T14:00:00+01:00",
      "end": "2026-01-29T15:30:00+01:00",
      "allDay": false,
      "location": "Bridoux_TD 29",
      "description": "\n\nSAPIN-MINET Anne\nGroupe 02 Bridoux\n\n(Modifié le:02/12/2025 15:27)",
      "status": "",
      "url": "",
      "lastModified": "2025-12-02T15:27:00+01:00"
    },
    {
      "id": "ADE60322e706c616e6e696e67554c5f323032355f323032362d33303036372d302d30",
      "title": "TP GR.2 Projet Professionnel Personnalisé en APAS",
      "start": "2026-01-29T14:30:00+01:00",
      "end": "2026-01-29T16:30:00+01:00",
      "allDay": false,
      "location": "Bridoux_TD 27",
      "description": "\n\nTP APAS GR.2\nASSELIN Marine\n\n(Modifié le:05/12/2025 16:19)",
      "status": "",
      "url": "",
      "lastModified": "2025-12-05T16:19:00+01:00"
    },
    {
      "id": "ADE60322e706c616e6e696e67554c5f323032355f323032362d32393931352d382d30",
      "title": "TP GR.1 Pratiques spécifiques en APAS 2",
      "start": "2026-01-29T14:30:00+01:00",
      "end": "2026-01-29T16:30:00+01:00",
      "allDay": false,
      "location": "Bridoux_TP Damasio D3",
      "description": "\n\nTP APAS GR.1\nTP APAS GR.1 LAS\nBUATOIS Severine\n\n(Modifié le:19/11/2025 11:40)",
      "status": "",
      "url": "",
      "lastModified": "2025-11-19T11:40:00+01:00"
    },
    {
      "id": "ADE60322e706c616e6e696e67554c5f323032355f323032362d38393832322d332d30",
      "title": "TD ME840 Didact. disciplinaire et mise en ?uvre des programmes",
      "start": "2026-01-29T15:00:00+01:00",
      "end": "2026-01-29T16:30:00+01:00",
      "allDay": false,
      "location": "Bridoux_TD 3",
      "description": "\n\nPESCARA Sylvain\nPrépa CAPES STAPS EDT M1\nM1 MEEF EPS - Groupe A\nM1 MEEF EPS - Groupe B\n\n(Modifié le:22/09/2025 11:04)",
      "status": "",
      "url": "",
      "lastModified": "2025-09-22T11:04:00+02:00"
    },
    {
      "id": "ADE60322e706c616e6e696e67554c5f323032355f323032362d36313639392d362d30",
      "title": "TP G Diversité des eucaryotes 2",
      "start": "2026-01-29T15:00:00+01:00",
      "end": "2026-01-29T16:00:00+01:00",
      "allDay": false,
      "location": "Bridoux_TP Ranvier E2",
      "description": "\n\nNEGUESQUE Adrien\nTP  G*\n\n(Modifié le:01/12/2025 14:56)",
      "status": "",
      "url": "",
      "lastModified": "2025-12-01T14:56:00+01:00"
    },
    {
      "id": "ADE60322e706c616e6e696e67554c5f323032355f323032362d31313238332d302d30",
      "title": "TD AB Génie microbiologique",
      "start": "2026-01-29T15:45:00+01:00",
      "end": "2026-01-29T17:45:00+01:00",
      "allDay": false,
      "location": "Bridoux_TD 5",
      "description": "\n\nPOUPIN Pascal\nTP  A*\nTP  B*\n\n(Modifié le:05/12/2025 14:51)",
      "status": "",
      "url": "",
      "lastModified": "2025-12-05T14:51:00+01:00"
    },
    {
      "id": "ADE60322e706c616e6e696e67554c5f323032355f323032362d363936372d302d33",
      "title": "CM EC 852.1 Systèmes d'exploitation embarqués",
      "start": "2026-01-29T15:45:00+01:00",
      "end": "2026-01-29T17:45:00+01:00",
      "allDay": false,
      "location": "Bridoux_TD 28",
      "description": "\n\nDIOU Camille\nCM/TD/TP CSEC\n\n(Modifié le:24/11/2025 16:07)",
      "status": "",
      "url": "",
      "lastModified": "2025-11-24T16:07:00+01:00"
    },
    {
      "id": "ADE60322e706c616e6e696e67554c5f323032355f323032362d3230363538322d302d36",
      "title": "*TD Spécifique pharmacie G01",
      "start": "2026-01-29T15:45:00+01:00",
      "end": "2026-01-29T17:15:00+01:00",
      "allDay": false,
      "location": "Bridoux_TD 29",
      "description": "\n\nSAPIN-MINET Anne\nGroupe 01 Bridoux\n\n(Modifié le:02/12/2025 15:27)",
      "status": "",
      "url": "",
      "lastModified": "2025-12-02T15:27:00+01:00"
    },
    {
      "id": "ADE60322e706c616e6e696e67554c5f323032355f323032362d343432332d302d30",
      "title": "CM EC 882.1 Supervision industrielle",
      "start": "2026-01-29T15:45:00+01:00",
      "end": "2026-01-29T17:45:00+01:00",
      "allDay": false,
      "location": "Bridoux_TD 26",
      "description": "\n\nBOUSEFSAF Frédéric\nCM ISHM/MTI\n\n(Modifié le:08/12/2025 08:38)",
      "status": "",
      "url": "",
      "lastModified": "2025-12-08T08:38:00+01:00"
    },
    {
      "id": "ADE60322e706c616e6e696e67554c5f323032355f323032362d383338372d302d31",
      "title": "TD GR.2 EM2  Natation",
      "start": "2026-01-29T15:45:00+01:00",
      "end": "2026-01-29T17:45:00+01:00",
      "allDay": false,
      "location": "Bridoux_TD 8",
      "description": "\n\nCREMONI Jerome\nGR.TD/TP EM2\n\n(Modifié le:15/12/2025 09:37)",
      "status": "",
      "url": "",
      "lastModified": "2025-12-15T09:37:00+01:00"
    },
    {
      "id": "ADE60322e706c616e6e696e67554c5f323032355f323032362d363334392d302d30",
      "title": "UE 606 TP ANGLAIS - GR. A",
      "start": "2026-01-29T15:45:00+01:00",
      "end": "2026-01-29T17:45:00+01:00",
      "allDay": false,
      "location": "Bridoux_TD 17",
      "description": "\n\nUBASSY Mickaël\nTP ANGLAIS - GR A\n\n(Modifié le:13/05/2025 13:52)",
      "status": "",
      "url": "",
      "lastModified": "2025-05-13T13:52:00+02:00"
    },
    {
      "id": "ADE60322e706c616e6e696e67554c5f323032355f323032362d31313136342d322d30",
      "title": "TD CD Physicochimie et biomarqueurs",
      "start": "2026-01-29T15:45:00+01:00",
      "end": "2026-01-29T17:45:00+01:00",
      "allDay": false,
      "location": "Bridoux_TD 2",
      "description": "\n\nMASFARAUD Jean-François\nTP  D*\nTP  C*\n\n(Modifié le:11/12/2025 14:52)",
      "status": "",
      "url": "",
      "lastModified": "2025-12-11T14:52:00+01:00"
    },
    {
      "id": "ADE60322e706c616e6e696e67554c5f323032355f323032362d36313734342d312d30",
      "title": "CM UE812-Effets des polluants à diff. niveaux d'organisation II",
      "start": "2026-01-29T15:45:00+01:00",
      "end": "2026-01-29T17:45:00+01:00",
      "allDay": false,
      "location": "Bridoux_TD 1",
      "description": "\n\nPRUD'HOMME Sophie\nCM ETOX\n\n(Modifié le:11/12/2025 15:30)",
      "status": "",
      "url": "",
      "lastModified": "2025-12-11T15:30:00+01:00"
    },
    {
      "id": "ADE60322e706c616e6e696e67554c5f323032355f323032362d3138383034302d302d30",
      "title": "UE 606 TP ANGLAIS - GR. B",
      "start": "2026-01-29T15:45:00+01:00",
      "end": "2026-01-29T17:45:00+01:00",
      "allDay": false,
      "location": "Bridoux_TD 16",
      "description": "\n\nNAVARRO Sylvain\nTP ANGLAIS - GR B\n\n(Modifié le:13/05/2025 13:40)",
      "status": "",
      "url": "",
      "lastModified": "2025-05-13T13:40:00+02:00"
    },
    {
      "id": "ADE60322e706c616e6e696e67554c5f323032355f323032362d36313734382d362d30",
      "title": "TP H Diversité des eucaryotes 2",
      "start": "2026-01-29T16:00:00+01:00",
      "end": "2026-01-29T17:00:00+01:00",
      "allDay": false,
      "location": "Bridoux_TP Ranvier E2",
      "description": "\n\nNEGUESQUE Adrien\nTP  H*\n\n(Modifié le:11/12/2025 12:18)",
      "status": "",
      "url": "",
      "lastModified": "2025-12-11T12:18:00+01:00"
    },
    {
      "id": "ADE60322e706c616e6e696e67554c5f323032355f323032362d36313835382d362d30",
      "title": "TP I Diversité des eucaryotes 2",
      "start": "2026-01-29T17:00:00+01:00",
      "end": "2026-01-29T18:00:00+01:00",
      "allDay": false,
      "location": "Bridoux_TP Ranvier E2",
      "description": "\n\nNEGUESQUE Adrien\nTP I*\n\n(Modifié le:01/12/2025 14:57)",
      "status": "",
      "url": "",
      "lastModified": "2025-12-01T14:57:00+01:00"
    },
    {
      "id": "ADE60322e706c616e6e696e67554c5f323032355f323032362d3139363231332d362d30",
      "title": "TP J Diversité des eucaryotes 2",
      "start": "2026-01-29T18:00:00+01:00",
      "end": "2026-01-29T19:00:00+01:00",
      "allDay": false,
      "location": "Bridoux_TP Ranvier E2",
      "description": "\n\nNEGUESQUE Adrien\nTP J*\n\n(Modifié le:01/12/2025 14:58)",
      "status": "",
      "url": "",
      "lastModified": "2025-12-01T14:58:00+01:00"
    },
    {
      "id": "ADE60322e706c616e6e696e67554c5f323032355f323032362d36343037322d312d30",
      "title": "TP E Projet Personnel et Professionnel",
      "start": "2026-01-30T08:00:00+01:00",
      "end": "2026-01-30T10:00:00+01:00",
      "allDay": false,
      "location": "Bridoux_TP Info1 C1",
      "description": "\n\nTP  E*\nDUVAL Alienor\n\n(Modifié le:12/12/2025 15:43)",
      "status": "",
      "url": "",
      "lastModified": "2025-12-12T15:43:00+01:00"
    },
    {
      "id": "ADE60322e706c616e6e696e67554c5f323032355f323032362d31313238352d302d30",
      "title": "TP A Toxicologie fondamentale",
      "start": "2026-01-30T08:00:00+01:00",
      "end": "2026-01-30T10:00:00+01:00",
      "allDay": false,
      "location": "Bridoux_TD 14",
      "description": "\n\nFELTEN Vincent\nTP  A*\n\n(Modifié le:09/12/2025 15:46)",
      "status": "",
      "url": "",
      "lastModified": "2025-12-09T15:46:00+01:00"
    },
    {
      "id": "ADE60322e706c616e6e696e67554c5f323032355f323032362d363638322d302d3132",
      "title": "UE 909 TP ANGLAIS - GR. A",
      "start": "2026-01-30T08:00:00+01:00",
      "end": "2026-01-30T10:00:00+01:00",
      "allDay": false,
      "location": "Bridoux_TD 15",
      "description": "\n\nTP ANGLAIS - GR A\nPACE Laetitia\n\n(Modifié le:03/07/2025 10:30)",
      "status": "",
      "url": "",
      "lastModified": "2025-07-03T10:30:00+02:00"
    },
    {
      "id": "ADE60322e706c616e6e696e67554c5f323032355f323032362d32383230302d302d3132",
      "title": "UE 909 TP ANGLAIS - GR. C",
      "start": "2026-01-30T08:00:00+01:00",
      "end": "2026-01-30T10:00:00+01:00",
      "allDay": false,
      "location": "Bridoux_TD 17",
      "description": "\n\nUBASSY Mickaël\nTP ANGLAIS - GR C\n\n(Modifié le:13/05/2025 15:21)",
      "status": "",
      "url": "",
      "lastModified": "2025-05-13T15:21:00+02:00"
    },
    {
      "id": "ADE60322e706c616e6e696e67554c5f323032355f323032362d31313330352d302d30",
      "title": "TD 402.1 Thermodynamique",
      "start": "2026-01-30T08:00:00+01:00",
      "end": "2026-01-30T10:00:00+01:00",
      "allDay": false,
      "location": "Bridoux_TD 13",
      "description": "\n\nL2 Physique FC\nL2 Physique LAS\nL2 PC\nL2 PC LAS\nL2 Physique PE\nL2 PC PE\nTD L2 Physique\nMOHRBACH Hervé\n\n(Modifié le:28/11/2025 13:10)",
      "status": "",
      "url": "",
      "lastModified": "2025-11-28T13:10:00+01:00"
    },
    {
      "id": "ADE60322e706c616e6e696e67554c5f323032355f323032362d32383139352d302d3132",
      "title": "UE 909 TP ANGLAIS - GR. B",
      "start": "2026-01-30T08:00:00+01:00",
      "end": "2026-01-30T10:00:00+01:00",
      "allDay": false,
      "location": "Bridoux_TD 18",
      "description": "\n\nMATHIS-BUTIN Catherine\nTP ANGLAIS - GR B\n\n(Modifié le:13/05/2025 15:16)",
      "status": "",
      "url": "",
      "lastModified": "2025-05-13T15:16:00+02:00"
    },
    {
      "id": "ADE60322e706c616e6e696e67554c5f323032355f323032362d393432362d322d30",
      "title": "CM Troubles neurologiques et intervention en APAS",
      "start": "2026-01-30T08:30:00+01:00",
      "end": "2026-01-30T10:30:00+01:00",
      "allDay": false,
      "location": "Bridoux_TP Start up 2 D16",
      "description": "\n\nCM APAS\nCM APAS LAS\nBRIER Laurence\n\n(Modifié le:06/11/2025 17:35)",
      "status": "",
      "url": "",
      "lastModified": "2025-11-06T17:35:00+01:00"
    },
    {
      "id": "ADE60322e706c616e6e696e67554c5f323032355f323032362d39353630322d34352d30",
      "title": "PRJ Préparation du projet tutoré",
      "start": "2026-01-30T09:00:00+01:00",
      "end": "2026-01-30T11:00:00+01:00",
      "allDay": false,
      "location": "Bridoux_TD 24",
      "description": "\n\nLP GDOSSL FI/FC\n\n(Modifié le:08/12/2025 14:52)",
      "status": "",
      "url": "",
      "lastModified": "2025-12-08T14:52:00+01:00"
    },
    {
      "id": "ADE60322e706c616e6e696e67554c5f323032355f323032362d31393037372d302d31",
      "title": "EI 1 206.1 Circuits électriques cours",
      "start": "2026-01-30T10:15:00+01:00",
      "end": "2026-01-30T12:15:00+01:00",
      "allDay": false,
      "location": "Bridoux_TD 2",
      "description": "\n\nCODA-BOUCHOT Virginie\nTP A Portail PC\nTP B Portail PC\n\n(Modifié le:12/12/2025 15:12)",
      "status": "",
      "url": "",
      "lastModified": "2025-12-12T15:12:00+01:00"
    },
    {
      "id": "ADE60322e706c616e6e696e67554c5f323032355f323032362d3133313031322d342d30",
      "title": "EI 2 EC 202.1 Electromagnétisme ",
      "start": "2026-01-30T10:15:00+01:00",
      "end": "2026-01-30T12:15:00+01:00",
      "allDay": false,
      "location": "Bridoux_TD 12",
      "description": "\n\nTP C Portail PC\nTP D Portail PC\nDALMASSO Stéphane\n\n(Modifié le:15/12/2025 09:33)",
      "status": "",
      "url": "",
      "lastModified": "2025-12-15T09:33:00+01:00"
    },
    {
      "id": "ADE60322e706c616e6e696e67554c5f323032355f323032362d31313636372d302d33",
      "title": "TD 403.2 Optique physique",
      "start": "2026-01-30T10:15:00+01:00",
      "end": "2026-01-30T12:15:00+01:00",
      "allDay": false,
      "location": "Bridoux_TD 6",
      "description": "\n\nL2 Physique FC\nL2 Physique LAS\nL2 PC\nL2 PC LAS\nL2 Physique PE\nL2 PC PE\nTD L2 Physique\nJOHANN Luc\n\n(Modifié le:28/11/2025 12:39)",
      "status": "",
      "url": "",
      "lastModified": "2025-11-28T12:39:00+01:00"
    },
    {
      "id": "ADE60322e706c616e6e696e67554c5f323032355f323032362d37373137392d302d30",
      "title": "SECONDE CHANCE Langues et internationalisation",
      "start": "2026-01-30T10:15:00+01:00",
      "end": "2026-01-30T11:15:00+01:00",
      "allDay": false,
      "location": "Bridoux_TD 17",
      "description": "\n\nUBASSY Mickaël\nLPRO Agro AAU\nLPRO Agro ADNT\n\n(Modifié le:05/11/2025 09:36)",
      "status": "",
      "url": "",
      "lastModified": "2025-11-05T09:36:00+01:00"
    },
    {
      "id": "ADE60322e706c616e6e696e67554c5f323032355f323032362d36333733392d322d30",
      "title": "EI IJ Algorithmique",
      "start": "2026-01-30T10:15:00+01:00",
      "end": "2026-01-30T12:15:00+01:00",
      "allDay": false,
      "location": "Bridoux_TD 1",
      "description": "\n\nTP I*\nTP J*\nCAMARA Baba Issa\n\n(Modifié le:03/12/2025 16:46)",
      "status": "",
      "url": "",
      "lastModified": "2025-12-03T16:46:00+01:00"
    },
    {
      "id": "ADE60322e706c616e6e696e67554c5f323032355f323032362d31373237302d302d30",
      "title": "TP B Toxicologie fondamentale",
      "start": "2026-01-30T10:15:00+01:00",
      "end": "2026-01-30T12:15:00+01:00",
      "allDay": false,
      "location": "Bridoux_TD 14",
      "description": "\n\nFELTEN Vincent\nTP  B*\n\n(Modifié le:09/12/2025 15:47)",
      "status": "",
      "url": "",
      "lastModified": "2025-12-09T15:47:00+01:00"
    },
    {
      "id": "ADE60322e706c616e6e696e67554c5f323032355f323032362d36343037362d312d30",
      "title": "TP F Projet Personnel et Professionnel",
      "start": "2026-01-30T10:15:00+01:00",
      "end": "2026-01-30T12:15:00+01:00",
      "allDay": false,
      "location": "Bridoux_TP Info1 C1",
      "description": "\n\nTP  F*\nDUVAL Alienor\n\n(Modifié le:12/12/2025 15:44)",
      "status": "",
      "url": "",
      "lastModified": "2025-12-12T15:44:00+01:00"
    },
    {
      "id": "ADE60322e706c616e6e696e67554c5f323032355f323032362d393432372d302d30",
      "title": "TD Troubles neurologiques et intervention en APAS",
      "start": "2026-01-30T10:30:00+01:00",
      "end": "2026-01-30T12:30:00+01:00",
      "allDay": false,
      "location": "Bridoux_TP Start up 2 D16",
      "description": "\n\nTD APAS\nTD APAS LAS\nBRIER Laurence\n\n(Modifié le:06/11/2025 17:36)",
      "status": "",
      "url": "",
      "lastModified": "2025-11-06T17:36:00+01:00"
    },
    {
      "id": "ADE60322e706c616e6e696e67554c5f323032355f323032362d32363838372d302d30",
      "title": "EI 1 Le monde pro et les différents supports de communication",
      "start": "2026-01-30T13:00:00+01:00",
      "end": "2026-01-30T15:00:00+01:00",
      "allDay": false,
      "location": "Bridoux_TD 1",
      "description": "\n\nLPRO Agro ADNT\nMULLER Manon\n\n(Modifié le:27/11/2025 17:17)",
      "status": "",
      "url": "",
      "lastModified": "2025-11-27T17:17:00+01:00"
    },
    {
      "id": "ADE60322e706c616e6e696e67554c5f323032355f323032362d32393532382d312d30",
      "title": "TP GR.2 Outils d'analyse, d'évaluation et de réadaptation en APAS",
      "start": "2026-01-30T13:15:00+01:00",
      "end": "2026-01-30T15:45:00+01:00",
      "allDay": false,
      "location": "Bridoux_TP Start up 1 D14BIS",
      "description": "\n\nTP APAS GR.2\nBOUSMIA Johanne\n\n(Modifié le:02/12/2025 16:06)",
      "status": "",
      "url": "",
      "lastModified": "2025-12-02T16:06:00+01:00"
    },
    {
      "id": "ADE60322e706c616e6e696e67554c5f323032355f323032362d34343834332d312d30",
      "title": "TD Analyse de l'intervention",
      "start": "2026-01-30T13:30:00+01:00",
      "end": "2026-01-30T16:00:00+01:00",
      "allDay": false,
      "location": "Bridoux_Salle des Actes B14",
      "description": "\n\nJESSEL Jean-Jacques\nGR. EM\n\n(Modifié le:15/12/2025 09:37)",
      "status": "",
      "url": "",
      "lastModified": "2025-12-15T09:37:00+01:00"
    },
    {
      "id": "ADE60322e706c616e6e696e67554c5f323032355f323032362d3139363038382d322d30",
      "title": "EI IJ 206.1 Chimie Organique pour la Biologie",
      "start": "2026-01-30T13:30:00+01:00",
      "end": "2026-01-30T15:30:00+01:00",
      "allDay": false,
      "location": "Bridoux_TD 17",
      "description": "\n\nHESSE Stéphanie\nTP I*\nTP J*\n\n(Modifié le:01/12/2025 13:18)",
      "status": "",
      "url": "",
      "lastModified": "2025-12-01T13:18:00+01:00"
    },
    {
      "id": "ADE60322e706c616e6e696e67554c5f323032355f323032362d39353630322d35372d30",
      "title": "PRJ Préparation du projet tutoré",
      "start": "2026-01-30T13:30:00+01:00",
      "end": "2026-01-30T15:30:00+01:00",
      "allDay": false,
      "location": "Bridoux_TD 24",
      "description": "\n\nLP GDOSSL FI/FC\n\n(Modifié le:08/12/2025 14:52)",
      "status": "",
      "url": "",
      "lastModified": "2025-12-08T14:52:00+01:00"
    },
    {
      "id": "ADE60322e706c616e6e696e67554c5f323032355f323032362d393130312d31342d30",
      "title": "EI 2 EC 203.1 Introduction à la chimie organique ",
      "start": "2026-01-30T13:30:00+01:00",
      "end": "2026-01-30T16:30:00+01:00",
      "allDay": false,
      "location": "Bridoux_TD 18",
      "description": "\n\nTP C Portail PC\nTP D Portail PC\nCOMOY Corinne\n\n(Modifié le:12/12/2025 17:05)",
      "status": "",
      "url": "",
      "lastModified": "2025-12-12T17:05:00+01:00"
    },
    {
      "id": "ADE60322e706c616e6e696e67554c5f323032355f323032362d3139353136312d332d30",
      "title": "TP grp 2 UE 922 - Formation SST",
      "start": "2026-01-30T13:30:00+01:00",
      "end": "2026-01-30T15:30:00+01:00",
      "allDay": false,
      "location": "Bridoux_TP Start up 2 D16",
      "description": "\n\nHOFFMANN Mireille\nTP GE\n\n(Modifié le:20/10/2025 12:56)",
      "status": "",
      "url": "",
      "lastModified": "2025-10-20T12:56:00+02:00"
    },
    {
      "id": "ADE60322e706c616e6e696e67554c5f323032355f323032362d36323638382d332d30",
      "title": "TD EF Génétique fondamentale",
      "start": "2026-01-30T13:30:00+01:00",
      "end": "2026-01-30T15:30:00+01:00",
      "allDay": false,
      "location": "Bridoux_TD 2",
      "description": "\n\nRODIUS François\nTP  E*\nTP  F*\n\n(Modifié le:08/12/2025 15:20)",
      "status": "",
      "url": "",
      "lastModified": "2025-12-08T15:20:00+01:00"
    },
    {
      "id": "ADE60322e706c616e6e696e67554c5f323032355f323032362d33303231352d302d31",
      "title": "TD GR.D Acrosport-Gymnastique",
      "start": "2026-01-30T15:30:00+01:00",
      "end": "2026-01-30T17:30:00+01:00",
      "allDay": false,
      "location": "Bridoux_TD 8",
      "description": "\n\nTD/TP GR.D\nSAGRAFENA Hugo\n\n(Modifié le:13/11/2025 16:37)",
      "status": "",
      "url": "",
      "lastModified": "2025-11-13T16:37:00+01:00"
    },
    {
      "id": "ADE60322e706c616e6e696e67554c5f323032355f323032362d3139343837382d332d30",
      "title": "TP grp1  UE 922 - Formation SST",
      "start": "2026-01-30T15:30:00+01:00",
      "end": "2026-01-30T17:30:00+01:00",
      "allDay": false,
      "location": "Bridoux_TP Start up 2 D16",
      "description": "\n\nTP GE\nHOFFMANN Mireille\n\n(Modifié le:20/10/2025 12:56)",
      "status": "",
      "url": "",
      "lastModified": "2025-10-20T12:56:00+02:00"
    },
    {
      "id": "ADE60322e706c616e6e696e67554c5f323032355f323032362d383038372d332d30",
      "title": "CM Histoire de l'Education Physique",
      "start": "2026-02-02T08:00:00+01:00",
      "end": "2026-02-02T10:00:00+01:00",
      "allDay": false,
      "location": "Bridoux_Salle des Actes B14",
      "description": "\n\nCREMONI Jerome\nGR. EM\n\n(Modifié le:15/12/2025 10:35)",
      "status": "",
      "url": "",
      "lastModified": "2025-12-15T10:35:00+01:00"
    },
    {
      "id": "ADE60322e706c616e6e696e67554c5f323032355f323032362d38343736362d31312d30",
      "title": "EI Paysage et vie du sol : botanique et écologie urbaine",
      "start": "2026-02-02T08:00:00+01:00",
      "end": "2026-02-02T11:00:00+01:00",
      "allDay": false,
      "location": "Bridoux_TD 1",
      "description": "\n\nVALENTIN Sophie\nLPRO Agro AAU\n\n(Modifié le:15/12/2025 09:30)",
      "status": "",
      "url": "",
      "lastModified": "2025-12-15T09:30:00+01:00"
    },
    {
      "id": "ADE60322e706c616e6e696e67554c5f323032355f323032362d3131383535302d302d30",
      "title": "Seconde chance UE 103.1 Atomes et molécules - Structure de la matière",
      "start": "2026-02-02T08:00:00+01:00",
      "end": "2026-02-02T09:30:00+01:00",
      "allDay": false,
      "location": "Bridoux_Darwin,Bridoux_TD 2",
      "description": "\n\nTP A Portail PC\nTP B Portail PC\nTP C Portail PC\nTP D Portail PC\nTP E Portail PC\nCARRE Vincent\nAKIL Suzanna\nCHAIMBAULT Patrick\nCOURILLEAU-GOBRY Anne\nTRAULLÉ Nathan\n\n(Modifié le:27/11/2025 11:40)",
      "status": "",
      "url": "",
      "lastModified": "2025-11-27T11:40:00+01:00"
    },
    {
      "id": "ADE60322e706c616e6e696e67554c5f323032355f323032362d31313536342d302d32",
      "title": "CM 403.2 Optique physique",
      "start": "2026-02-02T08:00:00+01:00",
      "end": "2026-02-02T10:00:00+01:00",
      "allDay": false,
      "location": "Bridoux_TD 12",
      "description": "\n\nL2 Physique FC\nL2 Physique LAS\nL2 PC\nL2 PC LAS\nL2 Physique PE\nL2 PC PE\nTD L2 Physique\nJOHANN Luc\n\n(Modifié le:28/11/2025 12:39)",
      "status": "",
      "url": "",
      "lastModified": "2025-11-28T12:39:00+01:00"
    },
    {
      "id": "ADE60322e706c616e6e696e67554c5f323032355f323032362d3233303139332d31342d30",
      "title": "EI ME830 Mobiliser les savoirs propres à la discipline des LC-2",
      "start": "2026-02-02T08:00:00+01:00",
      "end": "2026-02-02T10:00:00+01:00",
      "allDay": false,
      "location": "Bridoux_TD 24",
      "description": "\n\nM1 MEEF PC\nM1 MEEF M-PC\nCODA-BOUCHOT Virginie\n\n(Modifié le:06/11/2025 18:01)",
      "status": "",
      "url": "",
      "lastModified": "2025-11-06T18:01:00+01:00"
    },
    {
      "id": "ADE60322e706c616e6e696e67554c5f323032355f323032362d31313239302d342d30",
      "title": "CM Toxicologie systémique et appliquée",
      "start": "2026-02-02T08:00:00+01:00",
      "end": "2026-02-02T10:00:00+01:00",
      "allDay": false,
      "location": "Bridoux_TD 18",
      "description": "\n\nFAUPIN Solène\nTP  A*\nTP  B*\n\n(Modifié le:05/12/2025 11:59)",
      "status": "",
      "url": "",
      "lastModified": "2025-12-05T11:59:00+01:00"
    },
    {
      "id": "ADE60322e706c616e6e696e67554c5f323032355f323032362d39353637332d302d33",
      "title": "UE 803 TD EC1 Psychophysiologie de la fatigue",
      "start": "2026-02-02T08:00:00+01:00",
      "end": "2026-02-02T10:00:00+01:00",
      "allDay": false,
      "location": "Bridoux_TP Start up 1 D14BIS",
      "description": "\n\nBARBRY Alexis\nPromo complète M1 FA\nPromo complète M1 FI/FC\n\n(Modifié le:27/11/2025 16:19)",
      "status": "",
      "url": "",
      "lastModified": "2025-11-27T16:19:00+01:00"
    },
    {
      "id": "ADE60322e706c616e6e696e67554c5f323032355f323032362d39353538382d312d30",
      "title": "6.03 EI Management et gestion des structures et des services",
      "start": "2026-02-02T08:00:00+01:00",
      "end": "2026-02-02T10:00:00+01:00",
      "allDay": false,
      "location": "Bridoux_TP Start up 2 D16",
      "description": "\n\nLP GDOSSL FI/FC\nWALTER Christophe\n\n(Modifié le:13/10/2025 11:02)",
      "status": "",
      "url": "",
      "lastModified": "2025-10-13T11:02:00+02:00"
    },
    {
      "id": "ADE60322e706c616e6e696e67554c5f323032355f323032362d393533332d322d30",
      "title": "TD Outils d'analyse, d'évaluation et de réadaptation en APAS",
      "start": "2026-02-02T09:00:00+01:00",
      "end": "2026-02-02T12:00:00+01:00",
      "allDay": false,
      "location": "Bridoux_TD 3",
      "description": "\n\nTD APAS\nTD APAS LAS\nHAINAUT Jean-Philippe\n\n(Modifié le:02/12/2025 16:08)",
      "status": "",
      "url": "",
      "lastModified": "2025-12-02T16:08:00+01:00"
    },
    {
      "id": "ADE60322e706c616e6e696e67554c5f323032355f323032362d39353635332d302d34",
      "title": "UE 801 EC2 CM Anthropologie de la maladie et handicap",
      "start": "2026-02-02T10:00:00+01:00",
      "end": "2026-02-02T12:00:00+01:00",
      "allDay": false,
      "location": "Bridoux_TP Start up 1 D14BIS",
      "description": "\n\nPromo complète M1 FA\nPromo complète M1 FI/FC\nARBORIO Sophie\n\n(Modifié le:03/11/2025 15:36)",
      "status": "",
      "url": "",
      "lastModified": "2025-11-03T15:36:00+01:00"
    },
    {
      "id": "ADE60322e706c616e6e696e67554c5f323032355f323032362d383436392d302d30",
      "title": "TPL UE 407 INT Anglais GRP 1",
      "start": "2026-02-02T10:15:00+01:00",
      "end": "2026-02-02T12:15:00+01:00",
      "allDay": false,
      "location": "Bridoux_Langue 1",
      "description": "\n\nHOFFART Christine\nL2 SPI ANGLAIS GR D2\n\n(Modifié le:02/09/2025 11:22)",
      "status": "",
      "url": "",
      "lastModified": "2025-09-02T11:22:00+02:00"
    },
    {
      "id": "ADE60322e706c616e6e696e67554c5f323032355f323032362d31313236332d302d30",
      "title": "CM Signalisations cellulaires normales et pathologiques",
      "start": "2026-02-02T10:15:00+01:00",
      "end": "2026-02-02T12:15:00+01:00",
      "allDay": false,
      "location": "Bridoux_TD 16",
      "description": "\n\nNEGUESQUE Adrien\nTP  A*\nTP  B*\n\n(Modifié le:01/12/2025 16:50)",
      "status": "",
      "url": "",
      "lastModified": "2025-12-01T16:50:00+01:00"
    },
    {
      "id": "ADE60322e706c616e6e696e67554c5f323032355f323032362d36313731352d312d30",
      "title": "CM UE 805 - Ressources Naturelles",
      "start": "2026-02-02T10:15:00+01:00",
      "end": "2026-02-02T12:15:00+01:00",
      "allDay": false,
      "location": "Bridoux_TD 4",
      "description": "\n\nCM ETOX\nCM GEMAREC\nROBIN Vincent\n\n(Modifié le:20/11/2025 16:51)",
      "status": "",
      "url": "",
      "lastModified": "2025-11-20T16:51:00+01:00"
    },
    {
      "id": "ADE60322e706c616e6e696e67554c5f323032355f323032362d39353537302d302d33",
      "title": "TPL Anglais",
      "start": "2026-02-02T10:15:00+01:00",
      "end": "2026-02-02T12:15:00+01:00",
      "allDay": false,
      "location": "Bridoux_TD 18",
      "description": "\n\nMATHIS-BUTIN Catherine\nLP GDOSSL FI/FC\n\n(Modifié le:13/10/2025 11:02)",
      "status": "",
      "url": "",
      "lastModified": "2025-10-13T11:02:00+02:00"
    },
    {
      "id": "ADE60322e706c616e6e696e67554c5f323032355f323032362d31303938382d322d30",
      "title": "CM EC 401.1 Thermodynamique de la réaction chimique",
      "start": "2026-02-02T10:15:00+01:00",
      "end": "2026-02-02T12:15:00+01:00",
      "allDay": false,
      "location": "Bridoux_TD 17",
      "description": "\n\nACHARD Christian\nL2 Chimie FC\nL2 Chimie LAS\nL2 PC\nL2 PC LAS\nL2 Chimie PE\nL2 PC PE\nTD A L2 Chimie\n\n(Modifié le:24/11/2025 12:19)",
      "status": "",
      "url": "",
      "lastModified": "2025-11-24T12:19:00+01:00"
    },
    {
      "id": "ADE60322e706c616e6e696e67554c5f323032355f323032362d31303834352d332d30",
      "title": "CM Approche socio-historique des pédagogies corporelles",
      "start": "2026-02-02T10:15:00+01:00",
      "end": "2026-02-02T12:15:00+01:00",
      "allDay": false,
      "location": "Bridoux_TD 9",
      "description": "\n\nCM EM\nCM EM LAS\nCREMONI Jerome\n\n(Modifié le:10/12/2025 16:26)",
      "status": "",
      "url": "",
      "lastModified": "2025-12-10T16:26:00+01:00"
    },
    {
      "id": "ADE60322e706c616e6e696e67554c5f323032355f323032362d3139373230382d302d30",
      "title": "Seconde chance UE 103.2 Equilibres et cinétique chimiques",
      "start": "2026-02-02T10:15:00+01:00",
      "end": "2026-02-02T11:45:00+01:00",
      "allDay": false,
      "location": "Bridoux_TD 2,Bridoux_Darwin",
      "description": "\n\nTP A Portail PC\nTP B Portail PC\nTP C Portail PC\nTP D Portail PC\nTP E Portail PC\nTP F Portail PC\nGHARRED Nawres\nSCHRAMM Sébastien\nZIMMER Alexandre\n\n(Modifié le:27/11/2025 11:42)",
      "status": "",
      "url": "",
      "lastModified": "2025-11-27T11:42:00+01:00"
    },
    {
      "id": "ADE60322e706c616e6e696e67554c5f323032355f323032362d31363535382d302d32",
      "title": "CM 405 Outils numériques 1",
      "start": "2026-02-02T10:15:00+01:00",
      "end": "2026-02-02T12:15:00+01:00",
      "allDay": false,
      "location": "Bridoux_TD 15",
      "description": "\n\nXU Hong\nL2 Physique PE\nTD L2 Physique\n\n(Modifié le:28/11/2025 15:33)",
      "status": "",
      "url": "",
      "lastModified": "2025-11-28T15:33:00+01:00"
    },
    {
      "id": "ADE60322e706c616e6e696e67554c5f323032355f323032362d3136373931362d382d30",
      "title": "EI ME830 Mobiliser les savoirs propres à la discipline des LC-2",
      "start": "2026-02-02T10:15:00+01:00",
      "end": "2026-02-02T12:15:00+01:00",
      "allDay": false,
      "location": "Bridoux_TD 28",
      "description": "\n\nM1 MEEF PC\nCOURILLEAU-GOBRY Anne\n\n(Modifié le:07/11/2025 16:44)",
      "status": "",
      "url": "",
      "lastModified": "2025-11-07T16:44:00+01:00"
    },
    {
      "id": "ADE60322e706c616e6e696e67554c5f323032355f323032362d38343538352d302d30",
      "title": "EXAMEN - UE 504 EC2 - Gestion et analyse de données",
      "start": "2026-02-02T11:15:00+01:00",
      "end": "2026-02-02T12:15:00+01:00",
      "allDay": false,
      "location": "Bridoux_TD 1",
      "description": "\n\nQUEVREUX Pierre\nLPRO Agro AAU\nLPRO Agro ADNT\n\n(Modifié le:05/11/2025 09:36)",
      "status": "",
      "url": "",
      "lastModified": "2025-11-05T09:36:00+01:00"
    },
    {
      "id": "ADE60322e706c616e6e696e67554c5f323032355f323032362d39353538322d312d30",
      "title": "6.02 EI Droit du travail",
      "start": "2026-02-02T13:00:00+01:00",
      "end": "2026-02-02T17:00:00+01:00",
      "allDay": false,
      "location": "Bridoux_TP Start up 2 D16",
      "description": "\n\nROTH David\nLP GDOSSL FI/FC\nLic Pro GDOSSL FA\n\n(Modifié le:13/10/2025 11:02)",
      "status": "",
      "url": "",
      "lastModified": "2025-10-13T11:02:00+02:00"
    },
    {
      "id": "ADE60322e706c616e6e696e67554c5f323032355f323032362d33303535302d302d30",
      "title": "TD GR.A MTU",
      "start": "2026-02-02T13:15:00+01:00",
      "end": "2026-02-02T14:45:00+01:00",
      "allDay": false,
      "location": "Bridoux_TD 7",
      "description": "\n\nTD/TP GR.A\nPAULY Jean\n\n(Modifié le:01/12/2025 15:35)",
      "status": "",
      "url": "",
      "lastModified": "2025-12-01T15:35:00+01:00"
    },
    {
      "id": "ADE60322e706c616e6e696e67554c5f323032355f323032362d33303034302d302d30",
      "title": "TD GR.H Tennis de table",
      "start": "2026-02-02T13:15:00+01:00",
      "end": "2026-02-02T15:15:00+01:00",
      "allDay": false,
      "location": "Bridoux_TD 14",
      "description": "\n\nTD/TP GR.H\nCREMONI Jerome\n\n(Modifié le:13/11/2025 17:11)",
      "status": "",
      "url": "",
      "lastModified": "2025-11-13T17:11:00+01:00"
    },
    {
      "id": "ADE60322e706c616e6e696e67554c5f323032355f323032362d33303038332d302d31",
      "title": "TD GR.G Acrosport-Gymnastique",
      "start": "2026-02-02T13:15:00+01:00",
      "end": "2026-02-02T15:15:00+01:00",
      "allDay": false,
      "location": "Bridoux_TD 9",
      "description": "\n\nTD/TP GR.G\nSAGRAFENA Hugo\n\n(Modifié le:13/11/2025 16:38)",
      "status": "",
      "url": "",
      "lastModified": "2025-11-13T16:38:00+01:00"
    },
    {
      "id": "ADE60322e706c616e6e696e67554c5f323032355f323032362d3139323638362d302d32",
      "title": "TD 407.1 Anglais B1",
      "start": "2026-02-02T13:30:00+01:00",
      "end": "2026-02-02T15:30:00+01:00",
      "allDay": false,
      "location": "Bridoux_TD 16",
      "description": "\n\nNAVARRO Sylvain\nL2 Physique-Chimie - Anglais GRP B1\n\n(Modifié le:02/09/2025 09:44)",
      "status": "",
      "url": "",
      "lastModified": "2025-09-02T09:44:00+02:00"
    },
    {
      "id": "ADE60322e706c616e6e696e67554c5f323032355f323032362d36343037362d322d30",
      "title": "TP F Projet Personnel et Professionnel",
      "start": "2026-02-02T13:30:00+01:00",
      "end": "2026-02-02T15:30:00+01:00",
      "allDay": false,
      "location": "Bridoux_TP Info4 C11",
      "description": "\n\nTP  F*\nDUVAL Alienor\n\n(Modifié le:12/12/2025 15:44)",
      "status": "",
      "url": "",
      "lastModified": "2025-12-12T15:44:00+01:00"
    },
    {
      "id": "ADE60322e706c616e6e696e67554c5f323032355f323032362d373832372d302d30",
      "title": "TD EC 404.1 MTU",
      "start": "2026-02-02T13:30:00+01:00",
      "end": "2026-02-02T15:30:00+01:00",
      "allDay": false,
      "location": "Bridoux_TD 24",
      "description": "\n\nCAPPELAERE Emmanuel\nL2 SPI\n\n(Modifié le:17/11/2025 16:52)",
      "status": "",
      "url": "",
      "lastModified": "2025-11-17T16:52:00+01:00"
    },
    {
      "id": "ADE60322e706c616e6e696e67554c5f323032355f323032362d31303738312d332d30",
      "title": "TD Pédagogie, didactique des APSA à des fins éducatives",
      "start": "2026-02-02T13:30:00+01:00",
      "end": "2026-02-02T14:30:00+01:00",
      "allDay": false,
      "location": "Bridoux_TD 2",
      "description": "\n\nTD EM LAS\nTD EM\nFRIEDRICH Jonathan\n\n(Modifié le:07/11/2025 17:34)",
      "status": "",
      "url": "",
      "lastModified": "2025-11-07T17:34:00+01:00"
    },
    {
      "id": "ADE60322e706c616e6e696e67554c5f323032355f323032362d383732332d302d33",
      "title": "TP B EC 205.1 Pratique expérimentale en chimie organique",
      "start": "2026-02-02T13:30:00+01:00",
      "end": "2026-02-02T16:30:00+01:00",
      "allDay": false,
      "location": "Bridoux_TP Grignard A8",
      "description": "\n\nTP B Portail PC\nBUHAIBEH Ruqaya\n\n(Modifié le:12/12/2025 13:19)",
      "status": "",
      "url": "",
      "lastModified": "2025-12-12T13:19:00+01:00"
    },
    {
      "id": "ADE60322e706c616e6e696e67554c5f323032355f323032362d3139323638372d302d37",
      "title": "TD 407.1 Anglais C1",
      "start": "2026-02-02T13:30:00+01:00",
      "end": "2026-02-02T15:30:00+01:00",
      "allDay": false,
      "location": "Bridoux_TD 18",
      "description": "\n\nMATHIS-BUTIN Catherine\nL2 Physique-Chimie - Anglais GRP C1\n\n(Modifié le:02/09/2025 09:56)",
      "status": "",
      "url": "",
      "lastModified": "2025-09-02T09:56:00+02:00"
    },
    {
      "id": "ADE60322e706c616e6e696e67554c5f323032355f323032362d353239362d302d30",
      "title": "TD AB Génétique fondamentale",
      "start": "2026-02-02T13:30:00+01:00",
      "end": "2026-02-02T15:30:00+01:00",
      "allDay": false,
      "location": "Bridoux_TD 12",
      "description": "\n\nNEGUESQUE Adrien\nTP  A*\nTP  B*\n\n(Modifié le:01/12/2025 14:43)",
      "status": "",
      "url": "",
      "lastModified": "2025-12-01T14:43:00+01:00"
    },
    {
      "id": "ADE60322e706c616e6e696e67554c5f323032355f323032362d31303434372d302d33",
      "title": "TPL EC 1 Anglais 4 D1",
      "start": "2026-02-02T13:30:00+01:00",
      "end": "2026-02-02T15:30:00+01:00",
      "allDay": false,
      "location": "Bridoux_TD 17",
      "description": "\n\nUBASSY Mickaël\nGR 1 - Anglais GRP D1\n\n(Modifié le:02/09/2025 09:58)",
      "status": "",
      "url": "",
      "lastModified": "2025-09-02T09:58:00+02:00"
    },
    {
      "id": "ADE60322e706c616e6e696e67554c5f323032355f323032362d36323732372d342d30",
      "title": "TD GH Génétique fondamentale",
      "start": "2026-02-02T13:30:00+01:00",
      "end": "2026-02-02T15:30:00+01:00",
      "allDay": false,
      "location": "Bridoux_TD 8",
      "description": "\n\nRODIUS François\nTP  G*\nTP  H*\n\n(Modifié le:11/12/2025 12:18)",
      "status": "",
      "url": "",
      "lastModified": "2025-12-11T12:18:00+01:00"
    },
    {
      "id": "ADE60322e706c616e6e696e67554c5f323032355f323032362d39333039302d332d30",
      "title": "TD ME1030 Savoirs propres à la discipline et épistémologie",
      "start": "2026-02-02T13:30:00+01:00",
      "end": "2026-02-02T16:30:00+01:00",
      "allDay": false,
      "location": "Bridoux_TD 1",
      "description": "\n\nMONIER Brice\nM2 MEEF EPS\n\n(Modifié le:22/09/2025 11:05)",
      "status": "",
      "url": "",
      "lastModified": "2025-09-22T11:05:00+02:00"
    },
    {
      "id": "ADE60322e706c616e6e696e67554c5f323032355f323032362d3136373931362d322d30",
      "title": "EI ME830 Mobiliser les savoirs propres à la discipline des LC-2",
      "start": "2026-02-02T13:30:00+01:00",
      "end": "2026-02-02T15:30:00+01:00",
      "allDay": false,
      "location": "Bridoux_TD 28",
      "description": "\n\nM1 MEEF PC\nHESSE Stéphanie\n\n(Modifié le:07/11/2025 16:44)",
      "status": "",
      "url": "",
      "lastModified": "2025-11-07T16:44:00+01:00"
    },
    {
      "id": "ADE60322e706c616e6e696e67554c5f323032355f323032362d383535352d302d32",
      "title": "TD GR.APA/GDOSSL Facteurs psychologiques de la performance",
      "start": "2026-02-02T13:30:00+01:00",
      "end": "2026-02-02T15:30:00+01:00",
